username;date;retweets;favorites;text;geo;mentions;hashtags;id;permalink
manishsinhaha;2018-03-21 12:56;0;1;"Much love to @firefliesai but we need the supernatural to help this guy stay accountable.";;@firefliesai;;"976502736463175681";https://twitter.com/manishsinhaha/status/976502736463175681
sudotong;2018-03-21 11:46;0;7;"Maybe @firefliesai could help this organization stay accountable https:// twitter.com/realDonaldTrum p/status/975346628113596417 …";;@firefliesai;;"976485300208717824";https://twitter.com/sudotong/status/976485300208717824
firefliesai;2018-03-20 18:30;0;2;"What is the role of AI? An assistant reproducing the intelligence of a human to do the job of humans? A machine hitting a target a human can’t even see? #AI #ArtificialIntelligence #HumanIntelligence #AIassistant #SaaS #VirtualAssistant Read it now http:// ow.ly/JCfE30j46Ss";;;#AI #ArtificialIntelligence #HumanIntelligence #AIassistant #SaaS #VirtualAssistant;"976224434779508737";https://twitter.com/firefliesai/status/976224434779508737
firefliesai;2018-03-19 15:00;0;1;"At http:// Fireflies.ai , we’re crafted an approach using machines and AI Trainers to provide a customized note taking assistant for each of our customers. #AI #AIassistant #artificialintelligence #SaaS #HaaS #business #productivity Read more: http:// ow.ly/CgE530iVlES pic.twitter.com/q8vSlHUQJE";;;#AI #AIassistant #artificialintelligence #SaaS #HaaS #business #productivity;"975809353533059072";https://twitter.com/firefliesai/status/975809353533059072
firefliesai;2018-03-16 20:00;0;0;"The brain behind the machine is a means of virtual assistance. However, it is not necessarily a replacement for people, at least not now with the current developments. #AI #AIassistant #artificialintelligence #SaaS #business #productivity Learn more: http:// ow.ly/CgE530iVlES pic.twitter.com/XpsPag23Es";;;#AI #AIassistant #artificialintelligence #SaaS #business #productivity;"974797668521250817";https://twitter.com/firefliesai/status/974797668521250817
firefliesai;2018-03-16 17:01;0;0;"Does #AI have to replace us? Why can’t it make us better? An AI virtual assistant is extremely helpful in the collection and computation of data, but it is after this point where humans can step in. #AIassistant #SaaS #business #productivity Learn more: http:// ow.ly/CgE530iVlES pic.twitter.com/0IfeBGfBoj";;;#AI #AIassistant #SaaS #business #productivity;"974752466779721730";https://twitter.com/firefliesai/status/974752466779721730
firefliesai;2018-03-16 15:01;1;0;"One of the challenges with completely automated Bot/AI services are that they leave enormous room for error. That’s why it demands human ensuring of concrete quality control. #AI #AIassistant #SaaS #HaaS #business #productivity Learn more http:// ow.ly/CgE530iVlES pic.twitter.com/g0yjuRvvOB";;;#AI #AIassistant #SaaS #HaaS #business #productivity;"974722351072980993";https://twitter.com/firefliesai/status/974722351072980993
firefliesai;2018-03-15 17:01;0;0;"#AI gives us options, but it doesn’t have to decide what the final options are. The last mile is where a mix of human and machine intelligence can be put to good use. #AIassistant #artificialintelligence #SaaS #business #productivity Learn more: http:// ow.ly/CgE530iVlES pic.twitter.com/bQcftH8JNU";;;#AI #AIassistant #artificialintelligence #SaaS #business #productivity;"974390063948795904";https://twitter.com/firefliesai/status/974390063948795904
firefliesai;2018-03-15 15:00;0;1;"It's time to learn how our AI can transform your conversations and unlock critical information to drive your business forward. #AI #AIassistant #artificialintelligence #SaaS #meetings #meetingnotes #notetaker #business #productivity pic.twitter.com/00tueY7fUk";;;#AI #AIassistant #artificialintelligence #SaaS #meetings #meetingnotes #notetaker #business #productivity;"974359825856516097";https://twitter.com/firefliesai/status/974359825856516097
firefliesai;2018-03-14 21:00;1;1;"#AI is believed to be a set of tools that can help humans, but not necessarily replace them. Companies that utilize AI technology as a black or white means for automation most likely fall into danger. #AIassistant #SaaS #HaaS #productivity Learn more http:// ow.ly/CgE530iVlES pic.twitter.com/V8RfyXeUrZ";;;#AI #AIassistant #SaaS #HaaS #productivity;"974087979722518528";https://twitter.com/firefliesai/status/974087979722518528
firefliesai;2018-03-14 17:01;1;1;"Question of the Week: Can you imagine a future where #AI will replace our presence in the workplace? Comment below! #SaaS #business #productivity At Fireflies, we see AI as an assistant that fills in human mistakes. See more http:// ow.ly/CgE530iVlES pic.twitter.com/b8JwcixcOl";;;#AI #SaaS #business #productivity;"974027692243857410";https://twitter.com/firefliesai/status/974027692243857410
firefliesai;2018-03-14 15:01;1;1;"Running new #AI models requires a lot of time spent on testing linguistic edge case, breaking limitations of Natural Language Processing, and handling variability of multiple narrow components of use cases. #AIassistant #business #productivity Learn more: http:// ow.ly/CgE530iVlES pic.twitter.com/o1YOos4WKe";;;#AI #AIassistant #business #productivity;"973997603661778944";https://twitter.com/firefliesai/status/973997603661778944
firefliesai;2018-03-13 17:01;1;1;"Voice AI makes modern day workflows even easier. We know that feeling of struggling to type notes on your phone. Let's cut that hassle with Fireflies handling the typing. #voiceassistant #AI #notetaker #business #meetings #productivity http:// ow.ly/Qqk130iRzdI";;;#voiceassistant #AI #notetaker #business #meetings #productivity;"973665293460561920";https://twitter.com/firefliesai/status/973665293460561920
firefliesai;2018-03-13 15:00;0;0;"While taking the market by storm, AI is often projected to take over human jobs. However, human assistants and AI assistants both pose their own issues. #AI #AIassistant #artificialintelligence #SaaS #business #productivity See the full article http:// ow.ly/CgE530iVlES";;;#AI #AIassistant #artificialintelligence #SaaS #business #productivity;"973634904868171777";https://twitter.com/firefliesai/status/973634904868171777
firefliesai;2018-03-12 15:10;0;0;"Perhaps AI bots are not ready to take over humans yet they are ready to make up for tasks humans are prone to error. #AI #AIassistant #artificialintelligence #SaaS #HaaS #intelligenceaugmentation #business #productivity pic.twitter.com/TI4L7zVSho";;;#AI #AIassistant #artificialintelligence #SaaS #HaaS #intelligenceaugmentation #business #productivity;"973275025674506240";https://twitter.com/firefliesai/status/973275025674506240
firefliesai;2018-03-11 17:10;0;0;"It's about time that AI assistants free humans from mundane tasks such as taking notes during meetings! @firefliesai AI assistant, Fred, has been so helpful to our customers in handling minute-taking and data entry tasks. Check it out http:// fireflies.ai";;@firefliesai;;"972942961976709120";https://twitter.com/firefliesai/status/972942961976709120
firefliesai;2018-03-11 17:06;0;0;"Hi @vnss_rv ! Perhaps you want to check out Fred, our AI assistant that automatically takes notes during meetings http:// fireflies.ai";;@vnss_rv;;"972941796824186880";https://twitter.com/firefliesai/status/972941796824186880
firefliesai;2018-03-09 17:00;0;0;""Too many meeting" is one of the factors preventing workers from heading home early. Why not condensing all meetings into a 10-minute sync? #meetings #meetingduration #meetingcost #timeconsuming #timeefficiency #productivity #business Read more: http:// bit.ly/2F3NIzT pic.twitter.com/Zn6MZ1c87f";;;#meetings #meetingduration #meetingcost #timeconsuming #timeefficiency #productivity #business;"972230632804937728";https://twitter.com/firefliesai/status/972230632804937728
firefliesai;2018-03-09 15:01;0;0;"Knowing key outcomes to drive towards makes it easy for both sides of the table to stay focused during the meeting. #meetings #meetingduration #meetingcost #timeconsuming #timeefficiency #productivity #business Read more: http:// bit.ly/2F3NIzT pic.twitter.com/TjNbiSX8u3";;;#meetings #meetingduration #meetingcost #timeconsuming #timeefficiency #productivity #business;"972200717443325954";https://twitter.com/firefliesai/status/972200717443325954
firefliesai;2018-03-08 20:00;0;0;"Setting a 10-minute meeting next time Challenge Accepted! 3 reasons why we should schedule 10-minute meetings http:// bit.ly/2F3NIzT pic.twitter.com/4Xcw2nB6rf";;;;"971913680425283585";https://twitter.com/firefliesai/status/971913680425283585
firefliesai;2018-03-08 15:00;0;0;"In a busy workplace, meetings add up and so do the cost for your entire team. This is why we are working to make meetings better for everyone #meetings #meetingcost #costefficiency #business #workproductivity #meetingnotes pic.twitter.com/yh6qB6kzh5";;;#meetings #meetingcost #costefficiency #business #workproductivity #meetingnotes;"971838124010692608";https://twitter.com/firefliesai/status/971838124010692608
firefliesai;2018-03-07 21:30;1;0;"Think about AI helping Sales Reps or Project Managers perform functional roles better. “Hiring” AI assistants using criteria applied to job applicants and colleagues will certainly be our near future. #ai #aiassistant #salesrep #projectmanager #HR #hiringdecision #productivity pic.twitter.com/bhfec6UYRI";;;#ai #aiassistant #salesrep #projectmanager #HR #hiringdecision #productivity;"971573757239316480";https://twitter.com/firefliesai/status/971573757239316480
firefliesai;2018-03-07 20:00;0;1;"Question of the Week: Working from home and working with peers at physical workstation... Which way do you prefer? #remote #remotework #remoteworkers #teamwork #teambuilding #workproductivity #teleworking #workfromhome #meetings #remotemeetings Share your thoughts below! pic.twitter.com/0Q0SERGHSo";;;#remote #remotework #remoteworkers #teamwork #teambuilding #workproductivity #teleworking #workfromhome #meetings #remotemeetings;"971551302093299713";https://twitter.com/firefliesai/status/971551302093299713
firefliesai;2018-03-07 17:01;0;0;"Understanding the scope of the discussion and reducing the meeting down to the more digestible points are the key to a successful sync. #meetings #meetingduration #meetingcost #timeconsuming #timeefficiency #productivity #business Read full article: http:// bit.ly/2F3NIzT pic.twitter.com/d0Mjw4Ug1L";;;#meetings #meetingduration #meetingcost #timeconsuming #timeefficiency #productivity #business;"971506040893263877";https://twitter.com/firefliesai/status/971506040893263877
firefliesai;2018-03-06 17:00;0;0;"Too often, we have a default approach of setting intervals of 30 minute or 1 hour long meetings. 10-minute #meetings have a great psychological impact on how you treat your time and other people’s time. #meetingduration #productivity #business Read more: http:// bit.ly/2F3NIzT pic.twitter.com/b16nEppILP";;;#meetings #meetingduration #productivity #business;"971143619460648960";https://twitter.com/firefliesai/status/971143619460648960
firefliesai;2018-03-06 15:01;0;0;"Being stuck in a 1.5-hour meeting and saying farewell to all the time you plan to work on your own tasks... Perhaps a 10-min meeting is the "right amount of meeting"? #meetings #meetingduration #timeefficiency #productivity #business Learn more: http:// bit.ly/2F3NIzT pic.twitter.com/0v342M9WFE";;;#meetings #meetingduration #timeefficiency #productivity #business;"971113524192776195";https://twitter.com/firefliesai/status/971113524192776195
firefliesai;2018-03-05 17:00;0;1;"While it’s human nature to have technical delays dialing in, setting 10 minute meetings forces attendees to prepare at least 5 minutes in advance for the meeting. #meetings #meetingduration #timeefficiency #productivity #business Learn more: http:// bit.ly/2F3NIzT pic.twitter.com/1S1soTXuz3";;;#meetings #meetingduration #timeefficiency #productivity #business;"970781162871324672";https://twitter.com/firefliesai/status/970781162871324672
firefliesai;2018-03-02 17:01;0;0;"30% of salespeople’s time is spent on prospect research. Every minute spent researching is a minute that could be better spent closing a deal. #sales #salesreps #prospect #research #qualifyprospect #timeconsuming #productivity #business Read now https:// goo.gl/nDsZqf pic.twitter.com/xmxqybEa7F";;;#sales #salesreps #prospect #research #qualifyprospect #timeconsuming #productivity #business;"969694106170642434";https://twitter.com/firefliesai/status/969694106170642434
firefliesai;2018-03-02 15:01;0;0;"A bulk of a sales rep’s work comes directly from updated and reliable prospect data pool. The best solution is to automate the process of gathering customer data. #sales #salesrep #prospectresearch #coldcall #dataentry #crmupdate #productivity Read more: https:// goo.gl/nDsZqf pic.twitter.com/k2BgnLPr5O";;;#sales #salesrep #prospectresearch #coldcall #dataentry #crmupdate #productivity;"969664001197133824";https://twitter.com/firefliesai/status/969664001197133824
firefliesai;2018-03-01 20:00;0;0;"Try setting a 10-min meeting next time. Resist the urge to bucket it as a 30-min or 1-hour event. Think about the scope of the meeting and why you are there. #meetings #meetingduration #timeconsuming #productivity #business Read the full article http:// bit.ly/2F3NIzT";;;#meetings #meetingduration #timeconsuming #productivity #business;"969376847384449030";https://twitter.com/firefliesai/status/969376847384449030
firefliesai;2018-03-01 17:01;1;0;"By automating sales process, #salesreps can cut time spent on non-sales tasks and focus on the valuable phases of sales interactions. #prospectresearch #coldcalls#dataentry #crmupdates #automation #productivity Learn more: https:// goo.gl/nDsZqf Infographic Source: Visualistan pic.twitter.com/Z5oGcqBJ8p";;;#salesreps #prospectresearch #coldcalls #dataentry #crmupdates #automation #productivity;"969331733542948864";https://twitter.com/firefliesai/status/969331733542948864
firefliesai;2018-02-28 20:00;0;0;"Filling in the Blank: How long do you think a productive meeting should last? 5-10 minutes? 1 hour? 2 hours? Comment your thoughts below! #meetings #meetingduration #meetingcost #timeconsuming #timeefficiency #productivity #business See the answer here: https:// goo.gl/nDsZqf pic.twitter.com/yVehmtUmQT";;;#meetings #meetingduration #meetingcost #timeconsuming #timeefficiency #productivity #business;"969014584303587329";https://twitter.com/firefliesai/status/969014584303587329
firefliesai;2018-02-28 17:01;0;0;"Taking a consultative approach to selling helps to increase the close rate. #sales #salesreps #salespeople #prospect #research #qualifyprospect #coldcalls #salescalls #timeefficiency #productivity #business Read more about the 70/30 Rule of Communication: https:// goo.gl/nDsZqf pic.twitter.com/KKRElNdkNp";;;#sales #salesreps #salespeople #prospect #research #qualifyprospect #coldcalls #salescalls #timeefficiency #productivity #business;"968969333899694088";https://twitter.com/firefliesai/status/968969333899694088
firefliesai;2018-02-28 15:01;0;0;"Rewrite sales reps' New Year's resolutions: automate sales prospecting process entirely and spend time wisely. #sales #salesreps #prospectresearch #coldcalls #dataentry #crmupdates #automation #productivity #business How to eliminate sales time wasters: https:// goo.gl/nDsZqf pic.twitter.com/5OCmm1bS75";;;#sales #salesreps #prospectresearch #coldcalls #dataentry #crmupdates #automation #productivity #business;"968939265378922496";https://twitter.com/firefliesai/status/968939265378922496
firefliesai;2018-02-27 17:01;1;2;"15 minutes of actual work and going to meeting for the rest of the day. Why not the reverse order? #meetings #meetingduration #meetingcost #timeconsuming #timeefficiency #productivity #business Wouldn't it be better to kill a meeting in only 10 minutes? pic.twitter.com/0zX5GlE8Sj";;;#meetings #meetingduration #meetingcost #timeconsuming #timeefficiency #productivity #business;"968606926136401921";https://twitter.com/firefliesai/status/968606926136401921
firefliesai;2018-02-27 15:01;0;0;"Reported by InsideSales, sales reps spend 36.6% of their time actually selling. What are salespeople doing with 63.4% of their time? #sales #salesreps #prospectresearch #coldcalls #dataentry #crmupdates #timeefficiency #productivity #business Learn more: http:// ow.ly/DhlX30ixJhK";;;#sales #salesreps #prospectresearch #coldcalls #dataentry #crmupdates #timeefficiency #productivity #business;"968576828905611264";https://twitter.com/firefliesai/status/968576828905611264
firefliesai;2018-02-26 17:00;0;0;"A study by Docurated’s State of Sales Productivity reported that around 30% of salespeople’s time is spent on prospect research. #sales #salesreps #salespeople #prospect #research #qualifyprospect #timeefficiency #productivity #business Learn more: https:// goo.gl/nDsZqf pic.twitter.com/ERFQJvmpCY";;;#sales #salesreps #salespeople #prospect #research #qualifyprospect #timeefficiency #productivity #business;"968244506947616768";https://twitter.com/firefliesai/status/968244506947616768
firefliesai;2018-02-23 17:00;0;1;"To make the CRM data entry accurate and time efficient, the best solution is to automate the process of gathering customer data. #crm #dataentry #customerdata #database #customerdatabase #business #sales #salesreps How to leverage the use of CRM systems: http:// ow.ly/Paiz30ixO9d pic.twitter.com/HBGti8eLGQ";;;#crm #dataentry #customerdata #database #customerdatabase #business #sales #salesreps;"967157339123015686";https://twitter.com/firefliesai/status/967157339123015686
firefliesai;2018-02-23 15:01;0;1;"We can anticipate a future where purchasing decisions around buying #software systems look more like company hiring decisions. #ai #artificialintelligence #software #HR #hiringsoftware #personnelreplacement #business #productivity See full text: http:// ow.ly/Uch330irXsC pic.twitter.com/IlD2oJ8c4z";;;#software #ai #artificialintelligence #software #HR #hiringsoftware #personnelreplacement #business #productivity;"967127294501416962";https://twitter.com/firefliesai/status/967127294501416962
firefliesai;2018-02-22 20:00;0;0;"It’s not just the dollars being paid to the employees that a business is losing in every meeting. It’s the dollars that aren’t being earned. #meetings #meetingcost #costefficiency #business #workproductivity #meetingnotes Learn about the cost of meetings: http:// ow.ly/K06P30iwn8d pic.twitter.com/XdsEkUnneC";;;#meetings #meetingcost #costefficiency #business #workproductivity #meetingnotes;"966840240282525696";https://twitter.com/firefliesai/status/966840240282525696
firefliesai;2018-02-22 17:01;0;0;"Filling in the blank: Do you think of your AI assistant as a colleague? #ai #artificialintelligence #aiassistant #business #productivity #meetings #meetingnotes #colleagues #employees #workplace See reasons why every office needs a virtual assistant: http:// ow.ly/1gaZ30iuQf9 pic.twitter.com/bJswj9bL4H";;;#ai #artificialintelligence #aiassistant #business #productivity #meetings #meetingnotes #colleagues #employees #workplace;"966794984514048000";https://twitter.com/firefliesai/status/966794984514048000
firefliesai;2018-02-22 15:00;0;1;""With Fred constantly following up with my dev team at regular intervals after meetings, we joke with all our PMs that Fred should get a salary raise and be on our payroll.” — David #ai #artificialintelligence #meetings #business #productivity Read more: http:// ow.ly/iKnl30irXbK pic.twitter.com/M8pP8zznfV";;;#ai #artificialintelligence #meetings #business #productivity;"966764701941227528";https://twitter.com/firefliesai/status/966764701941227528
firefliesai;2018-02-21 16:01;0;0;"No more work slipping through the cracks because we forgot to write it down in meetings! Hooray! #meetings #ai #artificialintelligence #aiassistant #business #productivity #meetingnote Check out the reasons why we should "hire" an AI assistant http:// ow.ly/SRgD30itgaS pic.twitter.com/fCGdvMOrCn";;;#meetings #ai #artificialintelligence #aiassistant #business #productivity #meetingnote;"966417533728411648";https://twitter.com/firefliesai/status/966417533728411648
firefliesai;2018-02-21 12:01;0;0;"It was pleasantly surprising to find that our clients treat Fred, our AI assistant, like an important member of their team. #ai #aiassistant #meeting #notetaker #conversational #interactions #humanizedAIsystem #business #productivity Learn more about AI: http:// ow.ly/VqUh30irX36 pic.twitter.com/cTCZifeWTd";;;#ai #aiassistant #meeting #notetaker #conversational #interactions #humanizedAIsystem #business #productivity;"966357271126126592";https://twitter.com/firefliesai/status/966357271126126592
firefliesai;2018-02-20 15:01;0;1;"We will come to rely on the system chatting with us, providing us with valuable information like a work colleague or human being would. #artificialintelligence #machinelearning #personalization #businessapplications #productivity Read the article: http:// ow.ly/JfH730irWNe pic.twitter.com/cHpTJiExcR";;;#artificialintelligence #machinelearning #personalization #businessapplications #productivity;"966040111006781440";https://twitter.com/firefliesai/status/966040111006781440
firefliesai;2018-02-19 12:01;0;2;"Could we see a world where we start “hiring” AI assistants based on what we as employers look for in good job applicants and colleagues? #ai #aiassistant #salesrep #projectmanager #datascientist #HR #hiringdecision #productivity Read more: http:// ow.ly/HEYP30iqE7q";;;#ai #aiassistant #salesrep #projectmanager #datascientist #HR #hiringdecision #productivity;"965632403158044673";https://twitter.com/firefliesai/status/965632403158044673
firefliesai;2018-02-16 20:00;0;2;"Walking out of #meeting on #Friday with tangible notes and action items in mind #tgif #meetings #businessmeetings #teammeetings#productivity #actionitems #meetingnotes #effectivemeetings #meetingcost #lowcost How to avoid wasteful meetings: http:// ow.ly/knFe30iqBUl pic.twitter.com/kAgSEJA9pB";;;#meeting #Friday #tgif #meetings #businessmeetings #teammeetings #productivity #actionitems #meetingnotes #effectivemeetings #meetingcost #lowcost;"964665871686914048";https://twitter.com/firefliesai/status/964665871686914048
firefliesai;2018-02-16 18:00;0;0;"Building meeting tactics into the team culture helps the company get better as a whole where everyone can keep each other accountable. #meetings #actionitems #meetingminutes #productivity Read full article: http:// ow.ly/BzqI30im2vJ pic.twitter.com/buro0F6wxC";;;#meetings #actionitems #meetingminutes #productivity;"964635748493332480";https://twitter.com/firefliesai/status/964635748493332480
firefliesai;2018-02-16 16:01;0;0;"Proper documentation of all critical info can save a ton of time for all. #meetings #meetingnotes #meetingagenda #timesaving #teammeetings #business #workproductivity Read full text: http:// ow.ly/teA730iqAo0 pic.twitter.com/J72FJ0b5RN";;;#meetings #meetingnotes #meetingagenda #timesaving #teammeetings #business #workproductivity;"964605571516297217";https://twitter.com/firefliesai/status/964605571516297217
firefliesai;2018-02-16 12:01;0;0;"A meeting agenda is the greatest weapon in one’s armory. Setting expectations is key. #meetingagenda #expectations #meetings #businessmeeting #businesstips #productivity See the article: http:// ow.ly/hZX930im25g pic.twitter.com/QRuTeLZVG5";;;#meetingagenda #expectations #meetings #businessmeeting #businesstips #productivity;"964545352769703936";https://twitter.com/firefliesai/status/964545352769703936
firefliesai;2018-02-15 20:00;4;6;"Q: "How much does a meeting cost?" A: "On average there are 6 people a meeting room. Let’s assume the average salary was $100,000. A 60 minute meeting with 6 people has cost your org $420!" #meetings #meetingcost #business #productivity Learn more: http:// ow.ly/iUbH30iqBbu pic.twitter.com/4f9uBLhZaO";;;#meetings #meetingcost #business #productivity;"964303410647400449";https://twitter.com/firefliesai/status/964303410647400449
firefliesai;2018-02-15 17:00;0;0;"At Fireflies, we want to enable everyone to have tangible notes and outcomes to leverage after the sync and keep the quality benchmark high. #firefliesai #meetings #business #productivity #meetingnotes Learn more tips about holding productive meetings: http:// ow.ly/DZqh30iqyVh pic.twitter.com/EJq7bJ2mWe";;;#firefliesai #meetings #business #productivity #meetingnotes;"964258164383322113";https://twitter.com/firefliesai/status/964258164383322113
firefliesai;2018-02-15 15:01;0;1;"Follow Amazon’s two pizza rule: Never have a meeting where two pizzas couldn’t feed the entire group. #amazon #twopizza #meeting #tactics #meetinginvite #meetingattendees Learn more about meeting tips: http:// ow.ly/W1Q930im1u0 pic.twitter.com/iMJ8goQHn1";;;#amazon #twopizza #meeting #tactics #meetinginvite #meetingattendees;"964228211671527424";https://twitter.com/firefliesai/status/964228211671527424
firefliesai;2018-02-15 13:30;0;0;"According to Business Insider, there are 11 million meetings in the US every day. The only reason is that meetings are vital to company labor productivity and vibrancy. #meetings #business #productivity #brainstorming #teamwork Read more: http:// ow.ly/pMnA30iqwG8 pic.twitter.com/JGyyOuLAZJ";;;#meetings #business #productivity #brainstorming #teamwork;"964205243201302528";https://twitter.com/firefliesai/status/964205243201302528
firefliesai;2018-02-14 20:00;0;0;"Having teammates record their presentations ahead of time is a neat way to save time for everyone. #teammeeting #timesaving #record #presentation #meeting #productivity Read full text: http:// ow.ly/UrRR30ihXvK pic.twitter.com/NyFOeP0DGL";;;#teammeeting #timesaving #record #presentation #meeting #productivity;"963941115991904257";https://twitter.com/firefliesai/status/963941115991904257
