username;date;retweets;favorites;text;geo;mentions;hashtags;id;permalink
firefliesai;2018-04-20 20:00;0;0;"Do you know? On average, 48% of company working time is spent surfing the web. 33% of time is spent socializing with coworkers, 30% conducting personal business, 19% on personal calls, and 15% on long lunch breaks. #distractions Read it here: http:// ow.ly/cvJs30jxAqf pic.twitter.com/Pq5mo4Riwv";;;#distractions;"987481222065598464";https://twitter.com/firefliesai/status/987481222065598464
firefliesai;2018-04-20 17:00;0;0;"People waste an enormous amount of valuable work time in day long #meetings that seem to drag on forever. If this is a common trend in your #workplace , take a step back and reevaluate if changes need to be made. See more: http:// ow.ly/mkwb30jxAFS pic.twitter.com/xLNJ5S3sdP";;;#meetings #workplace;"987435980050391040";https://twitter.com/firefliesai/status/987435980050391040
firefliesai;2018-04-20 15:01;0;0;"Rather than taking a break to check your phone or have the unnecessary coffee break time, set a time restriction and goals so that you can force yourself to commit all of your time and energy to finish your work. Read our article: http:// ow.ly/mkwb30jxAFS pic.twitter.com/AkmI4CGtWv";;;;"987405877752815616";https://twitter.com/firefliesai/status/987405877752815616
firefliesai;2018-04-19 15:01;0;0;"You never know how much appealing all these shiny things are to you at the #workplace . Shiny objects vary from #EmailNotifications to the Facebook #newsfeed that take away most of your time, and of course, #productivity . Read our article: http:// ow.ly/9OMp30jxAPH pic.twitter.com/H2ZohBiBRB";;;#workplace #EmailNotifications #newsfeed #productivity;"987043444869779457";https://twitter.com/firefliesai/status/987043444869779457
firefliesai;2018-04-18 17:00;0;0;"In an average week, #employees reported various accounts of misused #time . While this may vary from one #workplace to another, lack of #focus and #productivity is extremely common. How can we overcome the distraction to be more focused at work? http:// ow.ly/NXIp30jxtMf pic.twitter.com/bQWChYEw0o";;;#employees #time #workplace #focus #productivity;"986711206714138624";https://twitter.com/firefliesai/status/986711206714138624
firefliesai;2018-04-18 15:01;0;1;"Studies have found that people cannot spend excessive amounts of #time without their #phones . Rather than allowing your phone to continually #distract you and hinder your #performance , let's find ways to avoid #distraction at #workplace . Learn more: http:// ow.ly/NXIp30jxtMf pic.twitter.com/KHOSf0mciZ";;;#time #phones #distract #performance #distraction #workplace;"986681047978074112";https://twitter.com/firefliesai/status/986681047978074112
firefliesai;2018-04-17 17:00;0;0;"Often times, #meetings are as expensive and unnecessary as they feel. People waste an enormous amount of valuable work time in day long meetings that seem to drag on forever. #distraction #workplace #employees #productivity #workperformance See more: http:// ow.ly/NXIp30jxtMf pic.twitter.com/hO4gCsGKDb";;;#meetings #distraction #workplace #employees #productivity #workperformance;"986348695544385536";https://twitter.com/firefliesai/status/986348695544385536
firefliesai;2018-04-17 15:00;0;0;"It’s no secret that people in the #workplace are easily distracted. Nearly every employee consistently wastes working time on a daily basis. What’s keeping employees so easily distracted? And more importantly, how do companies overcome this? #distraction http:// ow.ly/NXIp30jxtMf";;;#workplace #distraction;"986318506215067648";https://twitter.com/firefliesai/status/986318506215067648
firefliesai;2018-04-16 22:30;0;2;"Analytics is important for startups of all stages. Our @firefliesapp CEO @krish_ramineni explains 5 lessons on how to utilize analytics to drive up your startup's SaaS marketing and sales efforts. #analytics #SaaS #Marketing #Sales #startups http:// ow.ly/GHj430jwz03";;@firefliesapp @krish_ramineni;#analytics #SaaS #Marketing #Sales #startups;"986069269933936640";https://twitter.com/firefliesai/status/986069269933936640
firefliesai;2018-04-16 17:00;0;1;""AI has also become more adept at recognising speech. It underlies voice assistants on phones and home speakers and allows algorithms to listen to calls and take in the speaker’s tone and content." That's how AI becomes the best meeting note-taker. http:// ow.ly/L5P530jvQBj";;;;"985986274757693441";https://twitter.com/firefliesai/status/985986274757693441
firefliesai;2018-04-16 15:00;0;0;"When #employees perform to their best ability, they want #recognition from their bosses. #Managers should keep their employees #accountable and #motivated to come into work. #management #productivity #leadership #teamleader See more: http:// ow.ly/fbUr30jpXIw pic.twitter.com/lEVvT3Kwl9";;;#employees #recognition #Managers #accountable #motivated #management #productivity #leadership #teamleader;"985956217288888322";https://twitter.com/firefliesai/status/985956217288888322
firefliesai;2018-04-13 20:00;0;0;"Would you really want to be managed by a boss that was constantly changing their expectations? Does this sound like a boss that’s organized and fit to manage? #management #managers #employees #leadership #goals #expectations What makes a good manager http:// ow.ly/fbUr30jpXIw pic.twitter.com/aASCVlLByK";;;#management #managers #employees #leadership #goals #expectations;"984944514157764608";https://twitter.com/firefliesai/status/984944514157764608
firefliesai;2018-04-13 17:01;0;0;"Feedback is a two-way exchange. If you get defensive when an employee approaches you, then you need to rethink your approach. #management #managers #employees #leadership #expectations #feedback #listening #respects More tips on managing a great team: http:// ow.ly/dExV30jpYV9";;;#management #managers #employees #leadership #expectations #feedback #listening #respects;"984899279105024000";https://twitter.com/firefliesai/status/984899279105024000
firefliesai;2018-04-12 15:01;0;2;"Many employees strive to do their best, yet they produce unrecognized work. #Managers can balance monetary #bonuses and #rewards with small, low cost incentive grants, which invariably boost employee morale. #management #goals #productivity Read more: http:// ow.ly/fbUr30jpXIw pic.twitter.com/ngank08ckd";;;#Managers #bonuses #rewards #management #goals #productivity;"984506777814220800";https://twitter.com/firefliesai/status/984506777814220800
krish_ramineni;2018-04-11 21:43;0;0;"@firefliesai we should do some work here to help folks with auto notes https:// twitter.com/Maxzzie/status /984133388465393664 …";;@firefliesai;;"984245545194536962";https://twitter.com/krish_ramineni/status/984245545194536962
firefliesai;2018-04-11 20:00;0;1;"Managers can focus on the following strategies to manage teams effectively: 1. Keep employees accountable 2. Be consistent with goals and expectations 3. Be a good listener and feedback acceptor 4. Provide time-efficient tools to employees See more: http:// ow.ly/bv9k30jq3u8 " pic.twitter.com/C1Fi7SzoBm";;;;"984219729345830912";https://twitter.com/firefliesai/status/984219729345830912
firefliesai;2018-04-11 17:01;0;0;"Question of the Week: What are the best ways to manage people? What else can we do to successfully lead a team? #management #managers #employee #leadership #goals #expectations #listening #productivity Comment your thoughts below! See more: http:// ow.ly/5SBz30jpYEo pic.twitter.com/B5lo59W1yI";;;#management #managers #employee #leadership #goals #expectations #listening #productivity;"984174510080487429";https://twitter.com/firefliesai/status/984174510080487429
firefliesai;2018-04-11 15:00;0;0;"#Managers should set #goals of strict compliance to #deadlines and stick to them; write down what to expect, honor past agreements, and stick to those word. #management #productivity #leadership #expectations See tips on the effective management: http:// ow.ly/fbUr30jpXIw pic.twitter.com/hOtZn2GRQR";;;#Managers #goals #deadlines #management #productivity #leadership #expectations;"984144268565639168";https://twitter.com/firefliesai/status/984144268565639168
firefliesai;2018-04-10 20:30;0;0;"A study by Forbes surveying 1,500 people confirmed that the more power a boss has, the less likely they are to take advice. Many bosses believe that managing involves all talking and no listening. Unfortunately, they are far from correct. See more: http:// ow.ly/fbUr30jpXIw pic.twitter.com/p27NHIUL9d";;;;"983864761183064064";https://twitter.com/firefliesai/status/983864761183064064
firefliesai;2018-04-10 15:00;0;0;"#Managing others is not an easy task. #Employees seem to do the exact opposite of what you’d hope or expect, or they seem to fall short of your expectations. Here are tips that will benefit both your #efficiency and the #efficiency of those around you. http:// ow.ly/fbUr30jpXIw";;;#Managing #Employees #efficiency #efficiency;"983781805559111680";https://twitter.com/firefliesai/status/983781805559111680
firefliesai;2018-04-09 17:00;0;0;"If #HR #recruiters are not ready for the entire #AI adoption, outsourcing the #interview #notetaking to AI allows recruiters to focus on the candidate's qualifications and make decisions based on accurate notes. #AIassistant #humanresources #hiringprocess http:// ow.ly/at5L30josnz";;;#HR #recruiters #AI #interview #notetaking #AIassistant #humanresources #hiringprocess;"983449622856261632";https://twitter.com/firefliesai/status/983449622856261632
firefliesai;2018-04-09 15:00;0;1;"#Emails consume more time, leading to a shift away from tradition and towards new #innovative #applications . Look into other #communication platforms that are both relevant and engaging. #slack #asana #skype #messagingapps Read more about sales emailing: http:// ow.ly/YXSf30jovRV pic.twitter.com/qalizeX0iE";;;#Emails #innovative #applications #communication #slack #asana #skype #messagingapps;"983419476329803776";https://twitter.com/firefliesai/status/983419476329803776
firefliesai;2018-04-06 20:00;1;1;"A recent study revealed that the average inbox has only 38% relevant, critical emails, leaving over 60% of #emails discarded or irrelevant. So why investing so much time in emails while people don't even bother to open any of them? See more: http:// ow.ly/Ff4j30jiOYR pic.twitter.com/UVMgmm5VhO";;;#emails;"982407813837279232";https://twitter.com/firefliesai/status/982407813837279232
firefliesai;2018-04-06 17:01;0;1;"With the advancement of #SocialMedia and #MessagingApps comes the reduced demand for #emails . People are already looking to instant forms of #communication , relative to email. See how the emerging technology is taking over emails in sales: http:// ow.ly/DZHW30jikMg";;;#SocialMedia #MessagingApps #emails #communication;"982362563798355968";https://twitter.com/firefliesai/status/982362563798355968
firefliesai;2018-04-05 20:00;0;0;"Email #spam #filters capture a large majority of #emails , or people weed out the emails that don’t pertain directly to them. Be careful of the #MassEmail ! Read our full article about emailing: http:// ow.ly/DPxM30jilNm pic.twitter.com/QgglwQirrl";;;#spam #filters #emails #MassEmail;"982045434242912256";https://twitter.com/firefliesai/status/982045434242912256
firefliesai;2018-04-05 18:19;0;1;"It's interesting how AI can alter objectivity. More importantly, should AI be as good as humans or better than humans? #deeplearning #ai #decisionmaking https:// medium.com/@krishramineni /what-if-ai-and-humans-disagree-79fb8bf297c4 …";;@krishramineni;#deeplearning #ai #decisionmaking;"982019937375055873";https://twitter.com/firefliesai/status/982019937375055873
firefliesai;2018-04-05 15:01;0;0;"In order to #personalize email #messages , it’s important to keep notes on your #prospects through the base #SalesPipeline . These #notes , in turn, will later help you to craft compelling and personalized #emails that your prospects will read. Learn more: http:// ow.ly/mtc630jikRS pic.twitter.com/4DfjgDgYMN";;;#personalize #messages #prospects #SalesPipeline #notes #emails;"981970068606275584";https://twitter.com/firefliesai/status/981970068606275584
firefliesai;2018-04-04 20:00;1;0;"If you wonder why your email campaign is not driving much impact, that's because emailing is no longer effective with the presence of spam filters, more innovative messaging apps, and impersonalized messages that you send to your audience. Read more: http:// ow.ly/wzQB30jbyKA pic.twitter.com/DD8YEkTKZz";;;;"981682927401619457";https://twitter.com/firefliesai/status/981682927401619457
firefliesai;2018-04-04 17:00;0;0;"Do you think that sending #emails is no longer an effective practice of customer outreach? Do you believe that #PersonalizedEmails can actually drive #impact to your #selling efforts? #ColdEmailing #spam #productivity #sales Check your assumptions here: http:// ow.ly/DPxM30jilNm pic.twitter.com/hL4NCVR62s";;;#emails #PersonalizedEmails #impact #selling #ColdEmailing #spam #productivity #sales;"981637773361807362";https://twitter.com/firefliesai/status/981637773361807362
firefliesai;2018-04-04 15:00;0;0;"The #email #personalization should relate directly to why this#prospect would benefit from the #product you are selling. #ColdEmailing #spam #productivity #communication #sales #business Tips on how to improve email conversion rates: http:// ow.ly/mtc630jikRS pic.twitter.com/7MQifMuo86";;;#email #personalization #prospect #product #ColdEmailing #spam #productivity #communication #sales #business;"981607536452399106";https://twitter.com/firefliesai/status/981607536452399106
firefliesai;2018-04-03 17:00;0;0;"Everyday, #salespeople dedicate countless hours to weeding through#emails and drafting an endless number of emails to #prospects . While this may feel effective, the person receiving the email may not actually open it. #ColdEmailing #spam See more: http:// ow.ly/DZHW30jikMg pic.twitter.com/NianwbhNoI";;;#salespeople #emails #prospects #ColdEmailing #spam;"981275229589852160";https://twitter.com/firefliesai/status/981275229589852160
firefliesai;2018-04-03 15:00;0;0;"Is #emailing truly a dead form of #communication for #salespeople ? With the newest forms of #socialmedia and advanced technology of communication, has emailing become a complete waste of time? The answer is yes, and here’s why. http:// ow.ly/mtc630jikRS";;;#emailing #communication #salespeople #socialmedia;"981245033197207552";https://twitter.com/firefliesai/status/981245033197207552
firefliesai;2018-04-02 17:00;0;0;"Tip #9: Personalize your message Customers are more responsive to emails that are customized to their need. A "one size fits all" email is a wasted email. http:// ow.ly/5gyp30jgxRN";;;#9;"980912856064581633";https://twitter.com/firefliesai/status/980912856064581633
firefliesai;2018-04-02 15:00;0;0;"Parkinson’s Law states that people will complete tasks given a time constraint. For example, if you allot an hour, work will be completed in an hour. #meetings #meetingnotes #meetingminutes #actionitems #productivity #business #workplace Read more: http:// ow.ly/wzQB30jbyKA pic.twitter.com/ZWMIbMzhP6";;;#meetings #meetingnotes #meetingminutes #actionitems #productivity #business #workplace;"980882709387112448";https://twitter.com/firefliesai/status/980882709387112448
firefliesai;2018-03-30 20:00;0;0;"Many #meetings can simply be condensed into a daily summary email, however many companies fail to consider this alternative and continue to schedule more meetings. #distractions #attention #meetingnotes #business #productivity #workplace See more: http:// ow.ly/dONS30jbAiM pic.twitter.com/Q8iUm6btAz";;;#meetings #distractions #attention #meetingnotes #business #productivity #workplace;"979871088342720512";https://twitter.com/firefliesai/status/979871088342720512
firefliesai;2018-03-30 17:00;0;0;"Do you know that the #distraction in #meetings also follows the domino effect? If one person gets distracted by a message, the one sitting next to him is also distracted as he has to watch the nearby person checking his phone. Learn more: http:// ow.ly/oZJ430jbAuj pic.twitter.com/tjrPckri0Q";;;#distraction #meetings;"979825836277878784";https://twitter.com/firefliesai/status/979825836277878784
firefliesai;2018-03-30 15:01;0;0;"Whether it’s choosing to do work during #meetings or becoming distracted thinking about all of your responsibilities, meetings begin to feel like a chore. #distractions #attention #meetingnotes #business #productivity #workplace See the full article http:// ow.ly/wgys30jbA3T pic.twitter.com/C137crBEFT";;;#meetings #distractions #attention #meetingnotes #business #productivity #workplace;"979795741010022400";https://twitter.com/firefliesai/status/979795741010022400
firefliesai;2018-03-29 17:00;0;2;"There is a firm belief that humans can solve the last mile problem and AI can help humans do it at scale. In many ways executive assistants happen to be customers of AI services. #AI #AIassistant #artificialintelligence #SaaS #HaaS #business #productivity http:// ow.ly/Cj5530je16g";;;#AI #AIassistant #artificialintelligence #SaaS #HaaS #business #productivity;"979463339809165313";https://twitter.com/firefliesai/status/979463339809165313
firefliesai;2018-03-29 15:01;0;0;"Unless you are not humans, you probably lose track of things discussed in the meeting while scrolling your Facebook feed. #meetingduration #distractions #multitasking #attention #meetingnotes #meetingminute #business #productivity #workplace Read more: http:// ow.ly/wgys30jbA3T pic.twitter.com/mfk2iBat5S";;;#meetingduration #distractions #multitasking #attention #meetingnotes #meetingminute #business #productivity #workplace;"979433366884966400";https://twitter.com/firefliesai/status/979433366884966400
firefliesai;2018-03-28 20:00;2;1;"One of the most detested tasks of day to day #business is mind-numbingly boring #meetings . Meetings can feel pointless, inefficient, to the point where you simply cannot concentrate. #meetingnotes #business #productivity #workplace Check out 6 reasons http:// ow.ly/dONS30jbAiM pic.twitter.com/fFKFB7GQWI";;;#business #meetings #meetingnotes #business #productivity #workplace;"979146333494837248";https://twitter.com/firefliesai/status/979146333494837248
firefliesai;2018-03-28 17:01;0;0;"Question of the Week: What are some factors that distract us the most in #meetings ? How can we eliminate meeting #distractions and focus on the core value of our meetings? #meetingnotes #business #productivity #workplace Comment below! Read more http:// ow.ly/52Hr30jbzNQ pic.twitter.com/cJAhwnL0Ua";;;#meetings #distractions #meetingnotes #business #productivity #workplace;"979101083242033152";https://twitter.com/firefliesai/status/979101083242033152
firefliesai;2018-03-28 15:01;0;0;"Many topics that could be succinctly explained in minutes often take take thirty minutes, and risk derailing the actual point of the #meeting itself. Keep it short and relevant! #meetingduration #meetingattention #meetingnotes #productivity Read more: http:// ow.ly/CGOv30jbztN pic.twitter.com/COz1zupxVG";;;#meeting #meetingduration #meetingattention #meetingnotes #productivity;"979070899608522752";https://twitter.com/firefliesai/status/979070899608522752
firefliesai;2018-03-27 17:00;0;0;"#Distractions during #meetings can be side conversations, messages, #emails , #SocialMedia notifications, or any boring things that suddenly become extremely attractive at the time of meetings. #meetingdistractions #productivity #workplace See more: http:// ow.ly/h0fC30jbyRS pic.twitter.com/TajcMObzUO";;;#Distractions #meetings #emails #SocialMedia #meetingdistractions #productivity #workplace;"978738519102443520";https://twitter.com/firefliesai/status/978738519102443520
firefliesai;2018-03-27 15:00;2;1;"While #meetings are intended to be a place of #DecisionMaking and execution, they usually result in the dreaded inverse... delayed decision making. Why is it so hard to pay attention? #meetingnotes #actionitems #productivity #workplace http:// ow.ly/h0fC30jbyRS";;;#meetings #DecisionMaking #meetingnotes #actionitems #productivity #workplace;"978708354963996672";https://twitter.com/firefliesai/status/978708354963996672
firefliesai;2018-03-26 17:00;0;1;""Many #meetings end up being as valuable as a Snapchat post--people talk, the ideas quickly disappear into the ether with no outcomes or #followup ." Outsourcing the #notetaking to an #AI bot is exactly what people need. #meetingnotes #productivity http:// ow.ly/79UG30j95Cl";;;#meetings #followup #notetaking #AI #meetingnotes #productivity;"978376267635585033";https://twitter.com/firefliesai/status/978376267635585033
firefliesai;2018-03-26 15:01;0;0;"Should we believe in a future where AI will surpass human intelligence, making calculations and deductions no human could ever hope to accomplish? #AI #ArtificialIntelligence #HumanIntelligence #AIassistant #SaaS #VirtualAssistant Read more: http:// ow.ly/JCfE30j46Ss pic.twitter.com/FCQhTyu2aj";;;#AI #ArtificialIntelligence #HumanIntelligence #AIassistant #SaaS #VirtualAssistant;"978346096694001664";https://twitter.com/firefliesai/status/978346096694001664
krish_ramineni;2018-03-26 13:29;1;0;"I wonder how many times Fred @firefliesai hears this every day @sudotong https:// twitter.com/MCSeto/status/ 977177169964257281 …";;@firefliesai @sudotong;;"978323033516421120";https://twitter.com/krish_ramineni/status/978323033516421120
krish_ramineni;2018-03-26 13:26;0;2;"Time to cut out the bs from #meetings https:// mashable.com/2018/03/26/off ice-meetings-phrases/?utm_cid=mash-com-fb-main-link#8DMUMhYvD9qk … #realwork @firefliesai #conferencecall";;@firefliesai;#meetings #8DMUMhYvD9qk #realwork #conferencecall;"978322279158366208";https://twitter.com/krish_ramineni/status/978322279158366208
firefliesai;2018-03-23 20:00;0;1;"Productivity = Human vs. AI Bot Productivity = Human^(AI Bot) There's no doubt that human productivity is raised to the infinite power thanks to the help of #AIAssistants . #AI #ArtificialIntelligence #AIBots #SaaS http:// ow.ly/zEyR30j13oC";;;#AIAssistants #AI #ArtificialIntelligence #AIBots #SaaS;"977334374390677504";https://twitter.com/firefliesai/status/977334374390677504
firefliesai;2018-03-23 17:01;0;0;"Our #AI today will take care of your meeting notes and in the future all data entry tasks. #AIassistant #AIBots #SaaS Read the full article about AI: http:// ow.ly/JCfE30j46Ss pic.twitter.com/Rj47dZvm6p";;;#AI #AIassistant #AIBots #SaaS;"977289173391544320";https://twitter.com/firefliesai/status/977289173391544320
firefliesai;2018-03-23 15:01;0;0;""AI is not hitting a target more accurately than a human; it’s hitting a target a human can’t even see and didn’t know existed." Is that true? #AI #ArtificialIntelligence #HumanIntelligence #AIassistant #AIBots #SaaS #VirtualAssistant See more: http:// ow.ly/JCfE30j46Ss pic.twitter.com/96nhUgvyrt";;;#AI #ArtificialIntelligence #HumanIntelligence #AIassistant #AIBots #SaaS #VirtualAssistant;"977259073942032384";https://twitter.com/firefliesai/status/977259073942032384
firefliesai;2018-03-22 20:00;0;1;"10 minute meetings are not just a work productivity hack. They have a great psychological impact on how you treat your time and other people’s time. #meetings #meetingduration #meetingcost #timeconsuming #productivity #business Read the full article http:// ow.ly/tldz30j6MBn";;;#meetings #meetingduration #meetingcost #timeconsuming #productivity #business;"976971873002184707";https://twitter.com/firefliesai/status/976971873002184707
firefliesai;2018-03-22 17:01;0;0;"#ArtificialIntelligence defined by Google How do you define Artificial Intelligence? #AI #HumanIntelligence #AIassistant #AIBots #SaaS #VirtualAssistant At Fireflies, we view AI as a synthetic reproduction of basic human intelligence. Read more http:// ow.ly/JCfE30j46Ss pic.twitter.com/BIkIVzMUWi";;;#ArtificialIntelligence #AI #HumanIntelligence #AIassistant #AIBots #SaaS #VirtualAssistant;"976926801741131778";https://twitter.com/firefliesai/status/976926801741131778
firefliesai;2018-03-22 15:00;0;0;"What's so exciting about Voice enabled AI assistants? What is the impact they will have on the workplace? Will the make their way into enterprise soon? #AI #voiceAI #AIassistant Listen to our 1st episode SoundCloud: http:// ow.ly/DkAZ30j5wAz iTunes: http:// ow.ly/v21m30j5y2K";;;#AI #voiceAI #AIassistant;"976896513430441987";https://twitter.com/firefliesai/status/976896513430441987
firefliesai;2018-03-21 21:05;0;0;"Someday we may not differentiate between ‘Artificial Intelligence’—replicating human intelligence—and ‘Quantum Intelligence’, the uber-mensch achievement of AI. #AI #ArtificialIntelligence #HumanIntelligence #AIassistant Read about the future of AI http:// ow.ly/5zYH30j5xqP pic.twitter.com/5jVU5iUzNo";;;#AI #ArtificialIntelligence #HumanIntelligence #AIassistant;"976625814174302208";https://twitter.com/firefliesai/status/976625814174302208
firefliesai;2018-03-21 17:01;0;1;"Question of the Week: Is #AI a virtual assistant that helps leverage human productivity? Or AI can do more than that? #ArtificialIntelligence #HumanIntelligence #AIassistant #AIBots #SaaS #VirtualAssistant Comment your thoughts! Read the discussion http:// ow.ly/JCfE30j46Ss pic.twitter.com/ViAVKh7Gbj";;;#AI #ArtificialIntelligence #HumanIntelligence #AIassistant #AIBots #SaaS #VirtualAssistant;"976564409043771392";https://twitter.com/firefliesai/status/976564409043771392
firefliesai;2018-03-21 15:01;0;0;"The process also requires #AI to learn, to improve its accuracy and to better understand the intricacies peculiar to a particular domain—sales calls being rather different than a technical #meeting between engineers. #meetingnotes #notetaker Learn more: http:// ow.ly/JCfE30j46Ss pic.twitter.com/BLt68mvOEV";;;#AI #meeting #meetingnotes #notetaker;"976534340476731392";https://twitter.com/firefliesai/status/976534340476731392
