username;date;retweets;favorites;text;geo;mentions;hashtags;id;permalink
VodafoneUKBiz;2018-11-06 05:34;1;0;"10 years ago #connectivity meant having one landline. Read how @Fluidly is taking advantage of today's rapidly evolving technology to stay connected to their customers: https:// vodafone.uk/2yNQXKT pic.twitter.com/zPQQqnSor9";;@Fluidly;#connectivity;"1059755779803303936";https://twitter.com/VodafoneUKBiz/status/1059755779803303936
Fluidly;2018-11-05 10:38;0;0;"Pure founder Spencer Craig: ‘You have to be all over the cash position, or you are dead’ http:// bit.ly/2B6F06d pic.twitter.com/SHW3X2qqLk";;;;"1059470116369383425";https://twitter.com/Fluidly/status/1059470116369383425
JohnnieBall_;2018-11-05 09:01;0;6;"Mon-Fri: Train #AI systems Sat-Sun: Train to be Viking! Had great fun #axethrowing @WhistlePunksUK on the weekend! Frontrunner for @Fluidly Christmas Social! pic.twitter.com/gdNe3Bf9K7";;@WhistlePunksUK @Fluidly;#AI #axethrowing;"1059445710800728064";https://twitter.com/JohnnieBall_/status/1059445710800728064
Fluidly;2018-11-05 05:29;0;1;"Come and see Fluidly at #Xerocon ! We were thrilled to be named a @WiredUK Top 100 European Startup. See us at stand B3 to find out why. pic.twitter.com/9TOk1T4CXL";;@WiredUK;#Xerocon;"1059392139539427328";https://twitter.com/Fluidly/status/1059392139539427328
Fluidly;2018-11-04 12:45;0;1;"Sweat the model, watch the cash - how @PureMadeForYou founder @PureSpen won £6.8m from Whitbread http:// bit.ly/2B6F06d pic.twitter.com/qE8K6j5dwD";;@PureMadeForYou @PureSpen;;"1059139551124471808";https://twitter.com/Fluidly/status/1059139551124471808
Fluidly;2018-11-04 07:41;0;0;"How to calculate your creditor days and why they're important for your business! https:// bit.ly/2BUqGhT";;;;"1059063170730463233";https://twitter.com/Fluidly/status/1059063170730463233
Fluidly;2018-11-03 08:52;0;1;"Here’s our overview of the best way to evaluate credit control software, so you opt for the best solution for your business https:// bit.ly/2HgjkaS";;;;"1058703352396165121";https://twitter.com/Fluidly/status/1058703352396165121
Fluidly;2018-11-02 13:19;2;0;"Ever wondered what Debtor Days are and how to calculate them? Look no further with our time and stress saving Debtor Days Calculator! All your problems have been solved... https:// bit.ly/2NHhK4a";;;;"1058408353326604288";https://twitter.com/Fluidly/status/1058408353326604288
Fluidly;2018-11-02 10:08;0;1;"Come and see why Fluidly is @AWEBExcellence 's Innovation of the Year at #Xerocon - stand B3! pic.twitter.com/4kpZKaSEdt";;@AWEBExcellence;#Xerocon;"1058360166108815360";https://twitter.com/Fluidly/status/1058360166108815360
Ostrichcredit;2018-11-02 09:26;1;0;"The latest Credit Control News! https:// paper.li/e-1531142583?e dition_id=f7b0fdc0-dea2-11e8-bcb4-0cc47a0d1605 … Thanks to @Fluidly @Creditcontrol @rudijansenaccoa #creditcontrol #identityverification";;@Fluidly @Creditcontrol @rudijansenaccoa;#creditcontrol #identityverification;"1058349746220396546";https://twitter.com/Ostrichcredit/status/1058349746220396546
Fluidly;2018-11-02 09:13;0;0;"Darren Glanville, Head of Operations at Valued Accountancy, tells us how advice on financial performance, cashflow forecasting and enhanced software processes are all key to Valued’s conversations with their business clients. https:// bit.ly/2oXDfjj";;;;"1058346481655144448";https://twitter.com/Fluidly/status/1058346481655144448
will_wjk;2018-11-01 14:00;2;4;"Indeed the official launch of the Centre was in April 2015. We have several ongoing research projects, sponsored by the likes of @blockchain , @OVioHQ & Global Advisors and Innovate UK grants with partners such as http:// Alice.si , @Film_Chain and http:// Breedr.co .";;@blockchain @OVioHQ @Film_Chain;;"1058056238095831042";https://twitter.com/will_wjk/status/1058056238095831042
API_Economics;2018-11-01 13:46;0;4;"The centre was actually founded in 2014 and I am the Co-Director along with @will_wjk . @imperialcollege had the first centre on #cryptocurrency and #blockchain in Europe! :) @ImperialBiz";;@will_wjk @imperialcollege @ImperialBiz;#cryptocurrency #blockchain;"1058052772925526017";https://twitter.com/API_Economics/status/1058052772925526017
TargetGroupLtd;2018-11-01 13:05;5;8;"5 things to know about the future of #money & #finance https://www. wired.co.uk/article/five-t rends-future-of-money … by @VargheseSanjana @WiredUK feat. @hugocornejo @monzo @ChadWestTweets @RevolutApp @imrangulam @UKOpenBanking @e_rossiello @BitPesa @API_Economics @tryflux @OvalMoney @canopyrent @Fluidly @getcoconut pic.twitter.com/9NmOBTw5vk";;@VargheseSanjana @WiredUK @hugocornejo @monzo @ChadWestTweets @RevolutApp @imrangulam @UKOpenBanking @e_rossiello @BitPesa @API_Economics @tryflux @OvalMoney @canopyrent @Fluidly @getcoconut;#money #finance;"1058042256568082432";https://twitter.com/TargetGroupLtd/status/1058042256568082432
Fluidly;2018-11-01 11:50;0;0;"Better credit control procedures for modern businesses http:// bit.ly/2BlZYxQ pic.twitter.com/aKrUvD7HWg";;;;"1058023566086754305";https://twitter.com/Fluidly/status/1058023566086754305
Fluidly;2018-11-01 06:49;0;1;"The importance of developing a flexible approach to cashflow forecasting http:// bit.ly/2tOuhtF";;;;"1057947744000790528";https://twitter.com/Fluidly/status/1057947744000790528
sid_marinako;2018-10-31 15:14;3;10;"So excited and grateful to have been shortlisted as a Tech Star in the @SyncDevelopHER awards thanks to my secret nomination by my @Fluidly colleagues Thanks masses! Really looking forward to the awards ceremony on 28/11 #womenintech #DevelopHERAwards https:// developherawards.com/shortlist2018/";;@SyncDevelopHER @Fluidly;#womenintech #DevelopHERAwards;"1057712401645273089";https://twitter.com/sid_marinako/status/1057712401645273089
reynolds_bec;2018-10-31 10:56;1;5;"Super stoked that @Fluidly 's very own @sid_marinako and Emily have been shortlisted for @SyncDevelopHER awards at the end of next month";;@Fluidly @sid_marinako @SyncDevelopHER;;"1057647553876029441";https://twitter.com/reynolds_bec/status/1057647553876029441
Fluidly;2018-10-31 10:25;0;1;"Come and see us at #Xerocon ! We're excited to chat about why cashflow forecasting is the future for you and your clients There may even be notebooks! Find out more about us: https:// bit.ly/2qiQdsi pic.twitter.com/C6IsCNxMin";;;#Xerocon;"1057639763669204994";https://twitter.com/Fluidly/status/1057639763669204994
axiscorporate;2018-10-31 07:50;1;3;"Key Takeaways from our breakfast briefing - Change the future of SME Banking – RBS Capability and Innovation Fund Alternative Remedies Package (ARP) https:// lnkd.in/ezx9fZB #SMEs @SMEFinanceForum @SMEBankingClub @ICAEW_BAS @Fluidly @duedil @SwoopFunding @co pic.twitter.com/nO1gl5Ld04";;@SMEFinanceForum @SMEBankingClub @ICAEW_BAS @Fluidly @duedil @SwoopFunding @co;#SMEs;"1057600602178502657";https://twitter.com/axiscorporate/status/1057600602178502657
Fluidly;2018-10-31 06:08;0;1;"Looking to the future of accounting - automated forecasting and avoiding cashflow issues https:// bit.ly/2GDMAbg";;;;"1057575115146346496";https://twitter.com/Fluidly/status/1057575115146346496
Fluidly;2018-10-30 09:38;0;4;"Budgeting, cashflow forecasting and scenarios http:// bit.ly/2sSynRk";;;;"1057265478941466624";https://twitter.com/Fluidly/status/1057265478941466624
CommsBreakdown;2018-10-30 06:22;0;0;"Top #cashflow tips from the team @Fluidly https:// twitter.com/Fluidly/status /1057211015681753088 …";;@Fluidly;#cashflow;"1057216277947781120";https://twitter.com/CommsBreakdown/status/1057216277947781120
Fluidly;2018-10-30 06:02;0;1;"Wondering how you can improve your #cashflow ? Look no further. These are our top tips https:// bit.ly/2wagVJJ";;;#cashflow;"1057211015681753088";https://twitter.com/Fluidly/status/1057211015681753088
Fluidly;2018-10-29 10:22;0;1;"What should you be including in your invoices to ensure prompt payment? Includes our free invoice templates! https:// bit.ly/2CxpQb0";;;;"1056914105372721154";https://twitter.com/Fluidly/status/1056914105372721154
Fluidly;2018-10-29 06:42;0;0;"This week on the Fluidly blog - what is a Chart of Accounts? And what are nominal ledgers? https:// bit.ly/2Jj6k5i";;;;"1056858793760489472";https://twitter.com/Fluidly/status/1056858793760489472
Foxe_News;2018-10-28 13:14;1;2;"Small business accounting teams...tell @Fluidly what you think!! https:// twitter.com/Fluidly/status /1056588277241823233 …";;@Fluidly;;"1056595158442143746";https://twitter.com/Foxe_News/status/1056595158442143746
Fluidly;2018-10-28 12:47;0;1;"FLUIDLY NEEDS YOU ... to take part in our user research! https:// bit.ly/2MLcAnd";;;;"1056588277241823233";https://twitter.com/Fluidly/status/1056588277241823233
Fluidly;2018-10-28 08:09;0;0;"A retailer's guide to key financial metrics you should be tracking within your business http:// bit.ly/2BE5z2p pic.twitter.com/sQXGJjZX80";;;;"1056518378389671937";https://twitter.com/Fluidly/status/1056518378389671937
Fluidly;2018-10-27 10:19;0;0;"The importance of meaningful data and actionable insights #cashflow http:// bit.ly/2BNk18c";;;#cashflow;"1056188595961294848";https://twitter.com/Fluidly/status/1056188595961294848
Fluidly;2018-10-27 06:01;1;1;"How effective is your credit control policy? Does your company even have one? Get your debtors in order with our free credit control policy template http:// bit.ly/2EqusMw";;;;"1056123815011454976";https://twitter.com/Fluidly/status/1056123815011454976
Fluidly;2018-10-26 10:52;1;0;"Automate and optimise your credit control in 2018 http:// bit.ly/2EAIlfi";;;;"1055834672301834240";https://twitter.com/Fluidly/status/1055834672301834240
Fluidly;2018-10-26 07:15;0;0;"Artificial Intelligence and Accounting - why you should be excited! https:// bit.ly/2LMK6ZE";;;;"1055780061532557312";https://twitter.com/Fluidly/status/1055780061532557312
Fluidly;2018-10-25 05:56;0;0;"'In this culture of endemic late payment, it’s vital to have a credit control procedure set up' http:// bit.ly/2BlZYxQ pic.twitter.com/QuXXQ0iOxP";;;;"1055397584888569856";https://twitter.com/Fluidly/status/1055397584888569856
Fluidly;2018-10-24 05:29;0;2;"What’s credit control? And why does my SME need to know about it? http:// bit.ly/2B3dKEE pic.twitter.com/JI7BWpuzY0";;;;"1055028529904209926";https://twitter.com/Fluidly/status/1055028529904209926
KendallCRE;2018-10-24 01:27;0;1;"> ICYMI @Propertyshe @antonyslumbers";;@Propertyshe @antonyslumbers;;"1054967608657752064";https://twitter.com/KendallCRE/status/1054967608657752064
Fluidly;2018-10-23 08:03;0;2;"To direct or to indirect cashflow forecast, that is the question. http:// bit.ly/2u5kxeV";;;;"1054704900242882560";https://twitter.com/Fluidly/status/1054704900242882560
robins_rebecca;2018-10-23 05:22;3;2;"Word up on London #startups #Feedback , #femcare , #finance and flowers @Fluidly @helloelvie @elliptic @BloomandWild https://www. wired.co.uk/article/best-s tartups-in-london-2018 … Pithy piece @olifranklin . @Interbrand @CSpaceGlobal";;@Fluidly @helloelvie @elliptic @BloomandWild @olifranklin @Interbrand @CSpaceGlobal;#startups #Feedback #femcare #finance;"1054664440388509697";https://twitter.com/robins_rebecca/status/1054664440388509697
Fluidly;2018-10-22 08:51;0;0;"Reduce stress, grow more, save time - do it all with these 6 @Xero add-ons: @GoCardless , @ReceiptBank , @iwoca , @Zapier , @MinuteDock & @Fluidly http:// bit.ly/2A2UNxk pic.twitter.com/0lY1TMUgEe";;@Xero @GoCardless @ReceiptBank @iwoca @Zapier @MinuteDock @Fluidly;;"1054354555578785792";https://twitter.com/Fluidly/status/1054354555578785792
Fluidly;2018-10-22 05:10;0;0;"We love efficiency! How to use #accountingtechnology to boost your efficiency: https:// bit.ly/2uq3pxk";;;#accountingtechnology;"1054298832480206848";https://twitter.com/Fluidly/status/1054298832480206848
Fluidly;2018-10-21 11:48;0;0;"Credit control software to get you paid faster and save time. Forecast your cash collections and see the future http:// bit.ly/2oqK39l";;;;"1054036633065013248";https://twitter.com/Fluidly/status/1054036633065013248
Fluidly;2018-10-21 07:10;0;0;"How to understand your clients - what is marketing segmentation? https:// bit.ly/2MpuZme";;;;"1053966676125982722";https://twitter.com/Fluidly/status/1053966676125982722
PriscilaBala;2018-10-20 11:30;0;0;". @Fluidly is designed to help small & medium businesses manage their cashflow. Its #SaaS platform helps #entrepreneurs track invoices & manage collections, & uses #MachineLearning to forecast future cashflow. #OVPortfolio http:// ow.ly/1XgW30me9wf";;@Fluidly;#SaaS #entrepreneurs #MachineLearning #OVPortfolio;"1053669742370787328";https://twitter.com/PriscilaBala/status/1053669742370787328
Fluidly;2018-10-20 07:24;0;0;"Take control of planning for your business' financial future, including thoughts from our friends over at @raedanCA http:// bit.ly/2EI7G7b";;@raedanCA;;"1053607761555132417";https://twitter.com/Fluidly/status/1053607761555132417
OctopusVentures;2018-10-20 06:30;3;6;". @Fluidly is designed to help small & medium businesses manage their cashflow. Its #SaaS platform helps #entrepreneurs track invoices & manage collections, & uses #MachineLearning to forecast future cashflow. #OVPortfolio http:// ow.ly/Nd8F30mh1fk";;@Fluidly;#SaaS #entrepreneurs #MachineLearning #OVPortfolio;"1053594264771461120";https://twitter.com/OctopusVentures/status/1053594264771461120
Fluidly;2018-10-19 12:39;0;0;"How do you effectively get your #invoices paid on time? Use our free payment reminder templates of course! https:// bit.ly/2IR87tj";;;#invoices;"1053324684606038016";https://twitter.com/Fluidly/status/1053324684606038016
sid_marinako;2018-10-19 05:59;0;8;"My last day at @Fluidly ... How amazing is this setting to welcome me first thing in the morning and how proud I am to have worked with such an awesome team Super thankful for everything I have learned and ready for all the things that are coming up next pic.twitter.com/cQy9s5PKA7";;@Fluidly;;"1053224137903296513";https://twitter.com/sid_marinako/status/1053224137903296513
Fluidly;2018-10-19 05:11;0;0;"What’s credit control? And why does my SME need to know about it? http:// bit.ly/2B3dKEE pic.twitter.com/achk715Kdb";;;;"1053212001739128832";https://twitter.com/Fluidly/status/1053212001739128832
Fluidly;2018-10-18 10:55;0;0;"Growing by numbers in retail: what metrics can help businesses go for the win http:// bit.ly/2BE5z2p pic.twitter.com/OHCluvTm8w";;;;"1052936132701409280";https://twitter.com/Fluidly/status/1052936132701409280
Fluidly;2018-10-18 05:17;0;0;"Powering your cashflow forecasts with data and AI by @Fluidly 's Chief Data Scientist @JohnnieBall_ http:// bit.ly/2EPun5r";;@Fluidly @JohnnieBall_;;"1052851163392032768";https://twitter.com/Fluidly/status/1052851163392032768
Fluidly;2018-10-17 05:57;0;0;"5 tips for advising your clients on how to improve their cashflow http:// bit.ly/2E1Wpyh";;;;"1052498796658257920";https://twitter.com/Fluidly/status/1052498796658257920
Fluidly;2018-10-16 05:49;0;1;"How to create a credit control policy (free template included) http:// bit.ly/2EqusMw";;;;"1052134460190273537";https://twitter.com/Fluidly/status/1052134460190273537
Fluidly;2018-10-15 10:09;0;0;"@ES_Entrepreneur shares tips for smarter financing including thoughts on convertible loan notes and EIS http:// bit.ly/2DjntbT";;@ES_Entrepreneur;;"1051837418389872641";https://twitter.com/Fluidly/status/1051837418389872641
Fluidly;2018-10-15 05:26;0;0;"Emma Sinclair MBE reveals the best piece of cashflow advice she ever received http:// bit.ly/2DjntbT";;;;"1051766251469586432";https://twitter.com/Fluidly/status/1051766251469586432
Fluidly;2018-10-14 09:17;0;1;"Open Banking, SEO, artificial intelligence & sprints: an internship http:// bit.ly/2zsPyMd by @ShingiMararike pic.twitter.com/HnKc7WuiDL";;@ShingiMararike;;"1051462080342175744";https://twitter.com/Fluidly/status/1051462080342175744
Fluidly;2018-10-13 07:19;0;0;"5 reasons why your manual cashflow management system isn’t working http:// bit.ly/2Bms34x pic.twitter.com/JSKW8layZN";;;;"1051069882828230657";https://twitter.com/Fluidly/status/1051069882828230657
Fluidly;2018-10-12 05:52;0;0;"Gain an understanding of how cashflow forecasting could transform your business https:// bit.ly/2pLN7gD";;;;"1050685731151040512";https://twitter.com/Fluidly/status/1050685731151040512
JohnnieBall_;2018-10-11 14:29;0;3;"Thanks Paco and great to see you!";;;;"1050453277190557696";https://twitter.com/JohnnieBall_/status/1050453277190557696
pacoid;2018-10-11 12:19;2;2;"by taking a data-driving approach, @Fluidly can test many different "lenses" for slicing the time-series analysis of SME financial forecasting";;@Fluidly;;"1050420728032583680";https://twitter.com/pacoid/status/1050420728032583680
pacoid;2018-10-11 12:08;2;8;". @JohnnieBall_ @fluidly #TheAIConf using AI to identify cashflow problems among small businesses — and enormous problem with very real social consequences, and great upside pic.twitter.com/xherNu6dDD";;@JohnnieBall_ @fluidly;#TheAIConf;"1050417898857136128";https://twitter.com/pacoid/status/1050417898857136128
Fluidly;2018-10-11 08:33;0;0;"Better understand the key drivers of your business, to allow you to make more informed financial decisions #intelligentcashflow https:// bit.ly/2DSBuZO";;;#intelligentcashflow;"1050363671778664449";https://twitter.com/Fluidly/status/1050363671778664449
Fluidly;2018-10-10 08:55;0;0;"Budgeting, cashflow forecasting and scenario planning - how to avoid confusing the terms and using them for your business http:// bit.ly/2sSynRk";;;;"1050006908252430336";https://twitter.com/Fluidly/status/1050006908252430336
Fluidly;2018-10-10 05:06;1;0;"Sold on cloud accounting software but not sure how to go about convincing your clients? Have a read: https:// bit.ly/2BlQhAf pic.twitter.com/BQNnCWwDXL";;;;"1049949376196567040";https://twitter.com/Fluidly/status/1049949376196567040
Fluidly;2018-10-09 09:30;0;0;"SEO, artificial intelligence and breakfast: interning at Fluidly http:// bit.ly/2zsPyMd by @ShingiMararike";;@ShingiMararike;;"1049653422826381314";https://twitter.com/Fluidly/status/1049653422826381314
ClaireHarropLaw;2018-10-09 08:27;0;0;"And the fifth is cash flow management and forecasting by @Fluidly . Keen to understand what is different to traditional invoice discounting and factoring (disclaimer - that's what my dad used to do!)";;@Fluidly;;"1049637406432010241";https://twitter.com/ClaireHarropLaw/status/1049637406432010241
Fluidly;2018-10-09 05:18;0;0;"Figuring out exactly when money is moving in or out can be hugely stressful for businesses - make a cashflow forecast for control, certainty and confidence. http:// bit.ly/2BJwnO7";;;;"1049589927640477696";https://twitter.com/Fluidly/status/1049589927640477696
TheFinTech50;2018-10-09 04:04;11;33;"Flying the flag in a super hot sector, some of the Innovators, founders and leaders featured in this year's #FinTech50 @Azimo @cwinesLondon @aqmetrics @SuadeLabs @Darktrace @Fluidly @StarlingBank @pensionbee #AdaLovelaceDay pic.twitter.com/7jVnrq5ej3";;@Azimo @cwinesLondon @aqmetrics @SuadeLabs @Darktrace @Fluidly @StarlingBank @pensionbee;#FinTech50 #AdaLovelaceDay;"1049571166954934272";https://twitter.com/TheFinTech50/status/1049571166954934272
Fluidly;2018-10-08 10:59;0;2;"Fed up with late payments? Automate your credit control to get paid faster and save hours each week http:// bit.ly/2oqK39l";;;;"1049313425778720768";https://twitter.com/Fluidly/status/1049313425778720768
Fluidly;2018-10-08 07:23;0;0;"Cashflow forecasts: what are they and why are they important? http:// bit.ly/2EawhBx";;;;"1049259010128576513";https://twitter.com/Fluidly/status/1049259010128576513
OutserveWeb;2018-10-08 05:30;0;0;"#Xerocon by @Xero gathers thousands of industry insiders! Find out more about the experience by watching a video our Managing Director took at Xerocon last year with Caroline from @Fluidly ! #Xerocon #Xero #London #Fluidly #Cashflowhttp://ow.ly/nw5230l8UcN";;@Xero @Fluidly;#Xerocon #Xerocon #Xero #London #Fluidly #Cashflowhttp;"1049230567974342661";https://twitter.com/OutserveWeb/status/1049230567974342661
Fluidly;2018-10-07 03:40;0;0;"@pbulpitt adds his thoughts on how to proactively help your clients to avoid classic SME cashflow problems http:// bit.ly/2FlF141";;@pbulpitt;;"1048840558377144322";https://twitter.com/Fluidly/status/1048840558377144322
TenzingPE;2018-10-06 08:54;1;3;"Congrats";;;;"1048557067102031872";https://twitter.com/TenzingPE/status/1048557067102031872
Fluidly;2018-10-06 07:07;0;0;"Operating cashflow: a definition https:// bit.ly/2G5zj67";;;;"1048530298210856961";https://twitter.com/Fluidly/status/1048530298210856961
VicaManos;2018-10-05 17:32;0;2;"Go team @Fluidly !! https:// twitter.com/Foxe_News/stat us/1048259176189837313 …";;@Fluidly;;"1048325027995762689";https://twitter.com/VicaManos/status/1048325027995762689
Foxe_News;2018-10-05 13:10;0;10;"Boom!!! Congratulations @Fluidly team! https:// twitter.com/AWEBExcellence /status/1048160632061743105 …";;@Fluidly;;"1048259176189837313";https://twitter.com/Foxe_News/status/1048259176189837313
Fluidly;2018-10-05 12:45;0;0;"Here's how to calculate your Days Sales Outstanding (DSO) number: https:// bit.ly/2HSuIcd";;;;"1048252841704525824";https://twitter.com/Fluidly/status/1048252841704525824
Fluidly;2018-10-05 08:33;0;0;"What is a cashflow forecast and why is it important? http:// bit.ly/2BJwnO7 @JohnnieBall_ gives an overview";;@JohnnieBall_;;"1048189488248344577";https://twitter.com/Fluidly/status/1048189488248344577
AWEBExcellence;2018-10-05 06:39;4;24;"And the award for Innovation of the Year goes to, @Fluidly ! Congratulations on winning both a survey award and a judged award! #AE18 pic.twitter.com/aASg0Rfgny";;@Fluidly;#AE18;"1048160632061743105";https://twitter.com/AWEBExcellence/status/1048160632061743105
AWEBExcellence;2018-10-05 06:29;0;1;"Congratulations to @Fluidly ! The Forecasting, Planning & Analysis Software of the Year! #AE18 pic.twitter.com/BGaTfgyQA6";;@Fluidly;#AE18;"1048158114661507072";https://twitter.com/AWEBExcellence/status/1048158114661507072
Fluidly;2018-10-04 10:19;1;1;"Why is #cashflow important to #investors ? Excellent question! Find out: https:// bit.ly/2Nq3SbF";;;#cashflow #investors;"1047853702340591618";https://twitter.com/Fluidly/status/1047853702340591618
Fluidly;2018-10-04 05:20;0;1;"5 signs your cashflow management is stuck in the past http:// bit.ly/2Bms34x";;;;"1047778543533477888";https://twitter.com/Fluidly/status/1047778543533477888
Chiene_digital;2018-10-04 03:36;4;7;"Great catch up this week with @Fluidly . Excellent app with real potential for our @chieneandtait clients. #cashflow #Forecasting #cloud @Xero @QuickBooksUK";;@Fluidly @chieneandtait @Xero @QuickBooksUK;#cashflow #Forecasting #cloud;"1047752289384091648";https://twitter.com/Chiene_digital/status/1047752289384091648
cplumb;2018-10-03 16:07;1;11;"Team @Fluidly social out doing life drawing tonight! pic.twitter.com/KVQjKJ2S39";;@Fluidly;;"1047578975223144456";https://twitter.com/cplumb/status/1047578975223144456
Fluidly;2018-10-03 07:09;0;0;"Predicting your future cash: cashflow projection vs cashflow forecasts https:// bit.ly/2GYJH0L";;;;"1047443576962076672";https://twitter.com/Fluidly/status/1047443576962076672
Fluidly;2018-10-02 09:51;0;0;"Better credit control procedures for modern businesses http:// bit.ly/2BlZYxQ pic.twitter.com/OwKOcWP2nV";;;;"1047122021002428416";https://twitter.com/Fluidly/status/1047122021002428416
Fluidly;2018-10-02 05:05;1;0;"Enough cash to make payroll? Can you take a dividend? Make a cashflow forecast for control, certainty and confidence http:// bit.ly/2BJwnO7";;;;"1047050016806903809";https://twitter.com/Fluidly/status/1047050016806903809
Octopus_UK;2018-10-02 04:46;9;8;"Octopus recently sponsored an @appg_e report titled: Women In Leadership. We spoke to @cplumb founder of @Fluidly and Tania Boler, founder of @helloelvie and asked them to share their experiences. Thanks to @georgewhitehead and @ZoeACastro for their input. https:// octopusgroup.com/insights/turni ng-the-tables-the-women-building-tomorrows-global-businesses/?utm_source=twitter&utm_medium=social&utm_campaign=october_social&utm_content=women-building-tomorrows-business_01102018 … pic.twitter.com/a1iQV8F6iz";;@appg_e @cplumb @Fluidly @helloelvie @georgewhitehead @ZoeACastro;;"1047045238177566720";https://twitter.com/Octopus_UK/status/1047045238177566720
OisforOctopus;2018-10-02 04:42;1;5;"Octopus recently sponsored an @appg_e report titled: Women In Leadership. We spoke to @cplumb founder of @Fluidly and Tania Boler, founder of @helloelvie and asked them to share their experiences. Thanks to @georgewhitehead and @ZoeACastro for their input. https:// octopusgroup.com/insights/turni ng-the-tables-the-women-building-tomorrows-global-businesses/?utm_source=twitter&utm_medium=social&utm_campaign=october_social&utm_content=women-building-tomorrows-business_01102018 … pic.twitter.com/IHLQVho7zn";;@appg_e @cplumb @Fluidly @helloelvie @georgewhitehead @ZoeACastro;;"1047044134299676673";https://twitter.com/OisforOctopus/status/1047044134299676673
AWEBExcellence;2018-10-01 08:50;1;5;"The 2018 Accounting Excellence Award for Innovation of the Year goes to @Fluidly ! Congratulations on winning both a Software survey voted award, and a judged award! A fantastic achievement! #AE18 pic.twitter.com/kvdFr01lWo";;@Fluidly;#AE18;"1046744053151420416";https://twitter.com/AWEBExcellence/status/1046744053151420416
Fluidly;2018-10-01 08:34;1;1;"Using data and AI to power cashflow forecasts http:// bit.ly/2EPun5r";;;;"1046740029354201088";https://twitter.com/Fluidly/status/1046740029354201088
AWEBExcellence;2018-10-01 08:20;2;3;"The award for Forecasting, Planning & Analysis Software of the Year goes to @Fluidly ! Congratulations! #AE18 pic.twitter.com/tBhLoC82Pt";;@Fluidly;#AE18;"1046736492608016385";https://twitter.com/AWEBExcellence/status/1046736492608016385
