username;date;retweets;favorites;text;geo;mentions;hashtags;id;permalink
Accountex;2018-01-16 09:37;8;15;"Accountex speakers & exhibitors - incl @rudijansenaccoa @AmandaCWatts @FUTRLI @gordongilchrist @2020GroupUK @webexpenses @Fluidly & @TheBDAcademy - share their thoughts on what's next for the accounting profession: http://www. accountex.co.uk/2018-beyond-ac counting-industry-insiders-share-thoughts-year-ahead/ … via @accountex";;@rudijansenaccoa @AmandaCWatts @FUTRLI @gordongilchrist @2020GroupUK @webexpenses @Fluidly @TheBDAcademy @accountex;;"953274977503076352";https://twitter.com/Accountex/status/953274977503076352
Fluidly;2018-01-16 09:00;0;0;"Skyrocket your productivity with the best Xero add-ons for 2018 http:// bit.ly/2A2UNxk pic.twitter.com/BOZYtPdJYl";;;;"953265694262616065";https://twitter.com/Fluidly/status/953265694262616065
Fluidly;2018-01-16 07:08;2;3;"6 @Xero add-ons to kickstart 2018: @GoCardless , @ReceiptBank , @iwoca , @Zapier , @MinuteDock & @Fluidly http:// bit.ly/2A2UNxk pic.twitter.com/PfdOBfOKqR";;@Xero @GoCardless @ReceiptBank @iwoca @Zapier @MinuteDock @Fluidly;;"953237626529746944";https://twitter.com/Fluidly/status/953237626529746944
reynolds_bec;2018-01-16 04:00;0;1;"Detail oriented and comms are your thing? Come work with us @Fluidly . Even our job spec gets great praise. https:// twitter.com/sharonodea/sta tus/952997039876472833 …";;@Fluidly;;"953190320480641024";https://twitter.com/reynolds_bec/status/953190320480641024
Fluidly;2018-01-15 17:55;0;1;"Thanks @sharonodea very kind words!";;@sharonodea;;"953037926123884544";https://twitter.com/Fluidly/status/953037926123884544
sharonodea;2018-01-15 15:12;0;9;"Here’s how you write a job ads to appeal to normal, experienced people. Chapeau @Fluidly - other startups take note. https:// docs.google.com/document/d/1sk AbYstpFMmLfAWvhl9yxe_IXV_nAq2K6-zhmqnTH8k/mobilebasic#…";;@Fluidly;#;"952997039876472833";https://twitter.com/sharonodea/status/952997039876472833
Fluidly;2018-01-15 12:23;2;1;"Come work with us at Fluidly! We’re hiring for a Growth Marketing Manager - please do connect if this is you! https:// angel.co/fluidly/jobs/3 18828-growth-marketing-manager …";;;;"952954406722588672";https://twitter.com/Fluidly/status/952954406722588672
Fluidly;2018-01-15 11:37;0;1;"Thanks again! Plus groan at that joke :)";;;;"952942734171615232";https://twitter.com/Fluidly/status/952942734171615232
bluearrayseo;2018-01-15 11:30;0;1;"Pleasure! Glad those Monday blues are scone!";;;;"952941091724169217";https://twitter.com/bluearrayseo/status/952941091724169217
Fluidly;2018-01-15 11:24;1;4;"A lovely afternoon tea here! Thanks @bluearrayseo for the tea, jam and biscuits that inspired this! https:// twitter.com/reynolds_bec/s tatus/952926349567684609 …";;@bluearrayseo;;"952939449066885120";https://twitter.com/Fluidly/status/952939449066885120
HiscoxUK;2018-01-15 09:00;0;3;". @cplumb OBE ,founder of @Fluidly and @FMTalent shares the lessons she's learnt while starting and scaling her business #serialentrepreneur http:// socsi.in/yxcgW pic.twitter.com/ZZgsMH4l0Z";;@cplumb @Fluidly @FMTalent;#serialentrepreneur;"952903430254874624";https://twitter.com/HiscoxUK/status/952903430254874624
Fluidly;2018-01-15 08:03;0;1;"Pure founder Spencer Craig: ‘You have to be all over the cash position, or you are dead’ http:// bit.ly/2B6F06d pic.twitter.com/JBuVQ4dxoi";;;;"952888860693925889";https://twitter.com/Fluidly/status/952888860693925889
MarketInvoice;2018-01-15 06:23;2;5;"Great to be a part of the #StartUp2018 @e_nation conference. Craig Flyer from our partnerships team shared insights on how #SMEs can manage #cashflow on a 'Show me the money" panel hosted by @TideBanking with Raj Shah from @LitchfieldsCA and Simon Smallwood from @Fluidly pic.twitter.com/tLHPnEDFBY";;@e_nation @TideBanking @LitchfieldsCA @Fluidly;#StartUp2018 #SMEs #cashflow;"952863909102456832";https://twitter.com/MarketInvoice/status/952863909102456832
JasonBates;2018-01-13 15:04;0;11;"...and the mandated APIs will be limited to a lowest common denominator of big banking systems. No real-time processing, payments metadata, webhooks, intelligent authorisation decisions, multiple users with multiple sub-accounts, and lots more from big banks even with good APIs";;;;"952270154230099970";https://twitter.com/JasonBates/status/952270154230099970
hyper_ed;2018-01-13 14:51;0;3;"Lovely bit from @AnneBoden";;@AnneBoden;;"952266918186102784";https://twitter.com/hyper_ed/status/952266918186102784
Fluidly;2018-01-13 11:46;0;0;"Five practical tips to boost your cashflow in 2018 http:// bit.ly/2FyxAHl";;;;"952220238610825216";https://twitter.com/Fluidly/status/952220238610825216
JCtheOriginal;2018-01-13 10:26;0;1;"I’d say the probability of google being able to connect you to people who are searching for things like ‘what is open banking’ is high. equally, if your audience hangs out on certain site on the web google can connect. Up to you to know where they hang out.";;;;"952200295274172416";https://twitter.com/JCtheOriginal/status/952200295274172416
JCtheOriginal;2018-01-13 10:20;0;3;"I would say, google ads work better if companies have a clear understanding of who is buying/what they are searching. Not Google’s fault, more on the company side.";;;;"952198608308310016";https://twitter.com/JCtheOriginal/status/952198608308310016
mikekelly85;2018-01-13 09:49;0;3;"Not sure about this. Customers won’t care or comprehend until they need a service that pulls them through the process. TPPs need to concentrate on creating value unlocked by open banking and the rest will fall into place.";;;;"952190874766757888";https://twitter.com/mikekelly85/status/952190874766757888
AnneBoden;2018-01-13 09:31;1;8;"Agreed - I think that there will be firms that are up for the cost, regulation and time needed to become a bank and there will be FinTech's using the API's but for these entities the revenue stream is very limited.";;;;"952186403177287683";https://twitter.com/AnneBoden/status/952186403177287683
dgwbirch;2018-01-13 09:28;0;3;"I understand this Anne but my point was that they don’t need to be a bank now that they can use bank APIs. So banks end up with the liabilities and the burden of regulation, and Facebook can replace Pingit/Paym in about a week.";;;;"952185663478272000";https://twitter.com/dgwbirch/status/952185663478272000
AnneBoden;2018-01-13 08:56;6;19;"Everyone underestimates what it takes to become a bank & how long it takes for regulation to be implemented e.g. I published this about PSD2 Oct 2015 - take a look and see what has changed https://www. starlingbank.com/blog/explainin g-psd2-without-tlas-tough/ …";;;;"952177485822791680";https://twitter.com/AnneBoden/status/952177485822791680
sohear;2018-01-13 08:55;0;2;"I think he said the aim is to get that to £12.";;;;"952177250534854659";https://twitter.com/sohear/status/952177250534854659
_AlexSherwood;2018-01-13 08:53;0;1;"@t_blom said at the beginning of last year that Monzo would be losing £20 per user, per year once the current accounts launch (& presumably the overdrafts are rolled out), that seems like a gap that the marketplace’s referral fees could cover. https:// community.monzo.com/t/competitor-u pdate/5861/169?u=alexs …";;@t_blom;;"952176718047047682";https://twitter.com/_AlexSherwood/status/952176718047047682
_AlexSherwood;2018-01-13 08:44;0;1;"Here’s my thoughts on that https:// twitter.com/_AlexSherwood/ status/932989970079453196 …";;;;"952174526330175491";https://twitter.com/_AlexSherwood/status/952174526330175491
_AlexSherwood;2018-01-13 08:38;0;0;"So now we’re talking about the same model as the challenger’s - providing insights & earning referral fees. That sounds good to me";;;;"952172980825743361";https://twitter.com/_AlexSherwood/status/952172980825743361
dgwbirch;2018-01-13 08:35;0;5;"A payment institution licence would cost Facebook approximately nothingt. It’s the bank that would remain heavily regulated. Facebook isn’t going to lend you money - it’s going to auction your leading requirement to the banks";;;;"952172347976568832";https://twitter.com/dgwbirch/status/952172347976568832
LizLum;2018-01-13 08:34;0;3;"That is the hope! Banks need to realise this.";;;;"952171993511624704";https://twitter.com/LizLum/status/952171993511624704
_AlexSherwood;2018-01-13 08:32;0;1;"Ok but that’s a much more natural progression for a financial services company..";;;;"952171589692547072";https://twitter.com/_AlexSherwood/status/952171589692547072
AEVUNA;2018-01-13 08:28;0;3;"Agreed! There could be avenues to delve in and provide certain services without having to dea with all the regs. Eg. Square with an Industrial Loan license but not a bank. Provides opportunity to offer what is aligned with its current business offerings.";;;;"952170550494973952";https://twitter.com/AEVUNA/status/952170550494973952
_AlexSherwood;2018-01-13 08:24;0;2;"Agreed. Then we’re talking about them making a significant effort to enter a market with a very different set of regulations than the one they’re in at the moment though. I can’t think of any examples where they’ve done that in the past so far but I feel like there must be some.";;;;"952169514401239040";https://twitter.com/_AlexSherwood/status/952169514401239040
LizLum;2018-01-13 08:21;1;1;"Ah, GDPR it's like a white knight...or a horseman of the apocalypse...haven't decided yet ;-)";;;;"952168613817012225";https://twitter.com/LizLum/status/952168613817012225
LizLum;2018-01-13 08:19;0;2;"It depends how much that data is worth to them.";;;;"952168266260197376";https://twitter.com/LizLum/status/952168266260197376
_AlexSherwood;2018-01-13 08:18;0;2;"I’m sure they could make themselves compliant but would they want to constrain themselves in order to do so?";;;;"952168010881601538";https://twitter.com/_AlexSherwood/status/952168010881601538
LizLum;2018-01-13 08:17;0;1;"However, unlike a startup, Google and Amazon can afford some pretty expensive lawyers and reg people.";;;;"952167661139611648";https://twitter.com/LizLum/status/952167661139611648
LedaGlyptis;2018-01-13 08:17;1;4;"True. Though as a consumer I am not sure how much of that we would actually want long term. Plus GDPR";;;;"952167640742625280";https://twitter.com/LedaGlyptis/status/952167640742625280
LizLum;2018-01-13 08:16;0;2;"True dat!";;;;"952167407807811584";https://twitter.com/LizLum/status/952167407807811584
LedaGlyptis;2018-01-13 08:15;0;2;"Fair. I am speaking of 'banking as we know it' barebones: The minute you need a license to process payments, take deposits or issue loans, your business changes. As does your regulatory exposure.";;;;"952167298953080832";https://twitter.com/LedaGlyptis/status/952167298953080832
AEVUNA;2018-01-13 08:15;0;1;"No better way of knowing & understanding customers than their financial data. U knw where, what & how they spend in addition to when and how much they earn. Unfortunately, the banks have had this data but never had a need to do anything with it. ‘If it’s not broken, don’t fix it’";;;;"952167180329803779";https://twitter.com/AEVUNA/status/952167180329803779
LizLum;2018-01-13 08:12;1;3;"I don't think the tech giants are looking at it in terms of 'banking-as-we-know-it'. I think they are looking at data. No data is more valuable than 'what you do with, how much you have, and where is your money coming from' data";;;;"952166343490592768";https://twitter.com/LizLum/status/952166343490592768
LedaGlyptis;2018-01-13 08:05;0;3;"Only if they deem banking to be a long term profitability play... lowering margins and increasingly regulation doesn't make our industry hugely appealing right now";;;;"952164723126136832";https://twitter.com/LedaGlyptis/status/952164723126136832
LedaGlyptis;2018-01-13 08:02;0;1;"Behind close doors, inside 'incumbent HQ'";;;;"952163849305718784";https://twitter.com/LedaGlyptis/status/952163849305718784
LizLum;2018-01-13 07:56;0;4;"The mistakes banks are making is thinking this is all about them...and a few small players (who they might buy anyway). Don't ya think Amazon, Google et all will go 'We'll have some of that Open Banking, thank you very much!' Alexa, remortage my house!";;;;"952162413725519872";https://twitter.com/LizLum/status/952162413725519872
_AlexSherwood;2018-01-13 07:50;0;3;"Interesting, where you can see those?";;;;"952161014887387137";https://twitter.com/_AlexSherwood/status/952161014887387137
TideBanking;2018-01-13 06:37;2;5;"Max from our Partnerships team is hosting a panel on how to manage your cashflow with Raj Shah from @LitchfieldsCA , Simon Smallwood from @Fluidly and Craig Flyger from @MarketInvoice . Join us at the “Show me the money” stage #StartUp2018 pic.twitter.com/33mJoEMgz8";;@LitchfieldsCA @Fluidly @MarketInvoice;#StartUp2018;"952142649548517377";https://twitter.com/TideBanking/status/952142649548517377
AEVUNA;2018-01-13 05:02;2;7;"Exact thoughts here! Incumbents will not champion it as it’s against their business model. Startups will struggle with funds to get into PR even at that, trusting them will take time. The regulator will have to champion it - everyone in the Fintech space have a role to play too";;;;"952118709333749765";https://twitter.com/AEVUNA/status/952118709333749765
LedaGlyptis;2018-01-13 04:57;0;7;"And customer education needs a champion, it's a chance for the regulator to really reach out IMO.";;;;"952117442502971393";https://twitter.com/LedaGlyptis/status/952117442502971393
LedaGlyptis;2018-01-13 04:56;0;3;"Sure. But unlocking new value entails working out where that lies, how you get to it, what the ROI is and how much of your old business you need to leave behind to achieve it. That process is in-flight.";;;;"952117094103093249";https://twitter.com/LedaGlyptis/status/952117094103093249
this_is_bud;2018-01-13 04:47;14;21;"Technology companies are looking at open banking. Bud and @Ed_Masl featured alongside @Fluidly and @TSB http:// read.bi/2DejB8L cheers @OscarWGrut and @businessinsider";;@Ed_Masl @Fluidly @TSB @OscarWGrut @businessinsider;;"952114868232048640";https://twitter.com/this_is_bud/status/952114868232048640
cplumb;2018-01-13 04:35;2;9;"Thanks @OscarWGrut for including @Fluidly and some of our thoughts on #OpenBanking in this article today https:// twitter.com/biuk/status/95 2087860626247680 …";;@OscarWGrut @Fluidly;#OpenBanking;"952111744343822336";https://twitter.com/cplumb/status/952111744343822336
AEVUNA;2018-01-13 04:32;0;4;"IMO - adoption should be driven by AISPs because this provides an opportunity for them to unlock new potentials and create new values enabled by the regulation as has been done. As for customers, without educating them to improve understanding of OB, they will be skeptical.";;;;"952111135037288448";https://twitter.com/AEVUNA/status/952111135037288448
LedaGlyptis;2018-01-13 04:15;0;8;"Because actual adoption needs 2B driven by customers or enabled by incumbents. In the absence of active customer demand *yet* #openbanking is mostly about what big banks choose to do and with whom. We never expected a stampede. A slow start doesn't diminish the change to come!";;;#openbanking;"952106763683328000";https://twitter.com/LedaGlyptis/status/952106763683328000
Fluidly;2018-01-13 04:12;2;3;"Join us today at #startup2018 talking about all things cash flow with @TideBanking @MarketInvoice and Litchfields";;@TideBanking @MarketInvoice;#startup2018;"952106175738335232";https://twitter.com/Fluidly/status/952106175738335232
AEVUNA;2018-01-12 19:29;0;7;"Why are most conversations about #openbanking centred around big #banks . Who are the third party providers ready to see this revolution through. @habito @FundingOptions @getcoconut @Fluidly";;@habito @FundingOptions @getcoconut @Fluidly;#openbanking #banks;"951974433941544961";https://twitter.com/AEVUNA/status/951974433941544961
Fluidly;2018-01-12 12:49;1;0;"5 no-nonsense ways to boost your firm's cashflow pipeline http:// bit.ly/2FyxAHl by @Simonsmallw00d";;@Simonsmallw00d;;"951873676286283776";https://twitter.com/Fluidly/status/951873676286283776
Fluidly;2018-01-12 11:16;1;1;"SMB New Year resolutions 2018 - 5 no-nonsense ways to boost your firm's cashflow pipeline featuring @GoCardless @PayPal @Square #cashflow #creditcontrol https:// fluidly.com/blog/5-no-nons ense-ways-to-boost-your-firms-cashflow-pipeline/ …";;@GoCardless @PayPal @Square;#cashflow #creditcontrol;"951850394547900417";https://twitter.com/Fluidly/status/951850394547900417
Fluidly;2018-01-12 05:08;7;13;"Great mention for @Fluidly in today’s @FT on OpenBanking and our work around cashflow management https://www. ft.com/content/3930bb d2-f619-11e7-8715-e94187b3017e …";;@Fluidly @FT;;"951757873071230976";https://twitter.com/Fluidly/status/951757873071230976
ArunDFernandez;2018-01-12 04:35;4;10;"Good to see @innfin members @withplum @this_is_bud @Fluidly in the @financialtimes around #openbanking - Shake-up for UK bank accounts comes into force https://www. ft.com/content/3930bb d2-f619-11e7-8715-e94187b3017e …";;@innfin @withplum @this_is_bud @Fluidly @financialtimes;#openbanking;"951749398542848000";https://twitter.com/ArunDFernandez/status/951749398542848000
daaaaamn_gina;2018-01-11 11:30;2;2;"Retweeted Fluidly ( @Fluidly ): A scary new era of Slack accountants | via @AccountingWEBuk by @trent_mclaren ... https:// fb.me/1vAs5znvL";;@Fluidly @AccountingWEBuk @trent_mclaren;;"951491607848611840";https://twitter.com/daaaaamn_gina/status/951491607848611840
Fluidly;2018-01-11 10:50;1;1;"Credit checking, definition of responsibilities, payment methods - how effective is your credit control policy? http:// bit.ly/2EqusMw";;;;"951481338129010689";https://twitter.com/Fluidly/status/951481338129010689
Fluidly;2018-01-11 05:32;4;4;"A scary new era of Slack accountants | via @AccountingWEBuk by @trent_mclaren http:// ow.ly/mjwV30hI6yT";;@AccountingWEBuk @trent_mclaren;;"951401527129894912";https://twitter.com/Fluidly/status/951401527129894912
CPHWheel;2018-01-10 16:58;0;1;"Dom Barker from @fluidly talks about “The best career decision I made” - hint it includes a #bike https:// hubs.ly/H09FgN70";;@fluidly;#bike;"951211636114763776";https://twitter.com/CPHWheel/status/951211636114763776
Fluidly;2018-01-10 09:28;0;0;"'In this culture of endemic late payment, it’s vital to have a credit control procedure set up' http:// bit.ly/2BlZYxQ pic.twitter.com/QkwwJBhhpx";;;;"951098542428512256";https://twitter.com/Fluidly/status/951098542428512256
Fluidly;2018-01-10 08:45;0;0;"Sweat the model, watch the cash - how @PureMadeForYou founder @PureSpen won £6.8m from Whitbread http:// bit.ly/2B6F06d pic.twitter.com/tpsU7Czyf2";;@PureMadeForYou @PureSpen;;"951087588525342720";https://twitter.com/Fluidly/status/951087588525342720
Fluidly;2018-01-10 07:00;1;2;"An effective credit control policy can save businesses time, reduce debtor days and improve cashflow. http:// bit.ly/2EqusMw";;;;"951061142444666880";https://twitter.com/Fluidly/status/951061142444666880
Fluidly;2018-01-10 04:00;0;0;"How to create a credit control policy (free template included) http:// bit.ly/2EqusMw";;;;"951015901264007169";https://twitter.com/Fluidly/status/951015901264007169
Fluidly;2018-01-09 17:48;0;0;"Tracking financial metrics in retail: the top 5 http:// bit.ly/2BE5z2p pic.twitter.com/Zb7UQMeR99";;;;"950861873204879360";https://twitter.com/Fluidly/status/950861873204879360
Foxe_News;2018-01-09 11:55;1;7;"Always happy to talk AI (esp. with awesome companies like @Fluidly @VerifiedbyAI @SearchInk) http:// fhflondon.co.uk/2018/01/fintec h-2018-fads-fears-future/ …";;@Fluidly @VerifiedbyAI @SearchInk;;"950772910318342144";https://twitter.com/Foxe_News/status/950772910318342144
Fluidly;2018-01-09 09:13;0;0;"Tracking financial metrics in retail: the top 5 http:// bit.ly/2BE5z2p pic.twitter.com/23tv29Fczb";;;;"950732160650051584";https://twitter.com/Fluidly/status/950732160650051584
CommsBreakdown;2018-01-09 08:55;1;2;"Some top Xero app recommendations from the folks @Fluidly #xero #cloud #accounting #fintech https:// twitter.com/Fluidly/status /950668492352774145 …";;@Fluidly;#xero #cloud #accounting #fintech;"950727702872559616";https://twitter.com/CommsBreakdown/status/950727702872559616
Fluidly;2018-01-09 05:00;2;6;"Reduce stress, grow more, save time - do it all with these 6 @Xero add-ons: @GoCardless , @ReceiptBank , @iwoca , @Zapier , @MinuteDock & @Fluidly http:// bit.ly/2A2UNxk pic.twitter.com/SMH9PxodIN";;@Xero @GoCardless @ReceiptBank @iwoca @Zapier @MinuteDock @Fluidly;;"950668492352774145";https://twitter.com/Fluidly/status/950668492352774145
Fluidly;2018-01-06 11:33;1;1;"'When managing an SMB you’ll need someone you trust looking after the purse-strings' http:// bit.ly/2m1ZovH pic.twitter.com/352dnlvWwV";;;;"949680215080538112";https://twitter.com/Fluidly/status/949680215080538112
datawireio;2018-01-06 08:03;2;9;"An awesome tutorial about how they got started with #microservices and #Kubernetes at @Fluidly by Dom Barker http:// bit.ly/2DQssg7";;@Fluidly;#microservices #Kubernetes;"949627427596242944";https://twitter.com/datawireio/status/949627427596242944
Fluidly;2018-01-05 10:35;0;0;"What’s credit control? And why does my SME need to know about it? http:// bit.ly/2B3dKEE pic.twitter.com/PAAO3Cpwjc";;;;"949303301165801472";https://twitter.com/Fluidly/status/949303301165801472
Fluidly;2018-01-05 09:04;0;7;"Really excited to be joining a list of great companies on the #FStechAwards shortlist. #FingersCrossed cc @habito @StarlingBank @salaryfin @pensionbee @ModulrFinance @Currencycloud http:// ow.ly/mMZZ30hBdb2";;@habito @StarlingBank @salaryfin @pensionbee @ModulrFinance @Currencycloud;#FStechAwards #FingersCrossed;"949280450551472130";https://twitter.com/Fluidly/status/949280450551472130
Fluidly;2018-01-05 08:00;1;0;"Start 2018 off on the right foot with your cash http:// bit.ly/2m1ZovH pic.twitter.com/M6BdnDWeZo";;;;"949264457460527106";https://twitter.com/Fluidly/status/949264457460527106
Fluidly;2018-01-05 05:01;1;1;"6 tips for better cashflow management in 2018 http:// bit.ly/2m1ZovH pic.twitter.com/BzaSdou48h";;;;"949219221485080576";https://twitter.com/Fluidly/status/949219221485080576
datawireio;2018-01-04 11:11;0;1;"An awesome tutorial about how they got started with #microservices and #Kubernetes at @Fluidly by Dom Barker http:// bit.ly/2qfigMe";;@Fluidly;#microservices #Kubernetes;"948949927589302273";https://twitter.com/datawireio/status/948949927589302273
dwbeever;2018-01-04 06:41;0;2;"was about to post this myself having just seen it on my flight home. nice!";;;;"948882150316826624";https://twitter.com/dwbeever/status/948882150316826624
Fluidly;2018-01-04 05:03;1;1;"5 cashflow things to leave behind in 2017 http:// bit.ly/2Bms34x pic.twitter.com/sgdA0FDEk5";;;;"948857352354254848";https://twitter.com/Fluidly/status/948857352354254848
Fluidly;2018-01-03 13:38;0;0;"Utilise technology to achieve those new year's resolutions @GoCardless , @ReceiptBank , @iwoca , @Zapier , @MinuteDock & @Fluidly http:// bit.ly/2A2UNxk pic.twitter.com/cUs8jadxAC";;@GoCardless @ReceiptBank @iwoca @Zapier @MinuteDock @Fluidly;;"948624511745822720";https://twitter.com/Fluidly/status/948624511745822720
Fluidly;2018-01-03 09:16;1;0;"6 steps for a better credit control procedure http:// bit.ly/2BlZYxQ pic.twitter.com/L4UhVLZ8iF";;;;"948558618852515840";https://twitter.com/Fluidly/status/948558618852515840
HeatherTowns;2018-01-03 08:55;0;0;"Me too...";;;;"948553357869965312";https://twitter.com/HeatherTowns/status/948553357869965312
Fluidly;2018-01-03 07:19;3;2;"Better credit control procedures for modern businesses http:// bit.ly/2BlZYxQ pic.twitter.com/1G8Hv7oNnM";;;;"948529257248182272";https://twitter.com/Fluidly/status/948529257248182272
InnFin;2018-01-03 07:08;0;1;"Shouldn't we have the same visibility into our finances as we do with pizza delivery? Read the #IFGS2018 blog by Caroline Plumb, CEO of @Fluidly http:// ow.ly/WSxu30h3q2p pic.twitter.com/BlLI5o4Ouh";;@Fluidly;#IFGS2018;"948526420149534720";https://twitter.com/InnFin/status/948526420149534720
Fluidly;2018-01-03 05:44;0;0;"A retailer's guide to key financial metrics you should be tracking within your business http:// bit.ly/2BE5z2p pic.twitter.com/IG5nMbvBXb";;;;"948505309949120512";https://twitter.com/Fluidly/status/948505309949120512
Fluidly;2018-01-03 05:37;0;0;"Thanks @HeatherTowns we are on the case ! So much more coming in Q1 we are SO excited";;@HeatherTowns;;"948503545367728128";https://twitter.com/Fluidly/status/948503545367728128
datawireio;2018-01-02 14:16;1;3;"An awesome tutorial about how they got started with #microservices and #Kubernetes at @Fluidly by Dom Barker http:// bit.ly/2qaPEDT";;@Fluidly;#microservices #Kubernetes;"948271875506962432";https://twitter.com/datawireio/status/948271875506962432
mmcconvert;2018-01-02 09:37;0;0;"@Fluidly Glad connecting with you on Twitter";;@Fluidly;;"948201695007272960";https://twitter.com/mmcconvert/status/948201695007272960
Fluidly;2018-01-02 08:11;0;0;"Open Banking, SEO, artificial intelligence & sprints: an internship http:// bit.ly/2zsPyMd by @ShingiMararike pic.twitter.com/G2cwYeV3Vy";;@ShingiMararike;;"948180050901430272";https://twitter.com/Fluidly/status/948180050901430272
cplumb;2018-01-02 08:00;4;35;"Happy New Year! A lovely start for me to discover a mention in the EasyJet magazine for @Fluidly as part of players in Financial Tech alongside @StarlingBank @Klarna and @bitwala pic.twitter.com/eydIofmYu7";;@Fluidly @StarlingBank @Klarna @bitwala;;"948177168072433667";https://twitter.com/cplumb/status/948177168072433667
Fluidly;2018-01-02 05:15;3;1;"6 @Xero add-ons to kickstart 2018: @GoCardless , @ReceiptBank , @iwoca , @Zapier , @MinuteDock & @Fluidly http:// bit.ly/2A2UNxk pic.twitter.com/Fh4voTY38k";;@Xero @GoCardless @ReceiptBank @iwoca @Zapier @MinuteDock @Fluidly;;"948135745054748673";https://twitter.com/Fluidly/status/948135745054748673
