username;date;retweets;favorites;text;geo;mentions;hashtags;id;permalink
GoldspotD;2018-02-28 11:09;1;1;"Goldspot Discoveries highlighted in CIM Magazine's article on machine learning in the mining industry. #mining #machinelearning #gold http:// magazine.cim.org/en/technology/ revving-up-en/ …";;;#mining #machinelearning #gold;"968880856595972096";https://twitter.com/GoldspotD/status/968880856595972096
GoldspotD;2018-02-27 00:53;1;2;"Our CEO & President, Denis Laviolette, will be a panelist for Mining & AI at MaRS Innovation's Cleantech and AI event, March 8. https:// marsdd.lpages.co/cleantech-and- ai-event/ … Also, a lot of our team will be in Toronto for PDAC - send us a message if you would like to meet!";;;;"968363440116064256";https://twitter.com/GoldspotD/status/968363440116064256
GoldspotD;2018-02-20 14:42;1;0;"We are looking for a Geophysicist with 3D inversion experience. Join our rapidly growing team and become part of the most innovative and disruptive force in mineral exploration. http://www. goldspot.ca/_resources/201 8.02.20-Goldspot-Geophysics-Job-Posting.pdf …";;;;"966035268468817920";https://twitter.com/GoldspotD/status/966035268468817920
afghanrugRT;2018-01-15 11:38;0;0;"@GoldspotD what is your stock ticker?";;@GoldspotD;;"952943079345958914";https://twitter.com/afghanrugRT/status/952943079345958914
GoldspotD;2018-01-11 11:41;0;0;"GoldSpot Discoveries Inc. Completes $1.3 Million Financing With A Prolific Mining Financier and Hochschild Mining http://www. goldspot.ca/news/index.php ?content_id=11 …";;;;"951494370720563200";https://twitter.com/GoldspotD/status/951494370720563200
Disrupt_Mining;2017-12-27 18:45;0;0;"#ICYMI find out what being a #DisruptMining 2017 finalist did for @GoldspotD https://www. youtube.com/watch?v=sZlExz EFLGU …";;@GoldspotD;#ICYMI #DisruptMining;"946165171361370112";https://twitter.com/Disrupt_Mining/status/946165171361370112
PalisadeFind;2017-12-26 17:06;1;2;"End of the year interview series - Collin Kettell, CEO & Partner, Palisade Global Investments Ltd. via http:// thenextbullmarketmove.tumblr.com / Featuring: @MustangMinerals @giga_metals @LSCLithium @cobalt27capital @TriumphGoldCorp @GoldspotD http:// thenextbullmarketmove.tumblr.com/post/168856099 020/end-of-the-year-interview-series-collin-kettell … pic.twitter.com/kS1Q7p54T0";;@MustangMinerals @giga_metals @LSCLithium @cobalt27capital @TriumphGoldCorp @GoldspotD;;"945777926020255744";https://twitter.com/PalisadeFind/status/945777926020255744
PalisadePro;2017-12-26 17:05;0;4;"End of the year interview series - Collin Kettell, CEO & Partner, Palisade Global Investments Ltd. via http:// thenextbullmarketmove.tumblr.com / Featuring: @MustangMinerals @giga_metals @LSCLithium @cobalt27capital @TriumphGoldCorp @GoldspotD http:// thenextbullmarketmove.tumblr.com/post/168856099 020/end-of-the-year-interview-series-collin-kettell … pic.twitter.com/Wvm6qzBcFK";;@MustangMinerals @giga_metals @LSCLithium @cobalt27capital @TriumphGoldCorp @GoldspotD;;"945777680628281344";https://twitter.com/PalisadePro/status/945777680628281344
GoldspotD;2017-12-22 14:31;0;0;"Goldspot Discoveries significantly strengths its team with the appointment of Ramón Barúa to the company's Board of Directors. Mr. Barúa is currently the CFO of Hochschild Mining, a leading underground precious metals producer focusing on high grade silver & gold deposits";;;;"944289408777252864";https://twitter.com/GoldspotD/status/944289408777252864
GoldspotD;2017-12-19 14:04;0;1;"Goldspot Discoveries Inc. is excited to announce its new strategic partnership with @Datamine_SW , a world leading provider of mining software and services to seamlessly plan and manage mining operations.";;@Datamine_SW;;"943195451448111106";https://twitter.com/GoldspotD/status/943195451448111106
Disrupt_Mining;2017-12-18 10:21;0;4;"Thanks to @Goldcorp_Inc COO Todd White, @GoldspotD 's Denis Laviolette and @KGeosystems 's Vince Gerrie for offering their insights on submitting a concept to #DisruptMining !";;@Goldcorp_Inc @GoldspotD @KGeosystems;#DisruptMining;"942776959565795330";https://twitter.com/Disrupt_Mining/status/942776959565795330
Disrupt_Mining;2017-12-15 15:22;0;5;"We are going LIVE Monday at 10:00am w/ @Goldcorp_Inc COO Todd White, Vince Gerrie of @KGeosystems and Denis Laviolette from @GoldspotD , talking about submitting an idea to #DisruptMining ! pic.twitter.com/usxE3SmSgc";;@Goldcorp_Inc @KGeosystems @GoldspotD;#DisruptMining;"941765527751364608";https://twitter.com/Disrupt_Mining/status/941765527751364608
MiHRCouncil;2017-12-11 10:40;1;6;"#DisruptMining accelerates #innovation . Find out how being a finalist in 2017 impacted exploration innovator @GoldspotD . Are you an entrepreneur or company with an idea that could #DisruptMining ? Submit it at http:// disruptmining.com . https:// twitter.com/Disrupt_Mining /status/933774335696707584 …";;@GoldspotD;#DisruptMining #innovation #DisruptMining;"940244855145496576";https://twitter.com/MiHRCouncil/status/940244855145496576
Goldcorp_Inc;2017-11-26 23:11;4;6;"Watch to see where one of last year's @Disrupt_Mining finalists, @GoldspotD , are now. To see the full list of 2017 winners, visit our blog https:// blog.goldcorp.com/2017/03/13/and -the-disruptmining-2017-winners-are/ … https:// twitter.com/Disrupt_Mining /status/933774335696707584 …";;@Disrupt_Mining @GoldspotD;;"934998002502193152";https://twitter.com/Goldcorp_Inc/status/934998002502193152
GoldspotD;2017-11-23 14:51;0;3;"Looking forward to finding some serious gold and silver. Let's go! https:// twitter.com/IntegraResourc e/status/933777426726789120 …";;;;"933785077871362048";https://twitter.com/GoldspotD/status/933785077871362048
IntegraResource;2017-11-23 14:21;0;3;"We look forward to working with @GoldspotD to leverage #ArtificialIntelligence at our DeLamar project. Some members of the Goldspot team were finalists in the 2016 Integra #Gold Rush Challenge! Find out how #DisruptMining accelerated their #innovation in the last ten months. https:// twitter.com/Disrupt_Mining /status/933774335696707584 …";;@GoldspotD;#ArtificialIntelligence #Gold #DisruptMining #innovation;"933777426726789120";https://twitter.com/IntegraResource/status/933777426726789120
Disrupt_Mining;2017-11-23 14:08;2;7;"Where Are They Now? Find out how being a #DisruptMining finalist accelerated @GoldspotD 's #exploration #innovation : pic.twitter.com/EARc13fyyy";;@GoldspotD;#DisruptMining #exploration #innovation;"933774335696707584";https://twitter.com/Disrupt_Mining/status/933774335696707584
Emerj;2017-11-03 11:48;0;0;"Good to hear! We look forward to seeing how ‘stodgy’ heavy industry takes on AI, quite a journey ahead! -Dan";;;;"926476261119049728";https://twitter.com/Emerj/status/926476261119049728
GoldspotD;2017-11-02 11:51;0;0;"Thanks for the shout-out @TechEmergence . We are going to change this industry. https:// goo.gl/yJWZP8";;@TechEmergence;;"926114479208677376";https://twitter.com/GoldspotD/status/926114479208677376
cejaykim;2017-10-10 22:58;0;0;"@EricTKChou will be presenting on behalf of @GoldspotD ! If you are in Toronto Nov 2-3 and want to learn more, send him a message! https:// twitter.com/GoldspotD/stat us/917878381181411328 …";;@EricTKChou @GoldspotD;;"917947398059524096";https://twitter.com/cejaykim/status/917947398059524096
GoldspotD;2017-10-10 18:23;0;0;"Thrilled to speak alongside fellow leaders in #AI / #ML at the #TOMLSummit on Nov 2-3. See the full schedule http:// bit.ly/2yDrLIt";;;#AI #ML #TOMLSummit;"917878381181411328";https://twitter.com/GoldspotD/status/917878381181411328
financialit_net;2017-09-07 04:21;0;0;"@GoldspotD , Reports Major Milestone At Sprott Mining Majority Owned Jerritt Canyon Project https:// financialit.net/news/artificia l-intelligence/threed-capital-announces-its-artificial-intelligence-investment …";;@GoldspotD;;"905707476355604480";https://twitter.com/financialit_net/status/905707476355604480
cejaykim;2017-09-06 09:18;0;0;"Exciting news from @GoldspotD - machine learning and mining https:// twitter.com/GoldspotD/stat us/905419698736529408 …";;@GoldspotD;;"905419928588632064";https://twitter.com/cejaykim/status/905419928588632064
GoldspotD;2017-09-06 09:17;0;1;"Corporate update via one of our largest shareholders https:// goo.gl/j1T1K8";;;;"905419698736529408";https://twitter.com/GoldspotD/status/905419698736529408
GoldspotD;2017-08-29 14:14;0;0;"Why data is the new oil and what it means for your investment portfolio http:// business.financialpost.com/wcm/702d10eb-e 5f0-4841-8e6a-e0c2004f66a6 …";;;;"902595434648002561";https://twitter.com/GoldspotD/status/902595434648002561
GoldspotD;2017-08-18 13:47;0;0;"Montreal and Toronto are becoming magnet cities for tech giants http:// for.tn/2uRsnYn";;;;"898602173562404864";https://twitter.com/GoldspotD/status/898602173562404864
GoldspotD;2017-08-13 00:05;0;0;"Elon Musk’s AI Bots Are the First to Beat E-Sport’s Best Gamers https:// youtu.be/wiOopO9jTZw";;;;"896583376672391169";https://twitter.com/GoldspotD/status/896583376672391169
GoldspotD;2017-07-20 11:42;0;0;"Sometimes “Small Data” Is Enough to Create Smart Products https:// hbr.org/2017/07/someti mes-small-data-is-enough-to-create-smart-products …";;;;"888061554549182464";https://twitter.com/GoldspotD/status/888061554549182464
michentr;2017-07-16 00:02;0;0;"RT: @GoldspotD -Jefferies gives IBM Watson a Wall Street reality check http:// tcrn.ch/2tRDjma";;@GoldspotD;;"886435952746532864";https://twitter.com/michentr/status/886435952746532864
GoldspotD;2017-07-16 00:02;0;0;"Jefferies gives IBM Watson a Wall Street reality check http:// tcrn.ch/2tRDjma";;;;"886435951014141952";https://twitter.com/GoldspotD/status/886435951014141952
GoldspotD;2017-05-24 14:27;0;0;"Top teams from Barrick's first hackathon present prototypes to leaders https:// goo.gl/WtwBYa $ ABX #gold";;;#gold;"867447099087962112";https://twitter.com/GoldspotD/status/867447099087962112
GoldspotD;2017-05-11 16:38;1;0;"#CFA Exam to Add Big Data, Artificial Intelligence as Topics #MachineLearning #AI https://www. bloomberg.com/news/articles/ 2017-05-09/cfa-exam-to-include-big-data-artificial-intelligence-as-topics …";;;#CFA #MachineLearning #AI;"862768812784889856";https://twitter.com/GoldspotD/status/862768812784889856
GoldspotD;2017-05-10 12:50;0;0;"“Every single Machine Learning course on the internet, ranked by your reviews” by @venturidb https:// medium.freecodecamp.com/every-single-m achine-learning-course-on-the-internet-ranked-by-your-reviews-3c4a7b8026c0 …";;@venturidb;;"862349224838549504";https://twitter.com/GoldspotD/status/862349224838549504
GoldspotD;2017-05-05 19:05;0;0;"Regulating the internet giants: The world’s most valuable resource is no longer oil, but data http://www. economist.com/news/leaders/2 1721656-data-economy-demands-new-approach-antitrust-rules-worlds-most-valuable-resource …";;;;"860631552413138944";https://twitter.com/GoldspotD/status/860631552413138944
GoldspotD;2017-04-27 12:03;0;0;"#mining .com article on @goldcorp_inc use of #AI in their #gold mines http:// bit.ly/2pb9omP via @frikels";;@goldcorp_inc @frikels;#mining #AI #gold;"857626138520059905";https://twitter.com/GoldspotD/status/857626138520059905
GoldspotD;2017-04-21 15:12;0;0;"“Our Machines Now Have Knowledge We’ll Never Understand” by @dweinberger https:// backchannel.com/our-machines-n ow-have-knowledge-well-never-understand-857a479dcc0e …";;@dweinberger;;"855499555499933696";https://twitter.com/GoldspotD/status/855499555499933696
GoldspotD;2017-03-13 23:40;0;2;"Team @GoldspotD after receiving 2 golden envelopes from @CiscoCanada at #disruptmining pic.twitter.com/4R7ZxwcYs7";;@GoldspotD @CiscoCanada;#disruptmining;"841494109269372928";https://twitter.com/GoldspotD/status/841494109269372928
cejaykim;2017-03-13 23:39;0;4;"Team @GoldspotD after receiving 2 golden envelopes from @CiscoCanada at #disruptmining pic.twitter.com/z5eFgYAp9t";;@GoldspotD @CiscoCanada;#disruptmining;"841493981821259776";https://twitter.com/cejaykim/status/841493981821259776
Disrupt_Mining;2017-03-08 18:07;0;0;"Thanks @bwightma for your support of #DisruptMining and putting our five finalists to the test! @GoldspotD https:// twitter.com/CiscoCanada/st atus/839609145150038016 …";;@bwightma @GoldspotD;#DisruptMining;"839613457091682304";https://twitter.com/Disrupt_Mining/status/839613457091682304
RobertGHawkins;2017-03-07 15:09;0;0;"@GoldspotD so let's get this straight... I'm over 50 so I'm a laggard and don't understand technology? Okay, the last part's right but...";;@GoldspotD;;"839206506834743296";https://twitter.com/RobertGHawkins/status/839206506834743296
Disrupt_Mining;2017-03-06 14:37;5;4;"A BIG thank you and congrats to our 5 finalist teams! #DisruptMining @BiomineSudbury @KGeosystems @GoldspotD #Cementation #TradeWinds pic.twitter.com/AkhPA2Vzjl";;@BiomineSudbury @KGeosystems @GoldspotD;#DisruptMining #Cementation #TradeWinds;"838836039175266304";https://twitter.com/Disrupt_Mining/status/838836039175266304
integragoldcorp;2017-03-06 14:37;1;2;"A BIG thank you and congrats to our 5 finalist teams! #DisruptMining @BiomineSudbury @KGeosystems @GoldspotD #Cementation #TradeWinds pic.twitter.com/0yWwOyjAzn";;@BiomineSudbury @KGeosystems @GoldspotD;#DisruptMining #Cementation #TradeWinds;"838836038499975168";https://twitter.com/integragoldcorp/status/838836038499975168
GoldspotD;2017-03-06 02:27;1;4;"Thank you @Goldcorp_Inc & @integragoldcorp for the opportunity to present at #disruptmining what a great event!";;@Goldcorp_Inc @integragoldcorp;#disruptmining;"838652163316408321";https://twitter.com/GoldspotD/status/838652163316408321
sakura1979;2017-03-05 20:40;0;0;"Top 5 right here! #disruptmining pic.twitter.com/2HTUwIiN4z";;;#disruptmining;"838564986901377024";https://twitter.com/sakura1979/status/838564986901377024
Disrupt_Mining;2017-03-05 20:24;2;1;". @GoldspotD is up first - excited to hear their innovative idea to #disruptmining pic.twitter.com/WoAyGmTgFB";;@GoldspotD;#disruptmining;"838560819487117312";https://twitter.com/Disrupt_Mining/status/838560819487117312
integragoldcorp;2017-03-05 20:21;0;2;"Good luck to our judges & finalists @gerrydee @robertherjavec @bwightma @biominesudbury @goldspotD @KGeosystems @Goldcorp_Inc #disruptmining https:// twitter.com/disrupt_mining /status/838559125176987648 …";;@gerrydee @robertherjavec @bwightma @biominesudbury @goldspotD @KGeosystems @Goldcorp_Inc;#disruptmining;"838560023991189508";https://twitter.com/integragoldcorp/status/838560023991189508
ChloeKettell;2017-03-05 20:15;0;2;"Good luck to my brother Collin and @GoldspotD at #disruptmining #PDAC2017 https:// twitter.com/INN_Resource/s tatus/838557929167007744 …";;@GoldspotD;#disruptmining #PDAC2017;"838558681641979904";https://twitter.com/ChloeKettell/status/838558681641979904
cejaykim;2017-03-05 19:00;0;1;"Let's go @GoldspotD . Almost time #disruptmining pic.twitter.com/1SkbjxIgac";;@GoldspotD;#disruptmining;"838539825925996545";https://twitter.com/cejaykim/status/838539825925996545
GoldspotD;2017-03-04 10:50;1;1;"Dry run at the Carlu. Getting ready for #DisruptMining ! @integragoldcorp @Goldcorp_Inc pic.twitter.com/eAd57u0rFC";;@integragoldcorp @Goldcorp_Inc;#DisruptMining;"838053931477532672";https://twitter.com/GoldspotD/status/838053931477532672
GoldspotD;2017-03-01 13:58;1;1;"Goldspot's ML technology mentioned in @itworldca #disruptmining https:// goo.gl/91tnCv";;@itworldca;#disruptmining;"837014291467259905";https://twitter.com/GoldspotD/status/837014291467259905
integragoldcorp;2017-03-01 11:59;0;1;"#DisruptMining Finalist @GoldspotD is revolutionizing the investment decision model by using the Goldspot Algorithm http:// ow.ly/TBwC309tSY0";;@GoldspotD;#DisruptMining;"836984259009204224";https://twitter.com/integragoldcorp/status/836984259009204224
Disrupt_Mining;2017-03-01 11:59;2;1;"#DisruptMining Finalist @GoldspotD is revolutionizing the investment decision model by using the Goldspot Algorithm http:// ow.ly/TBwC309tSY0";;@GoldspotD;#DisruptMining;"836984259005009920";https://twitter.com/Disrupt_Mining/status/836984259005009920
GoldspotD;2017-02-28 16:13;0;0;"Five finalists and 12 semi-finalists seek to #DisruptMining – check out our website http://www. goldspot.ca";;;#DisruptMining;"836685834728321024";https://twitter.com/GoldspotD/status/836685834728321024
GoldspotD;2017-02-27 12:58;1;1;"Team member Antoine Caté's GeoLEARN also is semi-finalist! In 2 years Antoine has been a finalist twice & semi-finalist once #disruptmining";;;#disruptmining;"836274284712452096";https://twitter.com/GoldspotD/status/836274284712452096
GoldspotD;2017-02-25 22:47;0;0;"Very happy to have the support and mentorship of veteran mining & technology financier, Sheldon Inwentash https:// goo.gl/uMJrcS";;;;"835697677878751232";https://twitter.com/GoldspotD/status/835697677878751232
GoldspotD;2017-02-23 10:59;1;0;"Our team will be part of the next wave of #mining innovation at #DisruptMining . We will present our idea at the finale event on March 5th!";;;#mining #DisruptMining;"834794776666861568";https://twitter.com/GoldspotD/status/834794776666861568
cejaykim;2017-02-23 09:19;0;1;"@GoldspotD ready for #DisruptMining ! Our team is heading to #DisruptMining ! https:// goo.gl/3yMZGr";;@GoldspotD;#DisruptMining #DisruptMining;"834769614965858304";https://twitter.com/cejaykim/status/834769614965858304