username;date;retweets;favorites;text;geo;mentions;hashtags;id;permalink
maxwell_plus;2018-12-20 23:00;0;9;"As we wrap up an amazing year and head off on a well-deserved break, we wish you and your family a safe, happy and healthy Christmas and New year! We'll be back on board from January 7 for another exciting year!! pic.twitter.com/tLsQY2Lpk8";;;;"1075964149115555845";https://twitter.com/maxwell_plus/status/1075964149115555845
MariaMacNamara1;2018-12-12 19:02;0;3;"Have a wonderful day. Your excitement is infectious!";;;;"1073005202985238529";https://twitter.com/MariaMacNamara1/status/1073005202985238529
Mikenicholls88;2018-12-12 14:25;3;9;"Looking forward to seeing our teams @emesent @indeelabs @InventiaLifeSci @MorseMicro @FluroSat @MJBiercuk @maxwell_plus @MyriotaGlobal @CoviuApp @GilmourSpace @practera @rapid_AIM";;@emesent @indeelabs @InventiaLifeSci @MorseMicro @FluroSat @MJBiercuk @maxwell_plus @MyriotaGlobal @CoviuApp @GilmourSpace @practera @rapid_AIM;;"1072935536313032704";https://twitter.com/Mikenicholls88/status/1072935536313032704
M_CPartners;2018-12-11 22:26;0;7;"Not sure what to #read this summer? Be inspired by these leading Aussie #CEOs @HarrierHC @MicrolearningEd @maxwell_plus @onthegolife @HuobiAu @educatorimpact @indepreserve @openlrning @Rentcomau @twilio @sec_matters @BIAUS https://www. businessinsider.com.au/books-to-read- this-summer-2018-10 …";;@HarrierHC @MicrolearningEd @maxwell_plus @onthegolife @HuobiAu @educatorimpact @indepreserve @openlrning @Rentcomau @twilio @sec_matters @BIAUS;#read #CEOs;"1072694120894758912";https://twitter.com/M_CPartners/status/1072694120894758912
st_molloy;2018-12-11 18:52;3;3;""the #startup ’s vision is to diagnose non-communicable, or noninfectious or transmittable, diseases accurately, to flag risk of disease, and in turn allow doctors to act faster" #AI #healthtech #ProstateCancer @maxwell_plus https://www. startupdaily.net/2018/12/brisba nes-maxwell-plus-is-using-artificial-intelligence-to-help-clinicians-diagnose-and-flag-risk-of-disease/ … @StartupDailyANZ";;@maxwell_plus @StartupDailyANZ;#startup #AI #healthtech #ProstateCancer;"1072640387825721347";https://twitter.com/st_molloy/status/1072640387825721347
M_CPartners;2018-12-10 18:38;1;5;"CEO of @maxwell_plus Dr Elliot Smith sat down with @founderpodcast to talk all things #AI , medical imaging, & the #startup journey. Listen here https:// foundertofounderpodcast.com/ep-82-elliot-s mith … pic.twitter.com/8jvJQlQTbe";;@maxwell_plus @founderpodcast;#AI #startup;"1072274429588062208";https://twitter.com/M_CPartners/status/1072274429588062208
maxwell_plus;2018-12-06 12:21;0;0;"A great night out learning about genomics led by @srigsri23 with many other amazing speakers! https:// twitter.com/srigsri23/stat us/1069085561305018370 …";;@srigsri23;;"1070729962880155650";https://twitter.com/maxwell_plus/status/1070729962880155650
maxwell_plus;2018-12-06 12:20;2;1;"Check out work by @srigsri23 and @smitec in the latest edition of @MolecularOmics !! https:// twitter.com/MolecularOmics /status/1070709975268450306 …";;@srigsri23 @smitec @MolecularOmics;;"1070729607823982593";https://twitter.com/maxwell_plus/status/1070729607823982593
MolecularOmics;2018-12-06 11:02;0;3;". @srigsri23 @smitec et al. of @maxwell_plus investigate the metabolic profiles of prostate cancer tumours, out now in Molecular Omics https:// rsc.li/2ODr2yG pic.twitter.com/TYUVw2L5f7";;@srigsri23 @smitec @maxwell_plus;;"1070709975268450306";https://twitter.com/MolecularOmics/status/1070709975268450306
pauletteoldfie2;2018-12-02 01:29;0;3;"So lovely to meet you all. I learnt so much about the importance of genomics and how it can be applied for more preventative healthcare. Thank you everyone.";;;;"1069116376827146241";https://twitter.com/pauletteoldfie2/status/1069116376827146241
srigsri23;2018-12-01 23:27;1;8;"Inaugural 'genomics event': Genomics: is it ready for clinical practice? @AdvanceQld Precinct organized with help from @HealthtechQ @TamaraCMills , @pauletteoldfie2 @actually_alan was a great success! Thanks to all speakers! @QIMRBerghofer @MicrobaOfficial @genomiqa @maxwell_plus pic.twitter.com/wgypmkbKaH";;@AdvanceQld @HealthtechQ @TamaraCMills @pauletteoldfie2 @actually_alan @QIMRBerghofer @MicrobaOfficial @genomiqa @maxwell_plus;;"1069085561305018370";https://twitter.com/srigsri23/status/1069085561305018370
maxwell_plus;2018-11-29 18:45;1;2;"As we celebrate exceeding our fundraising target for @MovemberAUS , we're taking a moment in our blog to recognise those working in the field of improving the outcomes for prostate cancer: https:// bit.ly/2P9gRhm Remember you can still donate here: https:// bit.ly/2zxthuB pic.twitter.com/Lller9li4Y";;@MovemberAUS;;"1068289894244642816";https://twitter.com/maxwell_plus/status/1068289894244642816
maxwell_plus;2018-11-28 18:34;1;1;"We're on the look out for a part time junior designer intern to join the team. To find out more head to our website: https:// lnkd.in/gPJ8Dpd pic.twitter.com/IkunvXgWwA";;;;"1067924816454451200";https://twitter.com/maxwell_plus/status/1067924816454451200
HealthtechQ;2018-11-27 06:01;3;12;"Kick off! The health benefits of embedding genomics into routine clinical practice. Prevention! Screening! Diagnosis! Treatment! Thanks to our amazing speakers. @maxwell_plus @MicrobaOfficial @genomiqa Beijing Genomics Institute @QIMRBerghofer @TamaraCMills @pauletteoldfie2 . pic.twitter.com/HUid7dFmsG";;@maxwell_plus @MicrobaOfficial @genomiqa @QIMRBerghofer @TamaraCMills @pauletteoldfie2;;"1067372893829394432";https://twitter.com/HealthtechQ/status/1067372893829394432
scottrogers;2018-11-24 23:56;0;2;"@maxwell_plus";;@maxwell_plus;;"1066556147287547904";https://twitter.com/scottrogers/status/1066556147287547904
pauletteoldfie2;2018-11-23 18:24;0;2;"@maxwell_plus @QIMRBerghofer @MicrobaOfficial @HHQueensland @qldhealthnews @TamaraCMills https:// twitter.com/HealthtechQ/st atus/1066109300857176065 …";;@maxwell_plus @QIMRBerghofer @MicrobaOfficial @HHQueensland @qldhealthnews @TamaraCMills;;"1066110233032847360";https://twitter.com/pauletteoldfie2/status/1066110233032847360
maxwell_plus;2018-11-22 21:14;1;2;"Lucky us! We had the pleasure of having a Student of the Week in the office recently as a junior helper! I think we can agree that her MO is the cutest! Help @MovemberAUS stop men dying you - donate today: https:// mosista.co/13843328 pic.twitter.com/t5SofYaLpK";;@MovemberAUS;;"1065790693686145025";https://twitter.com/maxwell_plus/status/1065790693686145025
mikezim25;2018-11-20 22:01;0;2;"Hardware, software, production/ mftg, sales/channel mgmt and admin/ops. https:// jobs.lever.co/Emesent";;;;"1065077637159120896";https://twitter.com/mikezim25/status/1065077637159120896
Mikenicholls88;2018-11-20 21:47;0;4;"https:// jobs.lever.co/Emesent";;;;"1065074240204890112";https://twitter.com/Mikenicholls88/status/1065074240204890112
jackie_randles;2018-11-20 21:45;0;0;"What roles are available?";;;;"1065073679527141376";https://twitter.com/jackie_randles/status/1065073679527141376
RiverCityLabs;2018-11-20 19:22;3;14;"Supporting men’s health! The team from @maxwell_plus have set up an awesome bake sale at River City Labs for Movember! #menshealth #movember #RCL #community #maxwellplus pic.twitter.com/RTbJEX0ftz";;@maxwell_plus;#menshealth #movember #RCL #community #maxwellplus;"1065037634567725056";https://twitter.com/RiverCityLabs/status/1065037634567725056
RiverCityLabs;2018-11-20 17:10;2;9;"The team from @maxwell_plus are bringing in their baked goods today! Drop by #RCL to support their Movember Bake Sale! #startups #community #RCL pic.twitter.com/nqBVyRGnUp";;@maxwell_plus;#RCL #startups #community #RCL;"1065004417043197952";https://twitter.com/RiverCityLabs/status/1065004417043197952
MSeqVC;2018-11-20 17:00;4;6;"Super-cool new autonomous drone co @emesent is hiring hiring hiring in Brisbane, esp looking for female and under-represented folks. Help us get the word out! @MonBLeaves @coder_bec @emilylrich @annie_parker @julietrell @silviapfeiffer @FluroSat @rapid_AIM @maxwell_plus";;@emesent @MonBLeaves @coder_bec @emilylrich @annie_parker @julietrell @silviapfeiffer @FluroSat @rapid_AIM @maxwell_plus;;"1065001842797625347";https://twitter.com/MSeqVC/status/1065001842797625347
QChiefEntrepren;2018-11-19 20:41;5;11;""Queensland's strong medical research facilities and hospitals meant the state was a natural location for #medtech start-ups," @RightClickVC Managing Partner @benjaminchong told @brisbanetimes We agree. Great pic @maxwell_plus ! https://www. brisbanetimes.com.au/national/queen sland/how-queensland-became-a-leader-in-medical-technology-start-ups-20181118-p50gsp.html … via @brisbanetimes";;@RightClickVC @benjaminchong @brisbanetimes @maxwell_plus @brisbanetimes;#medtech;"1064695087156748288";https://twitter.com/QChiefEntrepren/status/1064695087156748288
maxwell_plus;2018-11-19 02:06;1;3;"You know it's serious when the Chief Dognositics Officer puts on a MO for the office! Follow Kelsey's lead and help @maxwell_plus raise $390 to reach our @MovemberAUS Fundraising target! https:// mosista.co/13843328 pic.twitter.com/VtFu7Eah02";;@maxwell_plus @MovemberAUS;;"1064414538945069056";https://twitter.com/maxwell_plus/status/1064414538945069056
RiverCityLabs;2018-11-18 20:57;4;9;"@maxwell_plus team will be at River City Labs on Wednesday 21 Nov from 10am. If you're in the area drop in to support their Movember Bake Sale! #startups #community #events #RCL #maxwellplus #RCLA pic.twitter.com/xojqjc8roH";;@maxwell_plus;#startups #community #events #RCL #maxwellplus #RCLA;"1064336729400795136";https://twitter.com/RiverCityLabs/status/1064336729400795136
RCLaccelerator;2018-11-18 20:49;3;11;"Along with some of our alumni we have been nominated in the @StartConHQ Australasian Startup Awards! To vote for @RCLaccelerator , Dr Elliot Smith of @maxwell_plus (BNE2), @AaronBirkby (BNE1 EIR) and/or @FloodMapp (BNE4) head here! https://www. startcon.com/vote #startupAus #startcon";;@StartConHQ @RCLaccelerator @maxwell_plus @AaronBirkby @FloodMapp;#startupAus #startcon;"1064334713173594112";https://twitter.com/RCLaccelerator/status/1064334713173594112
maxwell_plus;2018-11-18 19:27;1;7;"Thanks @brisbanetimes for including @maxwell_plus in your story today about #Queensland leading the way for #startups ! https://www. brisbanetimes.com.au/national/queen sland/how-queensland-became-a-leader-in-medical-technology-start-ups-20181118-p50gsp.html …";;@brisbanetimes @maxwell_plus;#Queensland #startups;"1064314256122757120";https://twitter.com/maxwell_plus/status/1064314256122757120
M_CPartners;2018-11-18 19:16;2;9;"#Queensland had the second highest number of #startups in 2018! A huge proportion of them are #health focused like @maxwell_plus which combines #AI with #medicalimaging & #patientdata to improve #cancer diagnoses & support @ljstone09 @brisbanetimes https://www. brisbanetimes.com.au/national/queen sland/how-queensland-became-a-leader-in-medical-technology-start-ups-20181118-p50gsp.html …";;@maxwell_plus @ljstone09 @brisbanetimes;#Queensland #startups #health #AI #medicalimaging #patientdata #cancer;"1064311306231005184";https://twitter.com/M_CPartners/status/1064311306231005184
maxwell_plus;2018-11-15 21:36;3;8;"Got a spare 30 seconds? Vote for @smitec for Startup Founder of the Year as part of the @StartConHQ 3rd Annual Australasian Startup Awards! Remember to vote daily! https:// bit.ly/2DxAtdC While you're there check out other QLDer's and support them too! pic.twitter.com/Ou2g83CctZ";;@smitec @StartConHQ;;"1063259564907229184";https://twitter.com/maxwell_plus/status/1063259564907229184
maxwell_plus;2018-11-13 22:46;0;1;"We took a MOment to appreciate some of our team MO efforts - Aiden as Mentor and Rohan Mentee!! Great work guys! Donate today to help us reach our fundraising target for @MovemberAUS - http:// mvmbr.co/2JVZQq4";;@MovemberAUS;;"1062552255537152001";https://twitter.com/maxwell_plus/status/1062552255537152001
maxwell_plus;2018-11-13 22:42;0;0;"Sounds good @QuantumGeology - let us know if you'd like more information";;@QuantumGeology;;"1062551294248800256";https://twitter.com/maxwell_plus/status/1062551294248800256
OreFox_CEO;2018-11-13 04:29;0;2;"I might use this in my AI for Geology talk soon. Its a great example of practical AI";;;;"1062276255230255106";https://twitter.com/OreFox_CEO/status/1062276255230255106
Mikenicholls88;2018-11-13 03:05;1;5;"1/ 2nd #movember Cancer Researcher/Startup for the day is Elliot Smith from @maxwell_plus who has developed an #ML platform that can diagnose #ProstateCancer from MRI imaging Full disclosure: @MSeqVC invested in Maxwell pic.twitter.com/hzZHRAwP3j";;@maxwell_plus @MSeqVC;#movember #ML #ProstateCancer;"1062255046367166464";https://twitter.com/Mikenicholls88/status/1062255046367166464
maxwell_plus;2018-11-11 22:32;1;3;"We're so excited about MeOwvember that even our pets are getting involved! Don't you think Mr Pudding looks good with a Mo? Donate today to help us reach $1,000 for @MovemberAUS ; http:// mvmbr.co/2JVZQq4 pic.twitter.com/zmE48Jm2iJ";;@MovemberAUS;;"1061824146844184576";https://twitter.com/maxwell_plus/status/1061824146844184576
maxwell_plus;2018-11-11 17:19;0;1;"Cheers Gerard!";;;;"1061745325981892609";https://twitter.com/maxwell_plus/status/1061745325981892609
GerBot;2018-11-09 05:57;0;3;"Yeah. Haven’t counted yet but there is a natural bias towards the host city. But that can work to QLD’s advantage as we don’t split the state vote";;;;"1060848809696055298";https://twitter.com/GerBot/status/1060848809696055298
ryanhanly;2018-11-09 05:48;0;1;"Seems like the Sydney startup awards. Go represent (& keep that shirt on!!)";;;;"1060846489042247680";https://twitter.com/ryanhanly/status/1060846489042247680
AaronBirkby;2018-11-09 05:44;0;1;"Thanks mate, and yes, massively so";;;;"1060845614802432000";https://twitter.com/AaronBirkby/status/1060845614802432000
ryanhanly;2018-11-09 05:11;0;2;"Just voted. Birkby you are in front!!! But is QLD severely under-represented in nominations?";;;;"1060837318804725760";https://twitter.com/ryanhanly/status/1060837318804725760
RiverCityLabs;2018-11-09 04:43;0;2;"Thank you!";;;;"1060830183664451584";https://twitter.com/RiverCityLabs/status/1060830183664451584
AaronBirkby;2018-11-09 04:40;0;3;"Thanks mate";;;;"1060829425548222464";https://twitter.com/AaronBirkby/status/1060829425548222464
scottrogers;2018-11-09 03:53;0;1;"Done";;;;"1060817725780623360";https://twitter.com/scottrogers/status/1060817725780623360
GerBot;2018-11-09 03:26;6;28;"placed my votes today for @RiverCityLabs @AaronBirkby Elliott from @maxwell_plus , Phil from @founderpodcast and the awesome crew at @teambiteable https://www. startcon.com/vote";;@RiverCityLabs @AaronBirkby @maxwell_plus @founderpodcast @teambiteable;;"1060810792440803328";https://twitter.com/GerBot/status/1060810792440803328
maxwell_plus;2018-11-09 01:05;6;21;"Exciting news! We know Elliot is an awesome boss, but it seems everyone agrees as he is a finalist for the StartUp Founder of the Year at StartCon! But we need your VOTE to help him win! Please go to https:// bit.ly/2DxAtdC every day and choose Elliot. VOTE NOW! pic.twitter.com/VuMT7wRuOg";;;;"1060775303834820609";https://twitter.com/maxwell_plus/status/1060775303834820609
philmorle;2018-11-07 16:31;2;9;"If you are excited about bringing your superpower to funded #deeptech companies like these and @CoviuApp @MyriotaGlobal @GilmourSpace @rapid_AIM @maxwell_plus @MorseMicro Baraja @indeelabs @FluroSat - let our founders know. https:// mseq.vc/jobs/";;@CoviuApp @MyriotaGlobal @GilmourSpace @rapid_AIM @maxwell_plus @MorseMicro @indeelabs @FluroSat;#deeptech;"1060283742072098816";https://twitter.com/philmorle/status/1060283742072098816
maxwell_plus;2018-11-06 19:40;1;5;"Go @srigsri23 ! Finding new MOlecular discoveries using MOchine learning is my way to support @MovemberAUS ! Help @maxwell_plus reach our fundraising target: https:// mosista.co/13843328 pic.twitter.com/N0qWJkJ5rQ";;@srigsri23 @MovemberAUS @maxwell_plus;;"1059968914891902976";https://twitter.com/maxwell_plus/status/1059968914891902976
Mikenicholls88;2018-11-06 04:33;0;0;"Form cut the link off";;;;"1059740592219901953";https://twitter.com/Mikenicholls88/status/1059740592219901953
Mikenicholls88;2018-11-06 04:27;0;0;"Thanks Alex";;;;"1059739100905844737";https://twitter.com/Mikenicholls88/status/1059739100905844737
thealexfreeman;2018-11-06 02:22;0;0;"Link https:// mseq.vc/jobs/";;;;"1059707487853531136";https://twitter.com/thealexfreeman/status/1059707487853531136
MSeqVC;2018-11-05 23:49;0;2;"We've updated our Jobs page so you can tell all our #deeptechfounders your superpower. Try it now if you want to work at @qctrlhq @maxwell_plus @coviuapp https:// buff.ly/2zuL84l";;@qctrlhq @maxwell_plus @coviuapp;#deeptechfounders;"1059668983245389825";https://twitter.com/MSeqVC/status/1059668983245389825
MSeqVC;2018-11-05 23:35;3;16;"We've updated our Jobs page so you can tell all our #deeptechfounders about your superpower. Try it now if you want to work at @qctrlhq @maxwell_plus @coviuapp";;@qctrlhq @maxwell_plus @coviuapp;#deeptechfounders;"1059665510739132417";https://twitter.com/MSeqVC/status/1059665510739132417
maxwell_plus;2018-11-05 00:46;1;1;"Today it's Geoff's turn to rock a Mo! But he hasn't let it stop him working hard to create the new Maxwell Plus Prostate Cancer Platform! What Mo do you want to see next? Donate and request now! https:// mosista.co/13843328 pic.twitter.com/FQLl1oiQ7i";;;;"1059320980290527232";https://twitter.com/maxwell_plus/status/1059320980290527232
maxwell_plus;2018-11-01 21:14;3;12;"Get on board with Maxwell for Momomomomomovemer! Day 2 and we've reached over 10% of our target. Donate today and request what Mo you'd like to see on Monday! Donate here: https:// mosista.co/13843328 #ProstateCancer @MovemberAUS pic.twitter.com/Yr7PlDJGT0";;@MovemberAUS;#ProstateCancer;"1058165336346742786";https://twitter.com/maxwell_plus/status/1058165336346742786
maxwell_plus;2018-11-01 00:17;2;3;"We're kicking off @MovemberAUS with Maxwell blue Mos! While working to create cutting-edge AI for the detection and diagnosis of prostate cancer, we're also aiming to raise $1,000! Get involved by donating at https:// mosista.co/13843328 and let us know what Mos you want to see!! pic.twitter.com/vwaS5cwgeU";;@MovemberAUS;;"1057849071711354880";https://twitter.com/maxwell_plus/status/1057849071711354880
mrkwhite;2018-10-31 16:24;0;2;"Great work @smitec and team!";;@smitec;;"1057730098021855232";https://twitter.com/mrkwhite/status/1057730098021855232
Tim47912427;2018-10-31 03:22;0;0;"@Therese_Rein";;@Therese_Rein;;"1057533253865824256";https://twitter.com/Tim47912427/status/1057533253865824256
TheTLady1;2018-10-30 23:19;0;0;"Hey Steve hows things? Guess what I got the 300 feedback sheets in - life is good still working hard with my vision of saturating the world one tea bag at a time!! in stores qld/Sa/vic very exciting hey bye for now - The T Lady";;;;"1057472009540497408";https://twitter.com/TheTLady1/status/1057472009540497408
M_CPartners;2018-10-30 22:52;0;2;"Brisbane #medicalstartup @maxwell_plus is hoping to improve long-term outcomes for #cancer patients through #artificialintelligence https://www. couriermail.com.au/business/brisb ane-startup-maxwell-plus-uses-technology-in-fight-against-cancer/news-story/7b774111c1a19e3bccab30858af982db?from=htc_rss …";;@maxwell_plus;#medicalstartup #cancer #artificialintelligence;"1057465292828233728";https://twitter.com/M_CPartners/status/1057465292828233728
maxwell_plus;2018-10-30 20:07;7;19;"Make sure you pick up a copy of @couriermail today and turn to page 46 to see a great write up about @smitec and @maxwell_plus ! pic.twitter.com/gk8gbPutTo";;@couriermail @smitec @maxwell_plus;;"1057423748184256517";https://twitter.com/maxwell_plus/status/1057423748184256517
viberenthq;2018-10-30 17:43;0;1;"Well done @smitec @maxwell_plus RT Great article in the @couriermail for @smitec and the @maxwell_plus team. Teams like this are what early stage investing is about. @TransitionLVL @AdvanceQld @RCLaccelerator @RiverCityLabs @murudau";;@smitec @maxwell_plus @couriermail @smitec @maxwell_plus @TransitionLVL @AdvanceQld @RCLaccelerator @RiverCityLabs @murudau;;"1057387483099353088";https://twitter.com/viberenthq/status/1057387483099353088
sbxr;2018-10-30 17:40;9;49;"Great article in the @couriermail for @smitec and the @maxwell_plus team. Teams like this are what early stage investing is about. @TransitionLVL @AdvanceQld @RCLaccelerator @RiverCityLabs @murudau pic.twitter.com/pnlcMhbwto";;@couriermail @smitec @maxwell_plus @TransitionLVL @AdvanceQld @RCLaccelerator @RiverCityLabs @murudau;;"1057386842419417088";https://twitter.com/sbxr/status/1057386842419417088
Craigokane;2018-10-26 05:15;3;7;"This just ask @leanne_kemp @goadepto @Graceloveslace @TandaHQ @gruntify @go1com @maxwell_plus Aussies, take the plunge! You will clean up in the UK! https:// twitter.com/AaronBirkby/st atus/1055743883357745152 …";;@leanne_kemp @goadepto @Graceloveslace @TandaHQ @gruntify @go1com @maxwell_plus;;"1055749784785477632";https://twitter.com/Craigokane/status/1055749784785477632
CancerAid_app;2018-10-26 00:32;0;4;"Our founder Dr @raghavmganesh is at #RANZCR2018 today actually getting his FRANZCR!";;@raghavmganesh;#RANZCR2018;"1055678574772944896";https://twitter.com/CancerAid_app/status/1055678574772944896
maxwell_plus;2018-10-25 18:45;0;1;"Signing off with his final post for #MaxwellPlus , our intern Josh reflects on what he's learned over the past three months in the Clinical Operations Team. Read about his experiences here: https:// bit.ly/2ELkhqS pic.twitter.com/79IBwqmp2i";;;#MaxwellPlus;"1055591097609658368";https://twitter.com/maxwell_plus/status/1055591097609658368
DrSarahLi;2018-10-24 18:16;0;2;"The Danish Breast Cancer Group Strategy: MDT #oncology care + technology & #BigData . Presented by Prof. Birgitte Offersen. Could there be collaboration opportunities with Australian startups @CancerAid_app and @maxwell_plus ? #RANZCR2018";;@CancerAid_app @maxwell_plus;#oncology #BigData #RANZCR2018;"1055221571898433536";https://twitter.com/DrSarahLi/status/1055221571898433536
maxwell_plus;2018-10-19 09:41;0;6;"Thanks to #LMBA2018 for a great night out! Looking forward to 2019!! pic.twitter.com/D0QStHBVPY";;;#LMBA2018;"1053280041428115456";https://twitter.com/maxwell_plus/status/1053280041428115456
maxwell_plus;2018-10-19 08:06;1;6;"Unfortunately no luck for us this year at #LMBA2018 , but massive congratulations to all the finalists, especially to Sam Hussey @lightweaveco for being the @SingaporeAir Young Business Person of the year!! pic.twitter.com/6JcCL4npQl";;@lightweaveco @SingaporeAir;#LMBA2018;"1053256153512128512";https://twitter.com/maxwell_plus/status/1053256153512128512
maxwell_plus;2018-10-19 00:19;0;3;"Tonight is the night! After weeks of waiting, we will finally find out if Elliot ( @smitec ) will win the @SingaporeAir Award for Young Business Person of the Year at #LMBA18 ! Keep your fingers crossed! pic.twitter.com/Xx8Lsuutq6";;@smitec @SingaporeAir;#LMBA18;"1053138486822297600";https://twitter.com/maxwell_plus/status/1053138486822297600
maxwell_plus;2018-10-18 06:33;1;2;"Need some hints for your summer reading list? Check out @smitec 's pick along with 16 other Aussie Executives! https:// twitter.com/M_CPartners/st atus/1052802820145958917 …";;@smitec;;"1052870310263840773";https://twitter.com/maxwell_plus/status/1052870310263840773
M_CPartners;2018-10-18 02:05;7;11;"Looking for a great read? Here are the top picks from Aussie execs: @GoDaddy @Lux_Escapes @travelloapp @Hyperwallet @James_C_Wright @educatorimpact @the_volte @indepreserve @twilio @maxwell_plus @Rentcomau @HuobiAu @sec_matters @cynatastemcells @Fiji_Kava https://www. businessinsider.com.au/australian-ceo s-favourite-fiction-books-2018-10 …";;@GoDaddy @Lux_Escapes @travelloapp @Hyperwallet @James_C_Wright @educatorimpact @the_volte @indepreserve @twilio @maxwell_plus @Rentcomau @HuobiAu @sec_matters @cynatastemcells @Fiji_Kava;;"1052802820145958917";https://twitter.com/M_CPartners/status/1052802820145958917
maxwell_plus;2018-10-17 19:52;0;1;"We love seeing our team getting out and about to share our work! Here's @srigsri23 with his recent research at the Amercian Association of Cancer Research Conference in Rhode Island! #AACRBioSci18 https:// twitter.com/srigsri23/stat us/1052632914909790208 …";;@srigsri23;#AACRBioSci18;"1052709064378015744";https://twitter.com/maxwell_plus/status/1052709064378015744
srigsri23;2018-10-17 14:50;0;4;"Had a great time presenting our poster on prostate cancer metabolism at AACR Special Conference. @maxwell_plus (here with Richard Stark) #AACRBioSci18 pic.twitter.com/F0cPr5ZTPl";;@maxwell_plus;#AACRBioSci18;"1052632914909790208";https://twitter.com/srigsri23/status/1052632914909790208
maxwell_plus;2018-10-14 18:44;1;2;"#AACRBioSci18 is off to a great start! We can't wait to hear @srigsri23 present metabolic markers for risk stratification in prostate cancer! https:// twitter.com/srigsri23/stat us/1051597949975846913 …";;@srigsri23;#AACRBioSci18;"1051604683611987968";https://twitter.com/maxwell_plus/status/1051604683611987968
maxwell_plus;2018-10-11 19:30;2;4;"Struggling to build a maintainable model for your #DeepLearning project? Our latest blog post by Lewis, Engineer at #MaxwellPlus , demonstrates his template for using @TensorFlow to build quality distributed training models. Read it here: https:// bit.ly/2C8OX2f pic.twitter.com/2D4Ryx8BUy";;@TensorFlow;#DeepLearning #MaxwellPlus;"1050529073712254977";https://twitter.com/maxwell_plus/status/1050529073712254977
