username;date;retweets;favorites;text;geo;mentions;hashtags;id;permalink
maxwell_plus;2018-04-19 20:26;5;11;"At @maxwell_mri, our vision is a world with post scarcity health. In part 1 of 's @smitec 's article, he explains what scarcity is. Read it here and let us know your thoughts: https:// bit.ly/2HKKBz3 pic.twitter.com/k7aMepmVO4";;@maxwell_mri @smitec;;"987125422419685376";https://twitter.com/maxwell_plus/status/987125422419685376
maxwell_plus;2018-04-11 23:25;2;14;"Thanks to @RCLaccelerator and @catalyst_au for inviting @mnbbrown to chat about the incredible opportunities both programs offer. Applications are open now: https://www. f6s.com/rivercitylabsa cceleratorbne4/apply … https:// pbs.twimg.com/media/DafbZZwX kAAMwx9.jpg … pic.twitter.com/hFX4Z9uu9x";;@RCLaccelerator @catalyst_au @mnbbrown;;"984271340994744320";https://twitter.com/maxwell_plus/status/984271340994744320
maxwell_plus;2018-04-10 21:45;7;5;"We're looking for an AI Engineer, Python Developer - Django and Frontend Developer - React to come and help us change the future of healthcare! Interested or know someone who might be? Find out more here: https:// bit.ly/2GQkS7g pic.twitter.com/U1WtpCwXIL";;;;"983883619302363136";https://twitter.com/maxwell_plus/status/983883619302363136
maxwell_plus;2018-04-03 20:03;11;19;"A massive shout out to Nicole Robinson @TheAIRCode for inviting @smitec to chat all things AI and Healthcare! Listen to the interview here: https:// apple.co/2GyKTri";;@TheAIRCode @smitec;;"981321341407285248";https://twitter.com/maxwell_plus/status/981321341407285248
maxwell_plus;2018-04-03 01:07;0;2;"Looking for inspiration after the Easter long weekend? Check out our current job opportunities with Maxwell: https://www. linkedin.com/jobs/search/?f _C=12892834&location=Worldwide&locationId=OTHERS.worldwide …";;;;"981035412822151169";https://twitter.com/maxwell_plus/status/981035412822151169
maxwell_plus;2018-03-29 03:47;6;18;"We're hiring! Make sure you check out our current opportunities! https://www. linkedin.com/jobs/search/?f _C=12892834&location=Worldwide&locationId=OTHERS.worldwide …";;;;"979263865425809408";https://twitter.com/maxwell_plus/status/979263865425809408
maxwell_plus;2017-12-04 22:25;8;27;"This week the amazing @simmoroos is at the WiML workshop this week alongside the world's top AI conference, NIPS. She's there presenting some the cutting edge ML research she's been doing at @maxwell_mri! #NIPS2017 #WiML2017 pic.twitter.com/e9DcPfr5Hr";;@simmoroos @maxwell_mri;#NIPS2017 #WiML2017;"937885717992169472";https://twitter.com/maxwell_plus/status/937885717992169472
maxwell_plus;2017-09-27 01:05;4;9;"Check out “Comparing Cancer Survival Rates in Australia and China” If you have friends in China, share with them too https:// medium.com/gradient-desce nt/comparing-cancer-survival-rates-in-australia-and-china-93992c7da7ea …";;;;"912906110100807682";https://twitter.com/maxwell_plus/status/912906110100807682
maxwell_plus;2017-09-01 02:12;5;25;"All of QLDs DGs in @RiverCityLabs talking startups innovation and the future of Queensland. #advanceqld pic.twitter.com/o0sbaPGgPi";;@RiverCityLabs;#advanceqld;"903500784989421569";https://twitter.com/maxwell_plus/status/903500784989421569
maxwell_plus;2017-05-11 03:31;0;1;"https:// twitter.com/mnbbrown/statu s/862570090796941312 …";;;;"862570771406700545";https://twitter.com/maxwell_plus/status/862570771406700545
maxwell_plus;2017-04-13 06:50;3;9;"Happy Easter from all of us at Maxwell MRI. Enjoy the break and stay safe! https:// twitter.com/petermaccc/sta tus/852415148312608768 …";;;;"852473940937023488";https://twitter.com/maxwell_plus/status/852473940937023488
maxwell_plus;2017-04-13 01:54;0;1;"Thanks Llew!!";;;;"852399605291466754";https://twitter.com/maxwell_plus/status/852399605291466754
maxwell_plus;2017-03-28 21:32;5;17;"It's @RCLaccelerator #demoday and we're excited!! #prostate #mri pic.twitter.com/Ep0wpoVtLc";;@RCLaccelerator;#demoday #prostate #mri;"846897854547316736";https://twitter.com/maxwell_plus/status/846897854547316736
maxwell_plus;2017-03-27 03:52;1;5;"Come say hi at @MyriadLive https:// twitter.com/mnbbrown/statu s/846267197181739008 …";;@MyriadLive;;"846268742442991616";https://twitter.com/maxwell_plus/status/846268742442991616
maxwell_plus;2017-03-24 05:49;3;8;"At the @RCLaccelerator friends and family night.. great night with our biggest supporters and advocates! https:// twitter.com/rivercitylabs/ status/845200812083101696 …";;@RCLaccelerator;;"845210886524485632";https://twitter.com/maxwell_plus/status/845210886524485632
maxwell_plus;2017-03-23 05:13;3;10;"Tonight we're at the @BrisbaneAi meetup talk about AI + Prostate MRI. @smitec pic.twitter.com/Lpw8VrciLf";;@BrisbaneAi @smitec;;"844839541747806208";https://twitter.com/maxwell_plus/status/844839541747806208
maxwell_plus;2017-03-05 21:22;2;2;"We must "...achieve rapid—and dramatic—productivity improvements in the delivery of health services". http:// buff.ly/2mJyY3W @McKinsey pic.twitter.com/aUa8SEKJZx";;@McKinsey;;"838575401714724864";https://twitter.com/maxwell_plus/status/838575401714724864
maxwell_plus;2017-02-20 03:20;0;1;"you bet Armin. A little way down the track but definitely something we intend on tackling.";;;;"833592034925481986";https://twitter.com/maxwell_plus/status/833592034925481986
maxwell_plus;2017-02-09 19:52;0;3;"that would awesome!";;;;"829855469682331649";https://twitter.com/maxwell_plus/status/829855469682331649
maxwell_plus;2017-02-08 02:04;0;1;"$15,000 per case - the cost of over treating prostate cancer http://www. medscape.com/viewarticle/77 9223 …";;;;"829224377271083008";https://twitter.com/maxwell_plus/status/829224377271083008
maxwell_plus;2017-02-06 20:28;16;33;"Super excited to be included in the @CBinsights 106 startups transforming healthcare with AI. @RCLaccelerator @sbxr @AdvanceQld pic.twitter.com/YLNgM1hmw1";;@CBinsights @RCLaccelerator @sbxr @AdvanceQld;;"828777453631922176";https://twitter.com/maxwell_plus/status/828777453631922176
maxwell_plus;2017-01-20 00:46;0;1;"Thanks for taking the time and for your support! https:// twitter.com/anarghya503/st atus/822255430223024129 …";;;;"822319464658051074";https://twitter.com/maxwell_plus/status/822319464658051074
maxwell_plus;2017-01-08 19:23;3;3;"Great piece on the potential of data science in #healthcare . #nextbigthing #medtech #JPM17 #cbinsights https:// techcrunch.com/2017/01/07/usi ng-data-science-to-beat-cancer/?ncid=rss&utm_source=feedburner&utm_medium=feed&utm_campaign=Feed%3A+Techcrunch+%28TechCrunch%29 … via @stewnit";;@stewnit;#healthcare #nextbigthing #medtech #JPM17 #cbinsights;"818251726054572033";https://twitter.com/maxwell_plus/status/818251726054572033
maxwell_plus;2017-01-02 02:41;0;1;"Thanks @scottrogers ! Hey @jennmchoi any thoughts on who we should chat to? :)";;@scottrogers @jennmchoi;;"815825206862225408";https://twitter.com/maxwell_plus/status/815825206862225408
maxwell_plus;2017-01-01 20:48;2;2;"We’ll be in SFO & NYC from 16th-28th Jan! Know anyone doing amazing things in #deeplearning or #healthcare ? Who should we talk to? pic.twitter.com/F4IDXh5RKA";;;#deeplearning #healthcare;"815736368026390529";https://twitter.com/maxwell_plus/status/815736368026390529
maxwell_plus;2016-11-29 20:09;0;0;"Focus on information and insights over pattern recognition. https:// twitter.com/maxwell_mri/st atus/803767332610797568 …";;;;"803767765144190976";https://twitter.com/maxwell_plus/status/803767765144190976
maxwell_plus;2016-11-29 20:07;0;0;"An interesting look at how radiologists and AI will work together to deliver better patient outcomes http:// jamanetwork.com/journals/jama/ fullarticle/2588764 …";;;;"803767332610797568";https://twitter.com/maxwell_plus/status/803767332610797568
maxwell_plus;2016-11-13 23:25;10;22;"Super excited to be featured in the Courier Mail on Saturday. pic.twitter.com/YShqFMb5vK";;;;"798018876248162304";https://twitter.com/maxwell_plus/status/798018876248162304
maxwell_plus;2016-10-23 19:15;3;6;"At the Texas medical center briefing looking to connect Australian startups with the American market. @AustradeUSA @RCLaccelerator pic.twitter.com/NQNTPdRYfG";;@AustradeUSA @RCLaccelerator;;"790330854362849280";https://twitter.com/maxwell_plus/status/790330854362849280
maxwell_plus;2016-10-16 02:01;2;6;"Productive weekend at @HealthHackAu #Brisbane . Adding collaborative annotation features to TissueStack from @NIFAus . pic.twitter.com/M3diYUr8dR";;@HealthHackAu @NIFAus;#Brisbane;"787534013518848000";https://twitter.com/maxwell_plus/status/787534013518848000
maxwell_plus;2016-10-07 22:25;0;1;"2 more to put in still as well!!";;;;"784580503693320192";https://twitter.com/maxwell_plus/status/784580503693320192
maxwell_plus;2016-10-07 21:12;5;12;"Our GPU box arrived from #digicor @Supermicro_SMCI yesterday. Supercharged model training. Going into @Over_The_Wire next week! pic.twitter.com/LMmlryWwI6";;@Supermicro_SMCI @Over_The_Wire;#digicor;"784561970708148224";https://twitter.com/maxwell_plus/status/784561970708148224
maxwell_plus;2016-09-26 17:10;3;1;"An insiders look at @murudau #BNE2 from @tsjio . http:// tsj.io/2016/09/26/riv er-city-labs-muru-d-accelerator/ …";;@murudau @tsjio;#BNE2;"780514821552742400";https://twitter.com/maxwell_plus/status/780514821552742400
maxwell_plus;2016-09-26 17:07;1;1;"Great to see @RCLaccelerator #BNE2 featured in @StartupSmartnow . We’re excited to be a part of it! http://www. startupsmart.com.au/advice/growth/ the-world-is-watching-river-city-labs-welcomes-seven-new-startups-into-accelerator-program/ …";;@RCLaccelerator @StartupSmartnow;#BNE2;"780514178939297793";https://twitter.com/maxwell_plus/status/780514178939297793
maxwell_plus;2016-09-22 05:33;0;3;"Maxwell MRI is excited to join #BNE2 @murudau @RCLaccelerator @RiverCityLabs @sbxr @StartupDailyANZ http://www. startupdaily.net/2016/09/river- city-labs-reveals-second-muru-d-accelerator-intake/ …";;@murudau @RCLaccelerator @RiverCityLabs @sbxr @StartupDailyANZ;#BNE2;"778889968324190208";https://twitter.com/maxwell_plus/status/778889968324190208
maxwell_plus;2016-09-17 23:38;0;0;"Preventative care is the future. http://www. brisbanetimes.com.au/federal-politi cs/political-news/crisis-looms-as-australians-look-to-ditch-private-health-insurance-20160916-grichb.html …";;;;"777351161619767296";https://twitter.com/maxwell_plus/status/777351161619767296
maxwell_plus;2016-09-17 21:45;3;4;"https://www. maxwellmri.com /";;;;"777322553735995392";https://twitter.com/maxwell_plus/status/777322553735995392
maxwell_plus;2016-09-16 19:07;4;6;"Kicking things off at @RCLaccelerator bootcamp. @RiverCityLabs @murudau @TalentVineHQ pic.twitter.com/rKnJmf2BdT";;@RCLaccelerator @RiverCityLabs @murudau @TalentVineHQ;;"776920569266659328";https://twitter.com/maxwell_plus/status/776920569266659328
maxwell_plus;2016-09-08 04:51;3;10;"At Broker meets Biotech for 2016.. keen to hear from @VolparaDensity . @AusBiotech @sbxr @RiverCityLabs pic.twitter.com/ADYnwykM3F";;@VolparaDensity @AusBiotech @sbxr @RiverCityLabs;;"773805845335252992";https://twitter.com/maxwell_plus/status/773805845335252992
maxwell_plus;2016-07-11 22:49;0;3;"Regular MRIs + AI driven interpretation of results = catch health issues before it's too late. #maxwellmri Coming 2017";;;#maxwellmri;"752696245227966464";https://twitter.com/maxwell_plus/status/752696245227966464