username;date;retweets;favorites;text;geo;mentions;hashtags;id;permalink
banknovo;2018-09-06 12:34;2;9;"Another day here at #TCDisrupt ! Come to booth K125 to learn about #smallbusiness #banking that doesn’t suck. For more information visit http://www. banknovo.com and see where #fintech is headed next. pic.twitter.com/AzJwBOKb6F";;;#TCDisrupt #smallbusiness #banking #fintech;"1037740820655468554";https://twitter.com/banknovo/status/1037740820655468554
Barclays;2018-09-06 12:09;4;7;"“I wanted to be an entrepreneur from a very young age.” We talk to Tyler McIntyre and Michael Rangel, founders of @banknovo about graduating from the #BarclaysAccelerator and why “the second you get comfortable, you know you are doing something wrong.” https:// barc.ly/2NUUgFI pic.twitter.com/E9CIOkojqk";;@banknovo;#BarclaysAccelerator;"1037734499218595840";https://twitter.com/Barclays/status/1037734499218595840
banknovo;2018-09-06 10:00;0;2;"Clinc expands to automotive, releases SaaS platform for its voice AI assistant https:// buff.ly/2oIlnc3";;;;"1037702034621952000";https://twitter.com/banknovo/status/1037702034621952000
pradyumna_d;2018-09-05 14:55;2;6;"2. Shoutout to all the #blockchain companies at #TCDisrupt @GPXenergy @GSCAviation @health_wizz @humaniq @Humanscape_ICO @PayWithInk @KlusterNet @LifeBankNigeria @mobodexter @banknovo";;@GPXenergy @GSCAviation @health_wizz @humaniq @Humanscape_ICO @PayWithInk @KlusterNet @LifeBankNigeria @mobodexter @banknovo;#blockchain #TCDisrupt;"1037413879670816769";https://twitter.com/pradyumna_d/status/1037413879670816769
KISHANMENDAPARA;2018-09-05 13:08;0;2;"Check this out! Awesome things coming from @banknovo at #TCDisrupt in SF. If you're at the show, stop by our booth or go to http://www. banknovo.com and see how you can join the future of #smallbusiness #banking http://www. prweb.com/releases/novo_ launches_pocket_sized_cfo_to_empower_small_businesses_at_techcrunch_disrupt_san_francisco/prweb15737396.htm …";;@banknovo;#TCDisrupt #smallbusiness #banking;"1037387049853042689";https://twitter.com/KISHANMENDAPARA/status/1037387049853042689
Will_Harlow;2018-09-05 12:37;1;2;"Check this out! Awesome things coming from @banknovo at #TCDisrupt . If you're at the show, stop by our booth and figure out how you can join the future of #smallbusiness #banking https:// twitter.com/banknovo/statu s/1037377474227851265 …";;@banknovo;#TCDisrupt #smallbusiness #banking;"1037379222363414529";https://twitter.com/Will_Harlow/status/1037379222363414529
banknovo;2018-09-05 12:30;1;1;"Novo Launches Pocket-Sized CFO to Empower Small Businesses at TechCrunch Disrupt SF #TCDisrupt #fintech http:// story.cd/AAJ5YX";;;#TCDisrupt #fintech;"1037377474227851265";https://twitter.com/banknovo/status/1037377474227851265
ThinkRiseGlobal;2018-09-05 07:53;1;1;"Find out more about our Rise FinTech Award 2018 nominee, Novo ( @banknovo ) http:// ow.ly/j4Po30lGkvu";;@banknovo;;"1037307613501898757";https://twitter.com/ThinkRiseGlobal/status/1037307613501898757
ThinkRiseGlobal;2018-09-05 07:50;1;0;"Rise FinTech Award nominee @banknovo on what it takes to be a successful entrepreneur #HomeofFinTech http:// ow.ly/9tUD30lGewI";;@banknovo;#HomeofFinTech;"1037306981990768641";https://twitter.com/ThinkRiseGlobal/status/1037306981990768641
ThinkRiseGlobal;2018-09-05 07:49;4;11;"Congratulations to the following companies who’ve been nominated for the prestigious Rise FinTech Award, part of the 2018 @BarclaysEntrepreneur Awards: @usealloy , @finbourne , @tryflux , Multiply ( http:// ow.ly/6SFR30lGeOz ), Novo @banknovo , @Sheild_pay and @simudyne . #HomeofFinTech";;@BarclaysEntrepreneur @usealloy @finbourne @tryflux @banknovo @Sheild_pay @simudyne;#HomeofFinTech;"1037306638972145666";https://twitter.com/ThinkRiseGlobal/status/1037306638972145666
banknovo;2018-09-03 10:01;0;3;"Countingup, the business bank account that combines bookkeeping, raises £2.3M seed https:// buff.ly/2CdUlTu";;;;"1036615139070496768";https://twitter.com/banknovo/status/1036615139070496768
banknovo;2018-08-31 10:01;0;0;"Clinc is building a voice AI system to replace humans in drive-through restaurants https:// buff.ly/2MC3p9k";;;;"1035527879847817216";https://twitter.com/banknovo/status/1035527879847817216
banknovo;2018-08-29 10:01;2;3;"Very Good Security makes data ‘unhackable’ with $8.5M from Andreessen https:// buff.ly/2ohsfg4";;;;"1034803122739326976";https://twitter.com/banknovo/status/1034803122739326976
banknovo;2018-08-23 10:00;0;1;"All 59 startups that launched today at Y Combinator’s S18 Demo Day 2 https:// buff.ly/2PrArqx";;;;"1032628726360682496";https://twitter.com/banknovo/status/1032628726360682496
banknovo;2018-08-22 10:00;0;0;"Revolut introduces a metal card https:// buff.ly/2LdwkuN";;;;"1032266249076699136";https://twitter.com/banknovo/status/1032266249076699136
money2020;2018-08-21 18:00;8;18;"In Vegas, see 24 startups, like @KapitalWise @LCharging @MessariCrypto @NewgenPayments & @banknovo , pitch their company in 3 minutes & 3 minutes of Q&A with our judges. They'll select 2 to go on to the finals, where our audience will pick the $25K winner! http:// bit.ly/2whPlqI pic.twitter.com/BRnmna2SsW";;@KapitalWise @LCharging @MessariCrypto @NewgenPayments @banknovo;;"1032024576308523011";https://twitter.com/money2020/status/1032024576308523011
ThinkRiseGlobal;2018-08-21 08:55;2;2;"Tyler McIntyre founder of @banknovo explains his three biggest tips on what makes a great entrepreneur in FinTech. #homeoffintech #WED2018 #twentyfirstaugust @ThinkRiseNY pic.twitter.com/ii27EYFccb";;@banknovo @ThinkRiseNY;#homeoffintech #WED2018 #twentyfirstaugust;"1031887446471061505";https://twitter.com/ThinkRiseGlobal/status/1031887446471061505
banknovo;2018-08-14 10:00;0;1;"African tech leaders Fope Adelowo, Ken Njoroge, Tayo Oviosu to speak at Disrupt SF https:// buff.ly/2nATvWJ";;;;"1029367038265966594";https://twitter.com/banknovo/status/1029367038265966594
banknovo;2018-08-08 10:00;0;1;"Chinese AI startup Tianrang raises a $26M funding round, launches new project to apply ML to cities https:// buff.ly/2OjaIz5";;;;"1027192884594921472";https://twitter.com/banknovo/status/1027192884594921472
banknovo;2018-08-07 10:00;0;1;"Flux partners with fast food merchant itsu for itemised paperless receipts https:// buff.ly/2KxYBvY";;;;"1026830401090846720";https://twitter.com/banknovo/status/1026830401090846720
banknovo;2018-08-06 10:00;0;1;"Challenger bank Monzo launches accounts for 16-18 year olds https:// buff.ly/2M7ACsa";;;;"1026467997383356417";https://twitter.com/banknovo/status/1026467997383356417
velocityvirtual;2018-08-03 07:12;0;1;"7 Reasons Why Your World-Changing #Startup Can’t Be Your Side Hustle http:// bit.ly/2veJDWR #sidegig @banknovo pic.twitter.com/jMZvMjO4m3";;@banknovo;#Startup #sidegig;"1025338493902487552";https://twitter.com/velocityvirtual/status/1025338493902487552
BEoffices;2018-08-01 13:39;0;0;"5 Reasons Why Co-Founding a #Company is a Lot Like Marriage http:// bit.ly/2vvjEtI @banknovo #newbiz pic.twitter.com/LhTvJNw3Jf";;@banknovo;#Company #newbiz;"1024711108999954432";https://twitter.com/BEoffices/status/1024711108999954432
BEoffices;2018-08-01 12:24;0;2;"#Toptips : The 5 People Every #Business Needs in Their Advisory Board http:// bit.ly/2vrh7Ap @banknovo pic.twitter.com/PGBPgQ3yop";;@banknovo;#Toptips #Business;"1024692235466625025";https://twitter.com/BEoffices/status/1024692235466625025
andoffices;2018-08-01 11:19;0;2;"How to Pick a Good #Business Name and Trademark @banknovo http:// bit.ly/2OuieZ3 #toptip #newbiz pic.twitter.com/Wf8zxKFoBv";;@banknovo;#Business #toptip #newbiz;"1024675881728520192";https://twitter.com/andoffices/status/1024675881728520192
tmcpro;2018-08-01 09:29;0;0;"The good news is that your @banknovo card will still work at @kroger ! https://www. bloomberg.com/news/articles/ 2018-07-30/credit-card-backlash-mounts-as-kroger-weighs-expanding-visa-ban …";;@banknovo @kroger;;"1024648290858688512";https://twitter.com/tmcpro/status/1024648290858688512
ThinkRiseNY;2018-07-31 14:53;0;3;"@7chordbd @datavorelabs @FinsuiteUSA @BoloroGlobal @plumalleyco @banknovo @NexChanger @Tenlegs @Forward_Lane @RealBlocks @ZelkovaVC @SigmaRatings @TheSunExchange";;@7chordbd @datavorelabs @FinsuiteUSA @BoloroGlobal @plumalleyco @banknovo @NexChanger @Tenlegs @Forward_Lane @RealBlocks @ZelkovaVC @SigmaRatings @TheSunExchange;;"1024367419870113793";https://twitter.com/ThinkRiseNY/status/1024367419870113793
banknovo;2018-07-30 10:01;0;0;"Grover raises €37M Series A to offer latest tech products as a subscription https:// buff.ly/2K4hWV7";;;;"1023931470426124289";https://twitter.com/banknovo/status/1023931470426124289
banknovo;2018-07-24 10:00;0;0;"Industrial robots startup Gideon Brothers raises $765K led by TransferWise co-founder https:// buff.ly/2Ocrwsj";;;;"1021756950349053958";https://twitter.com/banknovo/status/1021756950349053958
banknovo;2018-07-19 10:00;0;0;"With eyes on Europe, Open Banking API provider TrueLayer raises $7.5M https:// buff.ly/2NZ2UDo";;;;"1019945116759396353";https://twitter.com/banknovo/status/1019945116759396353
ManhattanCofC;2018-07-18 09:00;1;3;"#B2B Tech Solutions @TMobile with presentations from @BehalfInc , @cogninow and @banknovo on #finance and #banking solutions for #SmallBiz pic.twitter.com/SURFCcROEz";;@TMobile @BehalfInc @cogninow @banknovo;#B2B #finance #banking #SmallBiz;"1019567472880574465";https://twitter.com/ManhattanCofC/status/1019567472880574465
ManhattanCofC;2018-07-16 17:00;1;3;"It's not too late register for Wednesday morning's #B2B Tech Solutions event powered by @TMobile #TMobileTimesSquare ! Sign-up now to see @banknovo @cogninow and @BehalfInc present their business banking and finance solutions. Register at http:// bit.ly/ChamberB2BTech Solutions … . pic.twitter.com/iqV6RtsKjA";;@TMobile @banknovo @cogninow @BehalfInc;#B2B #TMobileTimesSquare;"1018963687690956801";https://twitter.com/ManhattanCofC/status/1018963687690956801
banknovo;2018-07-13 10:00;0;2;"Robinhood CEO Baiju Bhatt to talk fintech at Disrupt SF https:// buff.ly/2ma03uC";;;;"1017770717176266752";https://twitter.com/banknovo/status/1017770717176266752
banknovo;2018-07-12 10:00;0;0;"Japanese startup Paidy raises $55M Series C to let people shop online without a credit card https:// buff.ly/2zE7sMy";;;;"1017408243268608002";https://twitter.com/banknovo/status/1017408243268608002
ManhattanCofC;2018-07-11 09:48;0;1;"Attention #SmallBusinesses : Want to learn how using new #fintech solutions and apps you can grow your business? Join us for #B2B Tech Solutions at @TMobile #tmobiletimessquare on 7/18! Visit http:// bit.ly/B2BFinanceandB anking … to register! @cogninow @BehalfInc @banknovo pic.twitter.com/Go4Xta6i9m";;@TMobile @cogninow @BehalfInc @banknovo;#SmallBusinesses #fintech #B2B #tmobiletimessquare;"1017043032384958467";https://twitter.com/ManhattanCofC/status/1017043032384958467
banknovo;2018-07-10 10:00;0;1;"N26 updates its web app https:// buff.ly/2L5s1md";;;;"1016683664569139205";https://twitter.com/banknovo/status/1016683664569139205
banknovo;2018-07-09 10:00;0;1;"TaxScouts wants to make filing your tax return a lot less tedious https:// buff.ly/2ugk2vv";;;;"1016321233623896069";https://twitter.com/banknovo/status/1016321233623896069
banknovo;2018-07-06 10:00;0;1;"Starling CEO Anne Boden is coming to Disrupt Berlin https:// buff.ly/2u5z86C";;;;"1015234070610145281";https://twitter.com/banknovo/status/1015234070610145281
banknovo;2018-07-05 10:00;0;1;"Planck Re scores $12M Series A to simplify insurance underwriting with artificial intelligence https:// buff.ly/2lSIrU4";;;;"1014871571205378048";https://twitter.com/banknovo/status/1014871571205378048
banknovo;2018-07-04 10:00;0;1;"Airwallex raises $80M for its international payment service for businesses https:// buff.ly/2MKWm9U";;;;"1014509131926065153";https://twitter.com/banknovo/status/1014509131926065153
banknovo;2018-06-30 10:00;0;0;"Nigerian logistics startup Kobo360 accepted into YC, raises $1.2 million https:// buff.ly/2KhesDM";;;;"1013059586260176896";https://twitter.com/banknovo/status/1013059586260176896
banknovo;2018-06-25 10:00;0;2;"Fintech friends: Monzo partners with TransferWise for international payments https:// buff.ly/2yFKT9I";;;;"1011247799269232640";https://twitter.com/banknovo/status/1011247799269232640
banknovo;2018-06-22 10:01;0;1;"Drip Capital helps exporters access working capital https:// buff.ly/2K4jmzP";;;;"1010160736381947905";https://twitter.com/banknovo/status/1010160736381947905
ManhattanCofC;2018-06-21 11:22;2;3;"Join us at @TMobile #tmobiletimessquare for #B2B #FinTech Solutions on 7/18! Presenting companies include @cogninow @BehalfInc & @banknovo . Additional details below. Visit http:// bit.ly/B2BFinanceandB anking … to register! pic.twitter.com/r5WBtCFldq";;@TMobile @cogninow @BehalfInc @banknovo;#tmobiletimessquare #B2B #FinTech;"1009818825049694209";https://twitter.com/ManhattanCofC/status/1009818825049694209
banknovo;2018-06-21 10:01;0;2;"Penta, the bank account for SMEs, adds multi-card support to manage expenses https:// buff.ly/2t8voBM";;;;"1009798374202204160";https://twitter.com/banknovo/status/1009798374202204160
banknovo;2018-06-20 10:00;0;1;"Veriff raises $7.7M Series A to become the ‘Stripe for identity’ https:// buff.ly/2I2Or5b";;;;"1009435824906231808";https://twitter.com/banknovo/status/1009435824906231808
banknovo;2018-06-19 10:01;0;1;"Breaking down France’s new $76M Africa startup fund https:// buff.ly/2LZFxrp";;;;"1009073573372289024";https://twitter.com/banknovo/status/1009073573372289024
banknovo;2018-06-18 10:00;0;2;"Plum, the fintech chatbot that helps you save, adds theme-based investing https:// buff.ly/2t6Lsnv";;;;"1008711107987505152";https://twitter.com/banknovo/status/1008711107987505152
banknovo;2018-06-15 10:00;0;1;"N26 launches a revised metal card https:// buff.ly/2sThovC";;;;"1007623896277966848";https://twitter.com/banknovo/status/1007623896277966848
banknovo;2018-06-14 10:00;0;1;"A conversation with Sarah Cannon and Mark Goldberg, Index Ventures’ new partners https:// buff.ly/2JIeNv3";;;;"1007261509246967808";https://twitter.com/banknovo/status/1007261509246967808
coccinsight;2018-06-14 08:55;1;3;". @mlheureux_ct is introducing our #fintech panelists: Tyler McIntyre of @banknovo , Jim Slocum of @oneunited , & Skye Isard of @SandboxBanking #cocc2018 pic.twitter.com/nQ7L2YYPhJ";;@mlheureux_ct @banknovo @oneunited @SandboxBanking;#fintech #cocc2018;"1007245161955553280";https://twitter.com/coccinsight/status/1007245161955553280
banknovo;2018-06-12 10:00;0;2;"Africa Roundup: African startup investments turn to fintech this winter season https:// buff.ly/2JD3ODa";;;;"1006536829896658946";https://twitter.com/banknovo/status/1006536829896658946
banknovo;2018-06-11 10:00;0;1;"Marshmallow picks up $1.2M seed to provide car insurance to immigrants and expats https:// buff.ly/2sMqF7P";;;;"1006174428449951745";https://twitter.com/banknovo/status/1006174428449951745
banknovo;2018-06-10 10:00;1;4;"Revolut announces a Robinhood-like trading product https:// buff.ly/2M4KO1T";;;;"1005811898070249474";https://twitter.com/banknovo/status/1005811898070249474
banknovo;2018-06-09 10:00;0;0;"Switchee raises £1.3M for its smart thermostat for social housing landlords https:// buff.ly/2sCeUSd";;;;"1005449551753502721";https://twitter.com/banknovo/status/1005449551753502721
banknovo;2018-06-08 10:00;0;0;"MoloFinance scores £3.7M seed funding to offer a fully digital mortgage https:// buff.ly/2LWBAop";;;;"1005087145239990273";https://twitter.com/banknovo/status/1005087145239990273
banknovo;2018-06-07 10:00;0;0;"Lendix raises $37 million for its lending marketplace https:// buff.ly/2JeXd1v";;;;"1004724661362548736";https://twitter.com/banknovo/status/1004724661362548736
banknovo;2018-06-06 10:00;0;1;"ING backs FinCompare, the German comparison platform for SME financing https:// buff.ly/2xFhM5B";;;;"1004362356716122112";https://twitter.com/banknovo/status/1004362356716122112
banknovo;2018-06-05 10:00;0;5;"N26 now has 1 million customers https:// buff.ly/2JwoorI";;;;"1003999912042876931";https://twitter.com/banknovo/status/1003999912042876931
banknovo;2018-06-04 10:00;0;0;"TransferWise partners with France’s second largest bank BPCE Groupe https:// buff.ly/2LjzHRD";;;;"1003637655714893824";https://twitter.com/banknovo/status/1003637655714893824
banknovo;2018-06-02 10:00;0;0;"More speakers, panels at The Europas, and how to get your ticket free https:// buff.ly/2H6lSTW";;;;"1002912820604915712";https://twitter.com/banknovo/status/1002912820604915712
banknovo;2018-06-01 10:00;0;0;"Starling Bank raising another £80M, ends partnership with TransferWise https:// buff.ly/2IWJSyD";;;;"1002550435771813888";https://twitter.com/banknovo/status/1002550435771813888
banknovo;2018-05-31 10:00;0;0;"Tradeshift raises $250M Series E, Goldman Sachs joins the round https:// buff.ly/2IZhuIj";;;;"1002188072639975425";https://twitter.com/banknovo/status/1002188072639975425
banknovo;2018-05-29 10:00;0;1;"Flock raises £2.25M for its on-demand drone insurance https:// buff.ly/2GZ8sJt";;;;"1001463317892878336";https://twitter.com/banknovo/status/1001463317892878336
banknovo;2018-05-24 10:00;0;0;"Revolut adds Ripple and Bitcoin Cash support https:// buff.ly/2sarMPt";;;;"999651263099949057";https://twitter.com/banknovo/status/999651263099949057
ThinkRiseNY;2018-05-23 16:58;2;2;"“What makes you unique?” Bringing some of the expertise in technology to the barclays offices with @banknovo @gocutover @7chordbd #fintech pic.twitter.com/BCSwpFptPo";;@banknovo @gocutover @7chordbd;#fintech;"999394155267870721";https://twitter.com/ThinkRiseNY/status/999394155267870721
ThinkRiseNY;2018-05-23 16:51;5;6;"So proud to see #barclayaccel alumni @banknovo @gocutover @7chordbd participating in the open innovation panel today at Barclays offices. pic.twitter.com/fJkOdY8fVG";;@banknovo @gocutover @7chordbd;#barclayaccel;"999392398924017665";https://twitter.com/ThinkRiseNY/status/999392398924017665
banknovo;2018-05-23 10:00;0;0;"Meet the speakers at The Europas, and get your ticket free (July 3, London) https:// buff.ly/2x7igRU";;;;"999288873405513728";https://twitter.com/banknovo/status/999288873405513728
banknovo;2018-05-17 10:00;0;1;"Monzo, the U.K. challenger bank, finally rolls out Apple Pay https:// buff.ly/2IpTim7";;;;"997114541761794049";https://twitter.com/banknovo/status/997114541761794049
banknovo;2018-05-16 10:00;0;0;"BRD crowdraises $32 million to build financial services into a mobile crypto wallet https:// buff.ly/2IhI3vL";;;;"996752165095002112";https://twitter.com/banknovo/status/996752165095002112
banknovo;2018-05-11 10:00;0;1;"Monzo, the U.K. challenger bank, now lets you pay ‘Nearby Friends’ https:// buff.ly/2jJF7td";;;;"994940251201327104";https://twitter.com/banknovo/status/994940251201327104
ThinkRiseGlobal;2018-05-10 15:13;0;1;"@banknovo speaking live at #TechDay in NYC, part of our #barclaysaccel cohort pic.twitter.com/hMvv1g6YnF";;@banknovo;#TechDay #barclaysaccel;"994656580212809728";https://twitter.com/ThinkRiseGlobal/status/994656580212809728
ThinkRiseNY;2018-05-10 13:26;0;4;"Check out our friends @banknovo on stage now at #techday http:// bit.ly/2G5Vadw pic.twitter.com/rUhPGf1WFx";;@banknovo;#techday;"994629728173731842";https://twitter.com/ThinkRiseNY/status/994629728173731842
banknovo;2018-05-10 10:00;0;0;"Online mortgage broker Trussle raises £13.6M Series B https:// buff.ly/2jKH9t0";;;;"994577935578394624";https://twitter.com/banknovo/status/994577935578394624
TechDayHQ;2018-05-09 17:00;1;3;"Be sure to meet the amazing companies part of @ThinkRiseNY ! @banknovo and @real_blocks";;@ThinkRiseNY @banknovo @real_blocks;;"994321200515092487";https://twitter.com/TechDayHQ/status/994321200515092487
banknovo;2018-05-09 10:00;0;1;"Brazil’s tech startups begin to expand globally https:// buff.ly/2KJeEZ0";;;;"994215525638115328";https://twitter.com/banknovo/status/994215525638115328
seb_tanner;2018-05-08 08:07;4;5;"We’ve got some exciting #Fintech startups demoing at #TechDay on Thurs: @Vacayo_Tech is a vacation rental management platform & just came out of the @500Startups program @banknovo is the first #AI powered bank for startups & just graduated from the #BarclaysAccel with @techstars";;@Vacayo_Tech @500Startups @banknovo @techstars;#Fintech #TechDay #AI #BarclaysAccel;"993824721522315265";https://twitter.com/seb_tanner/status/993824721522315265
banknovo;2018-05-02 10:00;0;1;"TransferWise founder Taavet Hinrikus invests in fintech chatbot Cleo https:// buff.ly/2r7rLu6";;;;"991678799602470912";https://twitter.com/banknovo/status/991678799602470912
LondonMathews;2018-05-01 15:07;0;0;"A business flow through account is a real thing, biggest underrated consideration. Business checking fees is real thing, biggest daily nuisance. @banknovo is a real thing, biggest entrepreneurial empowerment. #TechTuesday";;@banknovo;#TechTuesday;"991393810696548352";https://twitter.com/LondonMathews/status/991393810696548352
banknovo;2018-05-01 10:00;0;0;"SoFi founder Mike Cagney is back with a new startup and $50 million in funding, too https:// buff.ly/2FtfwNC";;;;"991316547749732354";https://twitter.com/banknovo/status/991316547749732354
banknovo;2018-04-28 10:00;0;1;"Meet 11 new startups launching out of the Entrepreneurs Roundtable Accelerator https:// buff.ly/2FiPAUW";;;;"990229161263489030";https://twitter.com/banknovo/status/990229161263489030
ThinkRiseNY;2018-04-27 14:19;3;5;"Don't forget to register for #TechDay to meet face to face with the NY startup scene. Proud to be the #FinTech sponsor! https:// techdayhq.com/new-york/regis ter … @ThinkRiseGlobal @real_blocks @banknovo @hellobrigitapp https:// twitter.com/techdayhq/stat us/989912327733612552 …";;@ThinkRiseGlobal @real_blocks @banknovo @hellobrigitapp;#TechDay #FinTech;"989932104011210752";https://twitter.com/ThinkRiseNY/status/989932104011210752
banknovo;2018-04-27 10:01;0;1;"Digital banking startup Revolut raises $250M at a valuation of $1.7B https:// buff.ly/2r5VOmX";;;;"989867050821718016";https://twitter.com/banknovo/status/989867050821718016
banknovo;2018-04-26 10:00;1;0;"Challenger bank Starling adds investment service Wealthify to its in-app marketplace https:// buff.ly/2KfW7n4";;;;"989504531334561792";https://twitter.com/banknovo/status/989504531334561792
banknovo;2018-04-25 10:00;0;1;"German insurance ‘robo-advisor’ Clark scores $29 million Series B https:// buff.ly/2qZ1EVZ";;;;"989142113437831169";https://twitter.com/banknovo/status/989142113437831169
banknovo;2018-04-24 10:00;0;0;"Indian lending platform Capital Float raises $22M Series C extension from Amazon https:// buff.ly/2JjfHNW";;;;"988779603354374145";https://twitter.com/banknovo/status/988779603354374145
banknovo;2018-04-22 10:00;0;0;"Special Report: New York’s enterprise infrastructure ecosystem https:// buff.ly/2F4RVCQ";;;;"988054959609479170";https://twitter.com/banknovo/status/988054959609479170
LondonMathews;2018-04-21 11:28;1;2;"All the subconscious entrepreneurs in America should use @banknovo . It’s future-oriented capital management. Couldn’t wait for #TechTuesday — passive income isn’t exclusive to weekdays.";;@banknovo;#TechTuesday;"987714673796681729";https://twitter.com/LondonMathews/status/987714673796681729
ThinkRiseNY;2018-04-18 20:56;8;8;"4 different big data journeys! Steph Carter moderating our Structuring #BigData panel with @ElsenInc @Yodlee @banknovo and @BarclaysIB #NYFinTechWeek - incredible turnout #HomeofFinTech pic.twitter.com/5NjnpV8gtp";;@ElsenInc @Yodlee @banknovo @BarclaysIB;#BigData #NYFinTechWeek #HomeofFinTech;"986770423659581440";https://twitter.com/ThinkRiseNY/status/986770423659581440
ThinkRiseNY;2018-04-18 20:47;2;3;"Learning about the wisdom pyramid from @banknovo #NYFinTechWeek pic.twitter.com/qNj5df3pWt";;@banknovo;#NYFinTechWeek;"986768141253578752";https://twitter.com/ThinkRiseNY/status/986768141253578752
TechDayHQ;2018-04-18 13:00;2;3;"One last chance to get a ticket for today's "Lets talk about: Big data" hosted by @ThinkRiseNY and with @ElsenInc and @banknovo ! RSVP here: https://www. eventbrite.com/e/lets-talk-ab out-structuring-big-data-tickets-44238917794 …";;@ThinkRiseNY @ElsenInc @banknovo;;"986650649566826496";https://twitter.com/TechDayHQ/status/986650649566826496
ThinkRiseNY;2018-04-17 12:01;1;1;"One last chance to get a ticket for tomorrows Lets talk about: Big data with @ElsenInc and @banknovo RSVP: http:// ow.ly/R4EW30jvV0w";;@ElsenInc @banknovo;;"986273359024488448";https://twitter.com/ThinkRiseNY/status/986273359024488448
banknovo;2018-04-17 10:00;0;1;"US early-stage investment share shrinks as China surges https:// buff.ly/2IZEJkN";;;;"986243081488994304";https://twitter.com/banknovo/status/986243081488994304
ThinkRiseNY;2018-04-16 14:55;0;1;"Get your ticket for Wednesdays Lets Talk About: Big Data with @ElsenInc @banknovo RSVP: http:// ow.ly/YITQ30jvUSJ";;@ElsenInc @banknovo;;"985954748401700864";https://twitter.com/ThinkRiseNY/status/985954748401700864
banknovo;2018-04-12 10:00;0;1;"Tandem adds fixed savings accounts https:// buff.ly/2IK3KAo";;;;"984431115506212865";https://twitter.com/banknovo/status/984431115506212865
banknovo;2018-04-11 10:00;0;1;"Liberis raises £57.5M to offer finance for small businesses paid back via customer card transactions https:// buff.ly/2HpXLBw";;;;"984068577237045248";https://twitter.com/banknovo/status/984068577237045248
LevanonAdi;2018-04-05 03:26;0;0;"I listened to the audio book. Loved every bit of it. Great great book!";;;;"981795191328821248";https://twitter.com/LevanonAdi/status/981795191328821248
andyellwood;2018-04-04 20:03;0;0;"The effort/talent is the biggest take away and 100% true";;;;"981683724248145921";https://twitter.com/andyellwood/status/981683724248145921
denishakuhlor;2018-04-04 10:16;0;1;"Amazing read. You’ll like it!";;;;"981535989872123904";https://twitter.com/denishakuhlor/status/981535989872123904
