username;date;retweets;favorites;text;geo;mentions;hashtags;id;permalink
banknovo;2017-09-20 10:01;0;0;"GoCardless, a fintech that makes recurring payments easy for subscription businesses, raises $22.5M https:// buff.ly/2xiQ8JI";;;;"910504222059384832";https://twitter.com/banknovo/status/910504222059384832
banknovo;2017-09-19 10:01;0;0;"Younited Credit raises $47.8 million for its crowdlending platform https:// buff.ly/2jFB7Nl";;;;"910141811741659138";https://twitter.com/banknovo/status/910141811741659138
banknovo;2017-09-16 10:00;0;0;"FutureFuel.io adds new features to make paying off student loans easier https:// buff.ly/2x9l7aV";;;;"909054282426732544";https://twitter.com/banknovo/status/909054282426732544
banknovo;2017-09-15 10:00;0;0;"CashShield raises $5.5 million to prevent credit card fraud https:// buff.ly/2jsH4wN";;;;"908692059665649664";https://twitter.com/banknovo/status/908692059665649664
banknovo;2017-09-14 10:01;0;0;"YayPay raises $5.3 million for its accounts receivable service https:// buff.ly/2x2fzPG";;;;"908329876113027072";https://twitter.com/banknovo/status/908329876113027072
banknovo;2017-09-11 10:00;0;0;"Bankin lets you save money on Yomoni https:// buff.ly/2w0tyGK";;;;"907242533583028225";https://twitter.com/banknovo/status/907242533583028225
banknovo;2017-09-01 10:00;0;0;"Dharma wants to let anyone borrow a small amount of cryptocurrency https:// buff.ly/2vMQmVp";;;;"903618604427603969";https://twitter.com/banknovo/status/903618604427603969
bbvaopentalent;2017-08-28 06:12;1;3;"Nuggets es una app de #blockchain para consumidores, una herramienta de verificación biométrica de movimientos #BBVAOpenTalent #GlobalTrends pic.twitter.com/12ZWNT3w8j";;;#blockchain #BBVAOpenTalent #GlobalTrends;"902111635011141632";https://twitter.com/bbvaopentalent/status/902111635011141632
banknovo;2017-08-25 10:00;0;0;"Mortgage technology provider Blend raised another $100 million led by Greylock https:// buff.ly/2wK4dzY";;;;"901081831042408448";https://twitter.com/banknovo/status/901081831042408448
banknovo;2017-08-22 10:00;0;0;"N26 now has 500,000 customers for its bank of the future https:// buff.ly/2vgcvuW";;;;"899994768364761088";https://twitter.com/banknovo/status/899994768364761088
nuggetsPAYandID;2017-08-21 10:06;0;3;"2/2... @cerebri , @banknovo & @biowatch1 - Look forward to meeting you all in Chicago next month #BBVAOpenTalent";;@cerebri @banknovo @biowatch1;#BBVAOpenTalent;"899633693920251904";https://twitter.com/nuggetsPAYandID/status/899633693920251904
banknovo;2017-08-21 10:00;0;0;"Taxes in the gig economy https:// buff.ly/2uVZBHl";;;;"899632222910779396";https://twitter.com/banknovo/status/899632222910779396
banknovo;2017-08-21 09:01;0;0;"“Why Barter, When you can Buy on Credit?” by @MVRangs https:// medium.com/p/why-barter-w hen-you-can-buy-on-credit-67bf99961f20 …";;@MVRangs;;"899617367893979136";https://twitter.com/banknovo/status/899617367893979136
banknovo;2017-08-18 10:01;0;0;"Original Tech helps banks offer better loan applications https:// buff.ly/2vN4gZ7";;;;"898545269947674625";https://twitter.com/banknovo/status/898545269947674625
banknovo;2017-08-15 10:00;0;0;"London fintech Tail is a cashback platform built on the promise of Open Banking https:// buff.ly/2w6QF18";;;;"897458085807226880";https://twitter.com/banknovo/status/897458085807226880
banknovo;2017-08-13 10:00;0;1;"Curve co-founder joins challenger bank Monzo as COO https:// buff.ly/2vLGoHG";;;;"896733233982955520";https://twitter.com/banknovo/status/896733233982955520
banknovo;2017-08-12 10:00;0;0;"PayPal to acquire Swift Financial to bolster small business lending https:// buff.ly/2vmHOHF";;;;"896370854078054400";https://twitter.com/banknovo/status/896370854078054400
banknovo;2017-08-11 10:00;0;0;"Glint is a stealthy London fintech startup that promises to turn gold into a ‘new global currency’ https:// buff.ly/2wwnUsw";;;;"896008542385295360";https://twitter.com/banknovo/status/896008542385295360
banknovo;2017-08-10 10:01;0;0;"Railsbank, a new fintech startup from founder of Currencycloud, raises $1.2M led by Firestartr https:// buff.ly/2wsOfHX";;;;"895646292495486979";https://twitter.com/banknovo/status/895646292495486979
banknovo;2017-08-09 10:00;0;0;"Lambda School aims to cash in by upskilling untapped talent https:// buff.ly/2vdDWc9";;;;"895283585879506944";https://twitter.com/banknovo/status/895283585879506944
banknovo;2017-08-08 10:00;0;0;"Digital bank Tandem to acquire banking arm of UK’s famous luxury department store Harrods https:// buff.ly/2vclIb7";;;;"894921214552092672";https://twitter.com/banknovo/status/894921214552092672
banknovo;2017-08-07 09:01;0;0;"“How Small Businesses Plug the Financial Gap” by @MVRangs https:// medium.com/p/how-small-bu sinesses-plug-the-financial-gap-f0a337777e4f …";;@MVRangs;;"894543906771259393";https://twitter.com/banknovo/status/894543906771259393
banknovo;2017-08-04 10:01;0;0;"Savings app Qapital now offers a checking account and debit card http:// buff.ly/2vszRBs";;;;"893471888013438976";https://twitter.com/banknovo/status/893471888013438976
banknovo;2017-08-03 10:00;0;0;"PAYFAZZ wants to build a network of distributed bank agents in Indonesia http:// buff.ly/2vwn7um";;;;"893109351342383105";https://twitter.com/banknovo/status/893109351342383105
banknovo;2017-08-01 10:00;0;0;"N26 partners with Auxmoney to offer credit to more customers http:// buff.ly/2ubzeYN";;;;"892384510029037569";https://twitter.com/banknovo/status/892384510029037569
banknovo;2017-07-31 10:00;0;0;"Revolut’s $5.3 million crowdfunding campaign is oversubscribed http:// buff.ly/2hf4ggU";;;;"892022161392771072";https://twitter.com/banknovo/status/892022161392771072
banknovo;2017-07-31 09:01;0;0;"“Following The Money” by @MVRangs https:// medium.com/p/following-th e-money-708509c3d7b8 …";;@MVRangs;;"892007191544254469";https://twitter.com/banknovo/status/892007191544254469
banknovo;2017-07-29 10:01;0;1;"Stripe acquires Payable to help on-demand businesses manage 1099 tax reporting http:// buff.ly/2uByMER";;;;"891297537654706176";https://twitter.com/banknovo/status/891297537654706176
banknovo;2017-07-28 10:01;0;0;"CPG investing platform CircleUp will now issue loans to help consumer brands grow http:// buff.ly/2uC7zSw";;;;"890935159826132992";https://twitter.com/banknovo/status/890935159826132992
banknovo;2017-07-27 10:08;0;0;"After raising $70M, Betterment expands financial advice to all users http:// buff.ly/2v7JOoC";;;;"890574604284178433";https://twitter.com/banknovo/status/890574604284178433
banknovo;2017-07-26 10:00;0;0;"Visa makes strategic investment in card processing startup Marqeta http:// buff.ly/2uBwcPc";;;;"890210328008634368";https://twitter.com/banknovo/status/890210328008634368
banknovo;2017-07-25 10:00;0;0;"Mobile banking startup Varo Money has applied for a bank charter http:// buff.ly/2uwDK5B";;;;"889847824967491584";https://twitter.com/banknovo/status/889847824967491584
banknovo;2017-07-24 09:26;0;0;"“Is Blockchain Going to be the Future of Finance?” by @MVRangs https:// medium.com/p/is-blockchai n-going-to-be-the-future-of-finance-751777fe27cb …";;@MVRangs;;"889476766041026560";https://twitter.com/banknovo/status/889476766041026560
banknovo;2017-07-21 09:02;0;0;"“The Exponential Growth of Millennial Small Business Owners — Oh My!” by @MVRangs https:// medium.com/p/the-exponent ial-growth-of-millennial-small-business-owners-oh-my-e7512fa4b885 …";;@MVRangs;;"888383685518667776";https://twitter.com/banknovo/status/888383685518667776
banknovo;2017-07-19 10:00;0;0;"Beginning this week, automated savings app Digit will start charging users $3 a month http:// buff.ly/2tkfbvo";;;;"887673582213627905";https://twitter.com/banknovo/status/887673582213627905
banknovo;2017-07-18 10:01;0;0;"Revolut launches personal Euro accounts with your own IBAN http:// buff.ly/2u10ZGm";;;;"887311269291839488";https://twitter.com/banknovo/status/887311269291839488
banknovo;2017-07-17 09:01;0;0;"I just published “Can Fintech Startups Replace Typical Financial Advisors?” https:// medium.com/p/can-fintech- startups-replace-typical-financial-advisors-a07b0b65e764 …";;;;"886933842313048064";https://twitter.com/banknovo/status/886933842313048064
banknovo;2017-07-14 09:01;0;0;"“‘Banking Is Under Attack’” by @MVRangs https:// medium.com/p/banking-is-u nder-attack-15cacaf67b45 …";;@MVRangs;;"885846744617144321";https://twitter.com/banknovo/status/885846744617144321
banknovo;2017-07-13 10:00;0;0;"Revolut raises $66 million for its global banking alternative http:// buff.ly/2uPW1L7";;;;"885499148493103106";https://twitter.com/banknovo/status/885499148493103106
banknovo;2017-07-12 10:00;0;0;"London fintech Curve closing in on $10M Series A http:// buff.ly/2tEBNp9";;;;"885136666486353920";https://twitter.com/banknovo/status/885136666486353920
banknovo;2017-07-10 09:04;0;0;"I just published “Fintech and the Services Sector” https:// medium.com/p/fintech-and- the-services-sector-caaf1d028f6f …";;;;"884398001627779072";https://twitter.com/banknovo/status/884398001627779072
banknovo;2017-07-05 10:00;0;0;"Qonto launches its digital bank accounts for small companies http:// buff.ly/2tplWck";;;;"882600134126841857";https://twitter.com/banknovo/status/882600134126841857
banknovo;2017-07-04 10:00;0;0;"Six months after acquisition, SoFi is shutting down Zenbanx http:// buff.ly/2tKcjbd";;;;"882237688602079232";https://twitter.com/banknovo/status/882237688602079232
banknovo;2017-07-03 09:04;0;1;"I just published “How Chatbots and AI Can Help You and Your Business” https:// medium.com/p/how-chatbots -and-ai-can-help-you-and-your-business-5737b33f768c …";;;;"881861239730823168";https://twitter.com/banknovo/status/881861239730823168
banknovo;2017-06-29 10:00;0;0;"LendUp gets strategic investment from PayPal and adds to its executive team http:// buff.ly/2tYvFpJ";;;;"880425657636966401";https://twitter.com/banknovo/status/880425657636966401
banknovo;2017-06-28 10:02;0;0;"Monese, the mobile current account banking app, expands to Europe http:// buff.ly/2ubJOiv";;;;"880063811427868672";https://twitter.com/banknovo/status/880063811427868672
banknovo;2017-06-27 10:00;0;0;"Plaid puts out a ‘request for startups’ in nine underserved fintech sectors http:// buff.ly/2tckJH2";;;;"879701064974561280";https://twitter.com/banknovo/status/879701064974561280
banknovo;2017-06-26 09:01;0;2;"I just published “Is Regtech the New Fintech?” https:// medium.com/p/is-regtech-t he-new-fintech-8de08428629f …";;;;"879323623173050368";https://twitter.com/banknovo/status/879323623173050368
banknovo;2017-06-22 10:00;0;0;"TrueLayer raises $3M Series A to provide fintech companies with easy access to bank APIs http:// buff.ly/2trWz94";;;;"877888981106642945";https://twitter.com/banknovo/status/877888981106642945
banknovo;2017-06-21 10:00;0;0;"Soldo, a London fintech startup that offers a multi-user spending account, raises $11M led by Accel http:// buff.ly/2tLqFUp";;;;"877526523670138880";https://twitter.com/banknovo/status/877526523670138880
banknovo;2017-06-20 10:00;0;0;"AimBrain, a startup that uses biometric authentication to fight fintech fraud, raises £4M Series A http:// buff.ly/2sMHiTj";;;;"877164263814688768";https://twitter.com/banknovo/status/877164263814688768
FlexibilityARG;2017-06-19 12:51;1;2;"“Millennials and Fintech” — @banknovo https:// medium.com/banknovo/mille nnials-and-fintech-2abd3609da79 …";;@banknovo;;"876844981960540161";https://twitter.com/FlexibilityARG/status/876844981960540161
banknovo;2017-06-19 09:01;0;1;"I just published “Millennials and Fintech” https:// medium.com/p/millennials- and-fintech-2abd3609da79 …";;;;"876786901755318274";https://twitter.com/banknovo/status/876786901755318274
banknovo;2017-06-16 10:01;0;0;"Monese adds Direct Debits to become even more like a regular bank account http:// buff.ly/2tuaESU";;;;"875714914303844353";https://twitter.com/banknovo/status/875714914303844353
banknovo;2017-06-14 09:01;0;1;"“Can Industries Avoid Technology Disruption?” by @MVRangs https:// medium.com/p/can-industri es-avoid-technology-disruption-8e8393e93236 …";;@MVRangs;;"874975143306690560";https://twitter.com/banknovo/status/874975143306690560
hasjob;2017-06-13 17:09;0;0;"Content Writer https:// hasjob.co/banknovo.com/y 910r … #Anywhere @banknovo";;@banknovo;#Anywhere;"874735580042600448";https://twitter.com/hasjob/status/874735580042600448
hasjob;2017-06-13 17:09;0;0;"Senior iOS Developer (Remote / Ahmedabad) https:// hasjob.co/banknovo.com/5 aq3m … #Anywhere @banknovo";;@banknovo;#Anywhere;"874735568692723712";https://twitter.com/hasjob/status/874735568692723712
banknovo;2017-06-13 10:01;0;0;"Revolut launches business accounts in U.K. and Europe http:// buff.ly/2tgdVow";;;;"874627732889628673";https://twitter.com/banknovo/status/874627732889628673
banknovo;2017-06-12 09:03;0;1;"I just published “Role of AI in Financial Services” https:// medium.com/p/role-of-ai-i n-financial-services-1e50521b5f2e …";;;;"874250741334122496";https://twitter.com/banknovo/status/874250741334122496
banknovo;2017-06-09 10:00;0;0;"Revolut takes venture debt from Triplepoint Capital before ‘impending large equity round’ http:// buff.ly/2rQyLLR";;;;"873178084643622912";https://twitter.com/banknovo/status/873178084643622912
banknovo;2017-05-22 10:00;0;0;"Plum bets on Facebook Messenger as the place to manage your finances http:// buff.ly/2rHn2yJ";;;;"866654889753051136";https://twitter.com/banknovo/status/866654889753051136
banknovo;2017-05-20 10:00;0;0;"A new era for startup investing in Latin America http:// buff.ly/2rzU580";;;;"865930295656296448";https://twitter.com/banknovo/status/865930295656296448
banknovo;2017-05-18 10:01;0;0;"Fintech unicorn TransferWise reaches profitability, planning ‘new financial services’ http:// buff.ly/2roqcXU";;;;"865205608282238976";https://twitter.com/banknovo/status/865205608282238976
banknovo;2017-05-17 10:00;0;0;"CreditHero wants to help fix credit scores for those afraid to even look http:// buff.ly/2pQCPsO";;;;"864842983023276033";https://twitter.com/banknovo/status/864842983023276033
banknovo;2017-05-16 10:00;0;0;"NuCypher is using proxy re-encryption to lift more enterprise big data into the cloud http:// buff.ly/2rjIhq2";;;;"864480591340818432";https://twitter.com/banknovo/status/864480591340818432
banknovo;2017-04-29 10:00;0;0;"Plug and Play launches a fintech accelerator in Paris http:// buff.ly/2oTDxWw";;;;"858320025572319232";https://twitter.com/banknovo/status/858320025572319232
banknovo;2017-04-24 10:00;0;0;"Flux, a fintech startup founded by ex-Revolut employees, wants to make paper receipts obsolete http:// buff.ly/2pVs5L2";;;;"856508207136727044";https://twitter.com/banknovo/status/856508207136727044
banknovo;2017-04-13 10:00;0;0;"Chip’s new chatbot app points the way to ‘plugin banking’ http:// buff.ly/2p8MKLa";;;;"852521793881595905";https://twitter.com/banknovo/status/852521793881595905
banknovo;2017-04-07 10:00;0;0;"Meniga helps incumbent banks keep fintech fear at bay http:// buff.ly/2oHMMNg";;;;"850347529535455233";https://twitter.com/banknovo/status/850347529535455233
banknovo;2017-04-06 10:00;0;0;"BNP Paribas acquires Compte Nickel http:// buff.ly/2p16AqS";;;;"849985179036856320";https://twitter.com/banknovo/status/849985179036856320
banknovo;2017-04-05 10:01;0;1;"Money transfer startup Azimo now lets you send money to a phone number http:// buff.ly/2nY9hMn";;;;"849622999783407624";https://twitter.com/banknovo/status/849622999783407624
banknovo;2017-04-04 10:01;0;0;"Iyzico, a Turkish online payments company and potential Stripe competitor, closes $15M Series C http:// buff.ly/2nBPpvY";;;;"849260537909313536";https://twitter.com/banknovo/status/849260537909313536
banknovo;2017-03-25 10:00;0;0;"What do you want to ask SoFi CEO Mike Cagney at Disrupt NY? http:// buff.ly/2neTbvN";;;;"845636559823101956";https://twitter.com/banknovo/status/845636559823101956
banknovo;2017-03-24 10:00;0;1;"Revolut launches a premium subscription and starts raising a new round http:// buff.ly/2mVyUtf";;;;"845274011542130689";https://twitter.com/banknovo/status/845274011542130689
banknovo;2017-03-17 10:01;0;0;"Starling Bank, a digital-only UK challenger bank, launches beta http:// buff.ly/2mM5jnS";;;;"842737569653768192";https://twitter.com/banknovo/status/842737569653768192
banknovo;2017-03-16 10:01;0;0;"N26 now has 300,000 customers and adds 1,000 users per day http:// buff.ly/2n9ssTI";;;;"842375173391167488";https://twitter.com/banknovo/status/842375173391167488
banknovo;2017-03-15 10:01;0;0;"Revolut users can now apply for credit in just a few minutes http:// buff.ly/2mnLRMl";;;;"842012787710779392";https://twitter.com/banknovo/status/842012787710779392
banknovo;2017-02-17 10:00;0;0;"Listen to Monzo founder on building a ‘smart’ bank, fintech bubble, and turning down acquisition offer http:// buff.ly/2m0UNHu";;;;"832605525321854978";https://twitter.com/banknovo/status/832605525321854978
banknovo;2017-02-15 10:01;0;1;"Pleo, a startup that offers a card and app to manage company expenses, gets backing from Creandum http:// buff.ly/2kp16Ze";;;;"831881104915316737";https://twitter.com/banknovo/status/831881104915316737
banknovo;2017-02-14 10:00;0;0;"London fintech Soldo launches multi-user expense account for businesses http:// buff.ly/2lKNK6B";;;;"831518484391665664";https://twitter.com/banknovo/status/831518484391665664
banknovo;2017-02-02 10:00;0;0;"Yomoni raises $5.4 million for its automated portfolio management service http:// buff.ly/2jZ3Haq";;;;"827169728577884160";https://twitter.com/banknovo/status/827169728577884160
banknovo;2017-02-01 10:01;0;0;"Qvivr raises $5M to move beyond its all-in-one credit card http:// buff.ly/2kQTuKF";;;;"826807643331235840";https://twitter.com/banknovo/status/826807643331235840
banknovo;2017-01-25 10:01;1;0;"Skype’s Niklas Zennström backs London fintech startup Cleo http:// buff.ly/2jYEFbK";;;;"824270972375224320";https://twitter.com/banknovo/status/824270972375224320
banknovo;2017-01-17 10:00;0;0;"Revolut lets you split bills in a few taps http:// buff.ly/2jFu9DT";;;;"821371617116819458";https://twitter.com/banknovo/status/821371617116819458
banknovo;2017-01-12 10:00;0;0;"Curve adds instant cashback to mobile wallet and all-your-cards-in-one app http:// buff.ly/2jbma3X";;;;"819559806314905601";https://twitter.com/banknovo/status/819559806314905601
banknovo;2017-01-03 10:00;0;0;"Monese raises $10M Series A for its banking app targeting immigrants and expats http:// buff.ly/2iugtxu";;;;"816298138382270464";https://twitter.com/banknovo/status/816298138382270464
banknovo;2016-12-25 14:30;0;1;"Thank you! -- "Sylvester Kaczmarek ( @sjkaczmarek ) liked one of your Tweets!"";;@sjkaczmarek;;"813104749717450752";https://twitter.com/banknovo/status/813104749717450752
banknovo;2016-12-20 22:41;0;0;"Thank you! -- "Linda Bomba ( @lmb318 ) is now following you on Twitter!"";;@lmb318;;"811416167718023168";https://twitter.com/banknovo/status/811416167718023168
banknovo;2016-12-20 15:46;0;0;"Thank you! -- "Carlos Buendía ( @buendiadas ) liked one of your Tweets!"";;@buendiadas;;"811311775614377989";https://twitter.com/banknovo/status/811311775614377989
banknovo;2016-12-20 15:36;0;1;"Thank you! -- "FinTech 50 ( @TheFinTech50 ) liked one of your Tweets!"";;@TheFinTech50;;"811309371997167616";https://twitter.com/banknovo/status/811309371997167616
banknovo;2016-12-19 10:00;0;0;"WTF is Brexit? http:// buff.ly/2hyBFlj";;;;"810862404133330945";https://twitter.com/banknovo/status/810862404133330945
banknovo;2016-12-19 06:26;0;0;"Thank you! -- "Seair Exim Solutions ( @seairexim ) is now following you on Twitter!"";;@seairexim;;"810808475706163201";https://twitter.com/banknovo/status/810808475706163201
banknovo;2016-12-17 20:39;0;0;"Thank you! -- "Warren Whitlock ( @WarrenWhitlock ) is now following you on Twitter!"";;@WarrenWhitlock;;"810298308480630784";https://twitter.com/banknovo/status/810298308480630784
banknovo;2016-12-17 12:10;0;0;"Thank you! -- "Roger James Hamilton ( @rogerhamilton ) is now following you on Twitter!"";;@rogerhamilton;;"810170229372358657";https://twitter.com/banknovo/status/810170229372358657
banknovo;2016-12-16 22:04;0;0;"Thank you! -- "Yodlee Developer ( @YIDeveloper ) is now following you on Twitter!"";;@YIDeveloper;;"809957368566022144";https://twitter.com/banknovo/status/809957368566022144
banknovo;2016-12-16 17:59;0;0;"Thank you! -- "Joynture ( @Joynture ) is now following you on Twitter!"";;@Joynture;;"809895727489019904";https://twitter.com/banknovo/status/809895727489019904
banknovo;2016-12-16 13:49;0;0;"Thank you! -- "Ray Akers ( @its_rakers ) is now following you on Twitter!"";;@its_rakers;;"809832913411907584";https://twitter.com/banknovo/status/809832913411907584
banknovo;2016-12-16 10:59;0;0;"Thank you! -- "SocialMediaBizAgency (@Dave_B_Agency) retweeted your Tweet!"";;@Dave_B_Agency;;"809790082018377728";https://twitter.com/banknovo/status/809790082018377728
banknovo;2016-12-16 10:00;1;0;"London fintech startup Curve brings mobile wallet and all-your-cards-in-one app to Android http:// buff.ly/2gSCF31";;;;"809775086857232385";https://twitter.com/banknovo/status/809775086857232385
banknovo;2016-12-15 18:59;0;0;"Thank you! -- "YPC Group ( @YPCGroup ) is now following you on Twitter!"";;@YPCGroup;;"809548407966695424";https://twitter.com/banknovo/status/809548407966695424
banknovo;2016-12-15 10:00;0;0;"Brexit transition period vital to avoid UK fintech exodus, warns Lords report http:// buff.ly/2hzBzb6";;;;"809412847725899777";https://twitter.com/banknovo/status/809412847725899777
banknovo;2016-12-14 14:06;0;0;"Hey Sylvester Kaczmarek thanks for the follow!";;;;"809112285616766976";https://twitter.com/banknovo/status/809112285616766976
banknovo;2016-12-14 14:03;0;1;"Thank you! -- "Sylvester Kaczmarek ( @sjkaczmarek ) is now following you on Twitter!"";;@sjkaczmarek;;"809111599285993472";https://twitter.com/banknovo/status/809111599285993472
banknovo;2016-12-14 08:36;0;0;"Hey Twassistant thanks for the follow!";;;;"809029331540475904";https://twitter.com/banknovo/status/809029331540475904
banknovo;2016-12-12 23:07;0;0;"Hey RebuildRepairCredit thanks for the follow!";;;;"808523639108857857";https://twitter.com/banknovo/status/808523639108857857
banknovo;2016-12-12 01:51;0;0;"Hey Saurav Tomar thanks for the follow!";;;;"808202554677096448";https://twitter.com/banknovo/status/808202554677096448
banknovo;2016-12-12 01:48;0;0;"Thank you! -- "Saurav Tomar (@sauravtom) is now following you on Twitter!"";;@sauravtom;;"808201756949757954";https://twitter.com/banknovo/status/808201756949757954
banknovo;2016-12-11 23:21;1;0;"Hey BruceWayne128 thanks for the follow!";;;;"808164918658760704";https://twitter.com/banknovo/status/808164918658760704
banknovo;2016-12-10 03:51;0;0;"Hey Cooee Visual thanks for the follow!";;;;"807507936478109696";https://twitter.com/banknovo/status/807507936478109696
banknovo;2016-12-10 03:36;0;0;"Hey Cooee Creative thanks for the follow!";;;;"807504178050371584";https://twitter.com/banknovo/status/807504178050371584
banknovo;2016-12-10 03:06;0;0;"Hey Justin Cross thanks for the follow!";;;;"807496680652369921";https://twitter.com/banknovo/status/807496680652369921
banknovo;2016-12-10 03:03;0;0;"Thank you! -- "Justin Cross (@JCrossComedy) is now following you on Twitter!"";;@JCrossComedy;;"807495865862647808";https://twitter.com/banknovo/status/807495865862647808
banknovo;2016-12-09 22:36;0;0;"Hey Eduardo Perez thanks for the follow!";;;;"807428799583371264";https://twitter.com/banknovo/status/807428799583371264
banknovo;2016-10-05 10:00;0;2;"Product confidence is key to crowdfunding. http:// buff.ly/2dnrv3i pic.twitter.com/3eO8xmAISo";;;;"783668080329236482";https://twitter.com/banknovo/status/783668080329236482
banknovo;2016-10-04 10:00;0;0;"FinTech: Evolution or Revolution? http:// buff.ly/2a5fUCf";;;;"783305675061522432";https://twitter.com/banknovo/status/783305675061522432
banknovo;2016-10-03 10:00;0;0;"Crowdfunded property investment is gaining traction http:// buff.ly/2dw5qS5";;;;"782943346243280896";https://twitter.com/banknovo/status/782943346243280896
banknovo;2016-09-27 10:01;0;1;"Other countries are taking drastic steps to defend against cyber crimes. Russia demands encryption keys. http:// buff.ly/2cQn2qq pic.twitter.com/cYdCrCYuXi";;;;"780769254647930882";https://twitter.com/banknovo/status/780769254647930882
banknovo;2016-09-26 10:00;0;0;"The European Central Bank taking steps to fight fraud. http:// buff.ly/2cLgh7n pic.twitter.com/GIUW8TiVlF";;;;"780406610996891649";https://twitter.com/banknovo/status/780406610996891649
banknovo;2016-09-25 10:00;0;0;"Amazing breakthroughs in tech-based treatments. http:// buff.ly/2cQmFfC pic.twitter.com/7EnpWQixYe";;;;"780044219566227456";https://twitter.com/banknovo/status/780044219566227456
banknovo;2016-09-24 10:00;0;1;"Research And Markets Finds Connected Home Market Growing http:// buff.ly/2cSVjsc";;;;"779681869453463552";https://twitter.com/banknovo/status/779681869453463552
banknovo;2016-09-23 10:00;0;0;"Bitcoin Is Currency Now. Or Not. Or Yes? http:// buff.ly/2cPIHlY";;;;"779319637112676354";https://twitter.com/banknovo/status/779319637112676354
banknovo;2016-09-19 15:26;0;0;"Some insight on BlockChain https:// twitter.com/fintechna/stat us/777949302295494656 …";;;;"777951925476036608";https://twitter.com/banknovo/status/777951925476036608
banknovo;2016-09-13 16:41;0;0;"@TatianasBlog , vote for CLEAR as the WILDCARD at #tcdisrupt . CLEAR = AI + Credit Card #ai";;@TatianasBlog;#tcdisrupt #ai;"775796610802458629";https://twitter.com/banknovo/status/775796610802458629
banknovo;2016-09-13 16:41;0;0;"@prokopsky , vote for CLEAR as the WILDCARD at #tcdisrupt . CLEAR = AI + Credit Card #ai";;@prokopsky;#tcdisrupt #ai;"775796543613915136";https://twitter.com/banknovo/status/775796543613915136
