username;date;retweets;favorites;text;geo;mentions;hashtags;id;permalink
jordimollietee;2017-03-31 14:23;0;1;"Thanks for that. Enjoy your 9 new savers!";;;;"847876990975848449";https://twitter.com/jordimollietee/status/847876990975848449
withplum;2017-03-31 14:20;0;0;"Hi Jordann, sorry about the delay, should be with you now! Thanks for inviting!";;;;"847876266325934081";https://twitter.com/withplum/status/847876266325934081
jordimollietee;2017-03-31 14:00;0;0;"@withplum hi guys, how long does it take for invite money to hit your plum account? I had a few people sign up last night but no money yet";;@withplum;;"847871128592932864";https://twitter.com/jordimollietee/status/847871128592932864
withplum;2017-03-31 10:32;0;0;"Hi Reece, give your invite link to 3 friends and when they complete registration as a Plum user you will get £25 added to your Plum savings";;;;"847818994170114053";https://twitter.com/withplum/status/847818994170114053
reecelyonssound;2017-03-31 10:30;0;0;"@withplum How does the invite a friend work guys?";;@withplum;;"847818269549625345";https://twitter.com/reecelyonssound/status/847818269549625345
dannypolicarpo;2017-03-29 07:01;0;0;"don't worry already figured that one out but then the double messages are bit of an annoyance. pic.twitter.com/tsZcaqPFBx";;;;"847041094445600768";https://twitter.com/dannypolicarpo/status/847041094445600768
withplum;2017-03-29 06:36;0;0;"Catch Plum in the @Independent 6 ways to save money without even trying #savings http:// ind.pn/2o6sFaF pic.twitter.com/s2rzr3uIaS";;@Independent;#savings;"847034672974614528";https://twitter.com/withplum/status/847034672974614528
withplum;2017-03-29 06:32;0;0;"Single user goal coming soon! In the meantime, a hack is to invite yourself & contribute 50% - shh didn't hear it from me";;;;"847033631524687872";https://twitter.com/withplum/status/847033631524687872
dannypolicarpo;2017-03-28 09:49;0;0;"is there a way to create a non joint goal, so single user goal? I only see joint option in commands.";;;;"846720960107565056";https://twitter.com/dannypolicarpo/status/846720960107565056
dannypolicarpo;2017-03-28 04:54;0;0;"ah not to worry was hoping for a sneak peak but I'll hold out";;;;"846646577011810304";https://twitter.com/dannypolicarpo/status/846646577011810304
withplum;2017-03-28 04:53;0;0;"Hi Danny, we're not quite ready just yet, sorry - won't be long!";;;;"846646354915020800";https://twitter.com/withplum/status/846646354915020800
dannypolicarpo;2017-03-27 17:00;0;0;"hi never got an email with early access info, any chance I can still test this out?";;;;"846466889484304384";https://twitter.com/dannypolicarpo/status/846466889484304384
withplum;2017-03-27 06:00;0;1;"Money can be stressful, here's our 5 steps that just might help http:// bit.ly/2n9cyWn pic.twitter.com/DLJxkT48il";;;;"846300926000451584";https://twitter.com/withplum/status/846300926000451584
withplum;2017-03-24 14:12;0;0;"We're seeing higher error rates during bank account linking due to instability of one of our providers. Working towards a swift solution!";;;;"845337476436840448";https://twitter.com/withplum/status/845337476436840448
intoruth;2017-03-23 18:34;0;1;"Nice little notification from @withplum letting me know 3 people have used my referral link. £25 for the weekend https:// friends.withplum.com/r/FHLcmw";;@withplum;;"845041041560518656";https://twitter.com/intoruth/status/845041041560518656
withplum;2017-03-23 11:55;0;0;"Who said you only had to talk about money #withplum ? pic.twitter.com/QThkSjKWAz";;;#withplum;"844940745723314176";https://twitter.com/withplum/status/844940745723314176
catovitch;2017-03-23 08:40;0;2;"No Hugh Street banks but there is a Comfort Inn, pub and coffee shop on each corner. pic.twitter.com/KTTmXJCJXX";;;;"844891539595767812";https://twitter.com/catovitch/status/844891539595767812
catovitch;2017-03-23 08:33;0;0;"So you'd only lose money if the whole thing went bust?";;;;"844889748988710913";https://twitter.com/catovitch/status/844889748988710913
catovitch;2017-03-23 08:31;0;0;"Are they making people take on individuals' risk instead of aggregate risk? WTF?";;;;"844889366648537088";https://twitter.com/catovitch/status/844889366648537088
withplum;2017-03-23 05:37;0;0;"Thank you Holly! Great write up and thrilled to be featured :) Congrats on your savings too!";;;;"844845628869914624";https://twitter.com/withplum/status/844845628869914624
chainbear;2017-03-23 05:08;0;0;"Thanks for shouting about this last week; I've been using it ever since";;;;"844838350557143040";https://twitter.com/chainbear/status/844838350557143040
joeAlane;2017-03-21 10:12;0;1;"I'm doing some #fintech saving app/website trials so far got @moneyboxteam , Chip, @withplum , @Swaveme - any more for any more?";;@moneyboxteam @withplum @Swaveme;#fintech;"844190000774365184";https://twitter.com/joeAlane/status/844190000774365184
a_strzalek;2017-03-21 07:54;4;9;"Congrats @parcelly @withplum @RevolutApp for making the Startup Tech Company of the Year shortlist at the #NationalTechAwards";;@parcelly @withplum @RevolutApp;#NationalTechAwards;"844155274185396225";https://twitter.com/a_strzalek/status/844155274185396225
withplum;2017-03-20 17:47;0;1;"Finding it hard to save up? Maybe you should be trying these more wacky methods http:// bit.ly/2nVK2au pic.twitter.com/0xuLg8tjrS";;;;"843941979008438272";https://twitter.com/withplum/status/843941979008438272
yourmindco;2017-03-20 17:03;2;1;"Do you find #money #stressful ? Check out our tips to find money-related stress at bay on the @withplum blog! https:// twitter.com/withplum/statu s/843142725834850306 …";;@withplum;#money #stressful;"843930929626267652";https://twitter.com/yourmindco/status/843930929626267652
tomasquith93;2017-03-20 14:20;0;0;"thanks";;;;"843889975112404993";https://twitter.com/tomasquith93/status/843889975112404993
withplum;2017-03-20 12:47;0;0;"What's new with you? We have a new team member and new merchandise for our customers! https://www. facebook.com/withplum/posts /694710254036366 …";;;;"843866595760005121";https://twitter.com/withplum/status/843866595760005121
withplum;2017-03-20 12:43;0;1;"Plum generating more conversation around saving money with @MoneySavingExp https:// twitter.com/MoneySavingExp /status/842342690222145536 …";;@MoneySavingExp;;"843865661176774656";https://twitter.com/withplum/status/843865661176774656
areej_abuali;2017-03-20 09:27;1;1;"I've been using it for a few months and its AWESOME!";;;;"843816258999074816";https://twitter.com/areej_abuali/status/843816258999074816
withplum;2017-03-20 06:44;0;0;"Hi Tom, will add you to our invite list. You will hear from us shortly!";;;;"843775258431832064";https://twitter.com/withplum/status/843775258431832064
withplum;2017-03-20 06:24;0;1;"Congratulations to our competition winner Ray, who is going to see Drake tonight at the O2!";;;;"843770087769362432";https://twitter.com/withplum/status/843770087769362432
spoonersean;2017-03-19 20:34;0;3;"Just started using @withplum — first experience with a Messenger Bot, actually so good. https:// friends.withplum.com/r/hECQ42";;@withplum;;"843621731344506882";https://twitter.com/spoonersean/status/843621731344506882
JamesSLock;2017-03-19 15:39;0;2;"Then for smaller savings @withplum & @moneyboxteam are great options.";;@withplum @moneyboxteam;;"843547379324338176";https://twitter.com/JamesSLock/status/843547379324338176
amberullah;2017-03-19 08:24;0;0;"@withplum hey can you follow me, I got a question to ask!";;@withplum;;"843438067180601344";https://twitter.com/amberullah/status/843438067180601344
tomasquith93;2017-03-19 06:30;0;1;"@withplum hello! I've just started using plum and love it so far! Any chance of an invite to the investing beta please?";;@withplum;;"843409330032594944";https://twitter.com/tomasquith93/status/843409330032594944
withplum;2017-03-19 05:39;0;0;"that is right! We aim to have an impact on #savings and #fintech";;;#savings #fintech;"843396517033578496";https://twitter.com/withplum/status/843396517033578496
withplum;2017-03-18 12:51;0;2;"We've listed our 5 top tips to keep on top of money-related #stress with help from @yourmindco http:// bit.ly/2nzKYCh #DigALittleDeeper pic.twitter.com/VdA7BLrf1n";;@yourmindco;#stress #DigALittleDeeper;"843142725834850306";https://twitter.com/withplum/status/843142725834850306
withplum;2017-03-18 07:00;0;0;"#Chatbots are taking over! See our favourite 8 here, including Donald #Trump http:// bit.ly/2mWmX9T pic.twitter.com/cMXFGnGJfr";;;#Chatbots #Trump;"843054499640098821";https://twitter.com/withplum/status/843054499640098821
withplum;2017-03-18 03:35;0;0;"Learn more about how our UK #banking system really works http:// bit.ly/2mPXhKI pic.twitter.com/Spn2eXqFnC";;;#banking;"843002791094304769";https://twitter.com/withplum/status/843002791094304769
withplum;2017-03-18 02:25;0;1;"See our 6 tips for the busy #Londoner on how to save money http:// bit.ly/2n5nbfG pic.twitter.com/o5jXR9IUb1";;;#Londoner;"842985176586244096";https://twitter.com/withplum/status/842985176586244096
withplum;2017-03-17 17:47;0;0;"Win 2 tickets to #Drake at the O2, super giveaway from your little savings buddy! http:// bit.ly/2mWboj0 pic.twitter.com/6SlB1q092a";;;#Drake;"842854833782767617";https://twitter.com/withplum/status/842854833782767617
withplum;2017-03-17 09:58;1;1;"We've listed our 5 top tips to keep on top of money-related #stress with help from @yourmindco http:// bit.ly/2nvi2ys #DigALittleDeeper pic.twitter.com/XBTVSdUpWP";;@yourmindco;#stress #DigALittleDeeper;"842736905888452608";https://twitter.com/withplum/status/842736905888452608
withplum;2017-03-17 07:01;0;1;"Finding it hard to save up? Maybe you should be trying these more wacky methods http:// bit.ly/2nj8S7V pic.twitter.com/QJ2IpHVcQg";;;;"842692273863344129";https://twitter.com/withplum/status/842692273863344129
withplum;2017-03-17 06:00;1;0;"Great #oneplumsong cover entered into our #Drake competition. More info here: https:// blog.withplum.com/win-2-tickets- to-drake-from-plum-bb45d6ff2fdc … https://www. youtube.com/watch?v=pZMqKq Ydaas …";;;#oneplumsong #Drake;"842677032224022528";https://twitter.com/withplum/status/842677032224022528
withplum;2017-03-17 05:56;0;0;"Hi Reece, Plum saves for you every few days but you can increase your savings by cranking up the "Mood" in the commands menu";;;;"842675956657639425";https://twitter.com/withplum/status/842675956657639425
reecelyonssound;2017-03-17 04:20;0;0;"@withplum hey guys is there a way to get plum to save more often?";;@withplum;;"842651915855060993";https://twitter.com/reecelyonssound/status/842651915855060993
withplum;2017-03-17 03:35;0;0;""If AI can help people do things like develop a savings habit, it's a useful development." Thanks @MoneyAOL #fintech http:// bit.ly/2mIoCA1";;@MoneyAOL;#fintech;"842640398422081536";https://twitter.com/withplum/status/842640398422081536
withplum;2017-03-16 17:47;0;0;"Win 2 tickets to #Drake at the O2, super giveaway from your little savings buddy! http:// bit.ly/2mnyYBN pic.twitter.com/W0vYdcPQG1";;;#Drake;"842492427986505728";https://twitter.com/withplum/status/842492427986505728
withplum;2017-03-16 07:00;1;1;"Have you heard of these FinTech start-ups helping you control your finances? http:// bit.ly/2nsonHz pic.twitter.com/vqVKSCujvz";;;;"842329749997387776";https://twitter.com/withplum/status/842329749997387776
dannypolicarpo;2017-03-16 06:07;1;1;"awesome thanks. I've been testing commands over past few weeks and getting my head around how Plum works. Great idea";;;;"842316494629400577";https://twitter.com/dannypolicarpo/status/842316494629400577
withplum;2017-03-16 06:04;0;0;"Hi Danny, will add you to the early access list right away! We will email you in due course";;;;"842315704137326592";https://twitter.com/withplum/status/842315704137326592
dannypolicarpo;2017-03-16 05:56;0;0;"@withplum hi is it possible to gain early access to the ratesetter invest functionality of my account.";;@withplum;;"842313727546400768";https://twitter.com/dannypolicarpo/status/842313727546400768
withplum;2017-03-16 03:35;0;0;"Finding it hard to save up? Maybe you should be trying these more wacky methods http:// bit.ly/2nnGNMZ pic.twitter.com/6q307b8NS6";;;;"842278028390608896";https://twitter.com/withplum/status/842278028390608896
UKDigitalJobsUK;2017-03-15 23:00;1;0;"#Growth Lead job at @withplum - London http:// ow.ly/b2I2309EXml";;@withplum;#Growth;"842208992696909824";https://twitter.com/UKDigitalJobsUK/status/842208992696909824
withplum;2017-03-15 17:47;0;1;"Win 2 tickets to #Drake at the O2, super giveaway from your little savings buddy! http:// bit.ly/2m0C9UJ pic.twitter.com/DaniomcCkM";;;#Drake;"842130074874830853";https://twitter.com/withplum/status/842130074874830853
Matt_The_Human;2017-03-15 16:38;0;0;"@withplum Says I have more steps to complete. Then tells me "Awesome! You're all set up." Then won't let me input my sort code to confirm.";;@withplum;;"842112888072474624";https://twitter.com/Matt_The_Human/status/842112888072474624
withplum;2017-03-15 12:51;0;0;"Learn more about how our UK #banking system really works http:// bit.ly/2njoUik pic.twitter.com/VKNRLwZ7zJ";;;#banking;"842055554948321280";https://twitter.com/withplum/status/842055554948321280
a_strzalek;2017-03-15 11:38;3;4;"Congrats @payvision @withplum @TransferMate @VocaLink for making the Financial Technology of the Year shortlist at the #NationalTechAwards";;@payvision @withplum @TransferMate @VocaLink;#NationalTechAwards;"842037388952113152";https://twitter.com/a_strzalek/status/842037388952113152
landbookgallery;2017-03-15 09:06;1;3;"Really good #landingpage by @withplum http:// buff.ly/2mrNWHX pic.twitter.com/AgCSAv0LNr";;@withplum;#landingpage;"841998933010317314";https://twitter.com/landbookgallery/status/841998933010317314
withplum;2017-03-15 07:52;0;0;"@mrjamesob : This Should Be The UK's Biggest Scandal @LBC http:// shr.gs/o4oIMvC This is why Plum is here to help!";;@mrjamesob @LBC;;"841980453968072704";https://twitter.com/withplum/status/841980453968072704
withplum;2017-03-15 07:00;0;0;"We recognise the connection between your personal finance and your mental health, read all about it here http:// bit.ly/2mnuuvb pic.twitter.com/VpD1NwJJxV";;;;"841967437742538753";https://twitter.com/withplum/status/841967437742538753
withplum;2017-03-15 06:37;0;0;"Thanks Paul! We've now partnered w/RateSetter so you can push savings to P2P lending. In future we will do more like you say!";;;;"841961638156730368";https://twitter.com/withplum/status/841961638156730368
paul_r_fisher;2017-03-15 06:26;0;0;"Very cool FinBot @withplum . Do you have a way to automate putting savings I generate withplum into an separate ISA (cash/stocks n' shares)?";;@withplum;;"841958660481921024";https://twitter.com/paul_r_fisher/status/841958660481921024
intoruth;2017-03-15 05:08;1;1;"Just hit the £40 mark @withplum - saving without thinking, and you can too: https:// friends.withplum.com/r/FHLcmw";;@withplum;;"841939045060120576";https://twitter.com/intoruth/status/841939045060120576
withplum;2017-03-15 03:35;0;2;"#Chatbots are taking over! See our favourite 8 here, including Donald #Trump http:// bit.ly/2mncscq pic.twitter.com/gKuHnBgf1Y";;;#Chatbots #Trump;"841915645352636420";https://twitter.com/withplum/status/841915645352636420
withplum;2017-03-15 02:25;0;1;"See our 6 tips for the busy #Londoner on how to save money http:// bit.ly/2mnrKO4 pic.twitter.com/Fk89Zc3OGs";;;#Londoner;"841898009004802049";https://twitter.com/withplum/status/841898009004802049
withplum;2017-03-14 17:47;0;0;"Have you heard of these FinTech start-ups helping you control your finances? http:// bit.ly/2nAcVJf pic.twitter.com/MQJSwfhamZ";;;;"841767654159450112";https://twitter.com/withplum/status/841767654159450112
mcmurrak;2017-03-14 16:22;0;1;"The latest The Kirk McMurray Daily! http:// paper.li/mcmurrak?editi on_id=f6256350-08f3-11e7-b97c-0cc47a0d1605 … Thanks to @withplum @odsc @vergefeatured #crowdfunding #crowdfund";;@withplum @odsc @vergefeatured;#crowdfunding #crowdfund;"841746412475932677";https://twitter.com/mcmurrak/status/841746412475932677
GoCardlessDE;2017-03-14 12:59;0;0;"Wir freuen uns sehr über die Nominierung #NationalTechAwards mit unseren Freunden von @withplum @NTechAwards http:// buff.ly/2nk9hXM";;@withplum @NTechAwards;#NationalTechAwards;"841695178817703937";https://twitter.com/GoCardlessDE/status/841695178817703937
withplum;2017-03-14 12:51;0;0;"Win 2 tickets to #Drake at the O2, super giveaway from your little savings buddy! http:// bit.ly/2n5ejHn pic.twitter.com/9jm3JjxDJD";;;#Drake;"841693182651953152";https://twitter.com/withplum/status/841693182651953152
withplum;2017-03-14 09:58;0;2;"Apologies Tom, we will bring the Plum chatbot to other messaging platforms in the future.";;;;"841649791058792448";https://twitter.com/withplum/status/841649791058792448
DestructiveCup;2017-03-14 09:42;0;0;"That's a massive shame";;;;"841645737435942915";https://twitter.com/DestructiveCup/status/841645737435942915
withplum;2017-03-14 09:10;0;0;"Read the Plum weekly to hear about your new menu, a competition to see #Drake & the easiest way to get £25 for free https://www. facebook.com/withplum/posts /691645031009555 …";;;#Drake;"841637695512297472";https://twitter.com/withplum/status/841637695512297472
withplum;2017-03-14 08:45;0;0;"Finding it hard to save up? Maybe you should be trying these more wacky methods http:// bit.ly/2njlQ5G pic.twitter.com/biGqvmB3oo";;;;"841631470762508288";https://twitter.com/withplum/status/841631470762508288
gomedici;2017-03-14 08:30;5;4;"New #AI Service @withplum Enables #Consumers to Automatically Save, Invest & Earn More Interest on Money http:// buff.ly/2mm6NmR pic.twitter.com/9Y9muVtS2Q";;@withplum;#AI #Consumers;"841627507233304577";https://twitter.com/gomedici/status/841627507233304577
charlottespenc;2017-03-14 08:12;1;1;"The beginning of a beautiful relationship @withplum pic.twitter.com/j9zooCCBeq";;@withplum;;"841623088445943812";https://twitter.com/charlottespenc/status/841623088445943812
withplum;2017-03-14 08:03;0;1;"Super excited to have been shortlisted in TWO categories for the #NationalTechAwards @NTechAwards http:// nationaltechnologyawards.co.uk/shortlist17.php";;@NTechAwards;#NationalTechAwards;"841620862147166209";https://twitter.com/withplum/status/841620862147166209
GoCardless;2017-03-14 07:30;4;7;"We're thrilled to have been shortlisted for the #NationalTechAwards along w/ our friends @withplum @NTechAwards http:// bit.ly/2n4CQMz";;@withplum @NTechAwards;#NationalTechAwards;"841612600232296449";https://twitter.com/GoCardless/status/841612600232296449
withplum;2017-03-14 06:54;0;1;"We're going to look into this asap Nicklaus, our CTO @alexismic will email you to carry on the conversation.";;@alexismic;;"841603542351671296";https://twitter.com/withplum/status/841603542351671296
intoruth;2017-03-14 05:54;1;1;"It really is! Such a clever little robot.";;;;"841588261931876352";https://twitter.com/intoruth/status/841588261931876352
withplum;2017-03-14 05:38;0;1;"Great to see Plum helping you save Ruth! https:// twitter.com/intoruth/statu s/841578333833965568 …";;;;"841584434042269696";https://twitter.com/withplum/status/841584434042269696
marsty5;2017-03-14 05:25;0;2;"Did you know you can save money before you know it? ;) @withplum https:// friends.withplum.com/r/yswz7L @pcbo @nuveiga @DarylRodrigo check this out :)";;@withplum @pcbo @nuveiga @DarylRodrigo;;"841580981966557188";https://twitter.com/marsty5/status/841580981966557188
intoruth;2017-03-14 05:14;1;3;"NEW POST: Saving Coin Without Trying (with a little help from @withplum ) http://www. intoruth.com/2017/03/saving -coin-without-trying/ … #lbloggers #finance";;@withplum;#lbloggers #finance;"841578333833965568";https://twitter.com/intoruth/status/841578333833965568
niklausgerber;2017-03-14 00:55;0;0;"I tried with 8, 10, 16 etc. Doesn't work. This example was 50.";;;;"841513157075988481";https://twitter.com/niklausgerber/status/841513157075988481
HollandFinTech;2017-03-13 16:10;3;5;"Happy to be part of today's event! @donginsel @MF_Banking @MennovL @withplum @BlockPay_ch @europeone_ @Miracl @SpotcapGlobal";;@donginsel @MF_Banking @MennovL @withplum @BlockPay_ch @europeone_ @Miracl @SpotcapGlobal;;"841380976483803137";https://twitter.com/HollandFinTech/status/841380976483803137
withplum;2017-03-13 15:46;0;0;"Sorry Nicklaus, we have a password character limit of 60. Could you check the password is under 60 & try again for me please?";;;;"841374952276164608";https://twitter.com/withplum/status/841374952276164608
donginsel;2017-03-13 15:00;0;7;"Nice pitches by #fintech compagnies at The future of retail banking: @withplum @europeone_ @spendolater @SpotcapGlobal @BlockPay_ch @Miracl pic.twitter.com/o47fbQcn1T";;@withplum @europeone_ @spendolater @SpotcapGlobal @BlockPay_ch @Miracl;#fintech;"841363436223246337";https://twitter.com/donginsel/status/841363436223246337
withplum;2017-03-13 14:52;0;0;"Get £25 completely free when you invite 3 friends to start using Plum! #Free #Savings ! pic.twitter.com/5lY4WtrmG4";;;#Free #Savings;"841361360302813185";https://twitter.com/withplum/status/841361360302813185
Money_LIVE_;2017-03-13 14:15;1;1;"Money is pretty boring: introducing @withplum who will help you change that! #banking17";;@withplum;#banking17;"841351980702412800";https://twitter.com/Money_LIVE_/status/841351980702412800
niklausgerber;2017-03-13 11:24;0;0;"right here http:// cloud.niklausgerber.com/1w3e0L3s3X1A";;;;"841308899349266433";https://twitter.com/niklausgerber/status/841308899349266433
withplum;2017-03-13 06:43;0;0;"Hi Niklaus, happy to help here. At what point in the process could you not sign up?";;;;"841238303718416384";https://twitter.com/withplum/status/841238303718416384
withplum;2017-03-13 06:40;0;0;"Thanks Andy!";;;;"841237646714245121";https://twitter.com/withplum/status/841237646714245121
withplum;2017-03-13 06:40;0;0;"Hi Tom, unfortunately you must at least have Facebook Messenger to use Plum";;;;"841237539545587712";https://twitter.com/withplum/status/841237539545587712
DestructiveCup;2017-03-11 07:36;0;0;"@withplum hello! Can I use your service without having a Facebook account?";;@withplum;;"840541938147303424";https://twitter.com/DestructiveCup/status/840541938147303424
Andy92;2017-03-10 19:16;1;1;"@withplum Cool product!";;@withplum;;"840355760341168130";https://twitter.com/Andy92/status/840355760341168130
niklausgerber;2017-03-10 08:40;0;0;"@withplum How come I can't sign up?";;@withplum;;"840195558744707073";https://twitter.com/niklausgerber/status/840195558744707073
stuartcrouch;2017-03-10 07:53;0;0;"@withplum Can I stop plum chatbot spamming me with things such as tickets to a drake concert? I'd prefer to just talk savings with it.";;@withplum;;"840183715858939905";https://twitter.com/stuartcrouch/status/840183715858939905
UKDigitalJobsUK;2017-03-10 07:01;0;0;"#Growth Lead job at @withplum - London http:// ow.ly/b2I2309EXml";;@withplum;#Growth;"840170651088498688";https://twitter.com/UKDigitalJobsUK/status/840170651088498688
withplum;2017-03-09 13:00;0;0;"Can you sing? Do you like Drake? Share a video of you singing One Dance with our lyrics to win tickets to see Drake! https:// blog.withplum.com/win-2-tickets- to-drake-from-plum-bb45d6ff2fdc#.fywdqon3e …";;;#;"839898595578920960";https://twitter.com/withplum/status/839898595578920960
TableCrowd;2017-03-09 12:01;1;4;"@dabblinvest @withplum @Holvi we would love to see you all at our #FinTech dinner w/ @moneyfarmUK on Monday 13 March http:// buff.ly/2m5Ievb pic.twitter.com/9ApML0DpeF";;@dabblinvest @withplum @Holvi @moneyfarmUK;#FinTech;"839883832765595648";https://twitter.com/TableCrowd/status/839883832765595648
withplum;2017-03-09 11:30;0;0;"Drake ticket giveaway! Don't miss out! #Competition https:// blog.withplum.com/win-2-tickets- to-drake-from-plum-bb45d6ff2fdc#.fywdqon3e …";;;#Competition #;"839876070857916418";https://twitter.com/withplum/status/839876070857916418
withplum;2017-03-09 04:45;0;0;"Find out how to win tickets to see #Drake live at the O2 here: https:// blog.withplum.com/win-2-tickets- to-drake-from-plum-bb45d6ff2fdc#.irrd0tir1 …";;;#Drake #;"839774122448207872";https://twitter.com/withplum/status/839774122448207872
withplum;2017-03-08 13:02;0;0;"Thanks for the follow, followed back :)";;;;"839536715886956546";https://twitter.com/withplum/status/839536715886956546
kritimant;2017-03-08 13:01;0;1;"@withplum follow back so I can message you guys";;@withplum;;"839536552132890624";https://twitter.com/kritimant/status/839536552132890624
withplum;2017-03-08 12:00;0;0;"Win 2 free tickets to Drake at the O2 Arena on March 20th! All you have to do is sing along using these lyrics https://www. facebook.com/withplum/photo s/a.645012455672813.1073741828.557221327785260/688025001371558/?type=3&theater … pic.twitter.com/6O5nRNm9j9";;;;"839521105828282369";https://twitter.com/withplum/status/839521105828282369
withplum;2017-03-08 10:18;0;0;"Correct link: https://www. facebook.com/withplum/photo s/a.645012455672813.1073741828.557221327785260/688025001371558/?type=3&theater …";;;;"839495669765255170";https://twitter.com/withplum/status/839495669765255170
withplum;2017-03-08 10:00;0;0;"Do you want to see #Drake at the O2 on March 20th? Enter our #Competition here: https://www. facebook.com/withplum/photo s/a.645012455672813.1073741828.557221327785260/688025001371558/?type=3&theater … #london #draketour #tickets #music";;;#Drake #Competition #london #draketour #tickets #music;"839490911365038083";https://twitter.com/withplum/status/839490911365038083
withplum;2017-03-08 08:30;0;0;"Do you want to see #Drake at the O2 on March 20th? Enter our #Competition here: https://www. facebook.com/withplum/photo s/a.645012455672813.1073741828.557221327785260/688025001371558/?type=3&theater … #giveaway #draketour #win #music";;;#Drake #Competition #giveaway #draketour #win #music;"839468249100083202";https://twitter.com/withplum/status/839468249100083202
