username;date;retweets;favorites;text;geo;mentions;hashtags;id;permalink
withplum;2017-11-29 05:56;0;2;"Spare a thought for the banks having to cut their profits thanks to fintech like us 2.6 billion pounds for overdrafts for example https:// uk.reuters.com/article/uk-boe -banks-fintech/boe-says-banks-may-be-underestimating-fintech-threat-idUKKBN1DS18K …";;;;"935824700252610565";https://twitter.com/withplum/status/935824700252610565
NorthAlexandra;2017-11-29 05:05;2;2;"A #chatbot that could save me from myself... this #moneysaving #bot could actually help me stick to my New Year's resolution. Loving this concept from #startup @withplum #firsttimeforeverything #techpr https:// twitter.com/LDNTechWeek/st atus/935810570372157440 …";;@withplum;#chatbot #moneysaving #bot #startup #firsttimeforeverything #techpr;"935811985534529537";https://twitter.com/NorthAlexandra/status/935811985534529537
LDNTechWeek;2017-11-29 05:00;1;3;"London-based #startup @withplum is developing a #chatbot which helps you save money and "save you from yourself." http:// spr.ly/6014DDRz8 pic.twitter.com/1uMKeTAWcg";;@withplum;#startup #chatbot;"935810570372157440";https://twitter.com/LDNTechWeek/status/935810570372157440
LDNTechWeek;2017-11-24 09:00;5;9;"London-based #startup @withplum is developing a #chatbot which helps you save money and "save you from yourself." http:// spr.ly/6010DDRKC pic.twitter.com/JGlMpb9tSc";;@withplum;#startup #chatbot;"934059045333426176";https://twitter.com/LDNTechWeek/status/934059045333426176
withplum;2017-11-23 12:05;0;0;"Final words of wisdom before Black Friday check out the blog for more! http:// plum-blog.ghost.io/tag/community/ pic.twitter.com/TKsMFFBQjl";;;;"933743279191011328";https://twitter.com/withplum/status/933743279191011328
withplum;2017-11-23 11:17;0;0;"Planning on shopping on Black Friday tomorrow? Use this printable to keep you on track: https:// drive.google.com/file/d/1yGyIvB HjiHAX4RvmkpaI5PsjJqTO4EAd/view … Good luck everyone and let us know if we helped!";;;;"933731164531159040";https://twitter.com/withplum/status/933731164531159040
xstex;2017-11-23 09:51;0;0;"Seems it was pulled over from my Barclays account when I used the switching service and you don’t support Starling so I’m pretty sure it won’t do anything.";;;;"933709630429163520";https://twitter.com/xstex/status/933709630429163520
withplum;2017-11-23 06:29;0;0;"Yep thats us :D";;;;"933658854864375808";https://twitter.com/withplum/status/933658854864375808
withplum;2017-11-22 13:45;0;4;"Meet Sam employee number 1, Founding Engineer and beard model. When he’s not pushing code or looking pensively out of a window, you can find him at the barbers ...or just the bar. ‘Want a beer?’ #lifewithplum pic.twitter.com/FO44CWtuLx";;;#lifewithplum;"933406004334575616";https://twitter.com/withplum/status/933406004334575616
withplum;2017-11-22 09:48;0;1;"Gotta love a Plum T";;;;"933346407959932929";https://twitter.com/withplum/status/933346407959932929
MilesBradley00;2017-11-22 09:13;0;1;"You got there first AND sent me a t-shirt, so, if it comes down to it I’m backing you.";;;;"933337605386711041";https://twitter.com/MilesBradley00/status/933337605386711041
withplum;2017-11-22 07:08;0;2;"Don't accept the status quo. There are better options out there! http://www. dailymail.co.uk/news/article-5 105707/Boycott-greedy-banks-says-Bank-England-official.html …";;;;"933306297818189824";https://twitter.com/withplum/status/933306297818189824
withplum;2017-11-22 07:00;0;0;"pic.twitter.com/VjRyAc1PaA";;;;"933304158387605504";https://twitter.com/withplum/status/933304158387605504
SHACK15ldn;2017-11-22 06:55;1;4;"“Talent wins games, but teamwork and intelligence win championships.” - Michael Jordan @withplum #wednesdaywisdom #SHACK15 #DataScience #Tech #Startups pic.twitter.com/I0ziMaIRxj";;@withplum;#wednesdaywisdom #SHACK15 #DataScience #Tech #Startups;"933302830311583744";https://twitter.com/SHACK15ldn/status/933302830311583744
liamdaly;2017-11-21 18:00;0;0;"Look forward to part 2 then!";;;;"933107855116337153";https://twitter.com/liamdaly/status/933107855116337153
withplum;2017-11-21 17:56;0;1;"That’s part 2 of the blog post Part 1 focuses on getting good deals on things you actually need and avoid getting carried away";;;;"933106901730111488";https://twitter.com/withplum/status/933106901730111488
withplum;2017-11-21 15:45;0;2;"It's almost here! Take a look at our Black Friday survival guide with top tips and tricks from our favourite U.K. money bloggers to get you ready in time pic.twitter.com/NQSdKKgTL8";;;;"933073812572246017";https://twitter.com/withplum/status/933073812572246017
xstex;2017-11-21 14:17;0;0;"@withplum Is this you? pic.twitter.com/PuyVGImN5h";;@withplum;;"933051849757937665";https://twitter.com/xstex/status/933051849757937665
thefrugalfamily;2017-11-20 13:23;0;1;"Who doesn’t love houmous? Xx";;;;"932675672174100480";https://twitter.com/thefrugalfamily/status/932675672174100480
withplum;2017-11-20 13:17;2;6;"Meet tech recruiter, hummus addict and Plumster Mark from SW London. Being a food lover he’s always trying new restaurants and that makes saving hard. He loves how convenient saving has been with Plum (and the emojis), he even reached his goal of 1k #lifewithplum @MarkMcDaidAIRP pic.twitter.com/b35nFOOaJW";;@MarkMcDaidAIRP;#lifewithplum;"932674267577290753";https://twitter.com/withplum/status/932674267577290753
tubblog;2017-11-20 10:00;0;1;"@OnTrees I'm a @withplum user. Are there any plans to add Plum as a supported platform for the OnTrees Dashboard?";;@OnTrees @withplum;;"932624655386595328";https://twitter.com/tubblog/status/932624655386595328
withplum;2017-11-20 06:34;0;1;"Black Friday is round the corner...but will you survive? Click the link to read our complete Black Friday survival guide for tips if you are staying in and taking cover or braving the crowds from some of our favourite UK money bloggers! http:// plum-blog.ghost.io/tag/community/";;;;"932572836753039360";https://twitter.com/withplum/status/932572836753039360
thefrugalfamily;2017-11-19 18:01;0;1;"@withplum Great to work with you on the Black Friday survival guide #shopping #saving #BlackFriday #KeepCalm";;@withplum;#shopping #saving #BlackFriday #KeepCalm;"932383296977334272";https://twitter.com/thefrugalfamily/status/932383296977334272
michael_taggart;2017-11-18 07:59;2;2;"Four great apps to help you get a grip on your finances, our review includes @withplum and @piggypotapp https://www. mouthymoney.co.uk/four-best-fina ncial-assistant-apps/ …";;@withplum @piggypotapp;;"931869449078169600";https://twitter.com/michael_taggart/status/931869449078169600
withplum;2017-11-17 16:04;0;0;"Thanks for the feedback! You can adjust the notification settings in Plum (and messenger generally) if you ever decide to give us another go";;;;"931629087046733828";https://twitter.com/withplum/status/931629087046733828
AlxJWilson;2017-11-17 09:09;0;0;"Yes, would have stayed if you had stopped nagging me by app,text and email to update my details every few hours. I did give you several chances to stop doing it. To much automation imo, means you miss things like this that could have been easily solved. will be checking others";;;;"931524596280553472";https://twitter.com/AlxJWilson/status/931524596280553472
withplum;2017-11-17 08:37;2;2;"Thanks @metrouk :D https://www. metro.news/get-saving-sha rp-and-spending-smart-with-the-boom-in-money-apps/821974/ …";;@metrouk;;"931516647046868992";https://twitter.com/withplum/status/931516647046868992
withplum;2017-11-17 08:35;0;0;"Hi Alex, Sorry about that! Just confirming your account was cancelled at 13:01 today following your chat with Angela :)";;;;"931516051258593280";https://twitter.com/withplum/status/931516051258593280
withplum;2017-11-17 08:33;0;0;"Unfortunately not at the moment. We would recommend using the most active account you use (the one with the most in and out transactions) :)";;;;"931515719547793408";https://twitter.com/withplum/status/931515719547793408
KUMoneyMovement;2017-11-17 08:01;0;1;"Have you thought about using @withplum to help you manage your finances better this #Christmas ? UK bank users are paying a whopping £300 Million in overdraft fees every year, don't be one of the ones to get caught out! pic.twitter.com/1hU01ZJDGx";;@withplum;#Christmas;"931507471243456513";https://twitter.com/KUMoneyMovement/status/931507471243456513
AlxJWilson;2017-11-17 07:10;0;0;"@withplum how do I arrange for my account to be deleted. Requests continually ignored. Customer service terrible. Had enough";;@withplum;;"931494687512453120";https://twitter.com/AlxJWilson/status/931494687512453120
KyraAudleyCharl;2017-11-17 07:03;0;0;"@withplum Hi. Can I add multiple accounts if I use Plum as I use many current accounts and credit cards?";;@withplum;;"931493049208856577";https://twitter.com/KyraAudleyCharl/status/931493049208856577
withplum;2017-11-15 15:58;0;0;"You will need to re-download messenger as that's the only way to talk to Plum and withdraw Just search for Plum then type 'withdraw'";;;;"930902852876357633";https://twitter.com/withplum/status/930902852876357633
withplum;2017-11-15 15:53;0;1;"YES! THATS WHAT WE DO!! #dreamteam pic.twitter.com/pFuWM2HsCi";;;#dreamteam;"930901656081960963";https://twitter.com/withplum/status/930901656081960963
Get_Chip;2017-11-15 15:35;0;2;"...butttt who's ya fave? Have a great trip! pic.twitter.com/WLk6ic7nrk";;;;"930896988547223552";https://twitter.com/Get_Chip/status/930896988547223552
gortt;2017-11-15 12:50;0;1;"When you realise you have saved over £200 thanks to @withplum , @meet_cleo and @Get_Chip . Perfect timing for Malaysia/Thailand, boiii. pic.twitter.com/A1tkGAKdQk";;@withplum @meet_cleo @Get_Chip;;"930855433094549504";https://twitter.com/gortt/status/930855433094549504
krisagos;2017-11-15 09:18;0;0;"@withplum Hi guys, I need some help withdrawing from my plum as I don’t have messenger anymore. Can you help?";;@withplum;;"930802092679335937";https://twitter.com/krisagos/status/930802092679335937
scott_riley;2017-11-14 13:59;0;0;"I've set a password and can log in to the web app - I'm using Messenger with a phone number (no FB account) - I just need a way to link the Plum bot with my actual account";;;;"930510599125073920";https://twitter.com/scott_riley/status/930510599125073920
withplum;2017-11-14 11:46;0;0;"We have looked into that and it seems you haven’t set a password. Click ‘I forgot my password’ to set one or use your FB messenger password";;;;"930477058345578496";https://twitter.com/withplum/status/930477058345578496
scott_riley;2017-11-14 11:28;0;0;"Can't DM you, but it's hugs [at] scott [dot] is. Thanks!";;;;"930472585103663104";https://twitter.com/scott_riley/status/930472585103663104
iamstartacus;2017-11-14 08:30;2;1;"Alex Michael @alexismic co-founder at @withplum shares all on the current state of AI in finance & why the magic behind Plum lies in its algorithm https:// startacus.net/culture/plum-a nd-ai-in-finance#.WgrtxbSFit8 …";;@alexismic @withplum;#;"930427651323555842";https://twitter.com/iamstartacus/status/930427651323555842
jb_new;2017-11-14 08:03;0;1;"I've got @meet_cleo and @withplum Facebook bots that link to your bank accounts and track your spending. both are super safe and I'll happily recommend. DM me for any info or a referral";;@meet_cleo @withplum;;"930420852977528832";https://twitter.com/jb_new/status/930420852977528832
RobWaughMail;2017-11-14 07:32;0;0;"Sure thing will send now, follow me?";;;;"930413021805142017";https://twitter.com/RobWaughMail/status/930413021805142017
withplum;2017-11-14 07:30;0;1;"Would love to comment! Could you DM your email?";;;;"930412530152943617";https://twitter.com/withplum/status/930412530152943617
jb_new;2017-11-14 03:56;0;1;"I've got @meet_cleo and @withplum Facebook bots that link to your accounts and track spending. Super safe and happy to recommend. DM for my referral";;@meet_cleo @withplum;;"930358685548859392";https://twitter.com/jb_new/status/930358685548859392
Yodlee;2017-11-13 16:20;0;1;"Five savings apps to help you get into the savings habit https://www. savvywoman.co.uk/12760/five-sav ings-apps-apps-help-get-savings-habit/ … via @Savvy_Woman @withplum @Get_Chip @meet_cleo @asksquirrel @folio #fintech";;@Savvy_Woman @withplum @Get_Chip @meet_cleo @asksquirrel @folio;#fintech;"930183594789634048";https://twitter.com/Yodlee/status/930183594789634048
mccann_tom;2017-11-12 11:59;1;1;"@dustcrypto ?";;@dustcrypto;;"929755555660525568";https://twitter.com/mccann_tom/status/929755555660525568
jd;2017-11-11 14:02;2;4;"Who can build me @withplum for #BTC ?";;@withplum;#BTC;"929424003105808384";https://twitter.com/jd/status/929424003105808384
Savvy_Woman;2017-11-10 13:25;6;8;"Do you find it hard to get into the savings habit? @sarahjgartside has looked at 5 apps designed to help you https://www. savvywoman.co.uk/12760/five-sav ings-apps-apps-help-get-savings-habit/ … @withplum @getchipin @folio @asksquirrel @meet_cleo";;@sarahjgartside @withplum @getchipin @folio @asksquirrel @meet_cleo;;"929052350429442048";https://twitter.com/Savvy_Woman/status/929052350429442048
DanniCamilleri;2017-11-10 09:38;0;0;"Would love to comment on behalf of @withplum on the ways we are ensuring equal pay even in small teams";;@withplum;;"928995361343049729";https://twitter.com/DanniCamilleri/status/928995361343049729
withplum;2017-11-10 09:31;1;0;"We have just launched our exclusive Plum Saving Squad! Check it out https://www. facebook.com/groups/1620181 61060128/ …";;;;"928993445645086720";https://twitter.com/withplum/status/928993445645086720
tubblog;2017-11-10 06:00;1;1;"Here's a Friday Favourite - @withplum a Facebook Messenger bot that helps you save money automatically http:// tubb.co/2xOK2z5 pic.twitter.com/P5ixA3zZrt";;@withplum;;"928940509904678913";https://twitter.com/tubblog/status/928940509904678913
Sweatcoin;2017-11-09 12:21;1;2;"Thank you, Plum. I wonder how sweaty plums look and feel.";;;;"928673800681431040";https://twitter.com/Sweatcoin/status/928673800681431040
withplum;2017-11-09 09:34;1;3;"Thanks @Sweatcoin Anyone who wants to cash in on their usual walk check them out! pic.twitter.com/eH5kjyQFRN";;@Sweatcoin;;"928631890596323329";https://twitter.com/withplum/status/928631890596323329
DandMFinance;2017-11-08 06:17;0;1;"Share the love - High Value Members of this week @withplum @irstaxbook @beginsmall :)";;@withplum @irstaxbook @beginsmall;;"928219890531684352";https://twitter.com/DandMFinance/status/928219890531684352
withplum;2017-11-07 11:47;0;0;"It's officially cold but WAIT before you turn that heating check this out. Save around £250 on average in 6 clicks http:// bit.ly/2m3DNFM";;;;"927940511004086273";https://twitter.com/withplum/status/927940511004086273
getyolt;2017-11-07 09:16;0;0;"Hi Liam, thanks for your feedback! We're always looking to add new banks to Yolt and will add your suggestion to our user wishlist";;;;"927902695536644096";https://twitter.com/getyolt/status/927902695536644096
liamdaly;2017-11-07 08:56;0;1;"Finally! Now we need @withplum and @Get_Chip support and I will be happy!";;@withplum @Get_Chip;;"927897445656416257";https://twitter.com/liamdaly/status/927897445656416257
pollingersocial;2017-11-07 07:03;1;1;"Just signed up to @withplum . Very smooth. Innovative use of FB Messenger and love the concept. Learn more: https:// friends.withplum.com/r/7rvtSc";;@withplum;;"927869209601806336";https://twitter.com/pollingersocial/status/927869209601806336
simonhelyar;2017-11-07 04:05;0;1;"Just use @meet_cleo";;@meet_cleo;;"927824202211692545";https://twitter.com/simonhelyar/status/927824202211692545
AndyPStagg;2017-11-06 12:29;0;0;"My first £20 invested with @withplum via @ratesetter only way is up from here. pic.twitter.com/dpILgcnEfT";;@withplum @ratesetter;;"927588824292708352";https://twitter.com/AndyPStagg/status/927588824292708352
wmellaart;2017-11-06 09:29;0;0;"@withplum not available in the Netherlands? pic.twitter.com/AmdvJnnJt0";;@withplum;;"927543405223301120";https://twitter.com/wmellaart/status/927543405223301120
AndyPStagg;2017-11-06 07:11;0;0;"Plum is a fantastic service can’t stop raving about them you want to disappointed with Plum";;;;"927508721776971776";https://twitter.com/AndyPStagg/status/927508721776971776
withplum;2017-11-06 06:18;0;0;"It's true :D :D :D";;;;"927495326159785985";https://twitter.com/withplum/status/927495326159785985
withplum;2017-11-06 06:17;0;0;"Sorry about that! Could you DM us your email and we will take a look at what is happening for you!";;;;"927495136224915458";https://twitter.com/withplum/status/927495136224915458
AndyPStagg;2017-11-05 15:18;0;1;"I accept there is risk with any investment but I see it as a long term around 5 years plus not for short to medium term.";;;;"927268918745542657";https://twitter.com/AndyPStagg/status/927268918745542657
rob18244;2017-11-05 05:25;0;0;"How do you feel about the risk associated with it? Obviously that’s the case with any investment, but it’s something I’m considering.";;;;"927119681470820352";https://twitter.com/rob18244/status/927119681470820352
rob18244;2017-11-05 05:22;1;1;"@withplum Just signed up. Pain free, simple, and I’m actually GLAD to not have to download an app - innovative use of Messenger. Well done!";;@withplum;;"927118855159336965";https://twitter.com/rob18244/status/927118855159336965
scott_riley;2017-11-04 10:00;0;0;"@withplum hey hi I already have an account but your chatbot won't let me log in, just keeps bugging me to sign up.";;@withplum;;"926811365213384704";https://twitter.com/scott_riley/status/926811365213384704
AndyPStagg;2017-11-03 11:40;2;2;"My first 2 investments have been made with @withplum nice interest rate of 4.1% via @RateSetter time to watch it grow. #plum #plumster";;@withplum @RateSetter;#plum #plumster;"926474065757589505";https://twitter.com/AndyPStagg/status/926474065757589505
cjdoc;2017-11-03 10:08;0;1;"My DPD driver is going to hate my wife.";;;;"926451064798367744";https://twitter.com/cjdoc/status/926451064798367744
withplum;2017-11-03 08:16;0;0;"CANCLE YOUR PLANS THIS WEEKEND! You can now try before you buy with @ASOS Happy Friday http:// bit.ly/2hBNkix #fashion #fbloggers #style";;@ASOS;#fashion #fbloggers #style;"926422887820652544";https://twitter.com/withplum/status/926422887820652544
AndyPStagg;2017-11-02 11:28;0;0;"pic.twitter.com/6kHJ6QLBwP";;;;"926108799391490051";https://twitter.com/AndyPStagg/status/926108799391490051
withplum;2017-11-02 09:31;0;1;"Interest is paid monthly but accrued daily";;;;"926079298297057280";https://twitter.com/withplum/status/926079298297057280
withplum;2017-11-02 08:41;0;2;"Fixed it!";;;;"926066694161879040";https://twitter.com/withplum/status/926066694161879040
AndyPStagg;2017-11-02 08:01;0;0;"Good afternoon @withplum how often is the interest paid when you save via investments with @RateSetter";;@withplum @RateSetter;;"926056604100911104";https://twitter.com/AndyPStagg/status/926056604100911104
withplum;2017-11-02 06:59;1;4;"ALERT: We are currently experiencing a delay with our banking provider and withdrawals. As soon as we have updates we will let you all know.";;;;"926041097582841856";https://twitter.com/withplum/status/926041097582841856
withplum;2017-11-01 07:01;0;0;"Congrats to our Plumpkin contest winner £50 on its way to you now! pic.twitter.com/KnUnyd2auP";;;;"925679121430188033";https://twitter.com/withplum/status/925679121430188033
withplum;2017-11-01 06:46;2;2;"Hello again @TechCrunch https:// techcrunch.com/gallery/here-a re-some-standouts-from-500-startups-22nd-demo-day/slide/4/ …";;@TechCrunch;;"925675295067328514";https://twitter.com/withplum/status/925675295067328514
withplum;2017-10-31 14:34;1;6;"Check your daily spend and even alter Plums mood to suit you. Smarter savings + total control pic.twitter.com/cIQI7RkKg8";;;;"925430737796550656";https://twitter.com/withplum/status/925430737796550656
AndyPStagg;2017-10-31 03:05;0;1;"This morning Digest from @withplum love watching my savings grow . #imaplumster pic.twitter.com/ZHUaGwTqCA";;@withplum;#imaplumster;"925257451951263744";https://twitter.com/AndyPStagg/status/925257451951263744
SophieRobson2;2017-10-30 14:19;7;5;"8 apps for #students - @mouthymoney blog featuring great apps inc @usebean @TheGrantFairy @payfriendz @withplum https://www. mouthymoney.co.uk/eight-apps-tha t-students-will-love/ …";;@mouthymoney @usebean @TheGrantFairy @payfriendz @withplum;#students;"925064755357933568";https://twitter.com/SophieRobson2/status/925064755357933568
djohnsonxyz;2017-10-30 07:40;0;1;"Hey @withplum & @meet_cleo - When are you going to start working with @monzo ?";;@withplum @meet_cleo @monzo;;"924964270152060929";https://twitter.com/djohnsonxyz/status/924964270152060929
withplum;2017-10-30 06:22;0;0;"Check out our FB page for reviews https://www. facebook.com/withplum/ and this article or our website for how it works http://www. moneysavingexpert.com/team-blog/2017 /03/14/meet-new-facebook-friend-automatic-savings-app-lives-messenger/ …";;;;"924944685868703744";https://twitter.com/withplum/status/924944685868703744
SophieRobson2;2017-10-30 05:47;0;3;"Couldn't forget you guys! :)";;;;"924935874361593856";https://twitter.com/SophieRobson2/status/924935874361593856
withplum;2017-10-30 05:04;0;2;"And @withplum thank Sophie!";;@withplum;;"924925042764468224";https://twitter.com/withplum/status/924925042764468224
michael_taggart;2017-10-30 03:39;2;2;"Morning! We're featuring money apps on @MouthyMoney that students will LOVE, including @withplum & @moneyboxteam https://www. mouthymoney.co.uk/eight-apps-tha t-students-will-love/ …";;@MouthyMoney @withplum @moneyboxteam;;"924903545140281344";https://twitter.com/michael_taggart/status/924903545140281344
AndyPStagg;2017-10-29 08:34;0;1;"Find it hard to save money like i do? Why not let @withplum handle that for you sign up at https:// friends.withplum.com/r/nnWdbN #savemoney #plumster";;@withplum;#savemoney #plumster;"924615524553764864";https://twitter.com/AndyPStagg/status/924615524553764864
withplum;2017-10-28 09:01;0;0;"pic.twitter.com/FDoTtTAkbi";;;;"924259710127214593";https://twitter.com/withplum/status/924259710127214593
AndyPStagg;2017-10-28 08:04;0;0;"How rude of @meet_cleo pic.twitter.com/jMwYsAwWDP";;@meet_cleo;;"924245560160342016";https://twitter.com/AndyPStagg/status/924245560160342016
withplum;2017-10-28 07:37;1;0;"Head over to Insta for a chance to win £50 in our #plumpkincontest pic.twitter.com/Y6g2tprYvp";;;#plumpkincontest;"924238745485938688";https://twitter.com/withplum/status/924238745485938688
withplum;2017-10-28 07:27;0;0;"Not sure they like us very much pic.twitter.com/iyWLQfs9jC";;;;"924236072044978176";https://twitter.com/withplum/status/924236072044978176
AndyPStagg;2017-10-28 05:45;0;0;". @withplum have you thought about doing an integration with @meet_cleo ?";;@withplum @meet_cleo;;"924210608748269568";https://twitter.com/AndyPStagg/status/924210608748269568
MarkMcDaidAIRP;2017-10-26 17:12;0;1;"Was literally discussing this tonight at a HR/Recruitment meetup & how tech teams / orgs are being transparent";;;;"923658653122617344";https://twitter.com/MarkMcDaidAIRP/status/923658653122617344
withplum;2017-10-26 10:44;0;1;"Experts say millennials discuss salary with co-workers. Who would you discuss your salary with? #money #salary #wage http:// read.bi/2gFBqn2";;;#money #salary #wage;"923560942054633472";https://twitter.com/withplum/status/923560942054633472
withplum;2017-10-26 09:25;0;1;"Victor is a popular guy...Plum speaking at ANOTHER event @500Startups #500STRONG #batch22 #demoday pic.twitter.com/PmBYnATv19";;@500Startups;#500STRONG #batch22 #demoday;"923541019404234753";https://twitter.com/withplum/status/923541019404234753
quartermark;2017-10-25 19:17;0;1;"@withplum is very cool";;@withplum;;"923327599627051008";https://twitter.com/quartermark/status/923327599627051008
500Startups;2017-10-25 19:16;0;1;"@withplum monitors your spending, then automatically sets money aside for you #Batch22 #DemoDay pic.twitter.com/3pbBqdw1Iz";;@withplum;#Batch22 #DemoDay;"923327483700752385";https://twitter.com/500Startups/status/923327483700752385
500Startups;2017-10-25 19:15;2;2;"@withplum - smart, simple, and unboring personal finance. Learn more: https:// angel.co/withplum #Batch22 #DemoDay pic.twitter.com/bZboaKGYO0";;@withplum;#Batch22 #DemoDay;"923327282495836160";https://twitter.com/500Startups/status/923327282495836160
ApptologyCEO;2017-10-25 19:15;0;2;". @withplum automates money savings @500Startups #Batch22 #DemoDay #500Strong #Startup pic.twitter.com/ipMCSC47EF";;@withplum @500Startups;#Batch22 #DemoDay #500Strong #Startup;"923327202887811072";https://twitter.com/ApptologyCEO/status/923327202887811072
500Startups;2017-10-25 19:15;6;5;"See how @withplum is making saving simple and stress-free http:// s.500.co/jAN330g8iB7 #Batch22 #DemoDay";;@withplum;#Batch22 #DemoDay;"923327139306528768";https://twitter.com/500Startups/status/923327139306528768
AndyPStagg;2017-10-25 17:22;1;1;"Investing fully setup with @withplum time to watch my savings grow . #plumster #investor #littleandoften";;@withplum;#plumster #investor #littleandoften;"923298832254828544";https://twitter.com/AndyPStagg/status/923298832254828544
bluenicks_99;2017-10-25 06:41;1;1;"Nice and easy sign-up process @withplum & savings to be invested with @RateSetter Here's my @withplum referal: https:// friends.withplum.com/r/Pn5xzD";;@withplum @RateSetter @withplum;;"923137413303734272";https://twitter.com/bluenicks_99/status/923137413303734272
AndyPStagg;2017-10-25 03:03;0;1;"Up bright and early for work to find @withplum has taken a cheeky deposit. #plumster";;@withplum;#plumster;"923082599874093057";https://twitter.com/AndyPStagg/status/923082599874093057
