username;date;retweets;favorites;text;geo;mentions;hashtags;id;permalink
withplum;2018-06-11 10:29;0;0;"Hey James, Apologise for the wait, I can see that you are chatting to support now. Monday mornings are a little busy for support but tech has been looking into the issue since your last tweet so hopefully they will be able to fix it for you soon!";;;;"1006181704917188609";https://twitter.com/withplum/status/1006181704917188609
teawaterwire;2018-06-11 08:09;0;2;"Excited to see @withplum doing another crowdfunding round http:// plum.seedrs.com / #bullish";;@withplum;#bullish;"1006146428568330241";https://twitter.com/teawaterwire/status/1006146428568330241
Jaffa374;2018-06-11 06:37;0;0;"@withplum So I've asked for support twice on here, both have been fruitless, and then messages to your support 2 hours later haven't been read.... come on guys anyone? pic.twitter.com/czwMxvU5c5";;@withplum;;"1006123333857968128";https://twitter.com/Jaffa374/status/1006123333857968128
withplum;2018-06-11 06:13;0;0;"If you are looking to include ways to invest outside of the traditional don't hesitate to get in touch :) We are bringing investing to Facebook messenger and people can start with just £1.";;;;"1006117210056687616";https://twitter.com/withplum/status/1006117210056687616
Just_Entr;2018-06-11 05:29;4;5;"Born out of a challenge to see who could save the most every month. @withplum is the ultimate saving app, with AI technology making it easier to save smarter. Founded by childhood friends Victor and Alex, the duo have been making strides in their industry. https:// buff.ly/2sYT5LU pic.twitter.com/MG31zg9bd5";;@withplum;;"1006106014016557056";https://twitter.com/Just_Entr/status/1006106014016557056
FocusedThriving;2018-06-10 16:07;2;2;"Why i am obsessed with #microsaving in love with @withplum and how I've quickly grown a little nest egg without even noticing and without any effort http:// bit.ly/2JKADkA";;@withplum;#microsaving;"1005904320431362048";https://twitter.com/FocusedThriving/status/1005904320431362048
Jaffa374;2018-06-10 07:05;0;0;"Not heard anything from anyone yet?";;;;"1005767818720284673";https://twitter.com/Jaffa374/status/1005767818720284673
VeridianVenture;2018-06-08 17:54;0;1;"How our portfolio company @withplum is helping its users save: pic.twitter.com/Km7N5nnTvA";;@withplum;;"1005206458768687110";https://twitter.com/VeridianVenture/status/1005206458768687110
Jaffa374;2018-06-08 06:35;0;0;"Many thanks!";;;;"1005035476703744004";https://twitter.com/Jaffa374/status/1005035476703744004
withplum;2018-06-08 06:34;0;0;"No problem I have passed it to the tech team who should be in touch!";;;;"1005035384332603392";https://twitter.com/withplum/status/1005035384332603392
Jaffa374;2018-06-08 06:23;0;0;"Username should be jaffa374@hotmail.co.uk";;@hotmail;;"1005032444138000385";https://twitter.com/Jaffa374/status/1005032444138000385
Jaffa374;2018-06-08 06:05;0;0;"I don't seem to be able to currently... this could be me being not very good with twitter....";;;;"1005028072180146177";https://twitter.com/Jaffa374/status/1005028072180146177
withplum;2018-06-08 05:55;0;0;"Oh no sorry to hear that! Could you DM us your email address and we will get out tech team to take a look for you";;;;"1005025534718414848";https://twitter.com/withplum/status/1005025534718414848
Jaffa374;2018-06-08 05:51;0;0;"@withplum Hi guys. Having weird issues with my account, only working half the time on messenger and prompting for creds the other half, help?";;@withplum;;"1005024590530260992";https://twitter.com/Jaffa374/status/1005024590530260992
dannyrowson;2018-06-07 18:45;0;0;"They told me 'very soon' in August last year but unfortunately still waiting....";;;;"1004856852922937344";https://twitter.com/dannyrowson/status/1004856852922937344
withplum;2018-06-07 16:37;0;0;"pic.twitter.com/5ECcIB80S2";;;;"1004824690974756864";https://twitter.com/withplum/status/1004824690974756864
sebinsua;2018-06-07 16:11;0;1;"Thank you! That worked! This app is now even more amazing than it was before. Great update!";;;;"1004818114763161602";https://twitter.com/sebinsua/status/1004818114763161602
withplum;2018-06-07 12:57;0;0;"So sorry could you try again. There was a rogue comma in your address which threw an error with the compliance team! Should be sorted now!";;;;"1004769381207945218";https://twitter.com/withplum/status/1004769381207945218
DanniCamilleri;2018-06-07 10:34;0;1;"Still going strong! @withplum #womeninvesttoo #womenintech pic.twitter.com/One54wx1vA";;@withplum;#womeninvesttoo #womenintech;"1004733401562275841";https://twitter.com/DanniCamilleri/status/1004733401562275841
sebinsua;2018-06-07 09:48;0;0;"Still hanging for me...";;;;"1004721665182519296";https://twitter.com/sebinsua/status/1004721665182519296
fwartner;2018-06-07 09:23;0;0;"Sure!";;;;"1004715575090798592";https://twitter.com/fwartner/status/1004715575090798592
withplum;2018-06-07 09:21;0;0;"hmm ok would you be able to send an email to hello@withplum.com with a screenshot of what you see and we will get to the bottom of it for you :)";;@withplum;;"1004714860532334593";https://twitter.com/withplum/status/1004714860532334593
fwartner;2018-06-07 09:15;0;0;"Problems with validation... :/";;;;"1004713369323044865";https://twitter.com/fwartner/status/1004713369323044865
StockwoodCBS;2018-06-07 08:00;1;1;"Have you heard of @withplum ? The new ethical investment app to help make those wanting to make better investment choices https://www. standard.co.uk/tech/plum-star t-up-investment-fintech-a3851421.html … #sustainablebanking pic.twitter.com/HJUGLtaD4V";;@withplum;#sustainablebanking;"1004694480702844929";https://twitter.com/StockwoodCBS/status/1004694480702844929
withplum;2018-06-07 07:53;0;1;"Not yet but it’s in the next sprint! So coming very very soon";;;;"1004692825630441473";https://twitter.com/withplum/status/1004692825630441473
withplum;2018-06-07 07:53;0;0;"Hey Seb, We have fixed the bug could you close the webview and try again for us?";;;;"1004692740079316992";https://twitter.com/withplum/status/1004692740079316992
sebinsua;2018-06-07 07:31;0;0;"@withplum This new feature seems to hang indefinitely at this stage: pic.twitter.com/xXtTiaj62g";;@withplum;;"1004687212103938048";https://twitter.com/sebinsua/status/1004687212103938048
withplum;2018-06-07 06:44;0;0;"Oh no! Sorry to hear that. What seems to be the problem?";;;;"1004675479234899968";https://twitter.com/withplum/status/1004675479234899968
fwartner;2018-06-07 06:43;0;0;"@withplum your Website seems glitching on me. Can’t sign up..";;@withplum;;"1004675314495250433";https://twitter.com/fwartner/status/1004675314495250433
withplum;2018-06-07 05:50;0;2;"More investment options coming very very soon Get your name on the beta list for early access! https:// withplum.com/investments/";;;;"1004661791169892352";https://twitter.com/withplum/status/1004661791169892352
withplum;2018-06-07 05:48;0;1;"pic.twitter.com/PImWLLOsNZ";;;;"1004661450198175744";https://twitter.com/withplum/status/1004661450198175744
GracialNation;2018-06-07 05:21;3;6;"Loving my first month @withplum highly recommend if you want to save money. And no, this is not an ad, I really just like it. pic.twitter.com/qzAF9uidwt";;@withplum;;"1004654635779608576";https://twitter.com/GracialNation/status/1004654635779608576
L_R_M_Crawford;2018-06-07 02:25;0;1;"Pizza parrying last night at @withplum to hear about their upcoming new investment features! Thanks guys exciting times ahead pic.twitter.com/UEPDRxBRTl";;@withplum;;"1004610309192077312";https://twitter.com/L_R_M_Crawford/status/1004610309192077312
Receipts_LCraw;2018-06-07 02:25;1;6;"Pizza parrying last night at @withplum to hear about their upcoming new investment features! Thanks guys exciting times ahead pic.twitter.com/69WPpJYzOe";;@withplum;;"1004610199313928192";https://twitter.com/Receipts_LCraw/status/1004610199313928192
TasneemSharrem;2018-06-06 17:02;1;6;"Is it even a start-up event if there isn't pizza though ?! Went to meet the team behind @withplum tonight to find out what got them started with helping people to save and their next steps to help people invest. A super interesting insight into #fintech start-up life pic.twitter.com/O3AvCkHonA";;@withplum;#fintech;"1004468492215771137";https://twitter.com/TasneemSharrem/status/1004468492215771137
danielgynn;2018-06-06 16:44;1;1;"Had a great night meeting the @withplum team at their pizza party. Excited to start using the new investments features https://withplum.com?r=hKvARcn&c=twitter withplum.com/?r=hKvARcn&c=t …";;@withplum;;"1004464041090220032";https://twitter.com/danielgynn/status/1004464041090220032
BouncySean;2018-06-06 16:12;0;1;"Amazing to meet the team behind @withplum this evening! There pizza party event was awesome :D";;@withplum;;"1004456101339979777";https://twitter.com/BouncySean/status/1004456101339979777
withplum;2018-06-06 09:25;0;1;"We are so excited. To eat pizza.";;;;"1004353579963092993";https://twitter.com/withplum/status/1004353579963092993
angelslice;2018-06-06 08:10;0;1;"pic.twitter.com/gN6ENOi9vB";;;;"1004334613811138560";https://twitter.com/angelslice/status/1004334613811138560
withplum;2018-06-06 08:09;0;1;"pic.twitter.com/q7zmKnnRdD";;;;"1004334497754767360";https://twitter.com/withplum/status/1004334497754767360
angelslice;2018-06-06 08:08;1;1;"Plum Pizza party tonight! @withplum";;@withplum;;"1004334263985111040";https://twitter.com/angelslice/status/1004334263985111040
withplum;2018-06-06 08:08;1;1;"pic.twitter.com/p6ilTX4ifH";;;;"1004334231382904833";https://twitter.com/withplum/status/1004334231382904833
withplum;2018-06-06 07:35;0;2;"LAST ORDERS: Fancy meeting the people behind Plum and getting some free pizza tonight? Sure you do. Get your name on the list and your pizza orders in now. https://www. facebook.com/events/1672253 83948307/ …";;;;"1004325804384378880";https://twitter.com/withplum/status/1004325804384378880
BouncySean;2018-06-06 07:13;2;5;"Really looking forward to @withplum Pizza Part tonight!";;@withplum;;"1004320364263018496";https://twitter.com/BouncySean/status/1004320364263018496
withplum;2018-06-06 04:47;0;0;"Hi Chloe, This should not be happening. Could you please email support at hello@withplum.com so we can get to the bottom of this for you.";;@withplum;;"1004283573019594752";https://twitter.com/withplum/status/1004283573019594752
withplum;2018-06-05 17:53;0;0;"Ah! We have sent you a DM!";;;;"1004119136753025024";https://twitter.com/withplum/status/1004119136753025024
BeccaaSarah;2018-06-05 17:04;0;0;"Thats the problem my facebook linked to the account was disabled by facebook and i have no access to it anymore. Therefore i cant save myself or withdraw at all";;;;"1004106597038206976";https://twitter.com/BeccaaSarah/status/1004106597038206976
withplum;2018-06-05 17:01;0;0;"Sure! You can chat to support right from Plum by typing ‘chat to a human’ that way we have your account info right away";;;;"1004105997525356545";https://twitter.com/withplum/status/1004105997525356545
BeccaaSarah;2018-06-05 16:56;0;0;"@withplum are you guys able to privately message me please. Have a question about my account. Many thanks";;@withplum;;"1004104631079882752";https://twitter.com/BeccaaSarah/status/1004104631079882752
withplum;2018-06-05 15:17;0;0;"There is indeed! We take them through a little crash course in investing and lay out the different risk for each fund. They can invest with as little as £1. We hope it will be a great way to get people investing!";;;;"1004079688149553152";https://twitter.com/withplum/status/1004079688149553152
DavidPenneyPRW;2018-06-05 14:24;0;0;"How will they know which ETFs to buy? Is there any advice?";;;;"1004066566156189697";https://twitter.com/DavidPenneyPRW/status/1004066566156189697
withplum;2018-06-05 13:38;0;1;"Once ETFs are fully live for everyone, not just those who are on the waitlist, we will be relaunching this section of the website to give details on everything we offer";;;;"1004054762797576192";https://twitter.com/withplum/status/1004054762797576192
withplum;2018-06-05 13:35;0;0;"When anyone signs up to investing with Plum we take them through all the details and explain the types of options and associated risks. We only mention the P2P on the website at the moment as our ETF options are currently in beta and being rolled out slowly.";;;;"1004054167307071496";https://twitter.com/withplum/status/1004054167307071496
DavidPenneyPRW;2018-06-05 13:32;0;2;"What are the investment opportunities? Looks like peer to peer lending. If young people use this for money management and see “3% interest” when it is in fact P2P lending, I worry people will misunderstand. pic.twitter.com/WMZdPHdqgD";;;;"1004053238692245505";https://twitter.com/DavidPenneyPRW/status/1004053238692245505
themoneypanel;2018-06-05 12:18;2;1;"We have @withplum on our radio show this week so please tune in on @Secklow1055fm Thursday 7-8pm! They have some super exciting investment opportunities coming!";;@withplum @Secklow1055fm;;"1004034847986208768";https://twitter.com/themoneypanel/status/1004034847986208768
withplum;2018-06-05 12:16;0;3;"Hey Hannah Happy to answer any questions! We also let you invest and get insights into your spending on top of auto-savings";;;;"1004034326021865473";https://twitter.com/withplum/status/1004034326021865473
Hannah_Godfrey;2018-06-05 11:58;0;2;"Lovely, i'm sure i'll be in touch sometime soon!";;;;"1004029694482628609";https://twitter.com/Hannah_Godfrey/status/1004029694482628609
themoneypanel;2018-06-05 11:57;0;2;"Give me a shout anytime. I review a money app of the week each week on my podcast too https:// themoneypanel.co.uk/the-money-pane l-podcast/ …";;;;"1004029529776480257";https://twitter.com/themoneypanel/status/1004029529776480257
Hannah_Godfrey;2018-06-05 11:55;0;2;"Amazing, thank you so much";;;;"1004029064393478144";https://twitter.com/Hannah_Godfrey/status/1004029064393478144
themoneypanel;2018-06-05 11:54;0;1;"@withplum is fabulous for automating your savings";;@withplum;;"1004028820842692608";https://twitter.com/themoneypanel/status/1004028820842692608
withplum;2018-06-05 10:18;0;0;"We would love to chat about this! You can email daniellla@withplum.com to set up a call :)";;@withplum;;"1004004535046680576";https://twitter.com/withplum/status/1004004535046680576
DanniCamilleri;2018-06-04 11:41;0;1;"Yup still up 11p! pic.twitter.com/ShQh6kQfIc";;;;"1003662992276418560";https://twitter.com/DanniCamilleri/status/1003662992276418560
Seedrs;2018-06-04 11:30;7;12;"Great feature in today's London Evening Standard for one of our portfolio companies @withplum #SeedrsAlumni http:// bit.ly/2JeY1Ds @standardnews";;@withplum @standardnews;#SeedrsAlumni;"1003660193538945028";https://twitter.com/Seedrs/status/1003660193538945028
ESLifeandStyle;2018-06-04 04:03;0;0;"This start-up wants to get millennials investing from just £1 a month @withplum https://www. standard.co.uk/tech/plum-star t-up-investment-fintech-a3851421.html …";;@withplum;;"1003547654347984897";https://twitter.com/ESLifeandStyle/status/1003547654347984897
jmarcjones;2018-06-03 18:34;0;0;"Fantastic way to save money without missing it from your account! @withplum saves money automatically in few quid deposits much like a costa purchase which you would not even notice! #GiveItAGo https:// friends.withplum.com/r/nneRLw";;@withplum;#GiveItAGo;"1003404587209027584";https://twitter.com/jmarcjones/status/1003404587209027584
Jamiehailstone;2018-06-03 05:06;0;3;"@iamlouisesmith RT @michael_taggart : So many decent budgeting apps available now. The Sunday Times features @withplum @Get_Chip @getcoconut @findexchange @moneyfarmUK @emma_finance and @Stocard https://www. thetimes.co.uk/edition/money/ catch-the-budgeting-bug-apps-aimed-at-millennials-xv9k9mmnz …";;@iamlouisesmith @michael_taggart @withplum @Get_Chip @getcoconut @findexchange @moneyfarmUK @emma_finance @Stocard;;"1003201197468155904";https://twitter.com/Jamiehailstone/status/1003201197468155904
Foco_Global;2018-06-03 05:03;1;3;"There's little doubt budgeting apps are thriving, despite a slow start for #OpenBanking . The Sunday Times features @withplum @Get_Chip @getcoconut @findexchange @moneyfarmUK @emma_finance and @Stocard . https://www. thetimes.co.uk/edition/money/ catch-the-budgeting-bug-apps-aimed-at-millennials-xv9k9mmnz …";;@withplum @Get_Chip @getcoconut @findexchange @moneyfarmUK @emma_finance @Stocard;#OpenBanking;"1003200426240507904";https://twitter.com/Foco_Global/status/1003200426240507904
michael_taggart;2018-06-03 05:00;3;3;"So many decent budgeting apps available now. The Sunday Times features @withplum @Get_Chip @getcoconut @findexchange @moneyfarmUK @emma_finance and @Stocard https://www. thetimes.co.uk/edition/money/ catch-the-budgeting-bug-apps-aimed-at-millennials-xv9k9mmnz …";;@withplum @Get_Chip @getcoconut @findexchange @moneyfarmUK @emma_finance @Stocard;;"1003199776555438080";https://twitter.com/michael_taggart/status/1003199776555438080
BouncySean;2018-06-02 10:46;0;1;"I love @withplum so much I even end up saying thank you to a bot!";;@withplum;;"1002924427909173248";https://twitter.com/BouncySean/status/1002924427909173248
withplum;2018-06-01 10:40;0;0;"Ah, sounds like you are talking about the old investments option on Ratesetter only. The new investment options with funds aren't live for everyone yet but you can get early access by signing up to the waitlist over on our profile";;;;"1002560620133265408";https://twitter.com/withplum/status/1002560620133265408
withplum;2018-06-01 10:16;0;1;"Oh, if you type 'chat to a human' or email wander@withplum.com we can take a look and see what is going on for you! Do you mind telling us which fund you invested in?";;@withplum;;"1002554443903176704";https://twitter.com/withplum/status/1002554443903176704
withplum;2018-06-01 07:15;2;2;"Are you coming to the Plum Pizza Party on the 6th June? Get your name on the list and your pizza orders in now. https://www. facebook.com/events/1672253 83948307/ …";;;;"1002508841106452481";https://twitter.com/withplum/status/1002508841106452481
DanniCamilleri;2018-06-01 06:25;0;1;"Fingers crossed! Feel like a regular wolf of wall street";;;;"1002496319490002944";https://twitter.com/DanniCamilleri/status/1002496319490002944
DanniCamilleri;2018-06-01 06:19;0;1;"I put £20 in Growth - risk level 4 and Tech - risk level 6 (obviously ) pic.twitter.com/QYYhVx0xQ0";;;;"1002494794680152064";https://twitter.com/DanniCamilleri/status/1002494794680152064
DanniCamilleri;2018-06-01 05:09;1;8;"Fully addicted to checking my investments each morning now thanks to @withplum and it’s only day 2 #WomenInvestToo pic.twitter.com/5Wlly6M9a0";;@withplum;#WomenInvestToo;"1002477176506241024";https://twitter.com/DanniCamilleri/status/1002477176506241024
GoCardless;2018-06-01 03:24;3;1;"When choosing a payment method, it's important to think efficiency and customer experience Here's our guide to payment methods for investment platforms ft. @thenutmegteam & @withplum : https:// buff.ly/2KpIlxq pic.twitter.com/uiX96NmTfP";;@thenutmegteam @withplum;;"1002450679724638208";https://twitter.com/GoCardless/status/1002450679724638208
withplum;2018-05-31 11:34;0;0;"Very interesting listen. Did you give us a go? We would love to hear what you thought!";;;;"1002211676425539584";https://twitter.com/withplum/status/1002211676425539584
withplum;2018-05-31 11:01;0;1;"Do you know where to find the savings brain in Plum? Change how much Plum saves automatically by adjusting your mood, pause savings for specific amounts of time, and even configure Plum to save for you in overdraft. Total control + effortless automation = Plum pic.twitter.com/UN35l0qTen";;;;"1002203336676921350";https://twitter.com/withplum/status/1002203336676921350
scrambledpegg;2018-05-30 11:33;0;1;"Thanks for the info. I'll take a look.";;;;"1001849136960950273";https://twitter.com/scrambledpegg/status/1001849136960950273
withplum;2018-05-30 11:22;0;1;"For those in the thread the tool allows you to invest with as little as £1 and choose the risk and even sector if you are so inclined to suit you. It takes you through the basics - so you know what you are investing in - and your stocks from your bonds ;)";;;;"1001846336545804288";https://twitter.com/withplum/status/1001846336545804288
withplum;2018-05-30 11:21;0;1;"We are launching an investment tool to help get more people involved in investing in a few weeks (waitlist open now over on our profile). We would love to see what you find out!";;;;"1001845947482234881";https://twitter.com/withplum/status/1001845947482234881
withplum;2018-05-30 07:30;1;2;"Are you coming to the Plum Pizza Party next week? https://www. facebook.com/events/1672253 83948307/ … Maxine is. You might remember her from one of our first ever user profiles https:// blog.withplum.com/meet-maxine/";;;;"1001787901183750145";https://twitter.com/withplum/status/1001787901183750145
withplum;2018-05-29 09:45;0;0;"pic.twitter.com/mUWnzUbIsh";;;;"1001459583657922560";https://twitter.com/withplum/status/1001459583657922560
withplum;2018-05-29 09:37;0;0;"soon pic.twitter.com/aPANOfAeiT";;;;"1001457425747243008";https://twitter.com/withplum/status/1001457425747243008
TransferWise;2018-05-29 06:20;12;16;"Most Brits are losing on average £17,000 in their lifetime to hidden overseas fees - are you one of them? We've teamed up with @withplum & @resolvercouk to help you find out. Check for yourself below https:// fightoverseasfees.org /";;@withplum @resolvercouk;;"1001408010953134080";https://twitter.com/TransferWise/status/1001408010953134080
withplum;2018-05-28 14:08;0;0;"Hey! Our humans are on holiday now but will cancel your account tomorrow and send you an email to confirm";;;;"1001163220483264513";https://twitter.com/withplum/status/1001163220483264513
withplum;2018-05-27 06:45;1;1;"Meet Eugenio, employee number 7, data wizard and coffee connoisseur. When he's not concocting queries you can find him whipping up something tasty in the kitchen. 'What's interesting is you can see here...' #lifewithplum pic.twitter.com/zu3pDzaDBv";;;#lifewithplum;"1000689337888100353";https://twitter.com/withplum/status/1000689337888100353
withplum;2018-05-26 07:55;1;2;"The best time to plant a tree was 20 years ago. The next best time? Now. pic.twitter.com/y7h5f5JM9J";;;;"1000344566724165632";https://twitter.com/withplum/status/1000344566724165632
Alt_Return;2018-05-25 12:02;0;1;"Fintech trio launch campaign to fight hidden FX fees http:// bit.ly/2KLa8Zk #fintech #currencyexchange @withplum @TransferWise @resolvercouk http:// dlvr.it/QV5DB2 - RT AltFi";;@withplum @TransferWise @resolvercouk;#fintech #currencyexchange;"1000044327647629312";https://twitter.com/Alt_Return/status/1000044327647629312
withplum;2018-05-25 04:05;3;3;"Today is the day. The lovely Head of Ops, Elise, brings you this blog post to let you know what #GDPRday means for Plum - http:// ow.ly/gIVW30kakm0 - and this joke because it made us giggle in Plum HQ. Enjoy. pic.twitter.com/8wHc7kv6Lk";;;#GDPRday;"999924298625118208";https://twitter.com/withplum/status/999924298625118208
withplum;2018-05-24 07:35;5;7;"It’s almost here! Who’s excited Investments is now live for our first beta testers! If you want in on the testing action there is still time - sign up here https:// withplum.com/investments/ pic.twitter.com/yv5VInmnD2";;;;"999614760843927552";https://twitter.com/withplum/status/999614760843927552
withplum;2018-05-24 07:08;0;0;"With Plum, we only require a passport to withdraw once a user has reached above a certain amount in their Plum account (£400). We do not require this information before the threshold is reached and so do not request it.";;;;"999607953954103296";https://twitter.com/withplum/status/999607953954103296
withplum;2018-05-24 07:06;0;0;"Rest assured that this is the only reason your wife was asked to provide this information, if she has not yet reached the threshold please do get in contact with our support team and let them know - hello@withplum.com";;@withplum;;"999607532703436800";https://twitter.com/withplum/status/999607532703436800
LinuxJedi;2018-05-24 06:12;0;0;"OK, but a passport only covers half the KYC documentation requirement. Also this smells like you are trying to push to get the info insecurely now before GDPR makes it harder. Plus if it is for KYC you should have done it at least a year ago. That is not a comfortable feeling.";;;;"999594073169317889";https://twitter.com/LinuxJedi/status/999594073169317889
withplum;2018-05-24 05:51;0;0;"Hi Andrew, We require a passport as you are probably know for KYC regulation so that your wife can withdraw her funds. We agree that email is not the best method for this. That's why we are introducing a widget inside the bot to enable you to upload documents via a secure webview";;;;"999588695547277312";https://twitter.com/withplum/status/999588695547277312
withplum;2018-05-24 05:46;0;0;"In the future we will look to build an app too but for now we are just on messenger. Don't worry we never share your details with FB and you don't even need a FB account to use Plum ;)";;;;"999587546454740992";https://twitter.com/withplum/status/999587546454740992
KieranCassel;2018-05-24 05:34;0;0;"@withplum Is Plum always going to be FB-messenger only?";;@withplum;;"999584379453177856";https://twitter.com/KieranCassel/status/999584379453177856
graemebrown86;2018-05-24 02:38;2;2;"@withplum I just saved my first investment with Plum #savings #investing #lionstourfund https:// friends.withplum.com/r/bCeAgf";;@withplum;#savings #investing #lionstourfund;"999540061808054272";https://twitter.com/graemebrown86/status/999540061808054272
alexismic;2018-05-23 19:34;0;1;"@StevieBuckley Hey Stevie, a few kind people have been saying the best about you – would be great to chat regarding our hiring needs at @withplum";;@StevieBuckley @withplum;;"999433455359361024";https://twitter.com/alexismic/status/999433455359361024
