username;date;retweets;favorites;text;geo;mentions;hashtags;id;permalink
raccoon_world;2018-07-20 12:55;0;1;"http:// Raccoon.World goes to Startupbootcamp Digital Health Berlin #accelerator ! We made it to TOP 20 #digitalhealth #startups who get the unique chance to undergo 3-month #acceleration program. Thanks to @lars_buch and all the team! See you all in September! pic.twitter.com/e3TpXNyAN4";;@lars_buch;#accelerator #digitalhealth #startups #acceleration;"1020351429079371776";https://twitter.com/raccoon_world/status/1020351429079371776
sbcHealth;2018-07-20 12:27;12;23;"And the winners are... Nocturne, Prediction2020, ComputationalLife, EyeMove @oxipitAI @abatonhealth @raccoon_world @boldhealthhq @HenisajaDE @goodsomnia Cardiolyse, http:// Mindme.health are coming to Berlin for 3 months of acceleration at Startupbootcamp Digital Health! pic.twitter.com/GjPNEmZDy7";;@oxipitAI @abatonhealth @raccoon_world @boldhealthhq @HenisajaDE @goodsomnia;;"1020344346779021314";https://twitter.com/sbcHealth/status/1020344346779021314
raccoon_world;2018-07-18 11:01;0;1;"Our CEO @Svitlana Malovana became a member of the #Medtechwomen community. This is an additional opportunity to communicate with people in the management of #medical enterprises, improving and implementing our solution Raccoon.Recovery pic.twitter.com/oX1aIbW4XL";;@Svitlana;#Medtechwomen #medical;"1019597966305316865";https://twitter.com/raccoon_world/status/1019597966305316865
raccoon_world;2018-07-16 12:00;1;1;"Why is hand #disability really a huge problem? Annually 84M people worldwide get #handdisabilities , and only half of them get qualified #treatment pic.twitter.com/M4iOWxpyFk";;;#disability #handdisabilities #treatment;"1018888090713251841";https://twitter.com/raccoon_world/status/1018888090713251841
raccoon_world;2018-07-10 12:00;2;2;"#Rehabilitation has a number of problems: long and boring - for #patients , time-consuming - for #doctors , limiting the flow of clients and cumbersome expensive facilities - for #hospitals . We create Raccoon.Recovery to solve these problems pic.twitter.com/qe7mvtHOch";;;#Rehabilitation #patients #doctors #hospitals;"1016713814585368576";https://twitter.com/raccoon_world/status/1016713814585368576
raccoon_world;2018-07-07 08:00;0;3;"Since today our CEO @SvitlanaMalovan is a member of #InternationalExchangeAlumni , a prestigious community for alumni of #exchangeprograms supported by the #U .Sgovernment. It opens outstanding possibilities for networking and fundraising pic.twitter.com/N3ohamqALG";;@SvitlanaMalovan;#InternationalExchangeAlumni #exchangeprograms #U;"1015566205145567233";https://twitter.com/raccoon_world/status/1015566205145567233
raccoon_world;2018-07-02 13:00;3;6;"CEO of http:// Raccoon.World Svitlana Malovana spend last 19 days in USA on the SPECIAL AMERICAN BUSINESS INTERNSHIP TRAINING (SABIT) PROGRAM. This trip brought many new useful knowledge and business contacts #raccoonworld #ukrainian startup #SABITIt #StartupsProgram pic.twitter.com/2OduHADFD6";;;#raccoonworld #ukrainian #SABITIt #StartupsProgram;"1013829801344413697";https://twitter.com/raccoon_world/status/1013829801344413697
raccoon_world;2018-06-28 13:00;0;2;"CMO and COO of http:// Raccoon.World , spend this week in Berlin. They are building relationships with #clinics and #rehab centers for the development of our #rehabilitation solution #raccoonrecovery and learning what opportunities are available for #startups in #Germany . pic.twitter.com/gFV1IqPk4t";;;#clinics #rehab #rehabilitation #raccoonrecovery #startups #Germany;"1012380298565378050";https://twitter.com/raccoon_world/status/1012380298565378050
raccoon_world;2018-06-21 10:39;2;3;"Raccoon.Recovery, the tool for interactive hand therapy made by http:// Raccoon.World received €50K funding from the Horizon 2020! This grant gives us an opportunity for further work on the project. Info on the solution: http://www. rehab.raccoon.world / #horizon2020 #rehabilitation pic.twitter.com/AZH10Pi91C";;;#horizon2020 #rehabilitation;"1009808135748505600";https://twitter.com/raccoon_world/status/1009808135748505600
raccoon_world;2018-06-20 00:00;1;2;"84% of gamers are not satisfied with the size of their controllers. But we've solved the problem. Separate controllers + swappable linings allow Raccoon.Clip to fit the hand of any size and experience the natural position of fingers and zero discomfort. #raccoonclip pic.twitter.com/7XaeMLspIL";;;#raccoonclip;"1009284799784214530";https://twitter.com/raccoon_world/status/1009284799784214530
raccoon_world;2018-06-14 11:57;0;1;"CEO of http:// Raccoon.World celebrates the American Flag Day in the USA! Furthermore Svitlana today is in the most ceremonial and appropriate city - Washington, D.C. The whole http:// Raccoon.World 's team congratulates all Americans with the Flag Day! pic.twitter.com/w0wNis9ZHA";;;;"1007291011402534912";https://twitter.com/raccoon_world/status/1007291011402534912
raccoon_world;2018-06-05 13:21;0;2;"Tomorrow, on 6th Jun 2018, our CEO @SvitlanaMalovana will pitch on Hardware Bootcamp Kiev, organized by @ArkleyVC and http:// Reactor.UA . Lana will speak about Raccoon.Recovery - Interactive therapy and analyzing tool for rehabilitation. Let's wish her good luck! pic.twitter.com/sN9h3DwxU9";;@SvitlanaMalovana @ArkleyVC;;"1004050503183941633";https://twitter.com/raccoon_world/status/1004050503183941633
raccoon_world;2018-05-31 10:51;0;1;"Today, our Raccoons were on the Book Arsenal 2018. We saw a lot of inter-exchange book novelties, and also talked with exhibition participants about the prospects for cooperation. pic.twitter.com/nvaQfZUuZE";;;;"1002200987510235136";https://twitter.com/raccoon_world/status/1002200987510235136
raccoon_world;2018-05-10 03:47;0;1;"http:// Raccoon.Team will take part in SABIT Program "Information Technologies: Infrastructure and Development of Startups"! We got the opportunity to communicate with the top managers of international corporations and discuss the possibilities of cooperation! #raccoonworld pic.twitter.com/bkIVa0j6XI";;;#raccoonworld;"994484094078681088";https://twitter.com/raccoon_world/status/994484094078681088
alleroncaglia;2018-04-28 01:21;0;0;"RT @alleroncaglia : RT @alleroncaglia : RT @alleroncaglia : RT @alleroncaglia : RT @alleroncaglia : RT @alleroncaglia : RT @raccoon_world : Yesterday Peng Jun - Director of the Huawei Research Center and Alexey Menshikov - our Partner & Mentor visited us in our… pic.twitter.com/OQsr0uBwsk";;@alleroncaglia @alleroncaglia @alleroncaglia @alleroncaglia @alleroncaglia @alleroncaglia @raccoon_world;;"990098682057052161";https://twitter.com/alleroncaglia/status/990098682057052161
alleroncaglia;2018-04-27 23:21;0;0;"RT @alleroncaglia : RT @alleroncaglia : RT @alleroncaglia : RT @alleroncaglia : RT @alleroncaglia : RT @raccoon_world : Yesterday Peng Jun - Director of the Huawei Research Center and Alexey Menshikov - our Partner & Mentor visited us in our office! #Huawey #R … pic.twitter.com/OQsr0uBwsk";;@alleroncaglia @alleroncaglia @alleroncaglia @alleroncaglia @alleroncaglia @raccoon_world;#Huawey #R;"990068357524344832";https://twitter.com/alleroncaglia/status/990068357524344832
alleroncaglia;2018-04-27 21:21;0;0;"RT @alleroncaglia : RT @alleroncaglia : RT @alleroncaglia : RT @alleroncaglia : RT @raccoon_world : Yesterday Peng Jun - Director of the Huawei Research Center and Alexey Menshikov - our Partner & Mentor visited us in our office! #Huawey #Raccoonworld #meetin … pic.twitter.com/OQsr0uBwsk";;@alleroncaglia @alleroncaglia @alleroncaglia @alleroncaglia @raccoon_world;#Huawey #Raccoonworld #meetin;"990038176633942018";https://twitter.com/alleroncaglia/status/990038176633942018
alleroncaglia;2018-04-27 19:21;0;0;"RT @alleroncaglia : RT @alleroncaglia : RT @alleroncaglia : RT @raccoon_world : Yesterday Peng Jun - Director of the Huawei Research Center and Alexey Menshikov - our Partner & Mentor visited us in our office! #Huawey #Raccoonworld #meetings pic.twitter.com/OQsr0uBwsk";;@alleroncaglia @alleroncaglia @alleroncaglia @raccoon_world;#Huawey #Raccoonworld #meetings;"990007975749341185";https://twitter.com/alleroncaglia/status/990007975749341185
alleroncaglia;2018-04-27 17:21;0;0;"RT @alleroncaglia : RT @alleroncaglia : RT @raccoon_world : Yesterday Peng Jun - Director of the Huawei Research Center and Alexey Menshikov - our Partner & Mentor visited us in our office! #Huawey #Raccoonworld #meetings pic.twitter.com/OQsr0uBwsk";;@alleroncaglia @alleroncaglia @raccoon_world;#Huawey #Raccoonworld #meetings;"989977803796942850";https://twitter.com/alleroncaglia/status/989977803796942850
alleroncaglia;2018-04-27 15:21;0;0;"RT @alleroncaglia : RT @raccoon_world : Yesterday Peng Jun - Director of the Huawei Research Center and Alexey Menshikov - our Partner & Mentor visited us in our office! #Huawey #Raccoonworld #meetings pic.twitter.com/OQsr0uBwsk";;@alleroncaglia @raccoon_world;#Huawey #Raccoonworld #meetings;"989947632125644800";https://twitter.com/alleroncaglia/status/989947632125644800
alleroncaglia;2018-04-27 13:21;0;0;"RT @raccoon_world : Yesterday Peng Jun - Director of the Huawei Research Center and Alexey Menshikov - our Partner & Mentor visited us in our office! #Huawey #Raccoonworld #meetings pic.twitter.com/OQsr0uBwsk";;@raccoon_world;#Huawey #Raccoonworld #meetings;"989917451256324098";https://twitter.com/alleroncaglia/status/989917451256324098
raccoon_world;2018-04-27 12:26;0;2;"Yesterday Peng Jun - Director of the Huawei Research Center and Alexey Menshikov - our Partner & Mentor visited us in our office! #Huawey #Raccoonworld #meetings pic.twitter.com/H338ZFxsfx";;;#Huawey #Raccoonworld #meetings;"989903565819908097";https://twitter.com/raccoon_world/status/989903565819908097
raccoon_world;2018-04-25 19:41;1;1;"A whole day of company presentations, communication and exchange of contacts. Day of questions and answers. Day of @iForum conference! We thank everyone who came to our stand and talked with us. We did our best to give time to all comers! #raccoonworld #iForum2018 #Presentation pic.twitter.com/LBnXZlYbYP";;@iForum;#raccoonworld #iForum2018 #Presentation;"989288234676088833";https://twitter.com/raccoon_world/status/989288234676088833
raccoon_world;2018-04-23 18:35;0;1;"Get more control and don’t take your thumbs off the thumbstick to execute intricate jump, aim, and shoot combinations. #raccoonclip pic.twitter.com/mt9K3dWrF3";;;#raccoonclip;"988546856400687110";https://twitter.com/raccoon_world/status/988546856400687110
raccoon_world;2018-04-10 19:01;0;2;"Our Raccoons know how to talk to Wolves! Here are @SvitlanaMalovan and @oradovichenko on the @WolvesSummit 2018. Meetings, presentations of our rehabilitation solution and ... even more meetings. And we are assured of success! #raccoonrehab #raccoonteam #wolvessummit2018 pic.twitter.com/0iPuSH6Imi";;@SvitlanaMalovan @oradovichenko @WolvesSummit;#raccoonrehab #raccoonteam #wolvessummit2018;"983842430880505856";https://twitter.com/raccoon_world/status/983842430880505856
raccoon_world;2018-04-09 07:44;0;1;"Meet Tyler Coombs. He is one of the first testers of our solution for people with hand disabilities. Actually, he is one of those who inspired us to start work in this field. Thanks to the feedbacks of people like Tyler Coombs, we know that we are on the right way. #raccoonrehab pic.twitter.com/HP3TtFRPVd";;;#raccoonrehab;"983309655198793728";https://twitter.com/raccoon_world/status/983309655198793728
raccoon_world;2018-03-30 19:46;0;3;"Our team is almost always at work. Plans, new ideas, solving current problems - all this can happen anywhere. Here, after a cup of tea, the guys immediately began to work. And where did they get so much energy? #raccoonworld #workingforyou #team pic.twitter.com/nJpqcDpL48";;;#raccoonworld #workingforyou #team;"979867381483950081";https://twitter.com/raccoon_world/status/979867381483950081
raccoon_world;2018-03-23 13:51;1;0;""Surgeons save lifes. Specialists in physical rehabilitation improve the quality of life." This motto describes very precisely what we are doing. Our CEO @SvitlanaMalovan with such specialist Alexander Chernyavsky. His patients test our hypothesis. #raccoonrehab pic.twitter.com/a2B3GoDNcx";;@SvitlanaMalovan;#raccoonrehab;"977241337740316673";https://twitter.com/raccoon_world/status/977241337740316673
bupk_es;2018-03-16 08:47;0;0;"@raccoon_world Hey your work looks really interesting! I am trying to introduce VR/AR at my work where many of my clients have limited dexterity plus some kind of visual impairment.";;@raccoon_world;;"974628129527525376";https://twitter.com/bupk_es/status/974628129527525376
raccoon_world;2018-03-15 19:42;0;0;"Lecture of @SvitlanaMalovan in the 1991 Civic Tech Center about protection of intellectual property rights was really great! The audience was very diverse: businessmen, teachers, developers - as it turned out, many people are interested in this problem. #property #meeting #people pic.twitter.com/1U6OvNQIpw";;@SvitlanaMalovan;#property #meeting #people;"974430701687885824";https://twitter.com/raccoon_world/status/974430701687885824
raccoon_world;2018-03-12 17:14;1;1;"During the research among the gamers, we revealed the main features of an ideal game controller. Some of the results were quite surprising for us. Read more below. https:// raccoon.world/2018/03/12/top -features-of-a-perfect-game-controller-based-on-interviews-with-gamers/ … #gaming #raccoonclip #research #survey #results pic.twitter.com/CwGJov7jbH";;;#gaming #raccoonclip #research #survey #results;"973306171477168128";https://twitter.com/raccoon_world/status/973306171477168128
raccoon_world;2018-03-06 16:25;0;1;"And one more. #sketch #design #gaming #raccoonclip pic.twitter.com/eH94v7Tj88";;;#sketch #design #gaming #raccoonclip;"971134694866784256";https://twitter.com/raccoon_world/status/971134694866784256
raccoon_world;2018-03-06 16:25;1;1;"Guys, thank you for your help in our gaming research! Based on the results obtained, these sketches of the future device were created. Help us make a right choice! Which of the sketches do you like more? Write in the replies! #sketch #design #gaming #raccoonclip pic.twitter.com/95gSW5hMvf";;;#sketch #design #gaming #raccoonclip;"971134691326775297";https://twitter.com/raccoon_world/status/971134691326775297
raccoon_world;2018-03-03 04:02;0;1;"Max Polyakov, Managing Partner at Noosphere Ventures noted that portable devices are the future of medicine. By the way, one of our promising areas now is a solution for the rehabilitation of people with hand disabilities. #raccoondoctor #raccoonworld https:// innovationhouse.org.ua/en/statti/maks ym-polyakov-medytsyna-budushhego-v-novyh-obemah-dannyh/ …";;;#raccoondoctor #raccoonworld;"969860635378028545";https://twitter.com/raccoon_world/status/969860635378028545
annabezrodna;2018-02-28 04:37;0;0;"Alarm! We have finished the #Marketing research for @raccoon_world , the last step is left. Need 70 #Surveys to finalize #VPD of the best #controller ever made. If you love #games - fill the survey (5 min) and make difference. Thanks! #Xbox #PS4 #playstationnetwork #XboxOne #gamer https:// twitter.com/raccoon_world/ status/968168257395019776 …";;@raccoon_world;#Marketing #Surveys #VPD #controller #games #Xbox #PS4 #playstationnetwork #XboxOne #gamer;"968782139075584000";https://twitter.com/annabezrodna/status/968782139075584000
raccoon_world;2018-02-26 17:35;0;1;"Last week our CEO Svitlana Lana Malovana pitched at @elevate_conf We received a lot of positive feedbacks. But the most valuable prize for us was @mikebutcher "Good job" and ... his business card! It was a great day! #Elevate_conf #Pitching #Raccoonworld pic.twitter.com/QRQRYY4yos";;@elevate_conf @mikebutcher;#Elevate_conf #Pitching #Raccoonworld;"968253144558907392";https://twitter.com/raccoon_world/status/968253144558907392
raccoon_world;2018-02-26 11:57;0;1;"Help us create best controller ever and get a reward! Fill out our form and get the opportunity to pre-order Raccoon.Clip 2.0 for a pre-early bird price! #research #gamer #gaming #xboxone #playstation #nintendo https:// docs.google.com/forms/d/e/1FAI pQLScGXut1dSB1h-C0f4asAopbHR4-wlF8bTOaPjWdtCyY4HVx4Q/viewform … pic.twitter.com/NQnQy4E8ZB";;;#research #gamer #gaming #xboxone #playstation #nintendo;"968168257395019776";https://twitter.com/raccoon_world/status/968168257395019776
annabezrodna;2018-02-26 06:21;2;1;"Read my new article about #FacebookMarketing and working with future #clients before #productlaunch for #startup (done for @raccoon_world ) Useful #marketingtips : analytics, digits, conclusion and comparison of #Ads and manual search https:// goo.gl/wuSYAU pic.twitter.com/GvLUTw6VNO";;@raccoon_world;#FacebookMarketing #clients #productlaunch #startup #marketingtips #Ads;"968083613215535105";https://twitter.com/annabezrodna/status/968083613215535105
SvitlanaMalovan;2018-02-25 11:27;0;1;"On Thursday I presented @raccoon_world and our solution for hand #rehabilitation at Elevate Conference. We received a lot of positive feedbacks. But the most valuable prize for us was @mikebutcher 's "Good job" and ... his business card! It was a great day! pic.twitter.com/W8dzGpTClN";;@raccoon_world @mikebutcher;#rehabilitation;"967798213863464962";https://twitter.com/SvitlanaMalovan/status/967798213863464962
vitalisuccess;2018-02-22 06:19;0;0;"Svitlana, how could we meet here?";;;;"966633477239078912";https://twitter.com/vitalisuccess/status/966633477239078912
raccoon_world;2018-02-21 17:49;1;1;"Tomorrow, 02.22.2018 our CEO - @SvitlanaMalovan will make a presentation at the @elevate_conf ! Svitlana will speak about the prospects for using the Raccoon.Clip in medical rehabilitation. We wish her good luck and inspiration! #Raccoonworld #Elevateconference #presentation pic.twitter.com/HepmYNFsk8";;@SvitlanaMalovan @elevate_conf;#Raccoonworld #Elevateconference #presentation;"966444687946117120";https://twitter.com/raccoon_world/status/966444687946117120
raccoon_world;2018-02-18 15:21;0;0;"Virtual technologies cover more and more spheres of our life, which makes it more convenient. Today we present to your attention a project that will be appreciated by sports fans and those who have always wanted to try themselves as a sports commentator. #VR #LiveLike #streaming pic.twitter.com/W4iWc76wun";;;#VR #LiveLike #streaming;"965320306129866752";https://twitter.com/raccoon_world/status/965320306129866752
SvitlanaMalovan;2018-02-17 11:39;2;4;"This week @raccoon_world start clinical testing in the field of hand rehabilitation. People with cerebral palsy, traumas and after stroke have limited hands abilities. With our solution they can live the full life and reсover. We are doing the world better!) #rehabilitation pic.twitter.com/cafEl8oP3a";;@raccoon_world;#rehabilitation;"964902116576972800";https://twitter.com/SvitlanaMalovan/status/964902116576972800
raccoon_world;2018-02-15 13:44;0;2;"Great news! We already finished our research and received about 700 wishes from console gamers! They shared their opinion with us about what can be improved in the existing controllers. Thank you guys! You help us make the best controller for you! #controller #gamers #research pic.twitter.com/fnhZ2ElWRg";;;#controller #gamers #research;"964208771462463493";https://twitter.com/raccoon_world/status/964208771462463493
raccoon_world;2018-02-14 13:20;0;2;"Meet @SvitlanaMalovan , CEO of @raccoon_world . She became a lawyer when she was only 18 years old, and 4 years later she started her own business. Her great experience and inexhaustible energy inspires us to create the best gadget for you. #raccoonworld #gadgets #CEO pic.twitter.com/GPuk5JJMjm";;@SvitlanaMalovan @raccoon_world;#raccoonworld #gadgets #CEO;"963840422811455489";https://twitter.com/raccoon_world/status/963840422811455489
raccoon_world;2018-02-08 08:01;1;1;"Don't panic! @elonmusk soon on every screen of the world with a new best selling movie. #raccoonworld #TeslaRoadster #SpaceX #FalconHeavy pic.twitter.com/EJtpfoi4f9";;@elonmusk;#raccoonworld #TeslaRoadster #SpaceX #FalconHeavy;"961585685324095489";https://twitter.com/raccoon_world/status/961585685324095489
annabezrodna;2018-02-06 17:11;0;2;"At @raccoon_world we love technologies. But never miss a chance to laugh:) #FalconHeavy #SpaceX #spacexlaunch #TeslaRoadster #TeslaInspace #Uber pic.twitter.com/MYtnidPmi7";;@raccoon_world;#FalconHeavy #SpaceX #spacexlaunch #TeslaRoadster #TeslaInspace #Uber;"960999330650951681";https://twitter.com/annabezrodna/status/960999330650951681
annabezrodna;2018-01-31 13:47;0;0;"It is an exceptional experience to recruit gamers for the interviews for @raccoon_world when they are in USA and you are in Ukraine (-10h!). When they woke up it is almost night at my place A sweet snack and coffee helps to stay energized #raccoon_world #marketing #startup pic.twitter.com/lMoA0oDast";;@raccoon_world;#raccoon_world #marketing #startup;"958773729466740738";https://twitter.com/annabezrodna/status/958773729466740738
raccoon_world;2018-01-30 13:43;2;2;"Guys! Looking for console gamers for the interview via Skype or FB videochat about controllers. Reward - Ps/xbox/steam/itunes/playmarket gift cards. If you are interested - write "+" in comments. #gaming #parttime #giveaway #xbox #PS4 #Gift #nintendo #videogames #gamers #giftcard pic.twitter.com/XByloWDHEp";;;#gaming #parttime #giveaway #xbox #PS4 #Gift #nintendo #videogames #gamers #giftcard;"958410470570020864";https://twitter.com/raccoon_world/status/958410470570020864
raccoon_world;2018-01-26 16:41;0;2;"Tomorrow our COO @oradovichenko will conduct a lecture on "Maths + Investition and Marketing Statistics" at Lviv GameDev Conference 2018. http:// gamedev.lviv.ua / And he will succeed! #Gamedev #Lviv pic.twitter.com/7h6NPVCxFn";;@oradovichenko;#Gamedev #Lviv;"957005667285512192";https://twitter.com/raccoon_world/status/957005667285512192
raccoon_world;2018-01-24 16:58;0;0;"The heyday of VR games is already close https://www. roadtovr.com/gdc-2018-surve y-33-of-developers-most-interested-in-vr-over-other-gaming-platforms/ … #VR #gaming";;;#VR #gaming;"956285204066381825";https://twitter.com/raccoon_world/status/956285204066381825
raccoon_world;2018-01-24 07:13;0;0;"With the Raccoon.Clip you don't have to choose what to play - all the games in the world at your disposal! #gaming pic.twitter.com/3hZ4OMSrVO";;;#gaming;"956137757096767494";https://twitter.com/raccoon_world/status/956137757096767494
raccoon_world;2018-01-24 07:08;0;0;"When something went wrong in the game #gaming #oldgames pic.twitter.com/uSyWGYNkEk";;;#gaming #oldgames;"956136733552324608";https://twitter.com/raccoon_world/status/956136733552324608
SLeBaron;2018-01-09 22:37;0;0;"@raccoon_world ssl cert exported on http:// raccoon.world";;@raccoon_world;;"950934689098866688";https://twitter.com/SLeBaron/status/950934689098866688
raccoon_world;2018-01-01 12:33;0;1;"2018 starts on Monday. A great opportunity to finally give up bad habits and set about gaining useful ones instead. Also it's possibility to obtain a new gaming experience with Raccoon.Clip 2.0. #gamecontroller #Raccoonclip #newyear pic.twitter.com/9GuAuFYoBC";;;#gamecontroller #Raccoonclip #newyear;"947883529882435584";https://twitter.com/raccoon_world/status/947883529882435584
raccoon_world;2017-12-31 10:12;0;1;"Dear friends! On New Year's Eve, we want to thank all of you for supporting our project and all the invaluable assistance that you provided us. Let 2018 be a year of pleasant emotions, amazing discoveries and fulfillment of the most cherished desires! #HappyNewYear #Raccoonworld pic.twitter.com/0kwfoa8GDg";;;#HappyNewYear #Raccoonworld;"947485630061273088";https://twitter.com/raccoon_world/status/947485630061273088
raccoon_world;2017-12-28 04:43;0;1;"Some video games are better controlled by a joystick, others - a computer mouse and a keyboard. And how do you prefer to play? Favorite for the keyboard and mouse, retweet for the joystick. #videogames #joystick #keyboard #mouse pic.twitter.com/GW50Ole8TJ";;;#videogames #joystick #keyboard #mouse;"946315581229322240";https://twitter.com/raccoon_world/status/946315581229322240
raccoon_world;2017-12-19 13:57;0;0;"That's what a lev80 gamer's bedroom looks like! #gaming pic.twitter.com/nvznbolc9J";;;#gaming;"943193564414083072";https://twitter.com/raccoon_world/status/943193564414083072
raccoon_world;2017-12-13 16:34;0;2;"Never too late to become a gamer! #gaming #NeverTooOld pic.twitter.com/qehlQvE4qC";;;#gaming #NeverTooOld;"941058879458222082";https://twitter.com/raccoon_world/status/941058879458222082
linderoedutain;2017-12-04 17:50;0;0;"Impressive work, keep it up!";;;;"937816336821927937";https://twitter.com/linderoedutain/status/937816336821927937
raccoon_world;2017-11-28 10:46;0;0;"Would you like to be the first who find out about the new design of Raccoon.Clip? Moreover, would you like to affect on the product and choose the final look of the device? Go on Medium and read our last article. Your comments can make a difference! https:// medium.com/raccoon-world/ total-makeover-how-we-completely-changed-the-product-design-5d65c821775f …";;;;"935535279875788801";https://twitter.com/raccoon_world/status/935535279875788801
SvitlanaMalovan;2017-11-27 16:03;0;1;"@raccoon_world new design - how it was https:// medium.com/raccoon-world/ total-makeover-how-we-completely-changed-the-product-design-5d65c821775f …";;@raccoon_world;;"935252650261610497";https://twitter.com/SvitlanaMalovan/status/935252650261610497
raccoon_world;2017-11-23 10:58;0;3;"Happy #Thanksgiving We want to thank you all for your believe, support and invaluable feedback. You are truly the creators of our devices! We hope that you'll spend this day with your friends and relatives. By playing video games with the Raccoon.Clip pic.twitter.com/MB1Y60gqSA";;;#Thanksgiving;"933726400342831104";https://twitter.com/raccoon_world/status/933726400342831104
