username;date;retweets;favorites;text;geo;mentions;hashtags;id;permalink
raccoon_world;2018-12-27 11:53;0;1;"Last 2 days our managing team had a very productive time with our partner #rehab centre Innovo. Hours of discussions trials, new knowledge about treating patients with #neurological #diseases thanks to participation of centre’s stuff and ideas for Raccoon.Recovery refinement pic.twitter.com/Ax7GwjwPTc";;;#rehab #neurological #diseases;"1078332944337518593";https://twitter.com/raccoon_world/status/1078332944337518593
raccoon_world;2018-12-25 10:14;0;0;"Merry #Christmas to you from all the Raccoons! May the melody and spirit of the #holidays fill your home with love and peace. We wish you all the best and believe that the next year we will spend together too! XOXO pic.twitter.com/w4udtWFUX8";;;#Christmas #holidays;"1077583256894218240";https://twitter.com/raccoon_world/status/1077583256894218240
raccoon_world;2018-12-21 07:33;0;1;"“RICHARD”, the printed #magazine for #clinicians created by Deutsche Apotheker- und Ärztebank wrote about our solution for #recovery . More and more specialists become aware of us in Germany! pic.twitter.com/ZW8HTG9oQi";;;#magazine #clinicians #recovery;"1076093229987172353";https://twitter.com/raccoon_world/status/1076093229987172353
CurrentlyBill;2018-12-19 10:06;0;2;"'Each person is very individual. So it's not only about our physical conditions; it's also about our emotional conditions.' -- @SvitlanaMalovan @raccoon_world #stroke #gamification https:// wp.me/p9VfQ3-8b via @CurrentlyBill";;@SvitlanaMalovan @raccoon_world @CurrentlyBill;#stroke #gamification;"1075406978128572416";https://twitter.com/CurrentlyBill/status/1075406978128572416
raccoon_world;2018-12-19 08:03;0;0;"Our COO @oradovichenko took part in the photo shooting for the social advertising campaign " #Eurointegration : Opportunity" under the patronage of the Vice Prime Minister for European and Euro-Atlantic #Integration of #Ukraine and in cooperation with the EU project @Association4U pic.twitter.com/lwwukx7YB9";;@oradovichenko @Association4U;#Eurointegration #Integration #Ukraine;"1075376129660334080";https://twitter.com/raccoon_world/status/1075376129660334080
raccoon_world;2018-12-17 09:17;0;2;"@CurrentlyBill – a Generation X #StrokeSurvivor , an author of podcast Strokecast published the new #podcast episode with our CEO @SvitlanaMalovan about #gamified solution #Raccoon .Recovery, which has the power to change lives https:// bit.ly/2BpTb3D";;@CurrentlyBill @SvitlanaMalovan;#StrokeSurvivor #podcast #gamified #Raccoon;"1074669901846118401";https://twitter.com/raccoon_world/status/1074669901846118401
CurrentlyBill;2018-12-16 22:47;1;1;"'If we're talking about physical exercises it boring to do some repetitive movements, but it's okay if we're talking about video games.' -- @SvitlanaMalovan @raccoon_world #stroke #gamification https:// wp.me/p9VfQ3-8b via @CurrentlyBill";;@SvitlanaMalovan @raccoon_world @CurrentlyBill;#stroke #gamification;"1074511454169001984";https://twitter.com/CurrentlyBill/status/1074511454169001984
CurrentlyBill;2018-12-15 22:45;1;0;"'We use gaming for motivation and improving the quantity of repetitive movements.' -- @SvitlanaMalovan @raccoon_world #stroke #gamification https:// wp.me/p9VfQ3-8b via @CurrentlyBill";;@SvitlanaMalovan @raccoon_world @CurrentlyBill;#stroke #gamification;"1074148591084625920";https://twitter.com/CurrentlyBill/status/1074148591084625920
raccoon_world;2018-12-14 04:07;0;0;"Recently, our CTO Vitaly Tolkachov visited the workshop on #prototyping parts from molded #polyurethanes . This will help us #develop design faster and quickly prepare batches of #controller bodies for testing and demonstration at events pic.twitter.com/QPXA7KLpXM";;;#prototyping #polyurethanes #develop #controller;"1073504805002338304";https://twitter.com/raccoon_world/status/1073504805002338304
raccoon_world;2018-12-10 09:09;0;0;"Read about what our solution for #rehabilitation #RaccoonRecovery is about, how the idea of its creation appeared and how it will scale, as well as about the main sauce of our solution, which makes it really #effective https:// avviosan.com/the-avviosan-b log/raccoon-recovery …";;;#rehabilitation #RaccoonRecovery #effective;"1072131128138588160";https://twitter.com/raccoon_world/status/1072131128138588160
raccoon_world;2018-12-07 06:05;0;1;"@SvitlanaMalovan yesterday visited @Kyiv Tech Hub’18 - probably the best conference to connect Ukrainian #startups with elite Polish VCs, seed capital funds and Bas. It is important for us - we consider the Polish market as one of the first for our solution for #rehabilitation pic.twitter.com/HsD6f39iXi";;@SvitlanaMalovan @Kyiv;#startups #rehabilitation;"1070997756674744320";https://twitter.com/raccoon_world/status/1070997756674744320
raccoon_world;2018-12-04 09:37;1;1;"For 3 months we were in @Sbootcamp Digital Health Berlin acceleration program. Something conceptually changed in the minds, in the formulation of tasks and requirements for themselves and the team, in the understanding of the world and values. It was a great and useful experience pic.twitter.com/PEa6n1QVGa";;@Sbootcamp;;"1069963948588449792";https://twitter.com/raccoon_world/status/1069963948588449792
raccoon_world;2018-11-30 07:00;0;0;"#Winter begins tomorrow. A slip and fall on ice can result in a devastating #injury such as a fractured hip, concussion, shoulder dislocations, fractures, #wrist fractures etc. Take care not to get hurt. And be #healthy ! pic.twitter.com/yn4kGmTUwF";;;#Winter #injury #wrist #healthy;"1068474768423309312";https://twitter.com/raccoon_world/status/1068474768423309312
sbcHealth;2018-11-27 09:18;1;0;"@raccoon_world is Gamified telerehabilitation tool for hands #sbcdemoday #sbchealth pic.twitter.com/V8Sb8beA9Q";;@raccoon_world;#sbcdemoday #sbchealth;"1067422378177830912";https://twitter.com/sbcHealth/status/1067422378177830912
raccoon_world;2018-11-23 07:00;2;5;"November 27 will be DEMO DAY of #Startupbootcamp Digital Health Berlin Acceleration program. Our CEO @SvitlanaMalovan will pitch from the stage to 300 Investors, Partners, Mentors & fellow Entrepreneurs. Whole our team is proud of this and wishes Svitlana good luck! pic.twitter.com/ZulHTIRNcg";;@SvitlanaMalovan;#Startupbootcamp;"1065938052374282241";https://twitter.com/raccoon_world/status/1065938052374282241
SvitlanaMalovan;2018-11-22 14:53;0;0;"Cool;) thanks a lot and happy Thanksgiving day ;)";;;;"1065694776580812800";https://twitter.com/SvitlanaMalovan/status/1065694776580812800
BaileyEAustin;2018-11-22 14:41;1;3;"It's Thanksgiving Day in the United States today, but AVVIOSAN is still working hard with healthcare startups overseas! Read the latest post @raccoon_world @SvitlanaMalovan @annabezrodna #biotechnology #technology #innovation #rehabilitation #hands https:// avviosan.com/the-avviosan-b log/raccoon-recovery …";;@raccoon_world @SvitlanaMalovan @annabezrodna;#biotechnology #technology #innovation #rehabilitation #hands;"1065691645151084544";https://twitter.com/BaileyEAustin/status/1065691645151084544
sbcHealth;2018-11-22 08:22;2;1;"Meet the teams! Say hello to @raccoon_world and @goodsomnia . The startups are using Innovative Hardware and Software to Treat Medical Conditions. Read about it on our blog → https://www. startupbootcamp.org/blog/2018/11/i nnovative-hardware-software-treat-medical-conditions/ … #sbchealth #digitalhealth #startupspotlight pic.twitter.com/jCZE2okdN6";;@raccoon_world @goodsomnia;#sbchealth #digitalhealth #startupspotlight;"1065596371879821312";https://twitter.com/sbcHealth/status/1065596371879821312
clientmarketyks;2018-11-21 10:51;1;1;"What a lovely team @raccoon_world in #Berlin I have really enjoyed my time in #Germany advising on #internationaltrade & #marketing @Sbootcamp and meeting Alex, Anna & Svitlana who were great hosts during my stay pic.twitter.com/c1paTCpys9";;@raccoon_world @Sbootcamp;#Berlin #Germany #internationaltrade #marketing;"1065271387173076994";https://twitter.com/clientmarketyks/status/1065271387173076994
raccoon_world;2018-11-20 14:42;1;2;"Meet Simon Shepherd, our coach from #H2020 who came to Berlin from UK for 1 productive mentoring day to @SvitlanaMalovan , @oradovichenko and @annabezrodna . He helped us to structure our go-to-market and communicative tactics and shared valuable tips on time management in startup pic.twitter.com/DUTCWCF18r";;@SvitlanaMalovan @oradovichenko @annabezrodna;#H2020;"1064967122655285253";https://twitter.com/raccoon_world/status/1064967122655285253
annabezrodna;2018-11-19 14:33;0;0;"Totally not! Tech can improve treatment course but by no means it can substitute human care and experience. We are creating tech solution for physical rehab @raccoon_world and we consider doctors as an obligatory part of treatment";;@raccoon_world;;"1064602646328283137";https://twitter.com/annabezrodna/status/1064602646328283137
raccoon_world;2018-11-19 09:00;0;0;"We want to implement our #handrehabilitation solution as quickly as possible and believe that it will be effective and will help many people. And we have far-reaching plans! In the future, we want to adapt this solution for #rehabilitation of the legs, and then even whole body pic.twitter.com/BdK5KZhTTm";;;#handrehabilitation #rehabilitation;"1064518687426863106";https://twitter.com/raccoon_world/status/1064518687426863106
annabezrodna;2018-11-16 03:39;0;0;"It was a great interview! I can also share some interesting facts about gamification in rehabilitation as we develop a solution that can help recover while playing your favourite video games. I'll DM you)";;;;"1063350946435162112";https://twitter.com/annabezrodna/status/1063350946435162112
CurrentlyBill;2018-11-15 17:17;0;1;"Plus, a score is a great motivator for folks who like chasing numbers. It's great to see more gamification products. I talked with Lauren from @neofect about the Raphael Smart Glove several weeks back at http:// strokecast.com/smartglove";;@neofect;;"1063194429593280512";https://twitter.com/CurrentlyBill/status/1063194429593280512
raccoon_world;2018-11-15 08:41;2;3;"We’re changing the way #recovery works! Raccoon.Recovery is the #gamified #telerehabilitation tool for hands which helps patients to #recover more effectively thanks to the involvement in the process, and the #rehabilitationCenters increase revenue pic.twitter.com/dmGdKEeOnC";;;#recovery #gamified #telerehabilitation #recover #rehabilitationCenters;"1063064519667314688";https://twitter.com/raccoon_world/status/1063064519667314688
raccoon_world;2018-11-12 10:15;0;1;"Recognizing a #stroke is important, it can even save lives! Use #𝗙𝗔𝗦𝗧 to remember #symptomsofstroke : 𝗙: Face drooping 𝗔: Arm weakness 𝗦: Speech difficulty 𝗧: Time to call for ambulance immediently pic.twitter.com/RPaWfKfg4i";;;#stroke # #symptomsofstroke;"1062000959122010113";https://twitter.com/raccoon_world/status/1062000959122010113
raccoon_world;2018-11-09 06:00;0;0;"#Hands differ. As well as #diagnosis . That is why we have developed interchangeable linings for the controller. The patient, with the help of a #rehabilitation specialist, chooses a lining depending on his size of hand and current motor skills pic.twitter.com/HZxwlxTsXb";;;#Hands #diagnosis #rehabilitation;"1060849504075857920";https://twitter.com/raccoon_world/status/1060849504075857920
raccoon_world;2018-11-06 11:21;1;2;"Our CEO @SvitlanaMalovan and СOO @oradovichenko have graduated from @startupschool , the online business course created by @ycombinator , one of the most famous accelerators in the world https://www. startupschool.org/companies/Racc oon …";;@SvitlanaMalovan @oradovichenko @startupschool @ycombinator;;"1059843209596227586";https://twitter.com/raccoon_world/status/1059843209596227586
raccoon_world;2018-11-05 07:38;1;1;"The rapid evolution of #technology has allowed #health professionals to begin to adapt to these changes and deliver #healthcare in a new, remote fashion! Solution Raccoon.Recovery relates to such #telerehabilitation techniques pic.twitter.com/3ctUhlilSv";;;#technology #health #healthcare #telerehabilitation;"1059424694573690880";https://twitter.com/raccoon_world/status/1059424694573690880
raccoon_world;2018-11-02 09:45;1;1;"Today @SvitlanaMalovan and @oradovichenko presented our solution Raccoon.Recovery to scientists from Charité - Universitätsmedizin Berlin and other German institutions. It was an effective meeting, we had a brainstorm and discussed opportunities for future cooperation pic.twitter.com/iNA6rHukEE";;@SvitlanaMalovan @oradovichenko;;"1058354522135912448";https://twitter.com/raccoon_world/status/1058354522135912448
raccoon_world;2018-10-30 12:21;0;0;"To further refine the solution before entering the market, we launch pilot projects and collect feedback. At the moment, pilot projects are launched in three Ukrainian clinics and one #rehabilitation center, in addition, in two #rehabilitationcenters in the USA pic.twitter.com/lqYjTu1Ka5";;;#rehabilitation #rehabilitationcenters;"1057306525562232837";https://twitter.com/raccoon_world/status/1057306525562232837
raccoon_world;2018-10-25 10:00;0;1;"Our Tech Engineer Alex Chernegov told his own story: "Once I ran into a glass and cut my #hand . After that #fingers could only be in one of two positions. Fortunately, I was already working on a controller for Raccoon.Recovery, and with the help of it I completely #recovered " pic.twitter.com/F36xKsmhit";;;#hand #fingers #recovered;"1055458994888863745";https://twitter.com/raccoon_world/status/1055458994888863745
raccoon_world;2018-10-22 10:00;0;0;"It turns out that #videogames can not only help with hands #rehabilitation , but even help chronic low back pain https:// bit.ly/2OqqWeg";;;#videogames #rehabilitation;"1054371835800965120";https://twitter.com/raccoon_world/status/1054371835800965120
raccoon_world;2018-10-18 12:38;0;2;"Today our PR-manager Olga Tishkova attended the event #Horizon2020 &COSME: How It Works For Innovative #SME , organized by #EBRD Сompetitive Сonsulting. It was a busy and interesting day, filled with presentations by speakers, panel discussion and case studies pic.twitter.com/v4mJtyRFYX";;;#Horizon2020 #SME #EBRD;"1052962068289212417";https://twitter.com/raccoon_world/status/1052962068289212417
raccoon_world;2018-10-16 10:30;0;3;"Let's change the world for the better together! Now we open a #seedround and we are looking for #investments of $500K with a minimum check of $50K. If you are interested in our solution for #handrehabilitation PM us - we will be glad for the partnership pic.twitter.com/eZYW4iuiTK";;;#seedround #investments #handrehabilitation;"1052205050620248064";https://twitter.com/raccoon_world/status/1052205050620248064
SvitlanaMalovan;2018-10-14 10:16;0;0;"We in @raccoon_world have 5 years experience in developing communication hardware.";;@raccoon_world;;"1051476784712179714";https://twitter.com/SvitlanaMalovan/status/1051476784712179714
raccoon_world;2018-10-12 10:59;1;1;"Besides tons of practical information and ability to be mentored by great people, there is one special thing worth mentioning about being a part of @sbcBerlin . Everyone is willing to help and all the teams are so friendly! pic.twitter.com/FxdH8YAebk";;@sbcBerlin;;"1050762831652622337";https://twitter.com/raccoon_world/status/1050762831652622337
raccoon_world;2018-10-08 07:49;2;1;"#BigData and #AI radically change the scope of #Healthcare . Such technologies and legal and ethical aspects of their using are subjects for discussion. For example, such questions were raised on @GasteinForum : https:// bit.ly/2zRFpXO";;@GasteinForum;#BigData #AI #Healthcare;"1049265459697209344";https://twitter.com/raccoon_world/status/1049265459697209344
raccoon_world;2018-10-05 09:50;1;1;"After 1st month in @sbcBerlin , we are already succeeded to redevelop our business plan, go-to-market strategy, pricing and even made changes to the solution itself. We are moving forward and now can’t even imagine how far we will be till the end of the program. Let’s see! pic.twitter.com/cFmaSUAhkG";;@sbcBerlin;;"1048208749679300608";https://twitter.com/raccoon_world/status/1048208749679300608
raccoon_world;2018-10-02 10:25;1;1;"Today our CEO @SvitlanaMalovan has acted as speaker for 27th International Medical Exhibition PUBLIC HEALTH`2018. Svitlana told about the problems in the #handrehabilitation , our solution and about using the algorithms of #AI and #MachineLearning in #telerehabilitation pic.twitter.com/0cegy1d6YV";;@SvitlanaMalovan;#handrehabilitation #AI #MachineLearning #telerehabilitation;"1047130512085725187";https://twitter.com/raccoon_world/status/1047130512085725187
raccoon_world;2018-09-28 11:00;0;0;"With Raccoon.Recovery #patients get an opportunity to #recover while #playing their favorite videogames instead of simple and repetitive applications. Gamified experience ensures the #rehab #treatment is both effective and engaging pic.twitter.com/u2AVvqmy8F";;;#patients #recover #playing #rehab #treatment;"1045689614214844417";https://twitter.com/raccoon_world/status/1045689614214844417
raccoon_world;2018-09-24 12:00;0;1;"This article tells us, that using #gamification in #physicalrehabilitation will give much more chances to #patients with #disabilities after a #stroke in comparison with traditional methods! https://www. saebo.com/videogames-str oke-recovery/ …";;;#gamification #physicalrehabilitation #patients #disabilities #stroke;"1044255156102205442";https://twitter.com/raccoon_world/status/1044255156102205442
raccoon_world;2018-09-20 10:50;0;2;"Our team today participate in @DellTechForum We are proud to be chosen among 3 promising Ukrainian #startups and to be a part of this event, because #Dell 's philosophy «Create #technologies that drive human #progress » is extremely in harmony with ours pic.twitter.com/58pzf2pDtI";;@DellTechForum;#startups #Dell #technologies #progress;"1042787988428779520";https://twitter.com/raccoon_world/status/1042787988428779520
raccoon_world;2018-09-18 11:30;0;0;"With Raccoon.Recovery #screeningtests are done automatically. #Rehabilitation specialists can provide instructions to many #patients simultaneously and obtain their tests results for each patient automatically pic.twitter.com/ZJghT4lCzN";;;#screeningtests #Rehabilitation #patients;"1042073286983737347";https://twitter.com/raccoon_world/status/1042073286983737347
SvitlanaMalovan;2018-09-15 13:37;0;0;"@raccoon_world at @sbcHealth https:// twitter.com/UopenEU/status /1040187488650838018 …";;@raccoon_world @sbcHealth;;"1041018087422808066";https://twitter.com/SvitlanaMalovan/status/1041018087422808066
raccoon_world;2018-09-13 12:00;1;0;"Back in the 2013 #therapist of Tel Aviv University found that #stroke victims who play video #games in #therapy make more movements in general than in traditional therapy: Not only do players' movements require accuracy and balance, but there is also a cognitive benefit pic.twitter.com/oHvL0GccOS";;;#therapist #stroke #games #therapy;"1040268880931954694";https://twitter.com/raccoon_world/status/1040268880931954694
raccoon_world;2018-09-10 12:00;0;0;"Due to Raccoon.Recovery customer retention increased through a full patient #recovery process. The patient continues to #rehab at home, receiving feedback and advice on rehab program from a doctor via the app and fully recovering as a result pic.twitter.com/Tg3xjCujFM";;;#recovery #rehab;"1039181772272140296";https://twitter.com/raccoon_world/status/1039181772272140296
raccoon_world;2018-09-06 10:08;0;2;"http:// Raccoon.World 's CMO @annabezrodna and CTO Vitaliy Tolkachev visited Riga because we passed in the TOP 20 teams, which had the opportunity to take part in intensive educational Bootcamp of @BuilditAcc #Accelerator pic.twitter.com/CQprENTJQw";;@annabezrodna @BuilditAcc;#Accelerator;"1037704049347452928";https://twitter.com/raccoon_world/status/1037704049347452928
raccoon_world;2018-09-03 11:14;1;2;"September began - it's time to #learn ! Today is the first day for our CEO @SvitlanaMalovan and COO @oradovichenko on @Startupbootcamp Digital #Health Berlin. We are very pleased with this unique chance and we are in anticipation of interesting and useful course pic.twitter.com/vmCVnm5BRb";;@SvitlanaMalovan @oradovichenko @Startupbootcamp;#learn #Health;"1036633637356298240";https://twitter.com/raccoon_world/status/1036633637356298240
raccoon_world;2018-08-30 12:10;1;2;"Problems in the #handrehabilitation that patients face: Rehab solutions can’t be used out of the #hospital With Raccoon.Recovery patients can continue #rehab exercises at home, while still receiving guidance from the doctor and AI-based recommendations via their smartphone pic.twitter.com/fn62TcHHOc";;;#handrehabilitation #hospital #rehab;"1035198006591672322";https://twitter.com/raccoon_world/status/1035198006591672322
raccoon_world;2018-08-27 12:00;0;1;"Raccoon.Recovery is more affordable than most #rehabilitation #equipment : €5K and is paid once €29,99/month per #doctor $49 is cost of the controller pic.twitter.com/W6KavQomEU";;;#rehabilitation #equipment #doctor;"1034108336118157313";https://twitter.com/raccoon_world/status/1034108336118157313
raccoon_world;2018-08-24 11:00;0;0;"#Doctors are faced with the problem of lack of data for high precision #rehab treatment. http:// Raccoon.Re сovery offers improved #diagnostics : detailed data about each activity will help to choose most efficient pic.twitter.com/6BUlSHK4hD";;;#Doctors #rehab #diagnostics;"1033006051115900928";https://twitter.com/raccoon_world/status/1033006051115900928
raccoon_world;2018-08-21 12:00;0;1;"Why do we use games in our solution Raccoon.Recovery? It has long been established that games have a positive effect on #recovery , because games use both mind and body. In addition, such #treatment is more fun, which means that the patient is more willing to treat himself pic.twitter.com/oPsfzYcWon";;;#recovery #treatment;"1031933992055058433";https://twitter.com/raccoon_world/status/1031933992055058433
raccoon_world;2018-08-17 11:30;0;0;"Another problem that #hospitals face: no means to provide healthcare services to more patients Raccoon.Recovery will increase personal effectiveness. Increasing the number of clients without hiring new doctors due to efficient services provision on behalf of a #doctor pic.twitter.com/O6R8SzwfAq";;;#hospitals #doctor;"1030476888169504769";https://twitter.com/raccoon_world/status/1030476888169504769
raccoon_world;2018-08-14 11:00;0;2;"Today the http:// Raccoon.World 's team congratulates our CEO. @SvitlanaMalovan , happy birthday! She is young, but intelligent, ambitious and inventive. We wish Svetlana to fulfill her dreams and plans, at least the majority - because she has a lot of them pic.twitter.com/F2qojKF7QR";;@SvitlanaMalovan;;"1029382152486625282";https://twitter.com/raccoon_world/status/1029382152486625282
raccoon_world;2018-08-09 11:55;0;1;"#Rehabilitation of the #hands after #trauma or #stroke is often long, expensive and not very effective. Raccoon.Recovery offers high quality and affordable treatment that allows return home quickly pic.twitter.com/2srjNq8CVA";;;#Rehabilitation #hands #trauma #stroke;"1027584069390032898";https://twitter.com/raccoon_world/status/1027584069390032898
raccoon_world;2018-08-02 12:00;3;2;"To make a report for each patient with hand #disability takes up a lot of doctor’s time. Use Raccoon.Recovery's great to #savetime and effort of the #doctor ! #Machinelearning allows doctors to automatically create a #treatment program based on patient data pic.twitter.com/J7q4fDnkWM";;;#disability #savetime #doctor #Machinelearning #treatment;"1025048606292828162";https://twitter.com/raccoon_world/status/1025048606292828162
raccoon_world;2018-07-30 12:05;0;2;"With growing population of patients with hand #disabilities , there’s a high demand for simple and easy to use #rehab equipment. So we created Raccoon.Recovery, that is not expensive and will be beneficial for all: #hospitals , #rehabilitation specialist and patients pic.twitter.com/w7WkPj0g1n";;;#disabilities #rehab #hospitals #rehabilitation;"1023962807514132480";https://twitter.com/raccoon_world/status/1023962807514132480
SvitlanaMalovan;2018-07-26 15:46;0;1;"It was preparation day at @Sbootcamp !))))) Go @raccoon_world !))) https:// twitter.com/sbcHealth/stat us/1019534422574534656 …";;@Sbootcamp @raccoon_world;;"1022568840918691840";https://twitter.com/SvitlanaMalovan/status/1022568840918691840
raccoon_world;2018-07-26 12:26;0;2;"About problems of #rehabilitation that are faced by #hospitals management: equipments are expensive, large and not convenient to use. Integration of a Raccoon.Recovery into a hospital costs €5K. And it is paid once. Subscription costs only 29.99 euros per month for one #doctor pic.twitter.com/QfHnQn9GP2";;;#rehabilitation #hospitals #doctor;"1022518625423568896";https://twitter.com/raccoon_world/status/1022518625423568896
raccoon_world;2018-07-23 11:28;2;3;"The idea of creating a solution for #rehabilitation appeared on #TechCrunch 2017 when we introduced the game solution Raccoon.Clip. We decided to make Raccoon.Recovery thanks to a small boy, who had a #disability and could not cope with a #mouse or #gamepad pic.twitter.com/xtDkSNwkaV";;;#rehabilitation #TechCrunch #disability #mouse #gamepad;"1021416807469584384";https://twitter.com/raccoon_world/status/1021416807469584384
HPBursig;2018-07-21 04:22;0;4;"All the best to all participants @sbcHealth selection days and congratulations to the finalists!";;@sbcHealth;;"1020584843481055232";https://twitter.com/HPBursig/status/1020584843481055232
motognosis;2018-07-20 14:18;0;6;"Congrats batch 2018, this autumn is going to rock! \o/";;;;"1020372455511216128";https://twitter.com/motognosis/status/1020372455511216128
