username;date;retweets;favorites;text;geo;mentions;hashtags;id;permalink
shiftcxevent;2017-02-10 12:10;0;1;"RT @spyglaz : 4 Perks of Leveraging Big Data in Marketing http:// buff.ly/2k7eU5N via @businessdotcom #marketing #predictiveanalytics";;@spyglaz @businessdotcom;#marketing #predictiveanalytics;"830101600601571330";https://twitter.com/shiftcxevent/status/830101600601571330
spyglaz;2017-02-10 02:10;0;1;"Fantastic evening with Silicon Valley's leading women venture capitalists and CEOs. What glass ceiling? @trishcostello1 @UPWARD_Women pic.twitter.com/UqiOwJQJy1";;@trishcostello1 @UPWARD_Women;;"829950685491769344";https://twitter.com/spyglaz/status/829950685491769344
spyglaz;2017-02-09 11:55;0;1;"4 Perks of Leveraging Big Data in Marketing http:// buff.ly/2k7eU5N via @businessdotcom #marketing #bigdata #predictiveanalytics pic.twitter.com/rKaLgyY1Z5";;@businessdotcom;#marketing #bigdata #predictiveanalytics;"829735433865195521";https://twitter.com/spyglaz/status/829735433865195521
spyglaz;2017-02-07 11:55;2;1;"Spyglaz is a predictive #sales #analytics platform that helps increase #revenue from your current customers http:// buff.ly/2k4oQQT pic.twitter.com/db38hqRlAd";;;#sales #analytics #revenue;"829010593160032256";https://twitter.com/spyglaz/status/829010593160032256
spyglaz;2017-02-02 11:55;1;1;"What is predictive analytics? #predictiveanalytics #bigdata http:// buff.ly/2knbCfJ pic.twitter.com/eZuxwdySSl";;;#predictiveanalytics #bigdata;"827198669715865602";https://twitter.com/spyglaz/status/827198669715865602
spyglaz;2017-01-31 11:55;1;2;"Lack of skills remains one of the biggest data science challenges #bigdata #datascience http:// buff.ly/2knasRr pic.twitter.com/od3ga8Vy2d";;;#bigdata #datascience;"826473873579315201";https://twitter.com/spyglaz/status/826473873579315201
spyglaz;2017-01-26 11:55;5;1;"Why predictions are not enough! #predictiveanalytics #bigdata http:// buff.ly/2jAi1Uo pic.twitter.com/K6APczlS2E";;;#predictiveanalytics #bigdata;"824661967742889986";https://twitter.com/spyglaz/status/824661967742889986
spyglaz;2017-01-19 12:47;1;2;"#Spyglaz is an official member of @bizspark , a program that provides technology + support to promising #startups http:// buff.ly/2jDh1Sc";;@bizspark;#Spyglaz #startups;"822138461348069376";https://twitter.com/spyglaz/status/822138461348069376
spyglaz;2017-01-17 12:29;1;2;"Spyglaz is proud to be a certified Woman Owned Small Business #wosb #sba by @spyglaz http:// buff.ly/2iKwbUC";;@spyglaz;#wosb #sba;"821409166250176512";https://twitter.com/spyglaz/status/821409166250176512
spyglaz;2017-01-12 12:44;0;1;"More leads. More #sales . Made simple http:// buff.ly/2jbNr6e Sign up to Spyglaz today! http:// buff.ly/2jbSDqJ #analytics";;;#sales #analytics;"819601051406008327";https://twitter.com/spyglaz/status/819601051406008327
spyglaz;2017-01-03 12:05;1;0;"Spyglaz— a predictive #sales #analytics platform that helps increase #revenue from your current customers http:// spyglaz.com /";;;#sales #analytics #revenue;"816329591182753792";https://twitter.com/spyglaz/status/816329591182753792
spyglaz;2016-12-22 12:55;0;0;"Welcome to Spyglaz - a predictive #sales #analytics platform that helps increase #revenue from your current customer http:// spyglaz.com /";;;#sales #analytics #revenue;"811993481036099584";https://twitter.com/spyglaz/status/811993481036099584
spyglaz;2016-12-13 11:55;0;1;"Welcome to Spyglaz— a predictive #sales #analytics platform that helps increase #revenue from your current customers http:// spyglaz.com";;;#sales #analytics #revenue;"808716905221648385";https://twitter.com/spyglaz/status/808716905221648385
spyglaz;2016-12-06 11:55;0;4;"More leads. More sales. Made simple https:// youtu.be/uS1moLDQrT4 Sign up to Spyglaz today! http:// spyglaz.com / #bigdata #sales #analytics";;;#bigdata #sales #analytics;"806180183430533121";https://twitter.com/spyglaz/status/806180183430533121
_Vijay_Nagar_;2016-12-06 10:21;0;0;"Spyglaz is a predictive sales analytics platform @spyglaz Get more users by listing your app at http:// bit.ly/1rMK32E !!";;@spyglaz;;"806156498036543488";https://twitter.com/_Vijay_Nagar_/status/806156498036543488
spyglaz;2016-11-29 12:15;0;0;"Spyglaz is an easily deployed, high utility platform that can impact your #sales today! #bigdata #analytics http:// spyglaz.com";;;#sales #bigdata #analytics;"803648526290997248";https://twitter.com/spyglaz/status/803648526290997248
spyglaz;2016-11-24 12:10;1;1;"Welcome to Spyglaz— a predictive #sales #analytics platform that helps increase #revenue from your current customers https:// spyglaz.com /";;;#sales #analytics #revenue;"801835442303811587";https://twitter.com/spyglaz/status/801835442303811587
spyglaz;2016-11-22 12:10;2;1;"Nine Bizarre and Surprising Predictive Insights from Data Science http://www. predictiveanalyticsworld.com/patimes/nine-b izarre-surprising-predictive-insights-data-science/8183/ … #data #bigdata #predictiveanalytics #datascience";;;#data #bigdata #predictiveanalytics #datascience;"801110570632093697";https://twitter.com/spyglaz/status/801110570632093697
spyglaz;2016-11-17 11:55;1;0;"Welcome to Spyglaz— a predictive #sales #analytics platform that helps increase #revenue from your current customers https:// spyglaz.com /";;;#sales #analytics #revenue;"799294888059801600";https://twitter.com/spyglaz/status/799294888059801600
spyglaz;2016-11-15 12:25;1;2;"The How and Why of Predictive Analytics - interesting infographic https:// whatsthebigdata.com/2016/10/06/the -how-and-why-of-predictive-analytics/amp/ … #bigdata #predictiveanalytics";;;#bigdata #predictiveanalytics;"798577586376937473";https://twitter.com/spyglaz/status/798577586376937473
spyglaz;2016-11-10 12:45;2;1;"Business Decision-Making: Gut Instinct or Hard #Data ? http://www. business.com/business-intel ligence/business-decision-making-gut-instinct-or-hard-data … via @businessdotcom by @irmahunkeler #businessintelligence";;@businessdotcom @irmahunkeler;#Data #businessintelligence;"796770807896801280";https://twitter.com/spyglaz/status/796770807896801280
spyglaz;2016-11-08 12:45;0;0;"Welcome to Spyglaz— a predictive #sales #analytics platform that helps increase #revenue from your current customers https:// spyglaz.com /";;;#sales #analytics #revenue;"796045925479313413";https://twitter.com/spyglaz/status/796045925479313413
spyglaz;2016-11-03 13:30;2;0;"The Expansive Deployment of Predictive Analytics: 22 Examples http://www. predictiveanalyticsworld.com/patimes/expans ive-deployment-predictive-analytics-22-examples/8197/ … via @PA_Times #predictiveanalytics #bigdata";;@PA_Times;#predictiveanalytics #bigdata;"794230237609463808";https://twitter.com/spyglaz/status/794230237609463808
spyglaz;2016-11-01 14:06;1;0;"5 Amazing Things #BigData Helps Us To Predict Now -- Plus What's On The Horizon via @forbes http://www. forbes.com/sites/bernardm arr/2016/10/10/5-amazing-things-big-data-helps-us-to-predict-now-plus-whats-on-the-horizon/#7317df12b634 … via @BernardMarr";;@forbes @BernardMarr;#BigData #7317df12b634;"793514685412835328";https://twitter.com/spyglaz/status/793514685412835328
spyglaz;2016-10-25 11:45;0;1;"Read all about our vision and meet the people behind Spyglaz https:// spyglaz.com/about/ #data #bigdata #analytics #predictiveanalytics";;;#data #bigdata #analytics #predictiveanalytics;"790942328437534720";https://twitter.com/spyglaz/status/790942328437534720
spyglaz;2016-10-20 11:55;3;0;"Welcome to Spyglaz— a predictive #sales #analytics platform that helps increase #revenue from your current customers https:// spyglaz.com";;;#sales #analytics #revenue;"789132961023156224";https://twitter.com/spyglaz/status/789132961023156224
spyglaz;2016-10-18 12:05;1;0;"Spyglaz is an easily deployed, high utility platform that can impact your #sales today! #bigdata #analytics https:// spyglaz.com";;;#sales #bigdata #analytics;"788410646014619648";https://twitter.com/spyglaz/status/788410646014619648
spyglaz;2016-10-13 12:50;0;0;"The Most Practical #BigData Use Cases Of 2016 via @forbes http://www. forbes.com/sites/bernardm arr/2016/08/25/the-most-practical-big-data-use-cases-of-2016/#1e5a18f07533 … @BernardMarr";;@forbes @BernardMarr;#BigData #1e5a18f07533;"786610079290318848";https://twitter.com/spyglaz/status/786610079290318848
spyglaz;2016-10-11 12:45;0;0;"Reinventing Business Intelligence: 7 Ways #BigData is Changing Business http://www. business.com/business-intel ligence/reinventing-business-intelligence-7-ways-big-data-is-changing-business/?utm_medium=earned_social&utm_source=twitter … via @businessdotcom by @cam_johnson95";;@businessdotcom @cam_johnson95;#BigData;"785884028951990272";https://twitter.com/spyglaz/status/785884028951990272
spyglaz;2016-10-06 12:40;1;0;"4 Rules to Good #Sales Engagement #Data via @leahwinterbell http:// bit.ly/2dnScpf";;@leahwinterbell;#Sales #Data;"784070861355675648";https://twitter.com/spyglaz/status/784070861355675648
ElizabethTelson;2016-10-04 14:09;1;3;"#Gratitude to Recent Connects @LexDonness @jameyedwards @hixon_raphael @BrookeButller @spyglaz @markfidelman @_MWright9 @AskAaronLee :D";;@LexDonness @jameyedwards @hixon_raphael @BrookeButller @spyglaz @markfidelman @_MWright9 @AskAaronLee;#Gratitude;"783368579668381697";https://twitter.com/ElizabethTelson/status/783368579668381697
spyglaz;2016-10-04 12:35;0;0;"Welcome to Spyglaz, a predictive #sales #analytics platform that helps increase #revenue from your current customers https:// spyglaz.com /";;;#sales #analytics #revenue;"783344750908891136";https://twitter.com/spyglaz/status/783344750908891136
spyglaz;2016-09-29 12:45;1;1;"Predictive #Analytics Basics: Six Introductory Terms and The Five Effects http://www. predictiveanalyticsworld.com/patimes/predic tive-analytics-basics-six-introductory-terms-five-effects/8110/ … via @PA_Times #predictiveanalytics";;@PA_Times;#Analytics #predictiveanalytics;"781535426280583169";https://twitter.com/spyglaz/status/781535426280583169
spyglaz;2016-09-27 12:45;1;1;"Breaking It Down: How to Harness #BigData to Make Big #Sales http://www. business.com/business-intel ligence/how-to-harness-big-data-and-make-big-sales … via @businessdotcom by @christinacomben";;@businessdotcom @christinacomben;#BigData #Sales;"780810516071677953";https://twitter.com/spyglaz/status/780810516071677953
olustewart;2016-09-27 03:57;0;1;"#thanks @spyglaz thanks for the recent follow. Much appreciated :) Grow followers ➪ http:// bit.ly/free_followers_";;@spyglaz;#thanks;"780677716924248065";https://twitter.com/olustewart/status/780677716924248065
spyglaz;2016-09-22 12:20;1;0;"Spyglaz is an easily deployed, high utility platform that can impact your #sales today! #bigdata #analytics https:// spyglaz.com";;;#sales #bigdata #analytics;"778992433610780672";https://twitter.com/spyglaz/status/778992433610780672
spyglaz;2016-09-20 12:40;1;0;"Big Data And A Shocking Waste Problem via @Forbes http://www. forbes.com/sites/bernardm arr/2016/09/05/big-data-and-a-shocking-waste-problem/#1ba7764970e9 … @BernardMarr #bigdata #data";;@Forbes @BernardMarr;#1ba7764970e9 #bigdata #data;"778272665203277825";https://twitter.com/spyglaz/status/778272665203277825
spyglaz;2016-09-15 12:30;3;1;"3 Steps to Building a Predictive Analytics System by @ConnieAguilar http:// entm.ag/2cCANrp via @Entrepreneur #predictiveanalytics #data";;@ConnieAguilar @Entrepreneur;#predictiveanalytics #data;"776458163864342528";https://twitter.com/spyglaz/status/776458163864342528
spyglaz;2016-09-13 12:20;1;0;"Spyglaz is an easily deployed, high utility platform that can impact your #sales today! #bigdata #analytics https:// spyglaz.com";;;#sales #bigdata #analytics;"775730949698965504";https://twitter.com/spyglaz/status/775730949698965504
spyglaz;2016-09-08 12:31;2;1;"Will 'Analytics On The Edge' Be The Future Of Big Data? via @Forbes http://www. forbes.com/sites/bernardm arr/2016/08/23/will-analytics-on-the-edge-be-the-future-of-big-data/#453436ea2b09 … @BernardMarr #analytics #data #bigdata";;@Forbes @BernardMarr;#453436ea2b09 #analytics #data #bigdata;"773921803769184256";https://twitter.com/spyglaz/status/773921803769184256
spyglaz;2016-09-06 12:25;1;0;"How to Turn Dark Data from a Problem into an Advantage https:// shar.es/1ws85q via @Data_Informed #data #bigdata #analytics";;@Data_Informed;#data #bigdata #analytics;"773195430221971456";https://twitter.com/spyglaz/status/773195430221971456
spyglaz;2016-09-01 15:25;1;1;"#Spyglaz in the news via Colin Atkinson, CA Management Services newsletter @Camanexpo http://www. caman.com.au/news-a-newslet ters … pic.twitter.com/9abUi8yK5h";;@Camanexpo;#Spyglaz;"771428693319319553";https://twitter.com/spyglaz/status/771428693319319553
spyglaz;2016-09-01 12:16;2;1;"Spyglaz is an easily deployed, high utility platform that can impact your #sales today! #bigdata #analytics https:// spyglaz.com";;;#sales #bigdata #analytics;"771381123574296577";https://twitter.com/spyglaz/status/771381123574296577
spyglaz;2016-08-30 12:15;3;3;"How To Use Analytics To Identify Trends In Your Market via @Forbes http://www. forbes.com/sites/bernardm arr/2016/08/16/how-to-use-analytics-to-identify-trends-in-your-market/#3bb36b77228b … @BernardMarr #data #analytics";;@Forbes @BernardMarr;#3bb36b77228b #data #analytics;"770656294885785601";https://twitter.com/spyglaz/status/770656294885785601
spyglaz;2016-08-25 11:55;3;0;"Predictive analytics: science or magic wand? https:// shar.es/1wsEAI via @InformationAge #predictiveanalytics #bigdata #data";;@InformationAge;#predictiveanalytics #bigdata #data;"768839167224770560";https://twitter.com/spyglaz/status/768839167224770560
spyglaz;2016-08-18 12:40;2;0;"#Spyglaz is an agile, easily deployed, high utility platform that can impact your #sales today! #bigdata #analytics https:// spyglaz.com";;;#Spyglaz #sales #bigdata #analytics;"766313790287802368";https://twitter.com/spyglaz/status/766313790287802368
spyglaz;2016-08-16 12:25;3;4;"How the Internet of Things Changes Big Data Analytics https:// shar.es/1ZN2yN via @data_informed #bigdata #analytics #iot";;@data_informed;#bigdata #analytics #iot;"765585206560563200";https://twitter.com/spyglaz/status/765585206560563200
spyglaz;2016-08-14 12:50;1;5;"What’s the block with predictive analytics? http://www. information-age.com/it-management/ strategy-and-innovation/123461739/whats-block-predictive-analytics … #predictiveanalytics #bigdata #data";;;#predictiveanalytics #bigdata #data;"764866721664626688";https://twitter.com/spyglaz/status/764866721664626688
spyglaz;2016-08-04 12:45;0;2;"Welcome to Spyglaz— a predictive #sales #analytics platform that helps increase #revenue from your current customers https:// spyglaz.com";;;#sales #analytics #revenue;"761241592573333504";https://twitter.com/spyglaz/status/761241592573333504
spyglaz;2016-07-28 12:49;1;2;"Why 'Big Data' Means Nothing Without 'Little Data' via @forbes http://www. forbes.com/sites/bernardm arr/2016/06/23/why-big-data-means-nothing-without-little-data/#75c6462419c0 … #bigdata @BernardMarr";;@forbes @BernardMarr;#75c6462419c0 #bigdata;"758706044755410944";https://twitter.com/spyglaz/status/758706044755410944
spyglaz;2016-07-26 14:00;1;1;"#Spyglaz is an agile, easily deployed, high utility platform that can impact your #sales today! #bigdata #analytics http:// spyglaz.com/news/";;;#Spyglaz #sales #bigdata #analytics;"757999009193717760";https://twitter.com/spyglaz/status/757999009193717760
spyglaz;2016-07-21 12:45;1;1;"Why Investments In Big Data And Analytics Are Not Yet Paying Off via @forbes http://www. forbes.com/sites/bernardm arr/2016/06/27/why-investments-in-big-data-and-analytics-are-not-yet-paying-off/#1a31488980a2 … by @BernardMarr #bigdata";;@forbes @BernardMarr;#1a31488980a2 #bigdata;"756168242310311936";https://twitter.com/spyglaz/status/756168242310311936
spyglaz;2016-07-20 09:34;0;0;"When I deleted a load of mine, I realised how many I just hadn’t used!";;;;"755757688232013824";https://twitter.com/spyglaz/status/755757688232013824
spyglaz;2016-07-19 12:45;1;2;"Data-Driven Decision Making: 10 Simple Steps For Any Business via @forbes http://www. forbes.com/sites/bernardm arr/2016/06/14/data-driven-decision-making-10-simple-steps-for-any-business/#421a24757283 … by @BernardMarr #dataanalytics #bigdata";;@forbes @BernardMarr;#421a24757283 #dataanalytics #bigdata;"755443379543105537";https://twitter.com/spyglaz/status/755443379543105537
spyglaz;2016-07-14 12:45;0;1;"#Spyglaz is an agile, easily deployed, high utility platform that can impact your #sales today! #bigdata #analytics http:// spyglaz.com/news/";;;#Spyglaz #sales #bigdata #analytics;"753631541985742849";https://twitter.com/spyglaz/status/753631541985742849
toolowl;2016-07-14 03:00;3;1;"Check out free #leadgeneration #tool @spyglaz at #ToOLOwl .. http:// buff.ly/29zQb50 pic.twitter.com/VIZWSkafF4";;@spyglaz;#leadgeneration #tool #ToOLOwl;"753484405553950720";https://twitter.com/toolowl/status/753484405553950720
spyglaz;2016-07-12 12:45;3;1;"How Big Data Analytics Can Improve Your Marketing by @BernardMarr http:// data-informed.com/how-big-data-a nalytics-can-improve-your-marketing/ … #bigdata #analytics";;@BernardMarr;#bigdata #analytics;"752906751285092352";https://twitter.com/spyglaz/status/752906751285092352
spyglaz;2016-07-08 12:35;1;0;"Building Your Big Data Infrastructure: 4 Key Components Every Business Needs To Consider by @BernardMarr http://www. forbes.com/sites/bernardm arr/2016/06/15/building-your-big-data-infrastructure-4-key-components-every-business-needs-to-consider/#4876c1a6a0b0 … #bigdata";;@BernardMarr;#4876c1a6a0b0 #bigdata;"751454595176603648";https://twitter.com/spyglaz/status/751454595176603648
spyglaz;2016-07-01 12:25;1;0;"Our website has been revamped! https:// spyglaz.com / #bigdata #predictiveanalytics pic.twitter.com/BRkWvUdivZ";;;#bigdata #predictiveanalytics;"748915356266336256";https://twitter.com/spyglaz/status/748915356266336256
spyglaz;2016-06-20 12:45;0;1;"#Spyglaz is an agile, easily deployed, high utility platform that can impact your #sales today! #bigdata http:// spyglaz.com/news/";;;#Spyglaz #sales #bigdata;"744934248897904640";https://twitter.com/spyglaz/status/744934248897904640
spyglaz;2016-06-16 12:45;0;0;"5 Telltale Signs You Don’t Understand Big Data http://www. forbes.com/sites/bernardm arr/2016/05/19/5-telltale-signs-you-dont-understand-big-data/#54df8f3e2c70 … by @BernardMarr #bigdata #data #bigdataanalytics";;@BernardMarr;#54df8f3e2c70 #bigdata #data #bigdataanalytics;"743484673226055680";https://twitter.com/spyglaz/status/743484673226055680
spyglaz;2016-06-15 05:10;0;0;"thank you for your review and feedback on how we can improve! We're working on making the data upload crietria more specific!!";;;;"743007665945772032";https://twitter.com/spyglaz/status/743007665945772032
toolowl;2016-06-15 05:00;0;1;"#ToOLOwl finds out what unique about #LeadGeneration #tool @spyglaz ... http:// buff.ly/1XW2wrk pic.twitter.com/tEuif1WbSA";;@spyglaz;#ToOLOwl #LeadGeneration #tool;"743005288698138624";https://twitter.com/toolowl/status/743005288698138624
spyglaz;2016-06-14 12:45;0;0;"Big Data: Will We Soon No Longer Need Data Scientists? http:// wp.me/p6CwqL-1Sf #bigdata #data #datascientists";;;#bigdata #data #datascientists;"742759894886010888";https://twitter.com/spyglaz/status/742759894886010888
spyglaz;2016-06-07 15:30;0;0;"Spyglaz can give you actionable insights to sell more effectively and close more #sales #data #predictiveanalytics https:// spyglaz.com/Home/Product/";;;#sales #data #predictiveanalytics;"740264624537362432";https://twitter.com/spyglaz/status/740264624537362432
spyglaz;2016-05-31 12:45;0;0;"10 Most Successful Big Data Technologies https:// whatsthebigdata.com/2016/04/23/10- most-successful-big-data-technologies/ … #bigdata";;;#bigdata;"737686477463773184";https://twitter.com/spyglaz/status/737686477463773184
spyglaz;2016-05-30 14:56;0;1;""Analytical" traditionally perceived as a male trait. Not true according to recent research. https:// twitter.com/KirkDBorne/sta tus/737129355818741760 …";;;;"737357120132239361";https://twitter.com/spyglaz/status/737357120132239361
spyglaz;2016-05-26 12:45;0;0;"#Spyglaz is an agile, easily deployed, high utility platform that can impact your #sales today! http:// spyglaz.com/news/ #predictiveanalytics";;;#Spyglaz #sales #predictiveanalytics;"735874522348441601";https://twitter.com/spyglaz/status/735874522348441601
spyglaz;2016-05-24 12:45;0;0;"Eight Steps to Big Data Success http:// straighttalk.hcltech.com/eight-steps-bi g-data-success … #bigdata";;;#bigdata;"735149675716726784";https://twitter.com/spyglaz/status/735149675716726784
spyglaz;2016-05-17 12:40;0;0;"Big Data is useless and even dangerous without this key ingredient http:// blogs.csc.com/2016/05/09/big -data-is-useless-and-even-dangerous-without-this-key-ingredient/ … #bigdata";;;#bigdata;"732611754157584385";https://twitter.com/spyglaz/status/732611754157584385
spyglaz;2016-05-12 05:03;0;0;"thank you for the mention!";;;;"730684850781454336";https://twitter.com/spyglaz/status/730684850781454336
dianabenedikt;2016-05-11 18:46;1;2;"Want predictive sales analytics for better upsell/cross-sell rates? Take a peek @spyglaz #bizops #salesops https:// twitter.com/spyglaz/status /727796188037124096 …";;@spyglaz;#bizops #salesops;"730529556738637824";https://twitter.com/dianabenedikt/status/730529556738637824
spyglaz;2016-05-10 12:40;1;1;"#Spyglaz is an agile, easily deployed, high utility platform that can impact your #sales today! #bigdata https:// spyglaz.com/news/";;;#Spyglaz #sales #bigdata;"730074977098141700";https://twitter.com/spyglaz/status/730074977098141700
spyglaz;2016-05-05 12:45;0;0;"Data Delirium: Why and How You Should Embrace #BigData http://www. business.com/technology/why -and-how-you-should-embrace-big-data …";;;#BigData;"728264348234334208";https://twitter.com/spyglaz/status/728264348234334208
spyglaz;2016-05-04 05:45;0;0;"#Spyglaz is an agile, easily deployed, high utility platform that can impact your #sales bottom line today https:// spyglaz.com/news/";;;#Spyglaz #sales;"727796188037124096";https://twitter.com/spyglaz/status/727796188037124096
spyglaz;2016-05-03 18:10;0;0;"#Spyglaz is an agile, easily deployed, high utility platform that can impact your #sales bottom line today https:// spyglaz.com/Home/News";;;#Spyglaz #sales;"727621316447219712";https://twitter.com/spyglaz/status/727621316447219712
spyglaz;2016-05-03 12:40;1;0;"5 Types of Big Data Analytics and How They Help Customer Success http:// b2c.news/tj6K6Q via @B2Community #bigdata #dataanalytics";;@B2Community;#bigdata #dataanalytics;"727538289398394880";https://twitter.com/spyglaz/status/727538289398394880
spyglaz;2016-04-26 12:50;0;0;"Why Business That Use ‘Big Data’ Make More Money (Infographic) by @CatClifford http:// entm.ag/1UeZwn4 via @Entrepreneur #bigdata #business";;@CatClifford @Entrepreneur;#bigdata #business;"725004047032406017";https://twitter.com/spyglaz/status/725004047032406017
spyglaz;2016-04-19 12:40;0;0;"Spyglaz can quickly give you actionable insights to sell more effectively and close more sales. https:// spyglaz.com";;;;"722464841374543872";https://twitter.com/spyglaz/status/722464841374543872
spyglaz;2016-04-14 12:31;0;0;"How The Citizen Data Scientist Will Democratize Big Data by @BernardMarr http://www. forbes.com/sites/bernardm arr/2016/04/01/how-the-citizen-data-scientist-will-democratize-big-data/#410a70f84557 … #bigdata";;@BernardMarr;#410a70f84557 #bigdata;"720650685436596226";https://twitter.com/spyglaz/status/720650685436596226
agungw132;2016-04-12 13:00;0;1;"RT @spyglaz 3 factors to consider when working with predictive analytics https:// shar.es/1juM2i via @4enterprisers #predictiveanalytics #bi";;@spyglaz @4enterprisers;#predictiveanalytics #bi;"719933157466705920";https://twitter.com/agungw132/status/719933157466705920
spyglaz;2016-04-12 12:55;0;0;"3 factors to consider when working with predictive analytics https:// shar.es/1juM2i via @4enterprisers #predictiveanalytics #bigdata";;@4enterprisers;#predictiveanalytics #bigdata;"719931876606091264";https://twitter.com/spyglaz/status/719931876606091264
spyglaz;2016-04-05 13:10;0;0;"#Data Marries Design to Drive Customer Success in 2016 http:// lsh.re/10RIL #bigdata pic.twitter.com/B7xtHWVnig";;;#Data #bigdata;"717398933065039873";https://twitter.com/spyglaz/status/717398933065039873
spyglaz;2016-03-31 12:53;0;2;"#Spyglaz delivers advanced predictive analytics at an affordable price. #bigdata #predictiveanalytics https:// spyglaz.com/Home/Product/";;;#Spyglaz #bigdata #predictiveanalytics;"715582812817137665";https://twitter.com/spyglaz/status/715582812817137665
spyglaz;2016-03-29 12:25;0;0;"How Any Business Can Develop a Big Data Mindset http:// data-informed.com/how-any-busine ss-can-develop-a-big-data-mindset/ … by @BernardMarr #bigdata #business";;@BernardMarr;#bigdata #business;"714850977753522176";https://twitter.com/spyglaz/status/714850977753522176
spyglaz;2016-03-24 13:35;0;0;"Using Big Data to Win and Influence Customers #bigdata #customers #sales http:// fw.to/K333y7b";;;#bigdata #customers #sales;"713056567692771328";https://twitter.com/spyglaz/status/713056567692771328
spyglaz;2016-03-22 13:55;0;0;"17 Predictions About The Future Of Big Data Everyone Should Read via @forbes http://www. forbes.com/sites/bernardm arr/2016/03/15/17-predictions-about-the-future-of-big-data-everyone-should-read/#3afcb60c157c … @bernardmarr #bigdata";;@forbes @bernardmarr;#3afcb60c157c #bigdata;"712336827844313089";https://twitter.com/spyglaz/status/712336827844313089
spyglaz;2016-03-17 13:35;0;1;"Spyglaz can quickly give you actionable insights to sell more effectively and close more #sales https:// spyglaz.com/Home/Product/ #predictiveanalytics";;;#sales #predictiveanalytics;"710519907037929472";https://twitter.com/spyglaz/status/710519907037929472
