username;date;retweets;favorites;text;geo;mentions;hashtags;id;permalink
spyglaz;2018-02-26 23:00;0;1;"In 60 seconds, learn about the latest, proven customer retention tool. http:// ow.ly/7EJt30iuUYE . #CMOtips #organiseyoursalesforce #customersegmentation #salesforce #customerchurn #customerchurntool #customersuccesstools #customerloss #customerretention";;;#CMOtips #organiseyoursalesforce #customersegmentation #salesforce #customerchurn #customerchurntool #customersuccesstools #customerloss #customerretention;"968334984619724800";https://twitter.com/spyglaz/status/968334984619724800
spyglaz;2018-02-22 11:30;0;0;"Order takers or order makers? Helpful tools that help focus your sales staff. http:// ow.ly/8HNz30iuU9a . #CMOtips #organiseyoursalesforce #customersegmentation #salesforce #customerchurn #customerchurntool #customersuccesstools #customerloss #customerretention";;;#CMOtips #organiseyoursalesforce #customersegmentation #salesforce #customerchurn #customerchurntool #customersuccesstools #customerloss #customerretention;"966711854620954624";https://twitter.com/spyglaz/status/966711854620954624
spyglaz;2017-12-05 01:44;5;2;"We’re hiring! Looking for an early career stage data scientist who will work closely with founding team to evolve our offering and define future product vision #bigdata #datascientist #hiringnow #nowhiring https:// buff.ly/2iN8xtC pic.twitter.com/bYg2GzKOcj";;;#bigdata #datascientist #hiringnow #nowhiring;"937935605236977664";https://twitter.com/spyglaz/status/937935605236977664
UPWARD_Women;2017-11-28 12:59;1;5;"GIVERS look like... @ElizabethGore @KarenHQuintos @spyglaz #Thankyou ! https:// twitter.com/UPWARD_Women/s tatus/935565941399633920 …";;@ElizabethGore @KarenHQuintos @spyglaz;#Thankyou;"935568897385775104";https://twitter.com/UPWARD_Women/status/935568897385775104
spyglaz;2017-11-08 04:09;4;5;"Spyglaz is growing! https:// buff.ly/2zq8SIK";;;;"928187673650585600";https://twitter.com/spyglaz/status/928187673650585600
sifteryrecs;2017-10-28 07:16;0;0;"Are you using Spyglaz ( @spyglaz ) and recommend them? You can do it here http:// siftery.com/spyglaz?recomm end …";;@spyglaz;;"924233287148728321";https://twitter.com/sifteryrecs/status/924233287148728321
sifteryhello;2017-10-19 14:45;0;0;"Are you using Spyglaz ( @spyglaz ) and recommend them? You can do it here http:// siftery.com/spyglaz?recomm end …";;@spyglaz;;"921084792795430912";https://twitter.com/sifteryhello/status/921084792795430912
spyglaz;2017-10-19 11:55;4;6;"How to burn your customer churn @stangarber84 https:// buff.ly/2ysKUdf via @Inc #churn #customerchurn #retention pic.twitter.com/uyGDGXjvBk";;@stangarber84 @Inc;#churn #customerchurn #retention;"921042043245400065";https://twitter.com/spyglaz/status/921042043245400065
spyglaz;2017-10-17 11:55;3;1;"Spylaz business intelligence platform. More Sales. Less #Churn . Made Simple. Try it for free! https:// buff.ly/2ynT3lN #predictiveanalytics pic.twitter.com/eEtG6YNPgI";;;#Churn #predictiveanalytics;"920317234496638976";https://twitter.com/spyglaz/status/920317234496638976
spyglaz;2017-10-12 11:55;2;2;"#Email Is The Easiest Place to Get Started With #PredictiveAnalytics . Here's Why https:// buff.ly/2ga54Eh by @metabrown312 pic.twitter.com/e5wY8fa3Md";;@metabrown312;#Email #PredictiveAnalytics;"918505314361774080";https://twitter.com/spyglaz/status/918505314361774080
ZuzuDotAI;2017-10-10 11:55;0;1;"RT @spyglaz : How #AI Could Change #Amazon : A Thought Experiment https:// buff.ly/2ycvg7K via @HarvardBiz pic.twitter.com/CAuP9iVcAv";;@spyglaz @HarvardBiz;#AI #Amazon;"917780733325963265";https://twitter.com/ZuzuDotAI/status/917780733325963265
spyglaz;2017-10-10 11:55;0;1;"How #AI Could Change #Amazon : A Thought Experiment https:// buff.ly/2ycvg7K via @HarvardBiz pic.twitter.com/5knHIMKHH5";;@HarvardBiz;#AI #Amazon;"917780519324176385";https://twitter.com/spyglaz/status/917780519324176385
spyglaz;2017-10-03 11:55;0;2;"9 Case Studies That'll Help You Reduce #SaaS #Churn https:// buff.ly/2fNrw5S by @CaseyA";;@CaseyA;#SaaS #Churn;"915243867137564672";https://twitter.com/spyglaz/status/915243867137564672
spyglaz;2017-09-28 11:55;0;2;"Demystifying #Churn : Measuring and Benchmarking this Metric https:// buff.ly/2xueIrQ #retention";;;#Churn #retention;"913431883777810433";https://twitter.com/spyglaz/status/913431883777810433
spyglaz;2017-09-26 11:55;0;2;"Find out which customers you’re going to lose before you lose them https:// buff.ly/2hwpvI5 #churn #retention #predictiveanalytics pic.twitter.com/HWIN4yoVia";;;#churn #retention #predictiveanalytics;"912707125234868224";https://twitter.com/spyglaz/status/912707125234868224
spyglaz;2017-09-21 11:55;0;1;"Customer Retention Is King: The Future Of Retention Marketing via @forbes https:// buff.ly/2xSaNpt #retention #churn";;@forbes;#retention #churn;"910895142701338624";https://twitter.com/spyglaz/status/910895142701338624
spyglaz;2017-09-07 11:55;1;2;"Why does churn prediction matter when it comes to customer engagement? https:// buff.ly/2wDGKyn #churn #retention #predictiveanalytics";;;#churn #retention #predictiveanalytics;"905821732543582209";https://twitter.com/spyglaz/status/905821732543582209
spyglaz;2017-09-05 11:55;1;0;"Leverage the power of predictive analytics and machine learning for customer #retention https:// buff.ly/2vHaz3I #churn #predictiveanalytics pic.twitter.com/XGq42H3Twf";;;#retention #churn #predictiveanalytics;"905096955960930304";https://twitter.com/spyglaz/status/905096955960930304
spyglaz;2017-08-31 11:55;0;1;"Here are three tips to help you take charge of customer retention for your company! https:// buff.ly/2eHydCR #retention #churn pic.twitter.com/uEkkqUcxRH";;;#retention #churn;"903285008454098944";https://twitter.com/spyglaz/status/903285008454098944
spyglaz;2017-08-29 11:55;1;3;"Bulk vs. Targeted Emails — one size does not fit all. https:// buff.ly/2vE5qEJ #retention #churn #customers #emails pic.twitter.com/xlyNis79U8";;;#retention #churn #customers #emails;"902560243514843137";https://twitter.com/spyglaz/status/902560243514843137
spyglaz;2017-08-24 11:55;1;3;"Churn Prediction — the here and now of AI – rascott – Medium https:// buff.ly/2vlUnQd #churn #retention #AI pic.twitter.com/seJHT5ykht";;;#churn #retention #AI;"900748316287303680";https://twitter.com/spyglaz/status/900748316287303680
spyglaz;2017-08-22 11:55;2;3;"Spylaz business intelligence platform. More Sales. Less #Churn . Made Simple. Try it for free! https:// buff.ly/2wuY23o #predictiveanalytics pic.twitter.com/H0NFmLVi72";;;#Churn #predictiveanalytics;"900023532746399744";https://twitter.com/spyglaz/status/900023532746399744
spyglaz;2017-08-17 11:55;0;0;"Customer Churn Analysis—key to your company’s success https:// buff.ly/2vLGqwY #churn #retention #predictiveanalytics";;;#churn #retention #predictiveanalytics;"898211569561194497";https://twitter.com/spyglaz/status/898211569561194497
spyglaz;2017-08-15 11:55;1;0;"#Churn impacts #revenue . So why don’t more companies make churn management a top priority? Here are some insights https:// buff.ly/2x0qNB7 pic.twitter.com/UaaVbBnd0H";;;#Churn #revenue;"897486831641559040";https://twitter.com/spyglaz/status/897486831641559040
spyglaz;2017-08-11 11:55;1;3;"Are your customers picking up what you’re putting down? https:// buff.ly/2uwCsGZ #loyalty #customerretention #churn pic.twitter.com/b2hrDJ8kgW";;;#loyalty #customerretention #churn;"896037427722289152";https://twitter.com/spyglaz/status/896037427722289152
spyglaz;2017-08-08 11:55;1;0;"Spylaz business intelligence platform. More Sales. Less Churn. Made Simple. Try it for free! https:// buff.ly/2fpwKnz #predictiveanalytics pic.twitter.com/qesEnsFzQx";;;#predictiveanalytics;"894950104733503489";https://twitter.com/spyglaz/status/894950104733503489
spyglaz;2017-08-03 11:55;2;0;"Customer Feedback & Data Analysis: The Keys to a Good Customer Retention Rate http:// buff.ly/2w1N2Hp #analytics #bigdata #retention #churn";;;#analytics #bigdata #retention #churn;"893138159009247233";https://twitter.com/spyglaz/status/893138159009247233
spyglaz;2017-08-01 11:55;0;0;"What to do when your business suddenly loses customers: http:// buff.ly/2uglFaw #business #retention #churn #analytics";;;#business #retention #churn #analytics;"892413415993606148";https://twitter.com/spyglaz/status/892413415993606148
spyglaz;2017-07-27 11:55;1;0;"3 Things Are Holding Back Your #Analytics , and #Technology Isn’t One of Them via @HarvardBiz http:// buff.ly/2v5ilDL";;@HarvardBiz;#Analytics #Technology;"890601434114269184";https://twitter.com/spyglaz/status/890601434114269184
spyglaz;2017-07-25 11:55;0;0;"Leverage the power of predictive analytics and machine learning for customer #retention http:// buff.ly/2uT4XlW #churn #predictiveanalytics pic.twitter.com/M4LLcvEDlz";;;#retention #churn #predictiveanalytics;"889876662682341377";https://twitter.com/spyglaz/status/889876662682341377
spyglaz;2017-07-24 11:56;0;0;"Bulk vs. Targeted Emails — one size does not fit all. http:// buff.ly/2uszAvP #retention #churn #customers #email pic.twitter.com/iC0E2o9S6Z";;;#retention #churn #customers #email;"889514513543966720";https://twitter.com/spyglaz/status/889514513543966720
spyglaz;2017-07-20 11:55;1;0;"For Companies, Data Analytics is a Pain; But Why? http:// buff.ly/2uvim3r #analytics #dataanalytics #bigdata via @analyticbridge pic.twitter.com/xbsaA8Dfua";;@analyticbridge;#analytics #dataanalytics #bigdata;"888064740240629760";https://twitter.com/spyglaz/status/888064740240629760
spyglaz;2017-07-18 11:55;0;1;"How #Analytics Has Changed in the Last 10 Years (and How It’s Stayed the Same) http:// buff.ly/2u5sLBO via @HarvardBiz pic.twitter.com/tuslYjzxcj";;@HarvardBiz;#Analytics;"887339972977709056";https://twitter.com/spyglaz/status/887339972977709056
LADataPlatform;2017-07-14 21:00;0;0;"Hey @spyglaz , would you like to partner with and/or sponsor #SQLMalibu User Group? We are looking to showcase an @Azure startup. @sqlpass pic.twitter.com/IIIqxH5LzT";;@spyglaz @Azure @sqlpass;#SQLMalibu;"886027540443258885";https://twitter.com/LADataPlatform/status/886027540443258885
spyglaz;2017-07-14 11:55;0;0;"Customer Retention Strategies - the path to customer loyalty http:// buff.ly/2tSLK0G #retention #churn #predictiveanalytics #analytics pic.twitter.com/g9HRQ5gJBN";;;#retention #churn #predictiveanalytics #analytics;"885890497910378501";https://twitter.com/spyglaz/status/885890497910378501
spyglaz;2017-07-11 11:55;0;0;"Find out which customers you’re going to lose before you lose them http:// buff.ly/2tJhO76 #churn #retention #predictiveanalytics pic.twitter.com/ZVdZRNJDoY";;;#churn #retention #predictiveanalytics;"884803241850155008";https://twitter.com/spyglaz/status/884803241850155008
spyglaz;2017-07-06 11:55;4;2;"5 Types Of Emails That Grow Customer Lifetime Value by @UsmanCentric via @BrandQuarterly http:// buff.ly/2uGarg5 #customers #retention pic.twitter.com/C99Tn3cf41";;@UsmanCentric @BrandQuarterly;#customers #retention;"882991304631873541";https://twitter.com/spyglaz/status/882991304631873541
spyglaz;2017-07-04 11:55;1;2;"5 Keys to Understanding Big Data Analytics for Business http:// buff.ly/2tggE4L #bigdata #predictiveanalytics pic.twitter.com/DLNDveUQ0S";;;#bigdata #predictiveanalytics;"882266508692475911";https://twitter.com/spyglaz/status/882266508692475911
StevenRBrooks;2017-07-02 11:00;0;2;"http:// potomacleadershipacumen.com/?edition_id=27 e182e0-5f37-11e7-afd2-0cc47a0d15fd … daily Update... Check it out! Stories via @miguelzulategui @spyglaz @sissassy";;@miguelzulategui @spyglaz @sissassy;;"881527958510481409";https://twitter.com/StevenRBrooks/status/881527958510481409
spyglaz;2017-06-30 11:55;1;1;"Become hero of the day, and make it look easy http:// buff.ly/2ttHOoY #Saas #churn #retention #predictiveanalytics pic.twitter.com/Gv9jwOnz2t";;;#Saas #churn #retention #predictiveanalytics;"880816996891471872";https://twitter.com/spyglaz/status/880816996891471872
spyglaz;2017-06-29 11:55;0;1;"Customer Churn Analysis—key to your company’s success written by our very own Rafael Scott http:// buff.ly/2siI7U3 #churn #analytics";;;#churn #analytics;"880454575886659585";https://twitter.com/spyglaz/status/880454575886659585
spyglaz;2017-06-27 11:55;1;1;"Spylaz business intelligence platform. More Sales. Less Churn. Made Simple. Try it for free! http:// buff.ly/2tiHXMJ #predictiveanalytics pic.twitter.com/kvH0KKqwxU";;;#predictiveanalytics;"879729792253296640";https://twitter.com/spyglaz/status/879729792253296640
spyglaz;2017-06-22 11:55;0;2;"#Marketing Needs Quality #Data Before #BigData http:// buff.ly/2rMmM5g via @businessdotcom pic.twitter.com/KYw4k4YFYh";;@businessdotcom;#Marketing #Data #BigData;"877917877051023360";https://twitter.com/spyglaz/status/877917877051023360
spyglaz;2017-06-20 11:55;0;1;"How to Tell When You Need a Better #Analytics Platform - SmartData Collective http:// buff.ly/2sOzS1R via @SmartDataCo #bigdata pic.twitter.com/cDqrC71yxx";;@SmartDataCo;#Analytics #bigdata;"877193081807937536";https://twitter.com/spyglaz/status/877193081807937536
kstaxman;2017-06-16 03:22;0;1;"These two could be sisters.. amazing";;;;"875614534555152384";https://twitter.com/kstaxman/status/875614534555152384
spyglaz;2017-06-15 11:55;2;3;"What Most Companies Miss About Customer Lifetime Value http:// buff.ly/2tgVmR5 #retention #churn #customers pic.twitter.com/4GKhNzqcrH";;;#retention #churn #customers;"875381172473401345";https://twitter.com/spyglaz/status/875381172473401345
spyglaz;2017-06-13 11:55;2;0;"Leverage the power of predictive analytics and machine learning for customer #retention http:// buff.ly/2sXIHTT #churn #predictiveanalytics pic.twitter.com/LUx8pMbfWp";;;#retention #churn #predictiveanalytics;"874656414106517505";https://twitter.com/spyglaz/status/874656414106517505
UPWARD_Women;2017-06-12 14:57;0;2;"What a wonderful time with wonderful women!";;;;"874339955354423296";https://twitter.com/UPWARD_Women/status/874339955354423296
spyglaz;2017-06-12 14:09;2;3;"Spyglaz Founder Neeraja Rasmussen with Emmy-nominated talk show host Janice Edwards, at a recent Upward event. @CommunityGirl1 @UPWARD_Women pic.twitter.com/7rU8AvVoO9";;@CommunityGirl1 @UPWARD_Women;;"874327776593096706";https://twitter.com/spyglaz/status/874327776593096706
spyglaz;2017-06-08 11:55;1;3;"Building a Brand Through Customer Support http:// buff.ly/2rPKnkt by @sujanpatel #retention #customers";;@sujanpatel;#retention #customers;"872844461210050561";https://twitter.com/spyglaz/status/872844461210050561
spyglaz;2017-06-06 11:55;1;4;"4 Simple Ways to Improve Your Customer Experience http:// buff.ly/2rPEljt by @MediaMogulsPR #churnmanagement #retention pic.twitter.com/UwEMPfiss7";;@MediaMogulsPR;#churnmanagement #retention;"872119661172846592";https://twitter.com/spyglaz/status/872119661172846592
spyglaz;2017-06-01 11:55;2;3;"Five Simple Techniques For Reducing Customer Attrition Rates by @cloudvik @Forbes http:// buff.ly/2rQlt4z #customerattrition";;@cloudvik @Forbes;#customerattrition;"870307703989686272";https://twitter.com/spyglaz/status/870307703989686272
spyglaz;2017-05-30 11:55;0;1;"Get key insights on customer retention and churn management http:// buff.ly/2s9jpC5 #customerretention #predictiveanalytics pic.twitter.com/PdtHch77om";;;#customerretention #predictiveanalytics;"869582940832976897";https://twitter.com/spyglaz/status/869582940832976897
spyglaz;2017-05-25 11:55;2;1;"Why #Customers Say Goodbye: The 5 Factors that Result in #CustomerChurn http:// buff.ly/2rdPqvt #churnmanagement";;;#Customers #CustomerChurn #churnmanagement;"867770992650833921";https://twitter.com/spyglaz/status/867770992650833921
spyglaz;2017-05-23 11:55;1;2;"A unique perspective on #churnmanagement from #Spyglaz Co-founder Rafael Scott http:// buff.ly/2rMDk9F";;;#churnmanagement #Spyglaz;"867046249677148162";https://twitter.com/spyglaz/status/867046249677148162
merapps;2017-05-18 17:28;1;2;"Top story: Microsoft BizSpark on Twitter: "BizSpark startup @spyglaz uses #Azur … https:// twitter.com/i/web/status/8 65192506123837441 … , see more http:// tweetedtimes.com/v/1333?s=tnp";;@spyglaz;#Azur;"865318111913938944";https://twitter.com/merapps/status/865318111913938944
spyglaz;2017-05-18 11:55;1;2;"It’s Not You, It’s Me. Classic Signs That a Customer Might Leave (And How to Prevent It) http:// buff.ly/2pSe3IP via @SageOneNA pic.twitter.com/Wga1R0NsKN";;@SageOneNA;;"865234322743320576";https://twitter.com/spyglaz/status/865234322743320576
SimonIbbitt;2017-05-18 09:11;3;3;"BizSpark startup @spyglaz uses #Azure 's predictive analytics & #BigData to reduce customer churn. Here's how: http:// soc.fm/dwVyy4VH";;@spyglaz;#Azure #BigData;"865193038360043520";https://twitter.com/SimonIbbitt/status/865193038360043520
msft4startups;2017-05-18 09:09;13;17;"BizSpark startup @spyglaz uses #Azure 's predictive analytics & #BigData to reduce customer churn. Here's how: http:// msft.social/BjP2Ug pic.twitter.com/Moy4wLIL8U";;@spyglaz;#Azure #BigData;"865192506123837441";https://twitter.com/msft4startups/status/865192506123837441
spyglaz;2017-05-17 12:19;0;0;"Spyglaz featured as an up-and-coming start up on Microsoft's TechNet blog #predictiveanalytics #bigdata @bizspark http:// buff.ly/2pWU0Jv pic.twitter.com/NFUPYHLfpp";;@bizspark;#predictiveanalytics #bigdata;"864878085681885190";https://twitter.com/spyglaz/status/864878085681885190
olustewart;2017-05-17 04:09;0;1;"#thanks @andybacon1 @spyglaz @CastleRockDecor thanks for the recent follow. Much appreciated :) Want this https:// commun.it/thank-you/?aid =thankyou158 …";;@andybacon1 @spyglaz @CastleRockDecor;#thanks;"864754758103572481";https://twitter.com/olustewart/status/864754758103572481
spyglaz;2017-05-16 11:55;0;0;"Find out which customers you’re going to lose before you lose them http:// buff.ly/2qnfT8g #customerretention #predictiveanalytics pic.twitter.com/LtdZrYfJdz";;;#customerretention #predictiveanalytics;"864509584551145474";https://twitter.com/spyglaz/status/864509584551145474
BizSparkSA;2017-05-16 04:00;1;4;"BizSpark startup @spyglaz uses #Azure 's predictive analytics & #BigData to reduce customer churn. Here's how: http:// bit.ly/2q16mn4 pic.twitter.com/0UlJUVeVv7";;@spyglaz;#Azure #BigData;"864390208283914240";https://twitter.com/BizSparkSA/status/864390208283914240
spyglaz;2017-05-11 11:55;1;0;"Why Angry #Customers are Important for a Successful #Business via @ProProfs http:// buff.ly/2qNquKM pic.twitter.com/cqZTtSXfvP";;@ProProfs;#Customers #Business;"862697578474991617";https://twitter.com/spyglaz/status/862697578474991617
spyglaz;2017-05-09 11:55;0;1;"Good insights on #customerretention from #Spyglaz Co-founder Rafael Scott http:// buff.ly/2pXIhxq pic.twitter.com/s49AJsoX1o";;;#customerretention #Spyglaz;"861972812021497856";https://twitter.com/spyglaz/status/861972812021497856
spyglaz;2017-05-04 11:55;5;3;"Are You Making These 5 Customer Retention Mistakes? Pardon Your Poor ROI! http:// buff.ly/2qvnD8V via @senginepeople #customers #analytics pic.twitter.com/4drmXzEMh6";;@senginepeople;#customers #analytics;"860160853760507904";https://twitter.com/spyglaz/status/860160853760507904
spyglaz;2017-04-25 11:55;2;1;"Spyglaz is leveraging the technology and support of @bizspark #bizspark #microsoft #startup #siliconvalley http:// spyglaz.com";;@bizspark;#bizspark #microsoft #startup #siliconvalley;"856899363485999104";https://twitter.com/spyglaz/status/856899363485999104
spyglaz;2017-04-20 11:55;3;2;"Avoid 4 Common #PredictiveAnalytics Mistakes That Waste Money And Hurt Your Business via @forbes http:// buff.ly/2oTr3iI #bigdata pic.twitter.com/w8AhTwlfiW";;@forbes;#PredictiveAnalytics #bigdata;"855087541090963457";https://twitter.com/spyglaz/status/855087541090963457
spyglaz;2017-04-18 19:15;1;2;"Why search for hamburger when you have filet mignon at home? https:// spyglaz.com/insights_why_s earch_for_hamburger/ …";;;;"854473480464547841";https://twitter.com/spyglaz/status/854473480464547841
spyglaz;2017-04-18 11:55;0;1;"Overcoming customer attrition http:// buff.ly/2nWOkTD #customers #customerattrition #customerchurn pic.twitter.com/0OP0DGU5zN";;;#customers #customerattrition #customerchurn;"854362663056539648";https://twitter.com/spyglaz/status/854362663056539648
spyglaz;2017-04-13 11:55;0;0;"#Spyglaz proudly supports woman-owned small businesses http:// buff.ly/2nAJHON #wosb #sba #bigdata #datascience";;;#Spyglaz #wosb #sba #bigdata #datascience;"852550702530514946";https://twitter.com/spyglaz/status/852550702530514946
spyglaz;2017-04-11 11:55;0;0;"How To Better Interpret Big Data http:// buff.ly/2p3wfQH via @Allen24Ben for @Datafloq #bigdata #datascience pic.twitter.com/z7WxhWgP1I";;@Allen24Ben @Datafloq;#bigdata #datascience;"851825948479586304";https://twitter.com/spyglaz/status/851825948479586304
spyglaz;2017-04-06 12:11;4;4;"Big Data Analytics: 6 Predictions http:// buff.ly/2oIKgG8 #bigdata #analytics #datascience pic.twitter.com/pq2uDJPwfs";;;#bigdata #analytics #datascience;"850018226557919234";https://twitter.com/spyglaz/status/850018226557919234
StartUscc;2017-04-05 18:47;0;0;"@spyglaz Welcome! What's your startup working on?";;@spyglaz;;"849755392481665024";https://twitter.com/StartUscc/status/849755392481665024
spyglaz;2017-04-04 11:55;0;2;"Customer Retention: A Triple Play for Business Owners http:// buff.ly/2nCjlIb via @mspmentor #customerretention #attrition #sales #customers pic.twitter.com/qLaYs8lqxu";;@mspmentor;#customerretention #attrition #sales #customers;"849289238839533568";https://twitter.com/spyglaz/status/849289238839533568
spyglaz;2017-03-30 11:55;0;0;"#Spyglaz is an official member of @bizspark , a program that provides technology + support to promising #startups http:// buff.ly/2oc83xG";;@bizspark;#Spyglaz #startups;"847477290573447168";https://twitter.com/spyglaz/status/847477290573447168
xitus82;2017-03-27 08:45;0;1;"@spyglaz Wow! You are in the Social Wall about leadgeneration. Share it! http://www. seejay.cloud/rd/55ffff572a1 bb …";;@spyglaz;;"846342299793719296";https://twitter.com/xitus82/status/846342299793719296
spyglaz;2017-03-23 12:55;1;1;"Analytics projects not delivering? Read this - http:// buff.ly/2mLQmAE #analytics #dataanalysis #business pic.twitter.com/URnz6jutUY";;;#analytics #dataanalysis #business;"844955679291031552";https://twitter.com/spyglaz/status/844955679291031552
spyglaz;2017-03-21 12:55;1;1;"Spyglaz is a predictive #sales #analytics platform that helps increase #revenue from your current customers http:// buff.ly/2n47Vxm pic.twitter.com/dHcoAPaU1v";;;#sales #analytics #revenue;"844230911432540161";https://twitter.com/spyglaz/status/844230911432540161
spyglaz;2017-03-16 12:55;2;3;"How to Capture More Value from #BigData and #Analytics - Want Big Data ROI? Act quickly on insights http:// buff.ly/2njmJLB via @7wData pic.twitter.com/PBc1kGHU8F";;@7wData;#BigData #Analytics;"842418954534551553";https://twitter.com/spyglaz/status/842418954534551553
KarlaFriede;2017-03-14 16:10;0;3;"Hey @Manisha1 @Paybefore @spyglaz thanks for being top new followers this week! Much appreciated :)";;@Manisha1 @Paybefore @spyglaz;;"841743397929013249";https://twitter.com/KarlaFriede/status/841743397929013249
spyglaz;2017-03-14 12:55;0;0;"4 Reasons to Build Predictive Customer #Analytics into Your #Retail #Business - good insights by @OrenRofman http:// buff.ly/2mntdnE";;@OrenRofman;#Analytics #Retail #Business;"841694239281020929";https://twitter.com/spyglaz/status/841694239281020929
spyglaz;2017-03-09 11:55;2;4;"8 ways big data analytics can be applied by any CEO http:// buff.ly/2naXR4G via @7wData #bigdata #dataanalysis #dataanalytics pic.twitter.com/FzLMM7jLdu";;@7wData;#bigdata #dataanalysis #dataanalytics;"839882261524774913";https://twitter.com/spyglaz/status/839882261524774913
spyglaz;2017-03-07 11:55;0;1;"Spyglaz is leveraging the technology and support of @bizspark #bizspark #microsoft #startup #siliconvalley http:// buff.ly/2nacS6M pic.twitter.com/twaWnR7A5f";;@bizspark;#bizspark #microsoft #startup #siliconvalley;"839157448636252160";https://twitter.com/spyglaz/status/839157448636252160
spyglaz;2017-03-02 11:55;0;0;"6 reasons data analytics will make a splash in 2017 via @datafloq http:// buff.ly/2m3oYRD #dataanalytics #bigdata #datafloq pic.twitter.com/UClBfVXqNG";;@datafloq;#dataanalytics #bigdata #datafloq;"837345520486137857";https://twitter.com/spyglaz/status/837345520486137857
spyglaz;2017-02-28 11:55;1;0;"Could Predictive Analytics Be Bad For Sales? By @donaldaly from @altifyinc http:// buff.ly/2m38I39 @Forbes #predictiveanalytics #bigdata";;@donaldaly @altifyinc @Forbes;#predictiveanalytics #bigdata;"836620751621001216";https://twitter.com/spyglaz/status/836620751621001216
spyglaz;2017-02-23 11:55;0;0;"Why the promise of big #data hasn’t delivered yet http:// buff.ly/2lOBEMD via @techcrunch #bigdata #predictiveanalytics #analytics pic.twitter.com/ksmetwN7IF";;@techcrunch;#data #bigdata #predictiveanalytics #analytics;"834808796413300741";https://twitter.com/spyglaz/status/834808796413300741
spyglaz;2017-02-21 11:55;1;0;"More leads. More #sales . Made simple https:// youtube.com/watch?v=uS1moL DQrT4 … Sign up to Spyglaz today! http:// buff.ly/2jbSDqJ #analytics pic.twitter.com/uvesAba2eQ";;;#sales #analytics;"834084022137536512";https://twitter.com/spyglaz/status/834084022137536512
spyglaz;2017-02-16 11:55;0;1;"#Spyglaz proudly supports woman-owned small businesses #wosb #sba by @spyglaz http:// buff.ly/2kJs2yS #predictiveanalytics #sales #bigdata pic.twitter.com/H528F9Z6WF";;@spyglaz;#Spyglaz #wosb #sba #predictiveanalytics #sales #bigdata;"832272085951115265";https://twitter.com/spyglaz/status/832272085951115265
spyglaz;2017-02-14 11:55;0;0;"Key Data and Analytics Trends Everyone Should Watch in 2017 by @BernardMarr http:// buff.ly/2kvf0HQ #bigdata #predictiveanalytics";;@BernardMarr;#bigdata #predictiveanalytics;"831547334089723904";https://twitter.com/spyglaz/status/831547334089723904
