username;date;retweets;favorites;text;geo;mentions;hashtags;id;permalink
spyglaz;2018-12-18 19:10;0;0;"https://www. martechadvisor.com/articles/custo mer-experience-2/retention-marketing-done-right-how-to-reduce-churn-and-increase-revenue/ …";;;;"1075181610465542144";https://twitter.com/spyglaz/status/1075181610465542144
spyglaz;2018-11-22 16:00;1;0;"Predictive analytics can help lead the way to sales growth for your business. Learn how. https:// buff.ly/2ODszox";;;;"1065711667680555008";https://twitter.com/spyglaz/status/1065711667680555008
spyglaz;2018-11-20 12:00;0;0;"The Spyglaz Leadership series delivers valuable insights around managing customer churn from business leaders around the world. https:// buff.ly/2NXnZ4V";;;;"1064926419308957696";https://twitter.com/spyglaz/status/1064926419308957696
spyglaz;2018-11-16 12:00;0;0;"Customer success needs a company wide commitment. How committed is your organization? https:// buff.ly/2DzIleJ";;;;"1063477005923115009";https://twitter.com/spyglaz/status/1063477005923115009
spyglaz;2018-11-15 12:01;0;0;"To get customer churn right, you need to address these 4 fundamental issues first https:// buff.ly/2xcBbYh";;;;"1063114753223073793";https://twitter.com/spyglaz/status/1063114753223073793
spyglaz;2018-11-13 12:00;1;1;"Is your customer experience journey easy? A different slant on reducing churn is simply, to make things simple. #spyglaz #customersuccess https:// buff.ly/2tYDLTl";;;#spyglaz #customersuccess;"1062389878502187008";https://twitter.com/spyglaz/status/1062389878502187008
spyglaz;2018-11-12 14:51;0;0;"Great line-up of speakers at Digital Garage's annual conference #designintelligence http:// dg717.com/ncc/";;;#designintelligence;"1062070378942459906";https://twitter.com/spyglaz/status/1062070378942459906
spyglaz;2018-11-09 11:30;0;0;"https:// buff.ly/2ATyY7g";;;;"1060932661215182854";https://twitter.com/spyglaz/status/1060932661215182854
spyglaz;2018-11-08 16:00;0;0;"https:// buff.ly/2zCbaTy";;;;"1060638119442202624";https://twitter.com/spyglaz/status/1060638119442202624
spyglaz;2018-11-02 03:45;0;0;"https:// buff.ly/2QcwQMZ";;;;"1058263693396389888";https://twitter.com/spyglaz/status/1058263693396389888
spyglaz;2018-11-01 15:15;0;0;"To be successful at customer success, you need to build your strategy in the right way. Follow our process map to ensure you get it right. pic.twitter.com/CuG8AhI8CE";;;;"1058074996273225729";https://twitter.com/spyglaz/status/1058074996273225729
spyglaz;2018-10-30 16:00;0;0;"Stop hoping to improve customer churn. Stay ahead of it by adopting predictive analytics. The next 60 seconds could mean the difference for your business https:// buff.ly/2oc83xG";;;;"1057361501978349568";https://twitter.com/spyglaz/status/1057361501978349568
spyglaz;2018-10-25 16:24;0;0;"https:// buff.ly/2NueSU4 pic.twitter.com/p6GDyFcD3l";;;;"1055555608240373761";https://twitter.com/spyglaz/status/1055555608240373761
spyglaz;2018-10-23 16:20;0;0;"https:// buff.ly/2OzkFw8";;;;"1054829819865767936";https://twitter.com/spyglaz/status/1054829819865767936
spyglaz;2018-10-22 10:30;0;0;"https:// buff.ly/2Nyrl9p pic.twitter.com/1rMSCYCoZD";;;;"1054379359753158658";https://twitter.com/spyglaz/status/1054379359753158658
spyglaz;2018-10-19 21:00;0;0;"https:// buff.ly/2pnFSLt";;;;"1053450772783005697";https://twitter.com/spyglaz/status/1053450772783005697
spyglaz;2018-10-17 12:00;0;0;"https:// buff.ly/2OyGuMk";;;;"1052590295274147840";https://twitter.com/spyglaz/status/1052590295274147840
spyglaz;2018-10-16 15:15;0;0;"https:// buff.ly/2ypIXPh";;;;"1052276792881500160";https://twitter.com/spyglaz/status/1052276792881500160
spyglaz;2018-10-15 03:00;0;0;"https:// buff.ly/2ODszox pic.twitter.com/4DDcxbsswV";;;;"1051729506988376065";https://twitter.com/spyglaz/status/1051729506988376065
spyglaz;2018-10-12 12:00;0;0;"3 common mistakes to avoid when tackling customer retention. https:// buff.ly/2OuEwMX";;;;"1050778192057946112";https://twitter.com/spyglaz/status/1050778192057946112
spyglaz;2018-10-10 16:00;0;0;"Keep one eye on growth and two ears on the voice of your customers. https:// buff.ly/2y8wfEs";;;;"1050113858172542976";https://twitter.com/spyglaz/status/1050113858172542976
spyglaz;2018-10-08 12:01;0;0;"Spyglaz Customer Churn Leadership series: https:// buff.ly/2NXnZ4V pic.twitter.com/UevKB8oYt3";;;;"1049328820535406592";https://twitter.com/spyglaz/status/1049328820535406592
spyglaz;2018-10-04 18:00;0;0;"20 useful tips to improve customer retention. https:// buff.ly/2p633dr";;;;"1047969617640128512";https://twitter.com/spyglaz/status/1047969617640128512
spyglaz;2018-10-02 13:00;1;1;"Predictive analytics can vastly improve your approach to managing customer churn. #spyglaz #customerchurn pic.twitter.com/X6O8R9SmhS";;;#spyglaz #customerchurn;"1047169350095065088";https://twitter.com/spyglaz/status/1047169350095065088
spyglaz;2018-10-01 16:29;0;0;"A simplified decision chart that can guide your approach to managing customers likely to churn. #spyglaz #churnmanagement #customerchurn pic.twitter.com/zfLVgcixhZ";;;#spyglaz #churnmanagement #customerchurn;"1046859553135108097";https://twitter.com/spyglaz/status/1046859553135108097
spyglaz;2018-09-18 03:45;0;0;"Don't start any churn reduction strategy without first checking if you have the right building blocks in place. https:// buff.ly/2xcBbYh";;;;"1041956255882006530";https://twitter.com/spyglaz/status/1041956255882006530
spyglaz;2018-09-13 12:05;0;0;"Are you doing enough to improve customer retention? http:// ow.ly/hCQm30lIG40";;;;"1040270245582319617";https://twitter.com/spyglaz/status/1040270245582319617
CustExpWorld;2018-09-12 11:48;0;0;"@spyglaz Spyglaz Thank for following Real quick the #CX Event of the year is in Cape Town for the serious #CX Professionals - Customer Success means Business Success Go Here https:// bit.ly/2rXxggb";;@spyglaz;#CX #CX;"1039903460450344960";https://twitter.com/CustExpWorld/status/1039903460450344960
spyglaz;2018-09-11 10:25;0;0;"Having the right tools at your disposal is critical in delivering customer success, successfully! http:// ow.ly/pmB630lHFoA";;;;"1039520233898340352";https://twitter.com/spyglaz/status/1039520233898340352
spyglaz;2018-09-06 14:30;0;0;"Don't wait till it's too late. Churn management software provides you with leading indicators of customer churn. http:// ow.ly/u5gD30lCaQ9";;;;"1037770123589963778";https://twitter.com/spyglaz/status/1037770123589963778
spyglaz;2018-09-04 12:10;0;0;"Check out the latest in customer experience trends. http:// ow.ly/RZBh30lCavm";;;;"1037010009358561280";https://twitter.com/spyglaz/status/1037010009358561280
spyglaz;2018-08-30 16:00;0;0;"Defining churn isn't difficult. Get started on your churn reduction journey and hold onto more customers. http:// ow.ly/wXTf30lC9L8";;;;"1035256017427283968";https://twitter.com/spyglaz/status/1035256017427283968
spyglaz;2018-08-28 12:03;1;0;"The retention strategies of yesterday are no longer relevant in today's data rich world. http:// ow.ly/adgg30lrkVo";;;;"1034471457949134849";https://twitter.com/spyglaz/status/1034471457949134849
spyglaz;2018-08-23 12:01;0;0;"Stay in touch with the latest customer retention strategies. http:// ow.ly/VOc730lrkeC";;;;"1032659173727711232";https://twitter.com/spyglaz/status/1032659173727711232
spyglaz;2018-08-22 09:02;0;0;"Navigate your way out of the storm . Customer churn is now easier to manage. http:// ow.ly/2vXG30lrk1f";;;;"1032251644426313728";https://twitter.com/spyglaz/status/1032251644426313728
spyglaz;2018-08-18 05:05;0;0;"Great to be a part of the growing community of data scientists in Melbourne. This Meet Up is officially the 5th largest in the world. pic.twitter.com/HTx5mleHSE";;;;"1030742381170225153";https://twitter.com/spyglaz/status/1030742381170225153
spyglaz;2018-08-10 16:01;1;0;"Want to know how Predictive Analytics can help your business thrive? Read about this wholesaler who used the power of predictive analytics to improve customer retention and find sales growth. https://www. cmo.com.au/article/643920 /alvin-electronics-leaps-into-realm-machine-learning/ …";;;;"1028008402679750656";https://twitter.com/spyglaz/status/1028008402679750656
Brandon_Lopez;2018-08-09 11:43;3;4;"A special thanks to @spyglaz @LoopAndTie @salesdirectorai @lucidconnects for sharing insights into their experience with product market fit and will make for a better podcast recording tomorrow. Still time to add your vote or share your story! #founders #productmanagement";;@spyglaz @LoopAndTie @salesdirectorai @lucidconnects;#founders #productmanagement;"1027581036446736385";https://twitter.com/Brandon_Lopez/status/1027581036446736385
siftery;2018-08-05 11:00;0;0;"Are you using Spyglaz ( @spyglaz ) and recommend them? You can do it here http:// siftery.com/spyglaz?recomm end …";;@spyglaz;;"1026120669082411008";https://twitter.com/siftery/status/1026120669082411008
spyglaz;2018-08-03 16:01;0;0;"Key Benefits of Churn Management Software: Provides Clear Strategic Focus + Saves Time and Money + Promotes Optimal Reporting + Delivers Actionable Insights + Enables Retention Ownership + Easy CRM Integration - Learn more by reading our post below https:// spyglaz.com/churn-manageme nt-software-a-powerful-platform-for-customer-success/ …";;;;"1025471689373757446";https://twitter.com/spyglaz/status/1025471689373757446
spyglaz;2018-07-27 16:01;1;0;"Would you like to be able to predict when a customer chooses not to proceed with a specific proposal for your services or when they choose to upgrade their subscription? We have a solution for you! Click below to request a demo! https:// spyglaz.com/faq/#form-requ est-a-demo … pic.twitter.com/Upe1O4wHQ8";;;#form;"1022934979708428289";https://twitter.com/spyglaz/status/1022934979708428289
spyglaz;2018-07-20 16:00;0;0;"Ever get the feeling your business is spinning its’ wheels in the mud and experiencing customer churn? Predictive analytics literally gives you the ability to look into the future, to anticipate negative business outcomes before they actually happen. https:// spyglaz.com/customer-churn/ pic.twitter.com/3LJcg5QSia";;;;"1020398071161720833";https://twitter.com/spyglaz/status/1020398071161720833
SherrylDimitry;2018-07-20 09:43;0;1;""Lean in" has always felt like "pull yourself up from your bootstraps" to me. Leaning into a brick wall can be useless. At the same time, agency matters. Agency is the way to crack the wall. #genderequity #MeToo via @Entrepreneur @spyglaz http:// entm.ag/stk";;@Entrepreneur @spyglaz;#genderequity #MeToo;"1020303063989587968";https://twitter.com/SherrylDimitry/status/1020303063989587968
spyglaz;2018-07-13 16:00;0;0;"Customer Retention – Who Owns It? Predictive analytics software is helping to keep your customers around, learn more here! https:// spyglaz.com/customer-reten tion/ … pic.twitter.com/mRM4qR75IM";;;;"1017861467666776065";https://twitter.com/spyglaz/status/1017861467666776065
spyglaz;2018-06-26 12:01;0;0;"How many of your sales staff are focussed on today's sale rather than considering the long term value of the customer? Churn management software could be the key to help make the change. http:// ow.ly/MnUl30kxu53";;;;"1011640587529879554";https://twitter.com/spyglaz/status/1011640587529879554
LaurelJMintz;2018-06-21 13:03;0;0;"In the Era of #MeToo , Telling Women to 'Lean In' Does More Harm Than Good via @Entrepreneur @spyglaz https:// buff.ly/2tbvc4P pic.twitter.com/QU5Oazdn9P";;@Entrepreneur @spyglaz;#MeToo;"1009844167122579456";https://twitter.com/LaurelJMintz/status/1009844167122579456
spyglaz;2018-06-21 11:40;0;0;"Managing your data strategy doesn't need to be complicated. Keep it simple. Your customers will love you for it. http:// ow.ly/pgJy30koEio";;;;"1009823312506249217";https://twitter.com/spyglaz/status/1009823312506249217
blackwomen_biz;2018-06-21 11:22;0;1;"In the Era of #MeToo , Telling Women to 'Lean In' Does More Harm Than Good via @Entrepreneur @spyglaz http:// entm.ag/stk";;@Entrepreneur @spyglaz;#MeToo;"1009818866808246273";https://twitter.com/blackwomen_biz/status/1009818866808246273
shireenmccleary;2018-06-20 14:32;0;0;"In the Era of #MeToo , Telling Women to 'Lean In' Does More Harm Than Good via @Entrepreneur @spyglaz http:// entm.ag/stk";;@Entrepreneur @spyglaz;#MeToo;"1009504279189569537";https://twitter.com/shireenmccleary/status/1009504279189569537
itskgarvin;2018-06-20 14:00;0;0;"I have the urge to reread 'Lean In' now >> In the Era of #MeToo , Telling Women to 'Lean In' Does More Harm Than Good via @Entrepreneur @spyglaz http:// entm.ag/stk";;@Entrepreneur @spyglaz;#MeToo;"1009496263405047813";https://twitter.com/itskgarvin/status/1009496263405047813
tubmansghost;2018-06-19 21:33;0;0;"In the Era of #MeToo , Telling Women to 'Lean In' Does More Harm Than Good via @Entrepreneur @spyglaz http:// entm.ag/stk";;@Entrepreneur @spyglaz;#MeToo;"1009247831524364288";https://twitter.com/tubmansghost/status/1009247831524364288
jennifercloer;2018-06-19 17:55;0;0;"In the Era of #MeToo , Telling Women to 'Lean In' Does More Harm Than Good via @Entrepreneur @spyglaz http:// entm.ag/stk";;@Entrepreneur @spyglaz;#MeToo;"1009193055847530497";https://twitter.com/jennifercloer/status/1009193055847530497
nadeemansary;2018-06-19 14:28;0;0;"In the Era of #MeToo , Telling Women to 'Lean In' Does More Harm Than Good | by @spyglaz (on @WomenEnt ) http:// entm.ag/stk";;@spyglaz @WomenEnt;#MeToo;"1009140761621917696";https://twitter.com/nadeemansary/status/1009140761621917696
Shitikarsh;2018-06-19 13:19;0;0;"I've always supported countless feminist causes n all the myriad efforts lobbying for equal pay, equal opportunity, harassment free workplaces nd a woman's right to control what happens 2 her body.";;;;"1009123478929379328";https://twitter.com/Shitikarsh/status/1009123478929379328
Entrepreneur;2018-06-19 13:05;7;13;"In the Era of #MeToo , Telling Women to 'Lean In' Does More Harm Than Good | by @spyglaz (on @WomenEnt ) http:// entm.ag/stk";;@spyglaz @WomenEnt;#MeToo;"1009119900433043458";https://twitter.com/Entrepreneur/status/1009119900433043458
spyglaz;2018-06-19 10:45;0;0;"If we know a new customer costs 5 times as much to secure than retaining one, why don't we focus on it? http:// ow.ly/vorD30koEfv";;;;"1009084717415755776";https://twitter.com/spyglaz/status/1009084717415755776
spyglaz;2018-06-14 12:15;0;0;"Learn how to improve customer retention by over 70%. http:// ow.ly/Xj2S30koEbW";;;;"1007295449278177281";https://twitter.com/spyglaz/status/1007295449278177281
spyglaz;2018-06-12 18:47;1;1;"Great being part of this insightful panel discussion on predictive analytics @SIIAAnnual18 https:// twitter.com/jwhitby1/statu s/1006611094712905728 …";;@SIIAAnnual18;;"1006669455634542592";https://twitter.com/spyglaz/status/1006669455634542592
SIIASoftware;2018-06-12 15:02;1;2;"Predictive Analytics - What is it?! #SIIAAnnual18 Marco, VP Product of @salesforce | Neeraja Founder of @spyglaz | Nancy CEO @MindprintLearn help us understand with specific use cases pic.twitter.com/aCDJNGlrR6";;@salesforce @spyglaz @MindprintLearn;#SIIAAnnual18;"1006612746245267458";https://twitter.com/SIIASoftware/status/1006612746245267458
RhiannaSCollier;2018-06-12 15:01;3;10;"Such a fantastic panel on Predictive Analytics with @salesforce @spyglaz @MindprintLearn and Reach Analytics Great Content! #SIIAAnnual18 @SIIASoftware pic.twitter.com/NR4CUxh66o";;@salesforce @spyglaz @MindprintLearn @SIIASoftware;#SIIAAnnual18;"1006612371278712832";https://twitter.com/RhiannaSCollier/status/1006612371278712832
spyglaz;2018-06-12 11:30;0;0;"Who's winning the Market department versus Sales Department battle? Customers don't care. http:// ow.ly/fnJZ30koDZd";;;;"1006559418408939520";https://twitter.com/spyglaz/status/1006559418408939520
spyglaz;2018-06-08 12:00;0;0;"It's difficult to grow if you're not plugging your leaking sales today. http:// ow.ly/QVEp30koDVA";;;;"1005117412151349250";https://twitter.com/spyglaz/status/1005117412151349250
spyglaz;2018-05-31 11:55;0;0;"The latest tool to tackle customer churn is one click away. http:// ow.ly/rQQl30kaH8L";;;;"1002216958685843456";https://twitter.com/spyglaz/status/1002216958685843456
spyglaz;2018-05-29 12:01;0;0;"Everything you need to know about improving customer retention. http:// ow.ly/wneD30kaH2j";;;;"1001493767919108097";https://twitter.com/spyglaz/status/1001493767919108097
spyglaz;2018-05-25 10:30;0;0;"Customer churn has many hidden costs. Are you aware of them all? http:// ow.ly/u1mm30kaGS1";;;;"1000021314198032384";https://twitter.com/spyglaz/status/1000021314198032384
spyglaz;2018-05-22 16:08;1;1;"We #Python @spyglaz https:// twitter.com/kdnuggets/stat us/999014337388871685 …";;@spyglaz;#Python;"999019208393420800";https://twitter.com/spyglaz/status/999019208393420800
spyglaz;2018-05-17 12:05;0;0;"If customer retention is not on your immediate radar, your doing it wrong. http:// ow.ly/nBzf30jO9zU";;;;"997146078217687040";https://twitter.com/spyglaz/status/997146078217687040
spyglaz;2018-05-16 14:35;1;1;"Fantastic experience participating in the @techbayarea Global AI summit last week!! https:// twitter.com/MayaMancuso/st atus/995103126108553216 …";;@techbayarea;;"996821491361529856";https://twitter.com/spyglaz/status/996821491361529856
spyglaz;2018-05-15 11:45;0;0;"Customer Success and Customer Experience, when brought together, can significantly assist in reducing customer churn. Find out why. http:// ow.ly/gSZi30jO9pv";;;;"996416257053339653";https://twitter.com/spyglaz/status/996416257053339653
spyglaz;2018-05-11 05:00;0;1;"9 strategies to help reduce SaaS customer churn. https:// conversionxl.com/blog/reduce-ch urn/ …";;;;"994864898067836928";https://twitter.com/spyglaz/status/994864898067836928
spyglaz;2018-05-09 12:25;0;0;"Stop customer churn today! http:// ow.ly/sFgB30jUb0D";;;;"994251940170207232";https://twitter.com/spyglaz/status/994251940170207232
spyglaz;2018-05-03 10:30;0;0;"The next frontier of B2B sales is predictive analytics http:// ow.ly/2jUn30jqyZC";;;;"992048793955729408";https://twitter.com/spyglaz/status/992048793955729408
spyglaz;2018-04-26 12:02;0;0;"Checkout the latest predictions that you need to consider for your data management in 2018 http:// ow.ly/V7c830jpeMm";;;;"989535085346066433";https://twitter.com/spyglaz/status/989535085346066433
spyglaz;2018-04-24 11:20;1;2;"Learn how CustomInsight, an online SaaS platform for HR, stays one step ahead of business churn by partnering with Spyglaz and leveraging the power of predictive analytics. http:// ow.ly/LthS30jyV9o @CustomInsight @davegutzman";;@CustomInsight @davegutzman;;"988799789373579264";https://twitter.com/spyglaz/status/988799789373579264
spyglaz;2018-04-23 10:50;1;2;"Steve Emanouel, the Managing Director of Spyglaz, joined the TrinityP3 podcast to discuss the strategic flaws in focusing on acquisition and the importance of customer retention for business success. http:// ow.ly/N7da30jCzcC";;;;"988429834396340224";https://twitter.com/spyglaz/status/988429834396340224
spyglaz;2018-04-22 22:31;0;0;"Steve And Darren Chat About The Impact Of Data And Technology On Customer Retention by Managing Marketing via #soundcloud https:// soundcloud.com/managing-marke ting/steve-and-darren-chat-about-the-impact-of-data-and-technology-on-customer-retention?utm_source=soundcloud&utm_campaign=wtshare&utm_medium=Twitter&utm_content=https%3A//soundcloud.com/managing-marketing/steve-and-darren-chat-about-the-impact-of-data-and-technology-on-customer-retention …";;;#soundcloud;"988244035666984963";https://twitter.com/spyglaz/status/988244035666984963
spyglaz;2018-04-19 12:00;0;0;"Learn how Alvin Electronics reduced business churn with Spyglaz. http:// ow.ly/POKd30jxVQJ @alvinelectronics @scrhan";;@alvinelectronics @scrhan;;"986998056150237184";https://twitter.com/spyglaz/status/986998056150237184
spyglaz;2018-04-13 00:00;0;1;"Data trends in 2018. Is your data management heading in the right direction? http:// ow.ly/sSla30jp9lx";;;;"984642446704377856";https://twitter.com/spyglaz/status/984642446704377856
spyglaz;2018-04-10 15:46;1;1;"AI and machine learning myths busted #machinelearning #AI #predictthefuture https:// bit.ly/2GDzMRr";;;#machinelearning #AI #predictthefuture;"983793371872309249";https://twitter.com/spyglaz/status/983793371872309249
spyglaz;2018-04-10 11:25;0;0;"Stop customer churn before it happens! http:// ow.ly/XNb630jhq7O";;;;"983727612014014464";https://twitter.com/spyglaz/status/983727612014014464
spyglaz;2018-04-03 11:35;0;0;"4 Keys to boosting your customer retention today! http:// ow.ly/6E0t30jhomO";;;;"981193404582383616";https://twitter.com/spyglaz/status/981193404582383616
spyglaz;2018-03-29 12:01;0;0;"9 ways to improve customer retention. http:// ow.ly/o9Sx30jaw1v";;;;"979388015687749633";https://twitter.com/spyglaz/status/979388015687749633
spyglaz;2018-03-28 12:00;0;1;"The art of data science in reducing customer churn. http:// ow.ly/Smc230javB3";;;;"979025474276995072";https://twitter.com/spyglaz/status/979025474276995072
spyglaz;2018-03-16 11:01;0;1;"Great service is an important part of customer retention. So is having the right data to measure and understand it. #customerretention #machinelearning #ronburgundy #spyglaz #salesforce #churn pic.twitter.com/YaStP74hZd";;;#customerretention #machinelearning #ronburgundy #spyglaz #salesforce #churn;"974661972821266434";https://twitter.com/spyglaz/status/974661972821266434
spyglaz;2018-03-15 12:01;1;2;"Your data holds all the answers to successfully build your business. Learn how to tap into it and start growing. #machinelearning #customerretention #spyglaz #reducecustomerchurn #salesforce pic.twitter.com/EuLsqKo2FX";;;#machinelearning #customerretention #spyglaz #reducecustomerchurn #salesforce;"974314746873896960";https://twitter.com/spyglaz/status/974314746873896960
spyglaz;2018-03-11 18:05;1;1;"You need to K.I.S.S. your data analytics strategy now!! http:// ow.ly/ALDO30iLWln #machinelearning #CMOtips #salesforce #customerchurn #customerchurnsaas #customerretention #b2bcustomerretention #b2bmarketing #customerretentionsaas #retentionmarketing #spyglaz";;;#machinelearning #CMOtips #salesforce #customerchurn #customerchurnsaas #customerretention #b2bcustomerretention #b2bmarketing #customerretentionsaas #retentionmarketing #spyglaz;"972956613870063616";https://twitter.com/spyglaz/status/972956613870063616
SteveCassady;2018-03-10 04:25;0;1;"Thanks to my top #socialfave ​s @SimonSikorskiMD @WebsiteFame @spyglaz @Nazia_Shairy #STLove v/ https:// socialfave.net .";;@SimonSikorskiMD @WebsiteFame @spyglaz @Nazia_Shairy;#socialfave #STLove;"972402994040975360";https://twitter.com/SteveCassady/status/972402994040975360
spyglaz;2018-03-09 18:05;1;1;"Great service is an important part of customer retention. So is having the right data to measure and understand it. #customerretention #machinelearning #ronburgundy #spyglaz #salesforce #churn http:// ow.ly/iGgG30iRChm";;;#customerretention #machinelearning #ronburgundy #spyglaz #salesforce #churn;"972246943681392640";https://twitter.com/spyglaz/status/972246943681392640
spyglaz;2018-03-08 17:35;1;1;"Unlock the insights within your data to reduce customer churn. Click here to find out how. http:// ow.ly/L4w530iLHjj #machinelearning #salesforce #customerchurn #customerretention #b2bcustomerretention #b2bmarketing #customerretentionsaas #retentionmarketing #spyglaz";;;#machinelearning #salesforce #customerchurn #customerretention #b2bcustomerretention #b2bmarketing #customerretentionsaas #retentionmarketing #spyglaz;"971877003002568704";https://twitter.com/spyglaz/status/971877003002568704
spyglaz;2018-03-06 19:35;0;0;"Boosting customer loyalty. http:// ow.ly/k7kI30iLH8d #machinelearning #CMOtips #salesforce #customerchurn #customerchurnsaas #customerretention #b2bcustomerretention #b2bmarketing #customerretentionsaas #retentionmarketing #spyglaz";;;#machinelearning #CMOtips #salesforce #customerchurn #customerchurnsaas #customerretention #b2bcustomerretention #b2bmarketing #customerretentionsaas #retentionmarketing #spyglaz;"971182414327402496";https://twitter.com/spyglaz/status/971182414327402496
spyglaz;2018-03-05 16:25;1;0;"Reducing customer churn. A complete guide. http:// ow.ly/o7I930iLGAU #machinelearning #CMOtips #salesforce #customerchurn #customerchurnsaas #customerretention #b2bcustomerretention #b2bmarketing #customerretentionsaas #retentionmarketing #spyglaz";;;#machinelearning #CMOtips #salesforce #customerchurn #customerchurnsaas #customerretention #b2bcustomerretention #b2bmarketing #customerretentionsaas #retentionmarketing #spyglaz;"970772217918382082";https://twitter.com/spyglaz/status/970772217918382082
spyglaz;2018-03-02 15:30;1;0;"SMB customer retention trends. #machinelearning #CMOtips #salesforce #customerchurn #customerchurnsaas #customerretention #b2bcustomerretentionsoftware #b2bmarketing #customerretentionsaas #retentionmarketing";;;#machinelearning #CMOtips #salesforce #customerchurn #customerchurnsaas #customerretention #b2bcustomerretentionsoftware #b2bmarketing #customerretentionsaas #retentionmarketing;"969671318932197377";https://twitter.com/spyglaz/status/969671318932197377
spyglaz;2018-02-27 11:30;1;1;"In 60 seconds, learn about the latest, proven customer retention tool. https:// vimeo.com/256362988 #machinelearning #CMOtips #salesforce #customerchurn #customerretention #b2bcustomerretention #retentionmarketing";;;#machinelearning #CMOtips #salesforce #customerchurn #customerretention #b2bcustomerretention #retentionmarketing;"968523795391827969";https://twitter.com/spyglaz/status/968523795391827969
