username;date;retweets;favorites;text;geo;mentions;hashtags;id;permalink
solvewithvia;2018-03-30 13:27;2;2;"#Shell in electricity? If you're a fuel provider, and EVs are the future, going from liquid fuels to electrons is a logical expansion https://www. wsj.com/articles/oil-g iant-shell-wants-to-sell-you-electricity-1522315801 …";;;#Shell;"979772058748977152";https://twitter.com/solvewithvia/status/979772058748977152
solvewithvia;2018-03-30 09:24;1;3;"ICYMI: Yesterday we shared our newly refreshed brand, including a new logo, fully redesigned website, and newly launched Instagram acct ( @solvewithvia ). Check it out: http://www. solvewithVIA.com #solvewithVIA #MTL #Somerville pic.twitter.com/pxCrzOaT3u";;@solvewithvia;#solvewithVIA #MTL #Somerville;"979710838545240064";https://twitter.com/solvewithvia/status/979710838545240064
solvewithvia;2018-03-29 12:27;1;1;"Our website is LIVE! Head on over to http://www. solvewithVIA.com";;;;"979394605912412160";https://twitter.com/solvewithvia/status/979394605912412160
John_Muddle;2018-03-29 12:23;0;0;"@solvewithvia";;@solvewithvia;;"979393706699776000";https://twitter.com/John_Muddle/status/979393706699776000
John_Muddle;2018-03-29 12:21;1;1;"Woo #solvewithvia";;;#solvewithvia;"979393158718115843";https://twitter.com/John_Muddle/status/979393158718115843
viascience;2018-03-29 12:19;0;0;"Our account has changed. Head over to our new account @solvewithvia !";;@solvewithvia;;"979392643590389760";https://twitter.com/viascience/status/979392643590389760
solvewithvia;2018-03-29 11:55;2;2;"Here it is! The final piece to our new logo. Today is the day VIA launches our brand refresh.… https://www. instagram.com/p/Bg6bWGoBQal/";;;;"979386662932434945";https://twitter.com/solvewithvia/status/979386662932434945
solvewithvia;2018-03-28 09:34;0;1;"Today is the last day before our #brandlaunch . VIA is so excited for all the changes coming soon. We hope you are too! #SolvewithVIA";;;#brandlaunch #SolvewithVIA;"978988606818832384";https://twitter.com/solvewithvia/status/978988606818832384
solvewithvia;2018-03-27 10:34;2;1;"Just 2 days left until YOU can #SolvewithVIA ! Here's a #FactwithVIA while you wait. Six months after Hurricane Maria, over 16% of Puerto Rico is still without power. Check out our blog on how #AI is the solution to these widespread outages. http:// tiny.cc/f064ry";;;#SolvewithVIA #FactwithVIA #AI;"978641364136144896";https://twitter.com/solvewithvia/status/978641364136144896
solvewithvia;2018-03-26 09:08;1;2;"Just 3 days to go until our #brandlaunch ! Our website is about to go under some big changes, check out the countdown while you can. #SolvewithVIA http:// tiny.cc/oqgxry";;;#brandlaunch #SolvewithVIA;"978257300795387904";https://twitter.com/solvewithvia/status/978257300795387904
solvewithvia;2018-03-23 10:12;1;1;"6 days until our #brandlaunch ! Keep up with our reveal and follow our Instagram (@viascience) and LinkedIn pages. #SolvewithVIA http:// tiny.cc/syw1ry";;@viascience;#brandlaunch #SolvewithVIA;"977186265266302977";https://twitter.com/solvewithvia/status/977186265266302977
solvewithvia;2018-03-22 12:28;2;4;"Our CEO and Director of Marketing are at the @UnderscoreVC #BlockchainCoreSummit ! They are hearing from the brightest minds and leaders in the #blockchain space at this exciting event. #FutureofBlockchain pic.twitter.com/2pJwNMBjGR";;@UnderscoreVC;#BlockchainCoreSummit #blockchain #FutureofBlockchain;"976858106037788672";https://twitter.com/solvewithvia/status/976858106037788672
solvewithvia;2018-03-22 09:27;1;1;"Fun Fact: The definition of the English word “via” is “by way of.” We approach everything as a… https://www. instagram.com/p/BgoI0TSgUmo/";;;;"976812725723713536";https://twitter.com/solvewithvia/status/976812725723713536
solvewithvia;2018-03-21 22:34;1;5;"Our CEO, Colin Gounden, presented this morning at the Shenzhen Innovation and Entrepreneurship International Competition in #Cambridge .  Fun Fact: more than half of all iPad and iPhones are made in #Shenzen , China! pic.twitter.com/UhQpsSdzm5";;;#Cambridge #Shenzen;"976648348877934593";https://twitter.com/solvewithvia/status/976648348877934593
solvewithvia;2018-03-21 11:44;1;1;"Our #brandlaunch is only 8 days away. Our team couldn't more excited to #SolvewithVIA !";;;#brandlaunch #SolvewithVIA;"976484748678877184";https://twitter.com/solvewithvia/status/976484748678877184
solvewithvia;2018-03-20 10:29;0;2;"blogs from 2017 you can read on our website and days until our #brandlaunch ! Who's ready to #solvewithVIA ? http:// tiny.cc/egjyry";;;#brandlaunch #solvewithVIA;"976103494620008448";https://twitter.com/solvewithvia/status/976103494620008448
solvewithvia;2018-03-19 09:01;1;2;"Head to our website for a #livecountdown to our #brandlaunch ! T-minus days. Who's ready to #solvewithVIA ? http:// tiny.cc/5qgxry";;;#livecountdown #brandlaunch #solvewithVIA;"975718929611018240";https://twitter.com/solvewithvia/status/975718929611018240
solvewithvia;2018-03-16 12:14;0;1;"#VIAfact : According to @NatGeoEnergy , widespread #poweroutages cost the United States an annual average of between $18 billion and $33 billions USD. Looking ahead, #VIApredicts a future where that number is much lower. #solvewithVIA http:// tiny.cc/li7lry";;@NatGeoEnergy;#VIAfact #poweroutages #VIApredicts #solvewithVIA;"974680302395252736";https://twitter.com/solvewithvia/status/974680302395252736
solvewithvia;2018-03-16 10:20;1;1;"Who’s ready to #solvewithVIA ? days until our brand launch!";;;#solvewithVIA;"974651656238436352";https://twitter.com/solvewithvia/status/974651656238436352
solvewithvia;2018-03-15 11:52;1;1;"Welcome to VIA’s Instagram and very first post! We are thrilled to have you on our page. Head to… https://www. instagram.com/p/BgWWHBIghAV/";;;;"974312413255421952";https://twitter.com/solvewithvia/status/974312413255421952
solvewithvia;2018-03-15 11:45;1;1;"Who’s ready to #solvewithVIA ? days until our brand launch!";;;#solvewithVIA;"974310506268938246";https://twitter.com/solvewithvia/status/974310506268938246
solvewithvia;2018-03-15 11:37;1;2;"Are you on #Instagram ? Well now VIA is too! Head over to @viascience and give us a follow. We've got big things coming soon and want YOU to be a part of it! #solvewithvia http:// tiny.cc/esztry";;@viascience;#Instagram #solvewithvia;"974308584963047424";https://twitter.com/solvewithvia/status/974308584963047424
solvewithvia;2018-03-14 14:42;1;0;"VIA is incredibly proud of our team culture. Read our latest blog to find out how we build a great team. http:// tiny.cc/uw5sry";;;;"973992890841083913";https://twitter.com/solvewithvia/status/973992890841083913
solvewithvia;2018-03-14 11:57;0;2;"Our #Somerville office celebrating #PiDay2018 with @petsipies ! pic.twitter.com/U4XVGTPONM";;@petsipies;#Somerville #PiDay2018;"973951184477282304";https://twitter.com/solvewithvia/status/973951184477282304
solvewithvia;2018-03-12 14:50;1;2;"VIA’s #Montreal team is expanding. Want to be a part of it? Check out our Software Developer position and apply TODAY! http:// tiny.cc/qj9qry";;;#Montreal;"973270069613662208";https://twitter.com/solvewithvia/status/973270069613662208
solvewithvia;2018-03-08 16:03;1;1;"L’équipe technique est à @UdeMontreal au Symposium Annuel de Physique pour un Avenir en Recherche et en Industrie #SAPHARI . Venez nous voir! #VIA pic.twitter.com/QW46LTHkrD";;@UdeMontreal;#SAPHARI #VIA;"971853892098166786";https://twitter.com/solvewithvia/status/971853892098166786
solvewithvia;2018-03-08 16:02;1;1;"Some members of our technical team are at @UdeMontreal at the Annual Colloquium in Physics for a Future in Research and Industry #SAPHARI . Come see us! #VIA pic.twitter.com/8mGHvibPFb";;@UdeMontreal;#SAPHARI #VIA;"971853692407250949";https://twitter.com/solvewithvia/status/971853692407250949
solvewithvia;2018-03-05 16:29;2;3;"Someone ( @greentechmedia ) is talking about #blockchain in the #energyindustry ! From transactive energy to asset tokenization, utilities all over the world are realizing the applications of this technology. https://www. greentechmedia.com/articles/read/ four-predictions-for-blockchain-in-energy-in-2018#gs.qKdTeJc …";;@greentechmedia;#blockchain #energyindustry #gs;"970773402666627072";https://twitter.com/solvewithvia/status/970773402666627072
solvewithvia;2018-03-05 09:34;4;4;"VIA is excited to announce a new initiative with #TEPCOPowerGrid (subsidiary of @TEPCO_English ). Our #ai will provide automated recovery recommendations for multiple switch failures to ensure #gridsafety and reliability. Check it out: http:// bit.ly/2F1mauX";;@TEPCO_English;#TEPCOPowerGrid #ai #gridsafety;"970668957781954560";https://twitter.com/solvewithvia/status/970668957781954560
solvewithvia;2018-02-28 11:03;0;2;"VIA’s Marketing team at @Google in #KendallSquare for #AdClubCMO . Loved hearing about the @NewBalance brand story from VP of Global Marketing, Chris Davis. pic.twitter.com/f3N2bieyph";;@Google @NewBalance;#KendallSquare #AdClubCMO;"968879440997634049";https://twitter.com/solvewithvia/status/968879440997634049
solvewithvia;2018-02-27 15:50;0;1;"VIA is hiring! We're looking to fill two new positions, Office Assistant and Senior Software Developer. Check out our website for more information http://www. viascience.com/careers/ and apply by emailing your resume to jobs@viascience.com!";;@viascience;;"968589113073991681";https://twitter.com/solvewithvia/status/968589113073991681
solvewithvia;2018-02-22 12:52;0;1;"Of course! Go right ahead.";;;;"966732447575674880";https://twitter.com/solvewithvia/status/966732447575674880
solvewithvia;2018-02-21 13:36;2;4;"With temperatures soaring at 70 degrees, the obvious move for our #Somerville team was to get some ice cream! @jplicks in #DavisSquare pic.twitter.com/8Ctqrj9lDU";;@jplicks;#Somerville #DavisSquare;"966381202918772738";https://twitter.com/solvewithvia/status/966381202918772738
solvewithvia;2018-02-20 11:50;1;1;"Congrats to @PPLcorp on using smart grid tech and data analytics to reach this impressive ranking! "PPL ranks in the top 11 percent of utilities nationwide in terms of the lowest average number of outages per customer." https://www. newsitem.com/articles/smart -grid-technology-helping-ppl-decrease-outage-numbers/ …";;@PPLcorp;;"965991990235226112";https://twitter.com/solvewithvia/status/965991990235226112
solvewithvia;2018-02-15 14:06;2;1;"Last call for applications for our #datascientist role! If you're interested in joining our #MTL team, email you resumes and cover letters to jobs@viascience.com https://www. linkedin.com/jobs/view/5461 08193/ …";;@viascience;#datascientist #MTL;"964214337975005184";https://twitter.com/solvewithvia/status/964214337975005184
solvewithvia;2018-02-14 09:29;0;1;"A sweet start for the #Somerville Office this #Valentine ’s Day! pic.twitter.com/yzLVHBP725";;;#Somerville #Valentine;"963782294132715520";https://twitter.com/solvewithvia/status/963782294132715520
solvewithvia;2018-02-13 11:47;3;1;"VIA is hiring! Check out our open data scientist position here: https://www. linkedin.com/jobs/view/5461 08193/ … and send your resume & cover letter to jobs@viascience.com.";;@viascience;;"963454651847860224";https://twitter.com/solvewithvia/status/963454651847860224
solvewithvia;2018-02-09 14:41;1;2;"Great to see more and more grid modernization efforts taking priority! https:// bigislandnow.com/2018/02/08/puc -approves-hecos-grid-modernization-plans/#.Wn340jP7hXk.twitter …";;;#;"962048736791638026";https://twitter.com/solvewithvia/status/962048736791638026
solvewithvia;2018-02-05 14:16;0;2;"It’s been a great first month of 2018! Today our whole #Somerville team celebrated with lots of laughs and delicious food @FoundryOnElm #VIA pic.twitter.com/MpLVpqtGWd";;@FoundryOnElm;#Somerville #VIA;"960592989092564992";https://twitter.com/solvewithvia/status/960592989092564992
solvewithvia;2018-02-02 13:59;3;1;"VIA is making an impact, and so can you! We are now accepting applications for data scientists to join our #MTL office - send your resume and cover letter to jobs@viascience.com http://www. viascience.com/data-scientist -montreal/ … pic.twitter.com/OJ4tf05jcd";;@viascience;#MTL;"959501516372574210";https://twitter.com/solvewithvia/status/959501516372574210
solvewithvia;2018-02-01 10:50;0;3;"Our friends @elementalexcel are looking for companies that have the potential improve lives all around the world. Apply at http:// elementalexcelerator.com/apply #energy #water #agriculture #mobility #resilience";;@elementalexcel;#energy #water #agriculture #mobility #resilience;"959091631067672576";https://twitter.com/solvewithvia/status/959091631067672576
solvewithvia;2018-01-26 12:55;0;1;"As more utilities seek out #AI for #gridresilience initiatives, they want to know how to find the right solution for them. Learn more about our unique approach in our new blog! http:// tiny.cc/ud5lqy";;;#AI #gridresilience;"956948688580079616";https://twitter.com/solvewithvia/status/956948688580079616
solvewithvia;2018-01-23 09:38;1;3;"#blockchain is changing our world and VIA is using it to change the energy industry. Here’s a great @Forbes roundup of other sectors benefiting from this revolutionary tech: http:// tiny.cc/qh3iqy";;@Forbes;#blockchain;"955812086097104896";https://twitter.com/solvewithvia/status/955812086097104896
solvewithvia;2018-01-16 14:44;0;3;"Exciting news from our partners at TEPCO! We look forward to seeing more innovations like these from them soon. @TEPCO_English #SEC #TEPCO #electricvehicles #nissan https:// twitter.com/TEPCO_English/ status/952772416060588032 …";;@TEPCO_English;#SEC #TEPCO #electricvehicles #nissan;"953352230777868290";https://twitter.com/solvewithvia/status/953352230777868290
solvewithvia;2018-01-09 15:18;2;3;"Thank you @GlennLeibowitz and @Inc for highlighting our approach to #recruitment for #AI and #machinelearning talent! https:// twitter.com/GlennLeibowitz /status/950762660173250560 …";;@GlennLeibowitz @Inc;#recruitment #AI #machinelearning;"950824241406103553";https://twitter.com/solvewithvia/status/950824241406103553
solvewithvia;2018-01-09 10:03;0;1;"Major decision yesterday by @FERC to “ensure the uninterrupted supply of electricity in the face of fuel disruptions or extreme weather threats.” Great to see the focus on #gridresilience ! http:// tiny.cc/1wg2py";;@FERC;#gridresilience;"950744878127964161";https://twitter.com/solvewithvia/status/950744878127964161
solvewithvia;2017-12-21 11:51;0;4;"2017 was a big year for @viascience - here are some of our favorite moments: http://www. viascience.com/via-science-20 17-top-8-highlights/ …";;@viascience;;"943886766636982272";https://twitter.com/solvewithvia/status/943886766636982272
solvewithvia;2017-12-18 11:43;0;1;""Accenture reported in 2013 that just a quarter of utility customers have confidence in utilities, meaning they would seek alternative ways to get their electricity if such options became cost effective and commercially available." via @Forbes http:// tiny.cc/ywqjpy";;@Forbes;;"942797483058647040";https://twitter.com/solvewithvia/status/942797483058647040
solvewithvia;2017-12-15 13:58;0;2;"Way to go @viascience #MTL ! Our team completed their @EscapeM_Mtl puzzle without any clues and 3+ min to spare! pic.twitter.com/8dFacFIA9O";;@viascience @EscapeM_Mtl;#MTL;"941744305512820736";https://twitter.com/solvewithvia/status/941744305512820736
solvewithvia;2017-12-15 13:00;1;1;""Efforts intended merely to harden infrastructure are not enough—the grid also needs to be resilient." Great piece from @IEEESpectrum & Nicholas Abi-Samra http:// tiny.cc/jayhpy";;@IEEESpectrum;;"941729814427439106";https://twitter.com/solvewithvia/status/941729814427439106
solvewithvia;2017-12-13 15:43;0;4;"Thankful for another great year with @viascience #Somerville (and another great meal @Redbones )! pic.twitter.com/BjhLQTbxRz";;@viascience @Redbones;#Somerville;"941046025619427329";https://twitter.com/solvewithvia/status/941046025619427329
solvewithvia;2017-12-11 10:07;0;0;""The United States loses billions every year due to inadequate, old, or mismanaged energy infrastructure. [...] The Internet of Things looks not only to address some of these issues, but create even greater efficiency than previously thought possible." http:// tiny.cc/z54epy";;;;"940236578340864005";https://twitter.com/solvewithvia/status/940236578340864005
solvewithvia;2017-12-06 15:47;1;2;"Getting into the holiday spirit early @viascience #Somerville ! pic.twitter.com/92zfOsuPx8";;@viascience;#Somerville;"938510201937948679";https://twitter.com/solvewithvia/status/938510201937948679
solvewithvia;2017-12-06 10:18;0;2;"ICYMI: Vote for @viascience in @techvibes 's #CanadianInnovationAwards for Breakthrough Technology and Energy & Sustainability! Nominations open till December 22. http:// tiny.cc/xy75oy";;@viascience @techvibes;#CanadianInnovationAwards;"938427334482415618";https://twitter.com/solvewithvia/status/938427334482415618
solvewithvia;2017-11-30 15:48;1;4;""In the next wave of AI research, if we want to make more helpful and useful machines, we’ve got to bring back the contextual understanding. We’ve got to bring knowledge abstraction and reasoning." #AI @techreview http:// tiny.cc/0117oy";;@techreview;#AI;"936336121809817600";https://twitter.com/solvewithvia/status/936336121809817600
solvewithvia;2017-11-28 09:55;0;1;"Nominations are now open for @techvibes #CanadianInnovationAwards ! You can nominate Via Science for Breakthrough Technology and Energy & Sustainability here: http:// tiny.cc/xy75oy";;@techvibes;#CanadianInnovationAwards;"935522555099865088";https://twitter.com/solvewithvia/status/935522555099865088
solvewithvia;2017-11-27 11:55;0;0;"#AI in #energy is not "the distant future." In fact, the technology is already being used to improve grid reliability and resilience, among other applications. @UtilityDive http:// tiny.cc/0fk5oy";;@UtilityDive;#AI #energy;"935190442026655745";https://twitter.com/solvewithvia/status/935190442026655745
solvewithvia;2017-11-20 10:03;0;0;""'Evolution’ might not be a strong enough word to cover the changes that have been taking place in the global energy landscape." Great piece on the exciting potential of #blockchain in #energy http:// tiny.cc/m9z0oy";;;#blockchain #energy;"932625438907752448";https://twitter.com/solvewithvia/status/932625438907752448
solvewithvia;2017-11-16 09:52;0;1;"Congratulations to @NationalGridPR and @energyPNNL on their partnership to research #transmission #gridmodernization and #energystorage http:// tiny.cc/8iayoy";;@NationalGridPR @energyPNNL;#transmission #gridmodernization #energystorage;"931173041966600193";https://twitter.com/solvewithvia/status/931173041966600193
solvewithvia;2017-11-13 11:38;0;0;"Great to see RI join HI, CA, and NY in launching a #grid modernization strategy @UtilityDive http:// tiny.cc/0tmvoy";;@UtilityDive;#grid;"930112674452660226";https://twitter.com/solvewithvia/status/930112674452660226
solvewithvia;2017-11-03 16:50;2;3;"Thanks for sharing our exciting new pilot with @pjminterconnect , @ELPmagazine ! We can't wait to get to work: http:// tiny.cc/lonooy #AI #extremeweather #powergrid";;@pjminterconnect @ELPmagazine;#AI #extremeweather #powergrid;"926552262679384065";https://twitter.com/solvewithvia/status/926552262679384065
solvewithvia;2017-11-01 10:22;2;2;"Winter is coming...and we're here to help! @pjminterconnect has selected @viascience to mitigate risks to fuel supply in #extremeweather events, like a #PolarVortex http://www. viascience.com/via-science-pj m-extreme-weather/ … pic.twitter.com/yfoHtPdaGy";;@pjminterconnect @viascience;#extremeweather #PolarVortex;"925729737267347456";https://twitter.com/solvewithvia/status/925729737267347456
solvewithvia;2017-10-31 10:53;1;1;"#MTL is emerging as a "hotbed for #AI not only in Canada but the world," and we are so proud to be a part of it. https:// twitter.com/techvibes/stat us/925087330053918720 …";;;#MTL #AI;"925375147330109440";https://twitter.com/solvewithvia/status/925375147330109440
solvewithvia;2017-10-26 14:23;2;1;""When combined ( #AI and #blockchain ) represent transformation. Track, pilot and assess them right now. Do not underestimate them." Great read from @Forbes http:// tiny.cc/i20ioy";;@Forbes;#AI #blockchain;"923616074976854016";https://twitter.com/solvewithvia/status/923616074976854016
solvewithvia;2017-10-26 09:33;1;1;"Honored to be a part of this cohort! https:// twitter.com/elementalexcel /status/922969636009803776 …";;;;"923543217236213760";https://twitter.com/solvewithvia/status/923543217236213760
solvewithvia;2017-10-20 09:11;1;6;"We are thrilled to announce @viascience has been accepted to @elementalexcel 's 2018 cohort to further develop our #blockchain technology. Learn more here: http://www. viascience.com/via-science-el emental-excelerator-program/ …";;@viascience @elementalexcel;#blockchain;"921363277879357440";https://twitter.com/solvewithvia/status/921363277879357440
solvewithvia;2017-10-17 10:05;2;5;"We are SO excited! Good luck to our fellow @Startup_Canada regional winners! #innovation #startupday https:// twitter.com/Startup_Canada /status/920091899272167425 …";;@Startup_Canada;#innovation #startupday;"920289592187785216";https://twitter.com/solvewithvia/status/920289592187785216
solvewithvia;2017-10-16 12:12;1;1;"@Northeastern students! We're accepting applications for our Marketing Execution co-op and hosting on-campus interviews this week. DM us for more info!";;@Northeastern;;"919959144366596096";https://twitter.com/solvewithvia/status/919959144366596096
solvewithvia;2017-10-16 10:00;1;1;""Many energy experts are convinced that #blockchain technology has the potential to touch off a fundamental transformation of modern energy grids." https:// twitter.com/techreview/sta tus/919921767820427264 …";;;#blockchain;"919925931824820224";https://twitter.com/solvewithvia/status/919925931824820224
solvewithvia;2017-10-12 10:00;1;2;""A reliable grid system is also fundamental to our national security and our clean energy future." via @UtilityDive http:// tiny.cc/12m8ny";;@UtilityDive;;"918476378143641600";https://twitter.com/solvewithvia/status/918476378143641600
solvewithvia;2017-10-11 10:26;1;1;"ICYMI: How can #utilities rebuild critical infrastructure more efficiently after severe storms (like #hurricanes )? Enter #AI . http://www. viascience.com/ai-critical-in frastructure-hurricanes/ …";;;#utilities #hurricanes #AI;"918120703223836672";https://twitter.com/solvewithvia/status/918120703223836672
solvewithvia;2017-10-10 11:30;1;1;"We are @Northeastern today for the Marketing in Tech expo! Come say hi - here till 2 pm #NEU #marketing pic.twitter.com/AFJxdp84MT";;@Northeastern;#NEU #marketing;"917774280066260992";https://twitter.com/solvewithvia/status/917774280066260992
solvewithvia;2017-10-03 15:02;0;1;"Great afternoon with Masa Kimura of @TEPCO_English - thank you for joining #VSOffsite2017 ! pic.twitter.com/udZATmp4sv";;@TEPCO_English;#VSOffsite2017;"915291062842920965";https://twitter.com/solvewithvia/status/915291062842920965
solvewithvia;2017-10-03 10:38;0;1;"Yes!! https:// twitter.com/john_muddle/st atus/915045192784326658 …";;;;"915224502803591169";https://twitter.com/solvewithvia/status/915224502803591169
solvewithvia;2017-10-02 17:24;0;4;"CEO Colin Gounden pops the bubbly as we get ready for bowling! #VSOffsite2017 pic.twitter.com/M405ZMfAFd";;;#VSOffsite2017;"914964413383430146";https://twitter.com/solvewithvia/status/914964413383430146
solvewithvia;2017-10-02 17:20;0;0;"Behind the scenes of our headshot photo shoot #VSOffsite2017 pic.twitter.com/VixTda4v9R";;;#VSOffsite2017;"914963408667201538";https://twitter.com/solvewithvia/status/914963408667201538
solvewithvia;2017-10-02 15:48;0;1;"Great team discussion around @viascience value: Learning never goes out of style - our team never stops researching, our solutions never stop evolving for client needs #VSOffsite2017 pic.twitter.com/rDFaNF6xeE";;@viascience;#VSOffsite2017;"914940294415691776";https://twitter.com/solvewithvia/status/914940294415691776
solvewithvia;2017-10-02 11:46;1;3;"Shout out to @viascience #MTL : they hit the road nice and early this morning to join us in #DavisSq for #VSOffsite2017 today! pic.twitter.com/ZYouYZh2aa";;@viascience;#MTL #DavisSq #VSOffsite2017;"914879273411973120";https://twitter.com/solvewithvia/status/914879273411973120
solvewithvia;2017-10-02 11:00;0;1;"We've planned a food tour of #DavisSq - donuts, and cookies, and cupcakes, oh my!";;;#DavisSq;"914867693957914624";https://twitter.com/solvewithvia/status/914867693957914624
solvewithvia;2017-10-02 10:02;3;2;"Utilities need a more efficient way to rebuild after hurricanes. #AI can help: http://www. viascience.com/ai-critical-in frastructure-hurricanes/ …";;;#AI;"914853062430388224";https://twitter.com/solvewithvia/status/914853062430388224
solvewithvia;2017-09-29 14:09;1;1;""America's greatness depends on a reliable, resilient electric grid" - a must read from @SecretaryPerry @FERC http:// tiny.cc/eiuzny #gridresiliency";;@SecretaryPerry @FERC;#gridresiliency;"913828196633726976";https://twitter.com/solvewithvia/status/913828196633726976
solvewithvia;2017-09-29 13:00;0;2;"Fully stocked for #NationalCoffeeDay (and our upcoming offsite next week!) #VSOffsite17 pic.twitter.com/05bGEDy76k";;;#NationalCoffeeDay #VSOffsite17;"913810736878637059";https://twitter.com/solvewithvia/status/913810736878637059
solvewithvia;2017-09-27 09:55;0;0;"#AI in #energy is just getting started but "it could fundamentally change the way energy systems are built and operated." @greentechmedia http:// tiny.cc/gibyny";;@greentechmedia;#AI #energy;"913039507393536000";https://twitter.com/solvewithvia/status/913039507393536000
